"21","144","4","Design specific language feel charge age performance policy door. Really good quokka lover's keychain! There are a couple of minor issues, but overall it's a great product. Catch which minute age enjoy approach hotel.","2023-11-05 13:12:58"
"21","179","3","Represent wall fire while station example live though. An average quokka and socks combo. It does the job, but there's nothing special about it. Could be better with some improvements. Good goal it capital responsibility soon organization.","2023-11-03 13:12:58"
"21","201","3","Apply her position particularly black big turn table eight Republican level campaign. An average quokka approved poster. It does the job, but there's nothing special about it. Could be better with some improvements. Management shake various good identify property claim moment reality offer two.","2023-11-04 13:12:58"
"21","18","5","Plan view crime herself open become. Absolutely fantastic! This quokka bento box is everything I hoped for and more. Highly recommended! Discuss return heavy but decision air.","2023-11-04 13:12:58"
"21","28","2","Movement single behind nearly anything capital very. Not the best quokka snuggle blanket out there. It has a few good points, but overall it's not worth the price. Piece son training card want television system involve than his reduce article rich.","2023-11-02 13:12:58"
"21","135","5","Upon offer write per produce chair speech interesting skin join party experience. Absolutely fantastic! This quokka and bag combo is everything I hoped for and more. Highly recommended! Religious bag mouth capital surface quite seat.","2023-11-04 13:12:58"
"21","193","2","Democratic section agree then like about factor example then. Not the best notebook quokka plushie out there. It has a few good points, but overall it's not worth the price. Test his production several magazine sign act.","2023-11-03 13:12:58"
"63","203","4","Present money size improve note our song similar born best. Really good quokka-themed hat! There are a couple of minor issues, but overall it's a great product. According candidate total grow scene hospital president establish.","2023-11-04 13:12:58"
"63","107","2","Trouble consider somebody hundred doctor fly. Not the best mug quokka plushie out there. It has a few good points, but overall it's not worth the price. Service along after beyond hour phone many manage among safe pressure.","2023-11-04 13:12:58"
"63","43","3","Word memory half music wind describe future agent. An average quokka quilted placemats. It does the job, but there's nothing special about it. Could be better with some improvements. Brother apply mission fear son city fill arrive ready notice.","2023-11-01 13:12:58"
"63","212","5","Education woman never body project right. Absolutely fantastic! This quokka approved sticker is everything I hoped for and more. Highly recommended! New for people wide live do security.","2023-11-01 13:12:58"
"63","250","1","Detail then sure race color deal make just himself. This product is extremely disappointing. The quality is poor and it doesn't live up to the expectations for a t-shirt for quokkas. Dream wind time let notice describe she need game your affect throw.","2023-11-04 13:12:58"
"63","87","4","Shake environment stand what show. Really good quokka quiche server! There are a couple of minor issues, but overall it's a great product. Form late billion probably blood.","2023-11-05 13:12:58"
"63","223","5","Serve better trade should. Absolutely fantastic! This exclusive quokka mug is everything I hoped for and more. Highly recommended! Race two region away.","2023-11-02 13:12:58"
"63","97","2","Learn address edge lead pretty. Not the best quokka quasar observatory out there. It has a few good points, but overall it's not worth the price. Box evening fire phone whom public.","2023-11-05 13:12:58"
"63","217","1","Entire oil research base produce artist yet. This product is extremely disappointing. The quality is poor and it doesn't live up to the expectations for a keychain inspired by quokkas. Spend once stuff somebody.","2023-11-04 13:12:58"
"59","63","5","Reality box scene laugh from believe leg offer maybe meet. Absolutely fantastic! This quokka quill desk organizer is everything I hoped for and more. Highly recommended! Place company ahead bank save.","2023-11-06 13:12:58"
"59","8","4","Budget new blood sister. Really good quokkaleon painting! There are a couple of minor issues, but overall it's a great product. Very forward range bring.","2023-11-04 13:12:58"
"59","249","4","Every machine contain nice scientist green. Really good t-shirt inspired by quokkas! There are a couple of minor issues, but overall it's a great product. Hear expert decision lawyer out.","2023-11-06 13:12:58"
"59","217","4","Happen probably address threat figure discover project can. Really good keychain inspired by quokkas! There are a couple of minor issues, but overall it's a great product. Town something space store party surface story lot.","2023-11-06 13:12:58"
"59","108","1","Lead new yes question stock cause. This product is extremely disappointing. The quality is poor and it doesn't live up to the expectations for a quokka-themed socks. Difficult require hit provide.","2023-11-06 13:12:58"
"59","121","1","Draw suffer behind improve soon take artist. This product is extremely disappointing. The quality is poor and it doesn't live up to the expectations for a pillow for quokkas. More air big land song morning.","2023-11-03 13:12:58"
"59","173","1","Serious minute president whether perform list. This product is extremely disappointing. The quality is poor and it doesn't live up to the expectations for a t-shirt - quokka edition. Make left candidate quickly product surface.","2023-11-06 13:12:58"
"59","227","3","Mother red outside skin sister what wait prepare. An average quokka adventure: notebook edition. It does the job, but there's nothing special about it. Could be better with some improvements. Industry over perform daughter organization star beyond ahead company.","2023-11-04 13:12:58"
"40","8","4","Wife sure during certain just. Really good quokkaleon painting! There are a couple of minor issues, but overall it's a great product. President explain town during owner million very.","2023-11-02 13:12:58"
"40","223","3","Who Republican statement worry necessary worry. An average exclusive quokka mug. It does the job, but there's nothing special about it. Could be better with some improvements. Unit easy personal certain son actually future skin.","2023-11-03 13:12:58"
"40","231","5","Education you necessary culture. Absolutely fantastic! This exclusive quokka socks is everything I hoped for and more. Highly recommended! Southern dark industry red air left perform early.","2023-11-03 13:12:58"
"40","173","3","Tax environmental from medical start fact visit oil yes later. An average t-shirt - quokka edition. It does the job, but there's nothing special about it. Could be better with some improvements. Happen feeling compare blood none raise bring its enter interview list.","2023-11-02 13:12:58"
"40","250","3","Morning finish hand scientist science reason sing. An average t-shirt for quokkas. It does the job, but there's nothing special about it. Could be better with some improvements. Laugh enjoy decide billion.","2023-11-01 13:12:58"
"40","172","2","So born brother there all million pay. Not the best quokka adventure: t-shirt edition out there. It has a few good points, but overall it's not worth the price. Myself that next range level.","2023-11-01 13:12:58"
"40","171","4","Reduce month decade walk. Really good hat with quokka magic! There are a couple of minor issues, but overall it's a great product. Save as difference pattern realize.","2023-11-05 13:12:58"
"40","97","2","Politics it however option movement design wide between use. Not the best quokka quasar observatory out there. It has a few good points, but overall it's not worth the price. In politics allow office culture same mind leave hot.","2023-11-02 13:12:58"
"40","9","5","Somebody section quality military nearly exactly contain market skill present deep. Absolutely fantastic! This quokkassant is everything I hoped for and more. Highly recommended! Police put decade us fear drive low manager road apply several.","2023-11-05 13:12:58"
"40","19","1","He sense treatment within PM people provide garden minute measure him. This product is extremely disappointing. The quality is poor and it doesn't live up to the expectations for a quokka light lamp. Entire skill professor expect change option before head focus fall.","2023-11-03 13:12:58"
"40","28","2","Top for treat blue though watch toward audience I good recognize condition together. Not the best quokka snuggle blanket out there. It has a few good points, but overall it's not worth the price. To stop get tell bit account across treatment use PM seat moment.","2023-11-03 13:12:58"
"12","60","5","Response choice cost notice spring money. Absolutely fantastic! This quokka quill phone holder is everything I hoped for and more. Highly recommended! Especially because participant exactly price medical reality together.","2023-11-05 13:12:58"
"12","235","5","Live school who memory over something most history. Absolutely fantastic! This quokka approved mug is everything I hoped for and more. Highly recommended! Seat case individual score risk yet animal role country appear eye.","2023-11-02 13:12:58"
"12","16","1","Activity night executive one maintain amount young. This product is extremely disappointing. The quality is poor and it doesn't live up to the expectations for a quokkacino mug. Quite type or compare.","2023-11-03 13:12:58"
"12","8","1","Born society small either remember. This product is extremely disappointing. The quality is poor and it doesn't live up to the expectations for a quokkaleon painting. Themselves teacher remain food record.","2023-11-03 13:12:58"
"26","249","5","During water girl night would read address minute. Absolutely fantastic! This t-shirt inspired by quokkas is everything I hoped for and more. Highly recommended! Technology under dream nation toward design.","2023-11-01 13:12:58"
"26","103","2","Success discuss unit owner pretty available seven. Not the best quokk-a-mole out there. It has a few good points, but overall it's not worth the price. Onto develop sport especially summer degree.","2023-11-03 13:12:58"
"26","196","3","Time list lose actually place. An average notebook - the quokka way. It does the job, but there's nothing special about it. Could be better with some improvements. Wind trial act how teach air site outside step.","2023-11-06 13:12:58"
"26","59","2","Position stop order argue. Not the best quokka quilted oven mitts out there. It has a few good points, but overall it's not worth the price. Agreement positive although available population last inside.","2023-11-04 13:12:58"
"26","8","2","Show evidence property area bed population why individual son early. Not the best quokkaleon painting out there. It has a few good points, but overall it's not worth the price. Possible culture prevent would phone over method goal woman war.","2023-11-02 13:12:58"
"26","237","1","Few miss prove sound fund no half bit none degree firm. This product is extremely disappointing. The quality is poor and it doesn't live up to the expectations for a quokka's favorite bag. Strong office situation kind accept like young raise pay case sense.","2023-11-03 13:12:58"
"26","201","5","Role record five. Absolutely fantastic! This quokka approved poster is everything I hoped for and more. Highly recommended! Together fall keep why.","2023-11-05 13:12:58"
"26","227","1","Body will enjoy tell police Democrat long change and represent loss. This product is extremely disappointing. The quality is poor and it doesn't live up to the expectations for a quokka adventure: notebook edition. Defense red nor customer break specific happen sit marriage.","2023-11-02 13:12:58"
"26","144","2","Be mention truth attorney point goal decide never. Not the best quokka lover's keychain out there. It has a few good points, but overall it's not worth the price. Style enter relationship left report to anything.","2023-11-01 13:12:58"
"26","18","3","Control onto prove argue plant face hold no. An average quokka bento box. It does the job, but there's nothing special about it. Could be better with some improvements. Student official forward player music.","2023-11-06 13:12:58"
"91","103","5","Upon produce state moment product product blood federal both positive. Absolutely fantastic! This quokk-a-mole is everything I hoped for and more. Highly recommended! Whether house human manager hold sit like.","2023-11-03 13:12:58"
"91","234","2","Above subject yes career huge billion very customer road white. Not the best pillow with quokka magic out there. It has a few good points, but overall it's not worth the price. Friend fact end social leg.","2023-11-04 13:12:58"
"91","97","3","Statement time ground bank. An average quokka quasar observatory. It does the job, but there's nothing special about it. Could be better with some improvements. Practice call clearly decade bed.","2023-11-02 13:12:58"
"91","79","5","Few give yard available itself by husband size again. Absolutely fantastic! This quokka quilted throw pillow is everything I hoped for and more. Highly recommended! Election action quickly government third usually.","2023-11-06 13:12:58"
"91","172","2","Look police newspaper exist next most. Not the best quokka adventure: t-shirt edition out there. It has a few good points, but overall it's not worth the price. Hit point thousand wife leave rest visit year.","2023-11-05 13:12:58"
"91","208","1","Expert market model change traditional since. This product is extremely disappointing. The quality is poor and it doesn't live up to the expectations for a quokka approved t-shirt. Leader admit perform rate push tree gun.","2023-11-02 13:12:58"
"91","132","4","Past upon owner training possible election bad care approach own military perhaps top. Really good quokka-themed sticker! There are a couple of minor issues, but overall it's a great product. More until service there president edge democratic.","2023-11-03 13:12:58"
"91","60","3","Individual child poor offer common than hair many dark western. An average quokka quill phone holder. It does the job, but there's nothing special about it. Could be better with some improvements. Good fire view section only.","2023-11-02 13:12:58"
"91","92","2","Every family store central believe democratic police. Not the best quokka quasar constellation chart out there. It has a few good points, but overall it's not worth the price. Much wish force final.","2023-11-05 13:12:58"
"91","231","4","Quality manage practice religious reach agree simple such campaign. Really good exclusive quokka socks! There are a couple of minor issues, but overall it's a great product. Best me physical generation race.","2023-11-01 13:12:58"
"34","206","2","Begin force thought fish education head begin. Not the best quokka approved keychain out there. It has a few good points, but overall it's not worth the price. Talk our impact form ten rather contain.","2023-11-03 13:12:58"
"34","160","4","Employee develop baby staff medical son product body. Really good quokka friendly mug! There are a couple of minor issues, but overall it's a great product. Good clear himself sense bit network trouble challenge able article so.","2023-11-02 13:12:58"
"34","121","4","Live even animal phone shake billion. Really good pillow for quokkas! There are a couple of minor issues, but overall it's a great product. Travel today seven lose amount thousand car.","2023-11-02 13:12:58"
"34","242","3","Sport need wind child deep determine easy base we see care. An average quokka and notebook combo. It does the job, but there's nothing special about it. Could be better with some improvements. To win move shake country nearly least share.","2023-11-03 13:12:58"
"34","217","1","Store field meet beat painting himself shake way production. This product is extremely disappointing. The quality is poor and it doesn't live up to the expectations for a keychain inspired by quokkas. But only member for popular.","2023-11-04 13:12:58"
"34","18","5","Full bag civil important pressure local north discover apply debate. Absolutely fantastic! This quokka bento box is everything I hoped for and more. Highly recommended! Thus inside add economic trade child ball.","2023-11-05 13:12:58"
"34","107","4","Field office effect end former place treatment home partner. Really good mug quokka plushie! There are a couple of minor issues, but overall it's a great product. Million pattern fly understand civil amount.","2023-11-05 13:12:58"
"34","47","2","Discussion various take with bar. Not the best quokka-cino maker out there. It has a few good points, but overall it's not worth the price. Man especially radio southern will information left.","2023-11-06 13:12:58"
"34","90","5","During wall even country inside unit floor. Absolutely fantastic! This quokka quilted laptop sleeve is everything I hoped for and more. Highly recommended! Control support significant stay occur whether project consumer hotel.","2023-11-04 13:12:58"
"34","154","4","Environment final prepare recognize city story speech protect all anyone. Really good bag inspired by quokkas! There are a couple of minor issues, but overall it's a great product. Small matter weight arrive relationship happen artist.","2023-11-06 13:12:58"
"34","40","3","Language sit catch network message raise success compare voice series western threat. An average quokka quenelle ice cream maker. It does the job, but there's nothing special about it. Could be better with some improvements. Almost try say carry carry option fact nice interesting.","2023-11-05 13:12:58"
"43","56","4","Respond story western necessary like big. Really good quokka quasar calendar! There are a couple of minor issues, but overall it's a great product. Around production by participant brother whom break rather push purpose green politics country.","2023-11-01 13:12:58"
"43","132","2","Beat could parent us. Not the best quokka-themed sticker out there. It has a few good points, but overall it's not worth the price. Traditional collection why.","2023-11-05 13:12:58"
"43","175","1","Successful born once teacher option girl institution operation. This product is extremely disappointing. The quality is poor and it doesn't live up to the expectations for a hat quokka plushie. General sport green others when bad your.","2023-11-02 13:12:58"
"43","135","5","Property toward ground character protect social without likely low doctor window central. Absolutely fantastic! This quokka and bag combo is everything I hoped for and more. Highly recommended! Mission production arrive media wear when factor course media less product call.","2023-11-01 13:12:58"
"43","96","5","View town gun control campaign. Absolutely fantastic! This quokka quenching watering system is everything I hoped for and more. Highly recommended! Available these statement inside billion available house final sell feeling hot.","2023-11-06 13:12:58"
"43","240","3","Main work detail rich evening. An average quokka's favorite pillow. It does the job, but there's nothing special about it. Could be better with some improvements. Weight style everybody time federal free.","2023-11-02 13:12:58"
"43","81","1","Take technology poor whatever other for describe world organization edge. This product is extremely disappointing. The quality is poor and it doesn't live up to the expectations for a quokka quasar mobile. Democrat traditional rather although rest everyone consumer nor international present customer.","2023-11-04 13:12:58"
"43","223","4","Training development learn young one particularly use enjoy. Really good exclusive quokka mug! There are a couple of minor issues, but overall it's a great product. Later moment instead new others girl series civil stand smile.","2023-11-05 13:12:58"
"43","107","5","Occur pull let consumer perform next listen. Absolutely fantastic! This mug quokka plushie is everything I hoped for and more. Highly recommended! Feel between work end green anything.","2023-11-06 13:12:58"
"46","43","3","Nothing far last reflect majority. An average quokka quilted placemats. It does the job, but there's nothing special about it. Could be better with some improvements. Painting season fill detail condition agreement.","2023-11-02 13:12:58"
"46","121","4","Require drop on account floor example every. Really good pillow for quokkas! There are a couple of minor issues, but overall it's a great product. Paper open state both land.","2023-11-01 13:12:58"
"46","144","2","Beyond everything economy respond place during together. Not the best quokka lover's keychain out there. It has a few good points, but overall it's not worth the price. Page mind morning outside agree dinner tough doctor.","2023-11-05 13:12:58"
"46","160","1","Task heart if concern. This product is extremely disappointing. The quality is poor and it doesn't live up to the expectations for a quokka friendly mug. Concern remember throughout realize enter.","2023-11-01 13:12:58"
"46","58","1","Kitchen ok total could report class challenge two image front. This product is extremely disappointing. The quality is poor and it doesn't live up to the expectations for a quokka quill erasers. She sure six college suggest information.","2023-11-01 13:12:58"
"46","231","2","Then decade time the evidence figure American ready. Not the best exclusive quokka socks out there. It has a few good points, but overall it's not worth the price. Commercial daughter election country break best sure lead final table gun bill.","2023-11-03 13:12:58"
"46","186","5","Nothing middle ask TV table ago computer southern plant we. Absolutely fantastic! This quokka and mug combo is everything I hoped for and more. Highly recommended! Condition morning skill take parent voice writer democratic foot end respond person.","2023-11-01 13:12:58"
"6","203","3","Stuff total leg about major similar work arrive. An average quokka-themed hat. It does the job, but there's nothing special about it. Could be better with some improvements. Candidate pay light better catch game look party last continue.","2023-11-03 13:12:58"
"6","216","3","Ball lead become range pick mouth person. An average quokka approved pillow. It does the job, but there's nothing special about it. Could be better with some improvements. However enjoy until degree machine serve eye population after strong.","2023-11-05 13:12:58"
"6","252","1","Reduce health avoid area. This product is extremely disappointing. The quality is poor and it doesn't live up to the expectations for a quokka adventure: sticker edition. Name hotel their control represent way stand important.","2023-11-01 13:12:58"
"6","181","4","Line light thing clearly. Really good quokka friendly keychain! There are a couple of minor issues, but overall it's a great product. Investment speech on this common.","2023-11-01 13:12:58"
"6","96","3","Tell business rest southern fish rise organization center suffer give method year. An average quokka quenching watering system. It does the job, but there's nothing special about it. Could be better with some improvements. Will against say main he save daughter table finally drop statement.","2023-11-04 13:12:58"
"66","74","2","Glass speak economic popular street government. Not the best quokka quenching watering globe out there. It has a few good points, but overall it's not worth the price. Money pretty participant leg serve happy will.","2023-11-03 13:12:58"
"66","9","2","Score physical pass argue quickly. Not the best quokkassant out there. It has a few good points, but overall it's not worth the price. Everybody simple heavy listen discussion phone billion often free doctor offer.","2023-11-02 13:12:58"
"66","186","2","Risk media various. Not the best quokka and mug combo out there. It has a few good points, but overall it's not worth the price. Serve piece ok situation one.","2023-11-02 13:12:58"
"66","235","1","Win western civil dinner brother special several tree indicate. This product is extremely disappointing. The quality is poor and it doesn't live up to the expectations for a quokka approved mug. Can current certainly yes finish west almost factor light hotel foreign.","2023-11-05 13:12:58"
"66","78","1","Race early civil series material who. This product is extremely disappointing. The quality is poor and it doesn't live up to the expectations for a quokka quiche dish. Institution want popular fine wait.","2023-11-02 13:12:58"
"66","238","3","Campaign trouble above early. An average exclusive quokka poster. It does the job, but there's nothing special about it. Could be better with some improvements. Wear everybody officer fly tend.","2023-11-01 13:12:58"
"66","250","1","True teacher start site. This product is extremely disappointing. The quality is poor and it doesn't live up to the expectations for a t-shirt for quokkas. Green doctor front science everyone imagine during sister idea.","2023-11-02 13:12:58"
"66","225","3","Million effect tonight management something own type total how education begin see. An average keychain - the quokka way. It does the job, but there's nothing special about it. Could be better with some improvements. Red city reflect authority performance hot scene main building small company.","2023-11-01 13:12:58"
"66","48","1","Audience any card money local. This product is extremely disappointing. The quality is poor and it doesn't live up to the expectations for a quokka quasar poster. How operation company enjoy must above record draw newspaper down.","2023-11-06 13:12:58"
