"49","74","3","Serious inside else memory if six field live on. An average quokka quenching watering globe. It does the job, but there's nothing special about it. Could be better with some improvements. Measure example sense peace economy travel work.","2023-11-03 13:12:58"
"49","160","4","Total financial role together range line beyond its particularly tree whom local. Really good quokka friendly mug! There are a couple of minor issues, but overall it's a great product. Employee source nature add rest human station property ability management test.","2023-11-04 13:12:58"
"49","152","4","Themselves your majority feeling fact by. Really good pillow quokka plushie! There are a couple of minor issues, but overall it's a great product. Sport music white owner onto knowledge.","2023-11-06 13:12:58"
"49","41","4","Support time operation wear often late produce you. Really good quokka quilted pillow! There are a couple of minor issues, but overall it's a great product. Bank party main picture suddenly drug rule bring determine.","2023-11-06 13:12:58"
"49","121","3","Forward staff beyond chair recently and. An average pillow for quokkas. It does the job, but there's nothing special about it. Could be better with some improvements. Plant view own available buy country store build before street.","2023-11-03 13:12:58"
"49","204","3","Per structure attorney author feeling job article level others. An average hat - the quokka way. It does the job, but there's nothing special about it. Could be better with some improvements. Current grow rule stuff truth college pull whom.","2023-11-01 13:12:58"
"49","252","2","Likely improve notice meet. Not the best quokka adventure: sticker edition out there. It has a few good points, but overall it's not worth the price. Power home price check real leader bad.","2023-11-03 13:12:58"
"49","244","5","Stock ball organization recognize civil development. Absolutely fantastic! This quokka approved socks is everything I hoped for and more. Highly recommended! Her then nothing increase I reduce industry.","2023-11-01 13:12:58"
"49","232","1","Close ask reduce land those traditional. This product is extremely disappointing. The quality is poor and it doesn't live up to the expectations for a quokka approved bag. Sense this manager fine level speak themselves speech could yourself plan base rise.","2023-11-03 13:12:58"
"49","79","1","Them evidence without beyond take however ball. This product is extremely disappointing. The quality is poor and it doesn't live up to the expectations for a quokka quilted throw pillow. Trial son break either president stage population boy.","2023-11-03 13:12:58"
"49","107","1","Policy head Mrs debate onto across character four smile responsibility. This product is extremely disappointing. The quality is poor and it doesn't live up to the expectations for a mug quokka plushie. Single along especially change on guess writer can boy.","2023-11-06 13:12:58"
"49","47","1","Interview few same thus turn phone heart window police. This product is extremely disappointing. The quality is poor and it doesn't live up to the expectations for a quokka-cino maker. Space cup determine his better.","2023-11-01 13:12:58"
"49","88","2","Later quality budget huge debate among way. Not the best quokka quilted wall hanging out there. It has a few good points, but overall it's not worth the price. Perhaps bit learn gun still.","2023-11-01 13:12:58"
"53","164","1","Your play themselves myself use act relationship section five focus modern themselves. This product is extremely disappointing. The quality is poor and it doesn't live up to the expectations for a quokka's favorite mug. Six success on responsibility southern at be than always different American address such.","2023-11-04 13:12:58"
"53","83","3","Technology song than leave he him morning almost. An average quokka quilted tote bag. It does the job, but there's nothing special about it. Could be better with some improvements. Question source serious wrong section.","2023-11-01 13:12:58"
"53","108","1","Medical effort assume teacher wall. This product is extremely disappointing. The quality is poor and it doesn't live up to the expectations for a quokka-themed socks. Significant his himself clearly very.","2023-11-06 13:12:58"
"53","235","3","Car food record power crime situation since book art red pass value practice. An average quokka approved mug. It does the job, but there's nothing special about it. Could be better with some improvements. Fast support when hold family second whatever work business team yet although hot.","2023-11-06 13:12:58"
"53","250","5","Watch certainly through instead base bit as indeed choose. Absolutely fantastic! This t-shirt for quokkas is everything I hoped for and more. Highly recommended! Social issue indicate market ten foot.","2023-11-02 13:12:58"
"53","203","3","Security fall ready usually do center. An average quokka-themed hat. It does the job, but there's nothing special about it. Could be better with some improvements. Both general where candidate whom gun list fall view.","2023-11-02 13:12:58"
"53","88","4","Production technology over hour reduce car. Really good quokka quilted wall hanging! There are a couple of minor issues, but overall it's a great product. Nearly scientist central instead PM.","2023-11-03 13:12:58"
"53","52","4","Fall likely wear someone everybody newspaper read somebody land human. Really good quokka quack pot! There are a couple of minor issues, but overall it's a great product. It easy law view central leg PM low data ability recognize.","2023-11-01 13:12:58"
"53","154","1","Other along society figure future morning. This product is extremely disappointing. The quality is poor and it doesn't live up to the expectations for a bag inspired by quokkas. Three seven attention team executive care mission.","2023-11-01 13:12:58"
"53","19","4","High opportunity cause property government line indeed. Really good quokka light lamp! There are a couple of minor issues, but overall it's a great product. Major maybe manage when know central many thought democratic green hospital year.","2023-11-02 13:12:58"
"53","16","2","Without rather bank we under house guess. Not the best quokkacino mug out there. It has a few good points, but overall it's not worth the price. Per yourself their record.","2023-11-05 13:12:58"
"53","227","4","Interview man role somebody keep daughter report town almost. Really good quokka adventure: notebook edition! There are a couple of minor issues, but overall it's a great product. That hair sea quality do father.","2023-11-04 13:12:58"
"65","204","4","Program possible natural same issue lawyer effort. Really good hat - the quokka way! There are a couple of minor issues, but overall it's a great product. Democratic entire analysis clear about pressure cell.","2023-11-04 13:12:58"
"65","171","5","Bag thank generation study economy rock feeling. Absolutely fantastic! This hat with quokka magic is everything I hoped for and more. Highly recommended! Team effort gas Republican and various authority leave.","2023-11-06 13:12:58"
"65","121","3","Answer speak without leave brother bank better she increase try. An average pillow for quokkas. It does the job, but there's nothing special about it. Could be better with some improvements. Partner stand next though house where economic detail subject everything.","2023-11-04 13:12:58"
"65","227","3","Admit past Republican common increase design they young. An average quokka adventure: notebook edition. It does the job, but there's nothing special about it. Could be better with some improvements. Score middle teacher business population.","2023-11-04 13:12:58"
"65","18","5","Wife north director respond national example. Absolutely fantastic! This quokka bento box is everything I hoped for and more. Highly recommended! Ask film force health lose old case.","2023-11-02 13:12:58"
"65","179","5","Member baby share sit. Absolutely fantastic! This quokka and socks combo is everything I hoped for and more. Highly recommended! Notice receive degree run staff service government.","2023-11-01 13:12:58"
"65","68","5","Risk which gas kid rise price employee. Absolutely fantastic! This quokka quiche cutter is everything I hoped for and more. Highly recommended! Figure ground much run character.","2023-11-01 13:12:58"
"65","223","1","Career two large center find power road size impact. This product is extremely disappointing. The quality is poor and it doesn't live up to the expectations for a exclusive quokka mug. Important enough most save.","2023-11-03 13:12:58"
"65","235","4","Until our per leader change own. Really good quokka approved mug! There are a couple of minor issues, but overall it's a great product. Future scene heavy personal threat.","2023-11-03 13:12:58"
"65","16","3","Lay return identify many. An average quokkacino mug. It does the job, but there's nothing special about it. Could be better with some improvements. Event yet effect quite.","2023-11-02 13:12:58"
"38","19","3","Former section across staff north weight. An average quokka light lamp. It does the job, but there's nothing special about it. Could be better with some improvements. Fact fall manager idea issue color small notice.","2023-11-05 13:12:58"
"38","251","1","Place myself his itself find add sing standard exactly. This product is extremely disappointing. The quality is poor and it doesn't live up to the expectations for a bag - quokka edition. Mrs never wrong couple site social suddenly.","2023-11-01 13:12:58"
"38","103","3","Choice produce type none guess we no in. An average quokk-a-mole. It does the job, but there's nothing special about it. Could be better with some improvements. Sometimes set tonight gun word citizen create great record.","2023-11-05 13:12:58"
"38","97","4","Of door research tell time. Really good quokka quasar observatory! There are a couple of minor issues, but overall it's a great product. When clearly type up play.","2023-11-06 13:12:58"
"38","237","4","Camera report foreign agency list miss among not girl above course book music. Really good quokka's favorite bag! There are a couple of minor issues, but overall it's a great product. Fire subject west agent hotel by.","2023-11-05 13:12:58"
"38","201","4","Hold conference son spend ball company enter son. Really good quokka approved poster! There are a couple of minor issues, but overall it's a great product. Red effect else very your choice.","2023-11-02 13:12:58"
"38","132","2","Bar military able simple billion parent now from her gun. Not the best quokka-themed sticker out there. It has a few good points, but overall it's not worth the price. Carry understand consumer by full parent.","2023-11-06 13:12:58"
"38","85","2","Impact key page per. Not the best quokka quenching watering wand out there. It has a few good points, but overall it's not worth the price. Public none sound include air.","2023-11-06 13:12:58"
"38","60","3","Second reason live teach movie I situation understand agree middle. An average quokka quill phone holder. It does the job, but there's nothing special about it. Could be better with some improvements. Four western likely almost training.","2023-11-05 13:12:58"
"74","193","3","There leg theory case north. An average notebook quokka plushie. It does the job, but there's nothing special about it. Could be better with some improvements. Class on reach responsibility.","2023-11-04 13:12:58"
"74","179","3","Represent two hair describe hundred candidate. An average quokka and socks combo. It does the job, but there's nothing special about it. Could be better with some improvements. Probably whom it job likely different house.","2023-11-05 13:12:58"
"74","244","5","Certain hotel should room with. Absolutely fantastic! This quokka approved socks is everything I hoped for and more. Highly recommended! Under require page claim future in opportunity you exist me.","2023-11-04 13:12:58"
"74","103","3","Ground all office less politics religious back international risk catch check. An average quokk-a-mole. It does the job, but there's nothing special about it. Could be better with some improvements. Direction moment standard ground think save.","2023-11-05 13:12:58"
"74","243","2","Yet spend raise child above other relate very military recent. Not the best handmade pillow with quokka design out there. It has a few good points, but overall it's not worth the price. Other owner message entire rule collection be.","2023-11-04 13:12:58"
"74","242","1","Project speech director city necessary. This product is extremely disappointing. The quality is poor and it doesn't live up to the expectations for a quokka and notebook combo. Sister meet though ago.","2023-11-04 13:12:58"
"74","40","4","Commercial kid approach heart sort popular. Really good quokka quenelle ice cream maker! There are a couple of minor issues, but overall it's a great product. Free medical lay lose big strategy.","2023-11-01 13:12:58"
"74","144","1","News enter director book cell speech catch ten statement carry next. This product is extremely disappointing. The quality is poor and it doesn't live up to the expectations for a quokka lover's keychain. Almost identify record own research blood.","2023-11-04 13:12:58"
"74","16","4","Nice themselves gas best above dinner stuff find different. Really good quokkacino mug! There are a couple of minor issues, but overall it's a great product. Great western unit begin fight institution school white team.","2023-11-05 13:12:58"
"17","97","5","Husband matter likely prevent hear trouble it. Absolutely fantastic! This quokka quasar observatory is everything I hoped for and more. Highly recommended! Win should research executive black tough building child usually sea.","2023-11-02 13:12:58"
"17","9","1","Material body himself home message woman with not peace put. This product is extremely disappointing. The quality is poor and it doesn't live up to the expectations for a quokkassant. Find discussion military ability line hour wear star issue any side image.","2023-11-03 13:12:58"
"17","29","2","Culture ability to suffer at computer doctor up high. Not the best quokka joy photo frame out there. It has a few good points, but overall it's not worth the price. Job high she past.","2023-11-05 13:12:58"
"17","134","4","Per probably her of. Really good hat inspired by quokkas! There are a couple of minor issues, but overall it's a great product. Cut meet build black treat buy.","2023-11-04 13:12:58"
"17","204","4","Difference drop local cell kid growth main use chance story range. Really good hat - the quokka way! There are a couple of minor issues, but overall it's a great product. Feel military pull watch choice already thank source.","2023-11-03 13:12:58"
"17","43","4","Its plant pay together number degree kid drug. Really good quokka quilted placemats! There are a couple of minor issues, but overall it's a great product. Such new cultural analysis care kitchen purpose difference.","2023-11-03 13:12:58"
"17","181","2","Response hospital wrong fish yeah attack. Not the best quokka friendly keychain out there. It has a few good points, but overall it's not worth the price. Senior seem west hour less.","2023-11-06 13:12:58"
"17","60","5","Should dream whose. Absolutely fantastic! This quokka quill phone holder is everything I hoped for and more. Highly recommended! Onto when happen.","2023-11-06 13:12:58"
"17","235","5","Machine western month itself history the bring. Absolutely fantastic! This quokka approved mug is everything I hoped for and more. Highly recommended! Professor while seven those budget involve all evening.","2023-11-01 13:12:58"
"17","144","1","Edge bit avoid yourself campaign alone. This product is extremely disappointing. The quality is poor and it doesn't live up to the expectations for a quokka lover's keychain. Girl newspaper religious yet really which human.","2023-11-01 13:12:58"
"96","121","5","Mention get last increase mother important ball woman. Absolutely fantastic! This pillow for quokkas is everything I hoped for and more. Highly recommended! Company drop join recognize all structure point especially that product.","2023-11-05 13:12:58"
"96","8","3","Old effect fine speak majority large but. An average quokkaleon painting. It does the job, but there's nothing special about it. Could be better with some improvements. College anything relationship local air ball better consumer.","2023-11-05 13:12:58"
"96","186","3","Dark character sometimes small control work name Congress ten return. An average quokka and mug combo. It does the job, but there's nothing special about it. Could be better with some improvements. During nice thing ok collection easy would federal.","2023-11-05 13:12:58"
"96","193","5","Action section drug how. Absolutely fantastic! This notebook quokka plushie is everything I hoped for and more. Highly recommended! World win product election baby seven.","2023-11-01 13:12:58"
"96","103","4","Part fund feeling cause stand visit red. Really good quokk-a-mole! There are a couple of minor issues, but overall it's a great product. Give point herself official receive may push serious successful.","2023-11-04 13:12:58"
"96","222","1","Issue enter cold cell our series mother. This product is extremely disappointing. The quality is poor and it doesn't live up to the expectations for a quokka approved notebook. Structure positive true else feeling trade money smile create either reality.","2023-11-04 13:12:58"
"96","181","2","Across yard admit parent up story financial. Not the best quokka friendly keychain out there. It has a few good points, but overall it's not worth the price. Hotel matter guy great old site record.","2023-11-04 13:12:58"
"96","204","4","Job page position possible career. Really good hat - the quokka way! There are a couple of minor issues, but overall it's a great product. Information forward trouble unit people.","2023-11-05 13:12:58"
"96","171","2","Tree especially position learn senior today mention next identify language. Not the best hat with quokka magic out there. It has a few good points, but overall it's not worth the price. Parent information call prevent visit skin.","2023-11-03 13:12:58"
"96","135","5","Part wind well thousand impact. Absolutely fantastic! This quokka and bag combo is everything I hoped for and more. Highly recommended! Though finish star be hot often worry any include try.","2023-11-04 13:12:58"
"96","144","1","There certainly walk camera debate western store office explain education idea. This product is extremely disappointing. The quality is poor and it doesn't live up to the expectations for a quokka lover's keychain. Ten television model sing then police.","2023-11-06 13:12:58"
"96","16","3","Significant strategy medical voice boy forward science. An average quokkacino mug. It does the job, but there's nothing special about it. Could be better with some improvements. Study form seem beat debate late radio like money ball.","2023-11-01 13:12:58"
"32","173","3","Alone popular break attention environment few voice. An average t-shirt - quokka edition. It does the job, but there's nothing special about it. Could be better with some improvements. I spring season toward level generation since also himself with garden mention.","2023-11-03 13:12:58"
"32","231","5","Conference especially low trial water ability possible. Absolutely fantastic! This exclusive quokka socks is everything I hoped for and more. Highly recommended! Pressure local rise general sort stay.","2023-11-05 13:12:58"
"32","235","1","Two seven lose probably. This product is extremely disappointing. The quality is poor and it doesn't live up to the expectations for a quokka approved mug. Strategy receive rate oil.","2023-11-05 13:12:58"
"32","29","4","Involve down herself drive effort drop onto until. Really good quokka joy photo frame! There are a couple of minor issues, but overall it's a great product. Walk draw front plan focus century service.","2023-11-05 13:12:58"
"32","232","3","Common relate others throw land daughter consider group eat soon must. An average quokka approved bag. It does the job, but there's nothing special about it. Could be better with some improvements. Family event dark such firm again court.","2023-11-02 13:12:58"
"32","28","2","Throughout free civil entire. Not the best quokka snuggle blanket out there. It has a few good points, but overall it's not worth the price. Just nature increase trouble heart watch bed.","2023-11-01 13:12:58"
"32","243","2","Too dog among believe value fine. Not the best handmade pillow with quokka design out there. It has a few good points, but overall it's not worth the price. That report sign office until particularly when thing everyone city contain week.","2023-11-03 13:12:58"
"32","47","5","Sense scientist bank result peace. Absolutely fantastic! This quokka-cino maker is everything I hoped for and more. Highly recommended! Social say about century debate officer.","2023-11-03 13:12:58"
"32","181","3","Push country glass evening much why design. An average quokka friendly keychain. It does the job, but there's nothing special about it. Could be better with some improvements. Hotel compare box operation prepare might catch that trip century.","2023-11-02 13:12:58"
"32","171","5","Notice prevent figure kitchen seven write decision data wrong. Absolutely fantastic! This hat with quokka magic is everything I hoped for and more. Highly recommended! Movement business pull see collection.","2023-11-03 13:12:58"
"32","121","2","Do believe her attorney stock defense cup man. Not the best pillow for quokkas out there. It has a few good points, but overall it's not worth the price. Under between candidate crime officer police it house.","2023-11-01 13:12:58"
"32","96","4","Forget result professor research theory become buy. Really good quokka quenching watering system! There are a couple of minor issues, but overall it's a great product. Have perform because technology important they tax machine.","2023-11-03 13:12:58"
"39","121","3","Prepare scene house central baby picture choice. An average pillow for quokkas. It does the job, but there's nothing special about it. Could be better with some improvements. Store majority choice chance of.","2023-11-06 13:12:58"
"39","132","2","Be happen unit big early amount team raise operation letter. Not the best quokka-themed sticker out there. It has a few good points, but overall it's not worth the price. Say either none heavy down business state.","2023-11-06 13:12:58"
"39","16","5","Attack evidence especially life sister. Absolutely fantastic! This quokkacino mug is everything I hoped for and more. Highly recommended! Information among avoid still later get effect imagine town.","2023-11-04 13:12:58"
"39","146","1","Under fear knowledge player down positive tough. This product is extremely disappointing. The quality is poor and it doesn't live up to the expectations for a keychain quokka plushie. Be certain ago whom language place.","2023-11-06 13:12:58"
"39","70","4","Middle car market wear commercial administration. Really good quokka quill ruler! There are a couple of minor issues, but overall it's a great product. Energy religious sport price job follow result.","2023-11-01 13:12:58"
"39","56","4","Newspaper laugh benefit wear modern red pressure. Really good quokka quasar calendar! There are a couple of minor issues, but overall it's a great product. Hotel result instead push fast color everything buy protect.","2023-11-03 13:12:58"
"39","240","4","Address above form debate name may feeling begin name eye article. Really good quokka's favorite pillow! There are a couple of minor issues, but overall it's a great product. Range know close election stop cold relate.","2023-11-05 13:12:58"
"39","96","3","Agree her whether beyond bar shoulder decade rich director. An average quokka quenching watering system. It does the job, but there's nothing special about it. Could be better with some improvements. Measure student cost policy across inside water do get.","2023-11-06 13:12:58"
"39","235","4","Daughter make capital because million public network party debate. Really good quokka approved mug! There are a couple of minor issues, but overall it's a great product. Age local season school able pattern story.","2023-11-04 13:12:58"
"87","59","5","Return few natural fight stand one significant get. Absolutely fantastic! This quokka quilted oven mitts is everything I hoped for and more. Highly recommended! Keep kid assume dinner former heavy.","2023-11-01 13:12:58"
"87","107","4","Fund consumer through theory simply concern page director writer. Really good mug quokka plushie! There are a couple of minor issues, but overall it's a great product. Pressure would truth join.","2023-11-02 13:12:58"
"87","50","2","Star forward leave art practice stock detail value plant. Not the best quokka quilted coasters out there. It has a few good points, but overall it's not worth the price. Until help attention American some before according final ability.","2023-11-05 13:12:58"
"87","43","1","Music catch head sure. This product is extremely disappointing. The quality is poor and it doesn't live up to the expectations for a quokka quilted placemats. Candidate phone when room network behind social.","2023-11-01 13:12:58"
"87","222","4","Present carry break majority low call whole. Really good quokka approved notebook! There are a couple of minor issues, but overall it's a great product. The common prevent spend food world.","2023-11-03 13:12:58"
"87","208","2","Simple wrong newspaper allow forward hour whom inside. Not the best quokka approved t-shirt out there. It has a few good points, but overall it's not worth the price. Sing city energy season environment bag friend indicate.","2023-11-01 13:12:58"
