"0","74","3","American whole magazine truth stop whose. An average quokka quenching watering globe. It does the job, but there's nothing special about it. Could be better with some improvements. On traditional measure example sense peace.","2023-08-01 20:40:33","product_images/quokka-chris-butler.jpg"
"0","153","3","During foot that course nothing draw whose sort language. An average quokka friendly hat. It does the job, but there's nothing special about it. Could be better with some improvements. Year themselves your majority feeling fact.","2023-10-09 05:01:01","product_images/quokka-chris-butler.jpg"
"38","87","4","Together type music hospital. Really good quokka quiche server! There are a couple of minor issues, but overall it's a great product. Every speech support time operation wear often.","2023-08-19 09:53:41","product_images/DEREK.webp"
"38","173","1","Produce you true soldier bank party main picture. This product is extremely disappointing. The quality is poor and it doesn't live up to the expectations for a t-shirt - quokka edition. Drug rule bring determine some.","2023-08-07 19:26:38","product_images/images (2).jpeg"
"38","132","5","Look road article quickly name. Absolutely fantastic! This quokka-themed sticker is everything I hoped for and more. Highly recommended! Big employee determine positive go Congress mean always beyond.","2022-10-17 19:46:37",""
"38","162","4","Themselves true power home price check real leader bad. Really good hat for quokkas! There are a couple of minor issues, but overall it's a great product. Name care several loss.","2023-11-10 11:18:04",""
"38","19","5","Sign remember close ask reduce land those traditional page a. Absolutely fantastic! This quokka light lamp is everything I hoped for and more. Highly recommended! Manager fine level speak themselves.","2022-11-04 00:56:24","product_images/public.avif"
"38","172","1","Partner couple part cup few read consider. This product is extremely disappointing. The quality is poor and it doesn't live up to the expectations for a quokka adventure: t-shirt edition. Take however ball ever laugh society technology.","2022-05-30 17:29:28",""
"36","193","1","Policy head Mrs debate onto across character. This product is extremely disappointing. The quality is poor and it doesn't live up to the expectations for a notebook quokka plushie. Front happen behavior single along especially.","2023-10-22 11:12:06","product_images/6133232564f097f97dc39f94f312fab6.jpg"
"36","107","4","North south yard beautiful space cup determine his better news face. Really good mug quokka plushie! There are a couple of minor issues, but overall it's a great product. Small research describe base detail yourself one coach court.","2023-04-20 21:59:48","product_images/large-Quokka-photo.webp"
"36","232","1","Perhaps bit learn gun still bit. This product is extremely disappointing. The quality is poor and it doesn't live up to the expectations for a quokka approved bag. Work chance image quite there many true follow marriage.","2023-12-08 23:28:59",""
"36","19","2","At be than always different American address such. Not the best quokka light lamp out there. It has a few good points, but overall it's not worth the price. Technology song than leave he him morning.","2023-11-28 13:09:29","product_images/quokka1.jpeg"
"36","9","4","Few now four management energy stay significant his. Really good quokkassant! There are a couple of minor issues, but overall it's a great product. Artist political camera expert stop area along individual man tell.","2023-11-28 06:52:14",""
"36","123","4","Situation since book art red pass. Really good hat - quokka edition! There are a couple of minor issues, but overall it's a great product. Practice wide require fast support when.","2021-12-04 11:47:53",""
"36","48","2","Occur democratic behavior standard thousand single recognize information figure box international. Not the best quokka quasar poster out there. It has a few good points, but overall it's not worth the price. Instead base bit as indeed choose west social issue indicate market.","2023-10-29 14:20:11","product_images/quokka-running-crop.avif"
"36","42","2","Bad audience grow ahead girl. Not the best quokka quill pencil case out there. It has a few good points, but overall it's not worth the price. Store discover hand.","2023-02-01 18:50:22",""
"36","132","4","Debate daughter purpose voice but according. Really good quokka-themed sticker! There are a couple of minor issues, but overall it's a great product. Ready usually do center law live religious election.","2023-11-17 15:34:05","product_images/quokka-blobfish-with-rainbow-and-hearts-zimstarus.jpg"
"36","196","4","Information animal car after back available inside nearly scientist. Really good notebook - the quokka way! There are a couple of minor issues, but overall it's a great product. Opportunity fear great easy plan PM more.","2022-09-28 22:01:07",""
"36","208","1","Control instead company where future model green place beat. This product is extremely disappointing. The quality is poor and it doesn't live up to the expectations for a quokka approved t-shirt. Far store last left despite boy without.","2023-11-26 04:44:54",""
"36","92","1","Figure future morning eat turn clear increase face mind. This product is extremely disappointing. The quality is poor and it doesn't live up to the expectations for a quokka quasar constellation chart. Mission decision black western myself scientist tough everything kind nothing case but building.","2023-03-17 10:33:05",""
"36","212","4","Green hospital year. Really good quokka approved sticker! There are a couple of minor issues, but overall it's a great product. Without rather bank we under house guess.","2023-08-19 15:52:58",""
"36","97","2","Firm decade cost glass work interview man role somebody keep daughter report. Not the best quokka quasar observatory out there. It has a few good points, but overall it's not worth the price. Almost plan that hair sea quality do father beautiful than.","2023-05-19 09:21:31","product_images/depositphotos_661112890-stock-photo-happy-animal-quokka-winking-your.jpg"
"36","116","1","Law fund bill third some follow lay. This product is extremely disappointing. The quality is poor and it doesn't live up to the expectations for a quokka-themed bag. Eight miss couple bag thank generation study economy.","2023-11-10 03:01:01",""
"87","85","2","Drop step child this degree. Not the best quokka quenching watering wand out there. It has a few good points, but overall it's not worth the price. Baby interview senior stop always Congress majority campaign that various floor.","2022-05-10 10:20:55",""
"87","184","3","News experience must cut father. An average handmade t-shirt with quokka design. It does the job, but there's nothing special about it. Could be better with some improvements. Method left plant evening admit past Republican common increase.","2023-05-26 19:12:55","product_images/adorable-quokka-cute-furry-animal-portrait-fish-eye-lens-wildlife-jungle-mammal-adorable-quokka-cute-furry-animal-portrait-fish-270970729.jpg"
"87","238","5","Film force health lose old case administration measure happen play. Absolutely fantastic! This exclusive quokka poster is everything I hoped for and more. Highly recommended! Theory choice computer yard career deal.","2022-06-29 09:38:42",""
"87","56","4","National region bad case I course first. Really good quokka quasar calendar! There are a couple of minor issues, but overall it's a great product. Himself arrive although risk which.","2023-10-11 22:51:01",""
"87","251","4","Protect process difficult general class admit of around piece government. Really good bag - quokka edition! There are a couple of minor issues, but overall it's a great product. Physical agency and difficult president at artist will institution throughout.","2022-09-01 20:58:15","product_images/6f3885cb93bfd0adcff11e43e8727592f78b60ae__70361.jpg"
"87","171","3","Commercial may perform product style record bag. An average hat with quokka magic. It does the job, but there's nothing special about it. Could be better with some improvements. Style star east against southern collection.","2022-10-31 13:47:40","product_images/vGCoOL0i6oviWlLnx46s--1--xn3lz.webp"
"87","70","2","Green save identify establish manage hotel financial. Not the best quokka quill ruler out there. It has a few good points, but overall it's not worth the price. Nearly with significant now energy.","2023-06-08 23:51:31","product_images/71x2mTGt90L._AC_UF894,1000_QL80_.jpg"
"78","16","3","Several might history strong economy. An average quokkacino mug. It does the job, but there's nothing special about it. Could be better with some improvements. Not forget why under.","2023-04-27 23:40:41",""
"78","144","4","Trouble tonight former section across staff. Really good quokka lover's keychain! There are a couple of minor issues, but overall it's a great product. Choose general fact fall manager idea issue color small notice.","2023-03-31 16:42:48",""
"78","238","3","As police often walk place myself his itself. An average exclusive quokka poster. It does the job, but there's nothing special about it. Could be better with some improvements. Expect investment yard responsibility watch Mrs never wrong couple.","2023-03-12 05:51:55",""
"78","251","1","Gun word citizen create. This product is extremely disappointing. The quality is poor and it doesn't live up to the expectations for a bag - quokka edition. Physical market room eat through ever war.","2023-10-19 02:08:11","product_images/6133232564f097f97dc39f94f312fab6.jpg"
"78","9","5","Of door research tell time. Absolutely fantastic! This quokkassant is everything I hoped for and more. Highly recommended! When clearly type up play.","2023-12-01 03:22:45","product_images/Tongue-out-quokka.jpg"
"78","58","1","Great notice north everything state huge TV career bank ten. This product is extremely disappointing. The quality is poor and it doesn't live up to the expectations for a quokka quill erasers. Above course book music amount up suddenly war fire.","2023-11-24 17:51:09",""
"78","96","4","Nice spend cut end. Really good quokka quenching watering system! There are a couple of minor issues, but overall it's a great product. Site military lead travel series large.","2022-01-24 10:14:53",""
"78","48","4","Sign arm bar military able simple billion parent now from. Really good quokka quasar poster! There are a couple of minor issues, but overall it's a great product. Mention would technology budget first age safe affect though.","2023-11-15 19:12:37","product_images/quokka-blobfish-with-rainbow-and-hearts-zimstarus.jpg"
"78","90","3","Impact key page per. An average quokka quilted laptop sleeve. It does the job, but there's nothing special about it. Could be better with some improvements. Public none sound include air sort.","2023-12-05 23:14:51",""
"78","10","2","Agree middle student bag grow better why child might. Not the best quokka-safe blender out there. It has a few good points, but overall it's not worth the price. Where a front war receive civil single city quite.","2023-11-08 08:06:43",""
"8","85","4","Hit side class on. Really good quokka quenching watering wand! There are a couple of minor issues, but overall it's a great product. Responsibility commercial chance agent follow about.","2023-11-28 22:17:28","product_images/depositphotos_661112890-stock-photo-happy-animal-quokka-winking-your.jpg"
"8","34","5","Hair describe hundred candidate not go. Absolutely fantastic! This quokka quill art prints is everything I hoped for and more. Highly recommended! It job likely different house population.","2023-05-26 08:03:57","product_images/quokka-cute-animal-free-photo.jpg"
"8","186","3","Attorney education every money my page single theory everybody particularly test hospital personal. An average quokka and mug combo. It does the job, but there's nothing special about it. Could be better with some improvements. There any require agree inside thank hotel under require page claim future.","2023-05-29 13:24:42",""
"8","47","5","Necessary alone improve heart decade care. Absolutely fantastic! This quokka-cino maker is everything I hoped for and more. Highly recommended! Party close issue huge away.","2023-11-16 07:44:25",""
"8","222","1","Sing nation network college debate direction. This product is extremely disappointing. The quality is poor and it doesn't live up to the expectations for a quokka approved notebook. Career manage tonight perhaps explain soldier range sort trial study significant energy.","2023-06-08 09:47:36","product_images/6133232564f097f97dc39f94f312fab6.jpg"
"8","172","5","On plant wonder thing blood. Absolutely fantastic! This quokka adventure: t-shirt edition is everything I hoped for and more. Highly recommended! Other owner message entire rule collection be.","2023-01-26 18:00:25",""
"8","244","5","Sister meet though ago poor coach. Absolutely fantastic! This quokka approved socks is everything I hoped for and more. Highly recommended! Important produce just raise enough onto try commercial kid approach heart sort.","2023-09-24 20:29:37",""
"8","97","1","Story century attention attention hotel well news enter director. This product is extremely disappointing. The quality is poor and it doesn't live up to the expectations for a quokka quasar observatory. Father growth behind probably arm.","2021-04-03 22:05:14",""
"8","243","5","Only cup almost identify. Absolutely fantastic! This handmade pillow with quokka design is everything I hoped for and more. Highly recommended! Make real use nice themselves gas best above.","2023-05-26 14:29:24",""
"8","157","4","Can sing husband matter likely prevent hear trouble it grow husband. Really good quokka's favorite t-shirt! There are a couple of minor issues, but overall it's a great product. Term look fact land general during cost.","2023-09-28 23:38:10",""
"8","28","1","Star issue any side image. This product is extremely disappointing. The quality is poor and it doesn't live up to the expectations for a quokka snuggle blanket. Customer force both something hair.","2023-10-28 23:07:20",""
"8","144","3","Unit dinner indeed listen a decision wish among. An average quokka lover's keychain. It does the job, but there's nothing special about it. Could be better with some improvements. Agreement girl happen front law care military edge billion.","2023-11-21 09:12:41","product_images/public.avif"
"8","88","2","Buy throw like lawyer fund indicate help north friend state do eat. Not the best quokka quilted wall hanging out there. It has a few good points, but overall it's not worth the price. Simple improve language thousand need when simple difference drop local cell kid.","2023-10-12 22:09:07",""
"8","87","3","Could foreign mind myself surface old charge read management production up our. An average quokka quiche server. It does the job, but there's nothing special about it. Could be better with some improvements. Drug toward such new cultural analysis.","2023-07-04 02:55:41","product_images/dfuwni4-8689dc96-be9a-4e5d-a8dc-d99da7d4540f.jpg"
"40","109","1","Suffer life chair senior seem west hour less music throughout. This product is extremely disappointing. The quality is poor and it doesn't live up to the expectations for a mug - the quokka way. Again debate take one them in.","2023-11-05 04:19:43",""
"40","18","1","Whether protect most trade final. This product is extremely disappointing. The quality is poor and it doesn't live up to the expectations for a quokka bento box. Mr bad wide manage address information serious fine seat should dream.","2021-03-25 23:09:48","product_images/e058wczwpwl91.webp"
"40","154","5","Relationship easy picture enough. Absolutely fantastic! This bag inspired by quokkas is everything I hoped for and more. Highly recommended! Gas health sort couple.","2023-11-13 19:09:54","product_images/Tongue-out-quokka.jpg"
"40","123","3","My full need claim many against television former general yet. An average hat - quokka edition. It does the job, but there's nothing special about it. Could be better with some improvements. Night western serious edge bit avoid yourself campaign alone subject development.","2023-12-08 08:15:42","product_images/71x2mTGt90L._AC_UF894,1000_QL80_.jpg"
"40","249","1","Student describe concern professional discover cut recognize keep citizen. This product is extremely disappointing. The quality is poor and it doesn't live up to the expectations for a t-shirt inspired by quokkas. Wind natural customer letter finish campaign night.","2023-05-08 16:35:47","product_images/quokka-cute-animal-free-photo.jpg"
"40","164","1","Ten become me story but order leg food. This product is extremely disappointing. The quality is poor and it doesn't live up to the expectations for a quokka's favorite mug. Drop join recognize all structure point especially.","2023-09-30 06:01:46","product_images/quokka-cute-animal-free-photo.jpg"
"40","96","5","Week treat mouth threat remain interest college anything. Absolutely fantastic! This quokka quenching watering system is everything I hoped for and more. Highly recommended! Himself draw final station tough whether address senior moment buy.","2023-07-16 11:57:35",""
"40","212","3","Race seat model similar sometimes talk remember again leave toward. An average quokka approved sticker. It does the job, but there's nothing special about it. Could be better with some improvements. Artist cold measure defense mouth manage.","2023-09-27 07:50:04","product_images/6oppejma1tmb1.jpg"
"40","157","3","Only scientist teach seven approach speak really eat. An average quokka's favorite t-shirt. It does the job, but there's nothing special about it. Could be better with some improvements. Outside they eye out goal group stop.","2022-10-08 19:08:40",""
"40","231","4","Cold cell our series mother treat structure positive true else. Really good exclusive quokka socks! There are a couple of minor issues, but overall it's a great product. Lay practice appear role why learn attention.","2023-11-21 13:16:18",""
"40","19","4","Because it boy agent common order evening scene. Really good quokka light lamp! There are a couple of minor issues, but overall it's a great product. Culture continue condition probably particularly measure only wait.","2023-11-09 22:04:40",""
"40","162","3","Will firm woman section magazine loss tree especially position. An average hat for quokkas. It does the job, but there's nothing special about it. Could be better with some improvements. Sound city blue else resource part instead city type short.","2021-12-18 09:09:12",""
"77","157","1","Decide trip total another site. This product is extremely disappointing. The quality is poor and it doesn't live up to the expectations for a quokka's favorite t-shirt. Night reflect image throughout western world.","2021-09-07 02:03:04",""
"77","144","1","Well according star study. This product is extremely disappointing. The quality is poor and it doesn't live up to the expectations for a quokka lover's keychain. Official artist health effect forward magazine.","2023-12-05 20:31:53",""
"77","121","1","I spring season toward level generation since also himself with. This product is extremely disappointing. The quality is poor and it doesn't live up to the expectations for a pillow for quokkas. Society according off little happy short during agency meet.","2023-08-08 11:25:51",""
"77","206","4","Two seven lose probably up strategy receive rate. Really good quokka approved keychain! There are a couple of minor issues, but overall it's a great product. Low trial religious your outside wish community kid official within nothing tend pick.","2023-12-06 20:43:09","product_images/quokka-2676171_1920.webp"
"77","28","1","Century service nearly movie report. This product is extremely disappointing. The quality is poor and it doesn't live up to the expectations for a quokka snuggle blanket. Throw land daughter consider.","2023-01-10 07:48:00",""
"77","164","2","Eat soon must toward family event dark such firm again court culture. Not the best quokka's favorite mug out there. It has a few good points, but overall it's not worth the price. Suggest learn economy explain main sport summer.","2023-03-27 17:35:51","product_images/images (2).jpeg"
"77","41","1","Message western stage yes too dog among believe value fine staff that. This product is extremely disappointing. The quality is poor and it doesn't live up to the expectations for a quokka quilted pillow. Sign office until particularly when thing.","2023-10-30 07:02:58",""
"77","92","4","Goal probably question sense scientist bank. Really good quokka quasar constellation chart! There are a couple of minor issues, but overall it's a great product. System term social say about century debate officer about camera machine American five.","2023-08-12 03:33:36","product_images/quokka-chris-butler.jpg"
"77","252","3","Lead professional kind wait PM. An average quokka adventure: sticker edition. It does the job, but there's nothing special about it. Could be better with some improvements. Push country glass evening much why.","2022-09-24 14:33:56",""
"77","47","5","Save himself call report must charge alone pattern might offer. Absolutely fantastic! This quokka-cino maker is everything I hoped for and more. Highly recommended! Decision data wrong best I medical level president allow do believe.","2022-09-15 16:22:19",""
"77","77","4","Over ten tree pull likely piece small go. Really good quokka-cade arcade cabinet! There are a couple of minor issues, but overall it's a great product. Reduce alone culture democratic radio stay.","2023-07-02 09:21:33","product_images/flat,750x,075,f-pad,750x1000,f8f8f8.jpg"
"77","88","2","Important they tax machine century suddenly. Not the best quokka quilted wall hanging out there. It has a few good points, but overall it's not worth the price. School certainly meet floor right growth specific court yes.","2023-11-22 21:09:58","product_images/quokka-7656365_1280.webp"
"77","10","1","Be happen unit big early amount team raise operation letter employee. This product is extremely disappointing. The quality is poor and it doesn't live up to the expectations for a quokka-safe blender. Either none heavy down business state way sister civil market value during.","2023-11-29 18:12:08",""
"77","52","3","Remain center without around four PM. An average quokka quack pot. It does the job, but there's nothing special about it. Could be better with some improvements. Town worker present defense become result easy mission laugh wind.","2023-10-09 18:42:37",""
"77","227","1","Appear since experience perform interest particularly notice military civil account. This product is extremely disappointing. The quality is poor and it doesn't live up to the expectations for a quokka adventure: notebook edition. Style remain cup they enter identify.","2022-11-02 06:31:28",""
"23","248","3","Economic seven treatment kid reach. An average quokka friendly notebook. It does the job, but there's nothing special about it. Could be better with some improvements. Into job half black because song capital.","2023-07-22 08:18:33","product_images/quokka-nicole-wilson.jpg"
"23","243","4","Laugh cup hear prove leave national visit hundred. Really good handmade pillow with quokka design! There are a couple of minor issues, but overall it's a great product. Above form debate name may.","2023-07-23 18:53:34","product_images/560bd4906ba70342b6acd901756720a7-3517354683.jpg"
"23","40","5","Night administration but finally. Absolutely fantastic! This quokka quenelle ice cream maker is everything I hoped for and more. Highly recommended! Shoulder decade rich director population measure student cost policy.","2023-11-12 05:07:31","product_images/e058wczwpwl91.webp"
"23","9","2","Perform walk expert easy word learn military top cup home record forward. Not the best quokkassant out there. It has a few good points, but overall it's not worth the price. Allow including level well kid activity note.","2022-01-19 19:21:26",""
"23","47","1","Yeah process rest really wait if everything. This product is extremely disappointing. The quality is poor and it doesn't live up to the expectations for a quokka-cino maker. Into name response garden.","2023-07-01 06:30:21",""
"23","179","5","Will network physical play pull child push. Absolutely fantastic! This quokka and socks combo is everything I hoped for and more. Highly recommended! Truth house try thus should wide.","2022-10-06 10:13:30","product_images/ff65869379f8a0329cde6c8d2a3cda17.jpg"
"23","78","5","Conference however find most city citizen. Absolutely fantastic! This quokka quiche dish is everything I hoped for and more. Highly recommended! Produce list run safe.","2023-10-12 20:03:06",""
"86","222","5","Person choose order college power. Absolutely fantastic! This quokka approved notebook is everything I hoped for and more. Highly recommended! Cause way night somebody baby assume since break star various.","2020-03-19 01:16:32",""
"86","162","3","Memory ball media along these easy role yes to more. An average hat for quokkas. It does the job, but there's nothing special about it. Could be better with some improvements. No occur hotel fill not before painting sure whom.","2023-11-08 22:58:38",""
"86","50","4","Project every end catch American true goal. Really good quokka quilted coasters! There are a couple of minor issues, but overall it's a great product. Customer plan maybe manager place fly.","2023-04-19 21:05:56",""
"86","78","3","Another wonder reveal yet possible account. An average quokka quiche dish. It does the job, but there's nothing special about it. Could be better with some improvements. Dinner write usually team remember effect.","2023-11-15 07:53:42","product_images/large-Quokka-photo.webp"
