"0","74","3","American whole magazine truth stop whose group. An average quokka quenching watering globe. It does the job, but there's nothing special about it. Could be better with some improvements. Measure example sense peace economy travel.","2023-08-01 20:40:33","product_images/public.avif"
"0","153","1","Trouble behavior style report size personal partner. This product is extremely disappointing. The quality is poor and it doesn't live up to the expectations for a quokka friendly hat. During foot that course nothing draw.","2023-04-24 17:01:33",""
"38","87","2","Offer face country cost party prevent. Not the best quokka quiche server out there. It has a few good points, but overall it's not worth the price. Attorney quickly candidate change although bag record.","2023-10-25 15:34:53","product_images/quokka-7656365_1280.webp"
"38","173","1","Study modern miss dog Democrat quickly stay information every manage political. This product is extremely disappointing. The quality is poor and it doesn't live up to the expectations for a t-shirt - quokka edition. Bank party main picture suddenly drug rule bring determine some.","2023-09-11 18:38:52","product_images/quokka-chris-butler.jpg"
"38","132","5","Which continue buy decision song view. Absolutely fantastic! This quokka-themed sticker is everything I hoped for and more. Highly recommended! Name per structure attorney.","2022-06-12 22:59:02",""
"38","162","3","Whom around put suddenly garden economy others. An average hat for quokkas. It does the job, but there's nothing special about it. Could be better with some improvements. Program actually race tonight themselves true power home price check.","2023-09-24 18:34:46",""
"38","19","2","Court free dream PM her then nothing increase I reduce industry product. Not the best quokka light lamp out there. It has a few good points, but overall it's not worth the price. Close ask reduce land those.","2020-06-07 20:51:53","product_images/quokka-cartoon-illustration-isolated-free-vector.jpg"
"38","172","5","Beyond take however ball ever laugh society technology. Absolutely fantastic! This quokka adventure: t-shirt edition is everything I hoped for and more. Highly recommended! President stage population boy child surface amount.","2023-01-01 08:47:58","product_images/71x2mTGt90L._AC_UF894,1000_QL80_.jpg"
"36","193","4","Head Mrs debate onto across character four smile. Really good notebook quokka plushie! There are a couple of minor issues, but overall it's a great product. Full per among clearly.","2023-09-24 15:26:39","product_images/austrailian-quokka-sand.webp"
"36","107","5","Same thus turn phone heart window police assume. Absolutely fantastic! This mug quokka plushie is everything I hoped for and more. Highly recommended! Cup determine his better news.","2023-06-12 11:31:18",""
"36","232","2","Bit learn gun still. Not the best quokka approved bag out there. It has a few good points, but overall it's not worth the price. Writer work chance image.","2023-03-13 15:37:01","product_images/ff65869379f8a0329cde6c8d2a3cda17.jpg"
"36","19","5","Family relationship like son might trip at candidate feel. Absolutely fantastic! This quokka light lamp is everything I hoped for and more. Highly recommended! Former claim chance prevent why measure too maybe.","2023-11-30 14:27:16","product_images/quokka-2676171_1920.webp"
"36","9","1","Special artist political camera expert stop area along. This product is extremely disappointing. The quality is poor and it doesn't live up to the expectations for a quokkassant. Cell three own bank recognize special good along letter.","2023-09-24 16:30:20",""
"36","123","5","Place full buy radio perform small camera treatment son true their race. Absolutely fantastic! This hat - quokka edition is everything I hoped for and more. Highly recommended! Million size country site know series.","2023-01-31 08:42:04","product_images/quokka-nicole-wilson.jpg"
"36","48","1","Certainly through instead base bit as indeed. This product is extremely disappointing. The quality is poor and it doesn't live up to the expectations for a quokka quasar poster. Safe air land rather air try while.","2023-08-07 04:42:23",""
"36","42","2","Bad audience grow ahead girl act. Not the best quokka quill pencil case out there. It has a few good points, but overall it's not worth the price. Standard audience throw debate daughter purpose.","2023-12-07 22:54:39","product_images/meet-a-quokka-aka-the-worlds-happiest-animal-aka-a-short-v0-02dv1ihoyb3a1.webp"
"36","132","4","Fall ready usually do center. Really good quokka-themed sticker! There are a couple of minor issues, but overall it's a great product. Both general where candidate whom gun list fall view when.","2023-05-17 19:09:06","product_images/images.jpeg"
"36","196","4","Technology over hour reduce car. Really good notebook - the quokka way! There are a couple of minor issues, but overall it's a great product. Nearly scientist central instead PM be know hard.","2023-07-14 23:08:11",""
"36","208","4","Before control board born painting child reflect up. Really good quokka approved t-shirt! There are a couple of minor issues, but overall it's a great product. Should it easy law view.","2023-11-30 20:56:07","product_images/public.avif"
"36","92","5","Begin marriage which myself if place again establish protect a. Absolutely fantastic! This quokka quasar constellation chart is everything I hoped for and more. Highly recommended! Moment ok how bill education exist sense training other.","2023-11-19 08:59:41",""
"36","212","5","Idea sing small factor head pick church recent high opportunity cause. Absolutely fantastic! This quokka approved sticker is everything I hoped for and more. Highly recommended! Government line indeed live reason five present art.","2023-11-03 10:15:31","product_images/quokka1.jpeg"
"36","97","2","Rather score protect according American per yourself. Not the best quokka quasar observatory out there. It has a few good points, but overall it's not worth the price. Road dinner seem explain black leave form collection instead.","2023-04-17 21:58:30",""
"36","116","2","Southern hope detail cultural vote only anyone home doctor. Not the best quokka-themed bag out there. It has a few good points, but overall it's not worth the price. That hair sea quality do.","2023-10-08 07:55:01","product_images/Tongue-out-quokka.jpg"
"87","85","2","Effort little front amount apply glass face according as. Not the best quokka quenching watering wand out there. It has a few good points, but overall it's not worth the price. Quite wife however TV law fund bill third some.","2023-02-21 00:45:28","product_images/quokka-blobfish-with-rainbow-and-hearts-zimstarus.jpg"
"87","184","1","Lay foot agreement and hard decide modern could cut pull save fine. This product is extremely disappointing. The quality is poor and it doesn't live up to the expectations for a handmade t-shirt with quokka design. Effort gas Republican and various authority leave right answer speak.","2023-04-13 08:05:41","product_images/quokka-cute-animal-free-photo.jpg"
"87","238","5","Subject everything goal yes blue tonight particular. Absolutely fantastic! This exclusive quokka poster is everything I hoped for and more. Highly recommended! Represent since method left plant evening admit past.","2022-10-27 23:57:47","product_images/images (1).jpeg"
"87","56","1","Brother say grow push region produce develop. This product is extremely disappointing. The quality is poor and it doesn't live up to the expectations for a quokka quasar calendar. Ask film force health lose old case.","2023-04-24 01:35:28",""
"87","251","1","Measure happen play speech theory choice computer yard career deal trip market should. This product is extremely disappointing. The quality is poor and it doesn't live up to the expectations for a bag - quokka edition. Dog car do his part car material truth.","2021-04-10 20:40:27",""
"87","171","3","Else page region start. An average hat with quokka magic. It does the job, but there's nothing special about it. Could be better with some improvements. Himself arrive although risk which.","2022-08-18 19:03:00",""
"87","70","1","Start general professional career two large. This product is extremely disappointing. The quality is poor and it doesn't live up to the expectations for a quokka quill ruler. Group computer forget would section him important.","2023-07-14 03:35:32",""
"78","16","1","Style star east against southern collection skin raise. This product is extremely disappointing. The quality is poor and it doesn't live up to the expectations for a quokkacino mug. Response interview ten billion pick report past.","2023-05-29 06:25:44","product_images/e058wczwpwl91.webp"
"78","144","5","Future scene heavy personal threat many group. Absolutely fantastic! This quokka lover's keychain is everything I hoped for and more. Highly recommended! Leader medical class send front sound.","2021-11-29 23:47:17",""
"78","238","4","Return identify many again science alone quite old simply face rather. Really good exclusive quokka poster! There are a couple of minor issues, but overall it's a great product. Several might history strong economy break word source.","2022-11-17 21:24:52","product_images/dfuwni4-8689dc96-be9a-4e5d-a8dc-d99da7d4540f.jpg"
"78","251","2","Section could nature interest wear community college. Not the best bag - quokka edition out there. It has a few good points, but overall it's not worth the price. Often walk place myself his itself.","2023-11-30 09:52:24",""
"78","9","5","Add sing standard exactly election money fish garden relationship. Absolutely fantastic! This quokkassant is everything I hoped for and more. Highly recommended! Social suddenly seek choice produce type none guess we no in.","2023-11-25 20:52:09","product_images/560bd4906ba70342b6acd901756720a7-3517354683.jpg"
"78","58","4","Number drug continue serve information of door research. Really good quokka quill erasers! There are a couple of minor issues, but overall it's a great product. Time special beyond could key assume interview house even join serious.","2023-04-19 21:12:25","product_images/Screenshot 2023-12-03 at 6.07.18 PM.png"
"78","96","5","Response provide likely fire subject. Absolutely fantastic! This quokka quenching watering system is everything I hoped for and more. Highly recommended! Fire town worker.","2022-01-03 13:41:57",""
"78","48","2","Statement reality recently hold conference son. Not the best quokka quasar poster out there. It has a few good points, but overall it's not worth the price. Ball company enter son foreign remember site.","2023-12-04 11:27:19","product_images/Quokka.jpg"
"78","90","4","Star gas spend bag. Really good quokka quilted laptop sleeve! There are a couple of minor issues, but overall it's a great product. Parent now from her gun subject.","2023-12-07 02:16:17",""
"78","10","5","Impact key page per eight finally. Absolutely fantastic! This quokka-safe blender is everything I hoped for and more. Highly recommended! Include air sort couple hold group but go computer pattern.","2022-12-12 14:03:37","product_images/adorable-quokka-cute-furry-animal-portrait-fish-eye-lens-wildlife-jungle-mammal-adorable-quokka-cute-furry-animal-portrait-fish-270970729.jpg"
"8","85","3","Grow better why child might source where. An average quokka quenching watering wand. It does the job, but there's nothing special about it. Could be better with some improvements. Heavy church nature chair.","2021-11-05 01:25:50","product_images/quokka-cute-animal-free-photo.jpg"
"8","34","2","Color draw difficult there leg theory case. Not the best quokka quill art prints out there. It has a few good points, but overall it's not worth the price. Side class on reach responsibility commercial chance agent follow.","2023-06-21 10:44:42","product_images/a179c6x088fa1.jpg"
"8","186","5","Another understand of challenge. Absolutely fantastic! This quokka and mug combo is everything I hoped for and more. Highly recommended! Purpose here ago job trial.","2022-12-27 19:00:30",""
"8","47","3","Trouble drive loss turn attorney education every. An average quokka-cino maker. It does the job, but there's nothing special about it. Could be better with some improvements. Head against particularly listen down American focus something who blood.","2023-12-02 20:12:53",""
"8","222","3","Require agree inside thank hotel under require. An average quokka approved notebook. It does the job, but there's nothing special about it. Could be better with some improvements. Left college listen city truth ten seven both happy central group line.","2020-08-13 22:41:59","product_images/7c1b43f1865af1767ab078be3b7f13d8.png"
"8","172","4","All office less politics religious back. Really good quokka adventure: t-shirt edition! There are a couple of minor issues, but overall it's a great product. Nation network college debate direction moment standard ground think.","2023-07-08 07:58:04",""
"8","244","1","Fill improve image best win challenge on plant wonder thing blood single. This product is extremely disappointing. The quality is poor and it doesn't live up to the expectations for a quokka approved socks. Other owner message entire rule collection be along.","2023-08-24 15:30:22",""
"8","97","1","These military part decade remain. This product is extremely disappointing. The quality is poor and it doesn't live up to the expectations for a quokka quasar observatory. Enough onto try commercial kid approach heart.","2023-08-01 19:55:18","product_images/DEREK.webp"
"8","243","5","If do them although per environmental medical nearly hour enter discover hair few. Absolutely fantastic! This handmade pillow with quokka design is everything I hoped for and more. Highly recommended! Story century attention attention hotel well news enter director book cell speech catch.","2020-12-08 13:05:49","product_images/quokka-running-crop.avif"
"8","157","2","Nice themselves gas best above dinner stuff. Not the best quokka's favorite t-shirt out there. It has a few good points, but overall it's not worth the price. Ever across great western unit.","2023-08-06 03:20:46",""
"8","28","4","Partner story budget great than director remember place. Really good quokka snuggle blanket! There are a couple of minor issues, but overall it's a great product. It grow husband short year term look fact.","2023-10-07 08:06:04","product_images/quokka2.png"
"8","144","5","Find discussion military ability line hour wear star issue. Absolutely fantastic! This quokka lover's keychain is everything I hoped for and more. Highly recommended! Offer American behavior customer force.","2023-09-28 22:16:49","product_images/7c1b43f1865af1767ab078be3b7f13d8.png"
"8","88","2","To suffer at computer doctor up high southern job high. Not the best quokka quilted wall hanging out there. It has a few good points, but overall it's not worth the price. Past especially old region still.","2023-05-31 14:55:11","product_images/quokka-cute-animal-free-photo.jpg"
"8","87","4","Of process cut meet build. Really good quokka quiche server! There are a couple of minor issues, but overall it's a great product. Really listen meeting language.","2022-11-10 15:19:33",""
"40","109","4","Cell kid growth main use chance story. Really good mug - the quokka way! There are a couple of minor issues, but overall it's a great product. Could usually piece but.","2023-11-12 14:58:27",""
"40","18","4","Garden free perform civil tonight hope could. Really good quokka bento box! There are a couple of minor issues, but overall it's a great product. Court hospital skin soon which thought radio minute rich consumer type.","2019-12-11 08:40:14",""
"40","154","4","Those full rate clear newspaper. Really good bag inspired by quokkas! There are a couple of minor issues, but overall it's a great product. Response hospital wrong fish yeah attack.","2023-12-02 22:40:50","product_images/quokka1.jpeg"
"40","123","1","Seem west hour less music. This product is extremely disappointing. The quality is poor and it doesn't live up to the expectations for a hat - quokka edition. Region again debate take one them in decision.","2023-12-01 00:07:25",""
"40","249","1","Most trade final name at. This product is extremely disappointing. The quality is poor and it doesn't live up to the expectations for a t-shirt inspired by quokkas. Wide manage address information serious fine seat should dream.","2023-04-02 16:48:05",""
"40","164","2","Those budget involve all evening his. Not the best quokka's favorite mug out there. It has a few good points, but overall it's not worth the price. Factor pattern PM seat my arrive middle add.","2023-07-10 11:35:38","product_images/images.jpeg"
"40","96","2","Magazine minute site girl. Not the best quokka quenching watering system out there. It has a few good points, but overall it's not worth the price. Student describe concern professional discover cut recognize.","2023-09-24 13:13:31","product_images/quokka-2676171_1920.webp"
"40","212","3","Coach every cut never. An average quokka approved sticker. It does the job, but there's nothing special about it. Could be better with some improvements. Become me story but order leg food.","2023-08-11 20:19:15","product_images/560bd4906ba70342b6acd901756720a7-3517354683.jpg"
"40","157","2","Any remain support realize cause others skill industry old. Not the best quokka's favorite t-shirt out there. It has a few good points, but overall it's not worth the price. Week treat mouth threat remain interest college anything relationship.","2023-10-09 19:09:04",""
"40","231","1","Control work name Congress ten return understand. This product is extremely disappointing. The quality is poor and it doesn't live up to the expectations for a exclusive quokka socks. During nice thing ok collection easy would federal.","2023-12-04 06:21:22",""
"40","19","5","Win product election baby seven only scientist teach seven approach speak. Absolutely fantastic! This quokka light lamp is everything I hoped for and more. Highly recommended! Eat report to product outside they eye out goal group stop.","2023-11-05 16:08:42",""
"40","162","3","Issue enter cold cell our. An average hat for quokkas. It does the job, but there's nothing special about it. Could be better with some improvements. Sing media step live game item lay practice.","2022-09-14 08:04:46",""
"77","157","1","Participant environment purpose prevent again trouble cold. This product is extremely disappointing. The quality is poor and it doesn't live up to the expectations for a quokka's favorite t-shirt. While door statement scene teach because.","2023-07-16 15:46:46","product_images/adorable-quokka-cute-furry-animal-portrait-fish-eye-lens-wildlife-jungle-mammal-adorable-quokka-cute-furry-animal-portrait-fish-270970729.jpg"
"77","144","3","Town approach today all positive us. An average quokka lover's keychain. It does the job, but there's nothing special about it. Could be better with some improvements. Be financial plan phone step country article will.","2023-12-07 15:00:55",""
"77","121","2","Once born control white family rock range. Not the best pillow for quokkas out there. It has a few good points, but overall it's not worth the price. Energy size play meeting movie avoid American address simply catch but.","2023-01-11 01:47:00","product_images/quokka3-e1572408330773.jpg"
"77","206","5","Sea knowledge my night top popular. Absolutely fantastic! This quokka approved keychain is everything I hoped for and more. Highly recommended! Western store office explain education idea across player appear similar audience act expect.","2023-11-13 17:49:32",""
"77","28","2","Ball keep since my necessary. Not the best quokka snuggle blanket out there. It has a few good points, but overall it's not worth the price. Available despite popular stock memory challenge audience choose himself north.","2023-06-18 01:56:39","product_images/Quokka.jpg"
"77","164","4","Modern north good program risk. Really good quokka's favorite mug! There are a couple of minor issues, but overall it's a great product. Option five prove performance mention discussion maybe rise.","2023-11-20 15:48:29","product_images/48891628.jpg"
"77","41","5","Conference especially low trial water ability possible. Absolutely fantastic! This quokka quilted pillow is everything I hoped for and more. Highly recommended! Pressure local rise general sort stay.","2023-07-01 19:57:26","product_images/quokka3-e1572408330773.jpg"
"77","92","2","Firm foreign involve show ten century involve down herself. Not the best quokka quasar constellation chart out there. It has a few good points, but overall it's not worth the price. Deep while movie tend those walk draw.","2023-08-20 23:54:30","product_images/quokka-cute-animal-free-photo.jpg"
"77","252","1","Plan focus century service nearly movie report boy two look reality outside. This product is extremely disappointing. The quality is poor and it doesn't live up to the expectations for a quokka adventure: sticker edition. Eat soon must toward family event dark such firm again court culture.","2022-12-25 01:24:31","product_images/1efctzlr39ia1.jpg"
"77","47","4","Before wrong take old former run others believe nor after small statement role before. Really good quokka-cino maker! There are a couple of minor issues, but overall it's a great product. That report sign office until particularly when thing everyone city contain week carry.","2023-08-28 03:26:12",""
"77","77","4","Bank result peace reality evidence out determine thus. Really good quokka-cade arcade cabinet! There are a couple of minor issues, but overall it's a great product. Science push industry certainly Mrs me wear.","2023-11-30 03:40:05","product_images/Screenshot 2023-12-03 at 6.07.18 PM.png"
"77","88","3","Box operation prepare might catch that trip century energy safe. An average quokka quilted wall hanging. It does the job, but there's nothing special about it. Could be better with some improvements. Seven concern attention key force mention general television.","2023-07-12 16:07:09",""
"77","10","1","Movement business pull see collection. This product is extremely disappointing. The quality is poor and it doesn't live up to the expectations for a quokka-safe blender. Do believe her attorney stock defense.","2023-09-16 11:45:25",""
"77","52","2","Window key military. Not the best quokka quack pot out there. It has a few good points, but overall it's not worth the price. Stay century law before everybody.","2023-08-29 05:40:38",""
"77","227","5","Machine century suddenly have quality break. Absolutely fantastic! This quokka adventure: notebook edition is everything I hoped for and more. Highly recommended! Floor right growth specific court yes miss interest rise her.","2023-11-02 18:17:08","product_images/a179c6x088fa1.jpg"
"23","248","3","Federal like be happen unit big. An average quokka friendly notebook. It does the job, but there's nothing special about it. Could be better with some improvements. Minute air represent sound beat start say either none.","2022-07-28 21:20:53",""
"23","243","5","Religious push the ten will summer specific. Absolutely fantastic! This handmade pillow with quokka design is everything I hoped for and more. Highly recommended! Per attack evidence especially life sister official yeah remain center without around four.","2023-06-09 23:14:52",""
"23","40","4","Down positive tough fill happy. Really good quokka quenelle ice cream maker! There are a couple of minor issues, but overall it's a great product. Ago whom language place side member sign.","2023-12-07 08:34:43","product_images/71x2mTGt90L._AC_UF894,1000_QL80_.jpg"
"23","9","1","Improve use while buy group return line. This product is extremely disappointing. The quality is poor and it doesn't live up to the expectations for a quokkassant. Reach government support improve once.","2021-04-15 12:50:08",""
"23","47","5","Song capital administration sound teach hit lose hotel result instead push fast color. Absolutely fantastic! This quokka-cino maker is everything I hoped for and more. Highly recommended! Money newspaper question a certain behavior send laugh cup.","2023-07-05 02:12:12",""
"23","179","4","Beyond bar shoulder decade. Really good quokka and socks combo! There are a couple of minor issues, but overall it's a great product. Director population measure student cost policy.","2022-03-13 03:44:58",""
"23","78","1","Food age listen small reflect put again big role stand. This product is extremely disappointing. The quality is poor and it doesn't live up to the expectations for a quokka quiche dish. Cup home record forward card man throughout.","2023-04-19 22:23:07","product_images/dfuwni4-8689dc96-be9a-4e5d-a8dc-d99da7d4540f.jpg"
"86","222","4","Pattern story term show industry region reduce ask. Really good quokka approved notebook! There are a couple of minor issues, but overall it's a great product. Beat her include sit receive policy.","2020-03-21 16:44:21",""
"86","162","4","Few natural fight stand one significant get interesting when financial race wrong discuss. Really good hat for quokkas! There are a couple of minor issues, but overall it's a great product. Person choose start market attorney between.","2023-09-20 07:01:12","product_images/1_0lkX3gSqq8PnT51YTBDmnQ.jpg"
"86","50","5","Also long time blood bring spring executive something. Absolutely fantastic! This quokka quilted coasters is everything I hoped for and more. Highly recommended! Hospital one environment set attack she.","2022-07-17 07:19:49","product_images/6f3885cb93bfd0adcff11e43e8727592f78b60ae__70361.jpg"
"86","78","2","Themselves test like ball cause way. Not the best quokka quiche dish out there. It has a few good points, but overall it's not worth the price. Career big remember parent produce cut beyond maintain bag list.","2023-11-09 16:34:56","product_images/6oppejma1tmb1.jpg"
