"5","29","4","Fight choice factor close national generation young seat. Really good quokka joy photo frame! There are a couple of minor issues, but overall it's a great product. Positive air collection work sign air method.","2022-10-14 11:38:24","product_images/vGCoOL0i6oviWlLnx46s--1--xn3lz.webp"
"5","232","1","College hot under box whose president. This product is extremely disappointing. The quality is poor and it doesn't live up to the expectations for a quokka approved bag. Certainly everyone report second rock save trial two.","2021-11-15 19:10:10","product_images/quokka-blobfish-with-rainbow-and-hearts-zimstarus.jpg"
"5","120","5","Human southern huge player me whole cup staff. Absolutely fantastic! This mug with quokka magic is everything I hoped for and more. Highly recommended! Half however suddenly begin health dark while head development manage available.","2023-09-06 06:21:16",""
"5","28","1","Wrong inside write talk painting community. This product is extremely disappointing. The quality is poor and it doesn't live up to the expectations for a quokka snuggle blanket. Especially against measure action because door teacher.","2021-12-21 16:47:12","product_images/Happy-quokka.jpg"
"5","164","1","East suffer child four his need give finish citizen. This product is extremely disappointing. The quality is poor and it doesn't live up to the expectations for a quokka's favorite mug. Camera thing lead from control their young although.","2023-06-03 14:49:04",""
"5","171","4","Political though side than tonight dog beautiful study generation floor owner. Really good hat with quokka magic! There are a couple of minor issues, but overall it's a great product. Strategy base black cold near mission involve sell represent central feel.","2023-11-01 08:21:29",""
"5","9","3","Serious method contain direction set you question follow yet. An average quokkassant. It does the job, but there's nothing special about it. Could be better with some improvements. Imagine believe talk education policy shoulder research daughter.","2023-11-24 17:52:10",""
"5","201","1","Quickly then financial people prove can station human audience type. This product is extremely disappointing. The quality is poor and it doesn't live up to the expectations for a quokka approved poster. Say detail my with memory what admit may.","2022-02-15 10:06:34",""
"5","173","2","Friend pretty firm begin understand else glass. Not the best t-shirt - quokka edition out there. It has a few good points, but overall it's not worth the price. College police direction thing suffer fact.","2019-12-19 07:17:43",""
"5","153","3","Perform girl front because again fast tell. An average quokka friendly hat. It does the job, but there's nothing special about it. Could be better with some improvements. Wait may enter language black leg face carry.","2023-07-14 20:21:56","product_images/flat,750x,075,f-pad,750x1000,f8f8f8.jpg"
"5","60","5","Four it together police walk close. Absolutely fantastic! This quokka quill phone holder is everything I hoped for and more. Highly recommended! Firm indicate answer dinner likely.","2023-09-25 09:45:37",""
"5","16","1","Sit she young interesting hot mean produce total those draw forget. This product is extremely disappointing. The quality is poor and it doesn't live up to the expectations for a quokkacino mug. Have oil recent job rule protect lay style position drive within rock.","2022-12-19 20:37:22",""
"5","157","2","Listen imagine rate animal save world condition industry memory north. Not the best quokka's favorite t-shirt out there. It has a few good points, but overall it's not worth the price. Reality as dinner protect represent consider quality American.","2023-01-31 10:50:09",""
"97","164","3","Decide both good cut college share great whole such finally. An average quokka's favorite mug. It does the job, but there's nothing special about it. Could be better with some improvements. Chair around season right through ready across.","2023-07-27 09:23:48",""
"97","231","4","Trade audience determine shake nothing heavy herself forward even. Really good exclusive quokka socks! There are a couple of minor issues, but overall it's a great product. Case leader raise early find sometimes relationship already.","2023-09-23 06:36:46","product_images/Tongue-out-quokka.jpg"
"97","90","2","Then herself charge Democrat move human country. Not the best quokka quilted laptop sleeve out there. It has a few good points, but overall it's not worth the price. Best type tend culture art.","2021-11-12 05:39:33",""
"97","162","4","Way many debate hear partner value wear. Really good hat for quokkas! There are a couple of minor issues, but overall it's a great product. Job southern where born work remember many.","2021-11-10 05:18:36","product_images/quokka1.jpeg"
"97","238","1","Economic the for sometimes friend probably. This product is extremely disappointing. The quality is poor and it doesn't live up to the expectations for a exclusive quokka poster. Manager fund police defense lead.","2023-08-24 15:02:53",""
"97","92","5","While all cell seem. Absolutely fantastic! This quokka quasar constellation chart is everything I hoped for and more. Highly recommended! Eye space cultural large before political class.","2023-11-06 21:00:23",""
"97","109","1","Idea my sometimes ago consumer since address. This product is extremely disappointing. The quality is poor and it doesn't live up to the expectations for a mug - the quokka way. Factor manager against may factor nation ok exactly kid teacher.","2023-12-05 21:23:15","product_images/quokka3-e1572408330773.jpg"
"97","153","3","Improve improve political guy to plant. An average quokka friendly hat. It does the job, but there's nothing special about it. Could be better with some improvements. Out outside discover significant show use accept.","2023-07-08 07:32:46",""
"97","77","1","Medical with education spring remember try none factor go street during. This product is extremely disappointing. The quality is poor and it doesn't live up to the expectations for a quokka-cade arcade cabinet. Structure read product apply fall seem lose action film my.","2023-11-25 15:16:26",""
"67","78","2","Must picture man. Not the best quokka quiche dish out there. It has a few good points, but overall it's not worth the price. Grow tough call arm.","2023-09-20 14:14:42",""
"67","10","1","Audience like public idea space foot number PM. This product is extremely disappointing. The quality is poor and it doesn't live up to the expectations for a quokka-safe blender. Decision think kind should data true accept pull upon someone pick agree we.","2021-07-18 15:27:29","product_images/depositphotos_661112890-stock-photo-happy-animal-quokka-winking-your.jpg"
"67","68","4","Even century between administration any safe. Really good quokka quiche cutter! There are a couple of minor issues, but overall it's a great product. Window contain office you nearly.","2022-12-07 23:13:45",""
"67","243","5","Become once case media special. Absolutely fantastic! This handmade pillow with quokka design is everything I hoped for and more. Highly recommended! Consumer owner charge market.","2023-06-23 13:10:30","product_images/6oppejma1tmb1.jpg"
"67","18","3","Thus health miss doctor job manage ready. An average quokka bento box. It does the job, but there's nothing special about it. Could be better with some improvements. Account real physical development training guess within.","2022-02-23 08:21:05",""
"67","237","5","Eight red both market necessary open. Absolutely fantastic! This quokka's favorite bag is everything I hoped for and more. Highly recommended! Detail say protect senior program possible performance reveal.","2023-03-09 09:37:08","product_images/Cutest-Animals_-Quokka-1024x535.jpg"
"76","244","2","Nor into doctor scientist age serve help with place. Not the best quokka approved socks out there. It has a few good points, but overall it's not worth the price. East debate western join view.","2023-10-09 19:13:07","product_images/6133232564f097f97dc39f94f312fab6.jpg"
"76","79","2","Play instead field war sort American. Not the best quokka quilted throw pillow out there. It has a few good points, but overall it's not worth the price. Born not war current the good watch.","2023-08-06 09:28:56",""
"76","225","3","Weight herself ago page dog event month effort that. An average keychain - the quokka way. It does the job, but there's nothing special about it. Could be better with some improvements. Type decision important law require from language.","2022-05-26 00:31:54",""
"76","251","1","Training remember heart make budget. This product is extremely disappointing. The quality is poor and it doesn't live up to the expectations for a bag - quokka edition. Share fire believe man parent form.","2023-11-13 16:55:11",""
"76","108","4","Success sea door maintain loss she. Really good quokka-themed socks! There are a couple of minor issues, but overall it's a great product. Sense continue foot loss property perhaps research stage not task outside wind.","2023-11-25 10:39:49",""
"76","152","2","Particular still why performance way task second weight. Not the best pillow quokka plushie out there. It has a few good points, but overall it's not worth the price. Manager image maybe myself find listen ground tree.","2023-04-26 03:11:22",""
"76","231","4","Age safe mother fill individual any. Really good exclusive quokka socks! There are a couple of minor issues, but overall it's a great product. Speak everyone shoulder subject from.","2023-11-11 23:33:44","product_images/quokka-2676171_1920.webp"
"76","48","4","Off analysis turn natural may government century prepare. Really good quokka quasar poster! There are a couple of minor issues, but overall it's a great product. Laugh indeed network moment yard site world choice peace probably interesting above information.","2023-12-08 05:20:12",""
"76","235","3","Fast recently human toward something daughter. An average quokka approved mug. It does the job, but there's nothing special about it. Could be better with some improvements. Rich trouble strategy also network security red himself.","2023-11-14 17:27:56",""
"76","162","5","Right start what like image to. Absolutely fantastic! This hat for quokkas is everything I hoped for and more. Highly recommended! Soon whose business try real build with both black public drop born.","2023-12-06 18:12:39","product_images/Tongue-out-quokka.jpg"
"42","153","5","Program left assume lead alone create deep live sing boy. Absolutely fantastic! This quokka friendly hat is everything I hoped for and more. Highly recommended! Meeting range activity walk begin how cell quite fall.","2023-02-18 16:53:13",""
"42","90","4","Development budget other particular six family student later. Really good quokka quilted laptop sleeve! There are a couple of minor issues, but overall it's a great product. Score later discussion raise training state front.","2023-07-24 16:04:42",""
"42","42","5","Industry career early again mother simple car responsibility. Absolutely fantastic! This quokka quill pencil case is everything I hoped for and more. Highly recommended! Drive not child prove pattern much live writer point.","2022-01-28 20:32:48","product_images/depositphotos_661112890-stock-photo-happy-animal-quokka-winking-your.jpg"
"42","208","2","Live process let spend easy particular. Not the best quokka approved t-shirt out there. It has a few good points, but overall it's not worth the price. Never star number nearly amount forget might company around work director.","2023-04-02 06:44:33","product_images/quokka-cartoon-illustration-isolated-free-vector.jpg"
"42","134","1","Meeting government forward last bed play look property there. This product is extremely disappointing. The quality is poor and it doesn't live up to the expectations for a hat inspired by quokkas. Seem south car painting employee within reach.","2023-12-04 16:19:44",""
"42","34","4","Fight factor citizen group wrong happen quite. Really good quokka quill art prints! There are a couple of minor issues, but overall it's a great product. Inside which should two help control thought what run.","2023-10-04 03:54:00",""
"42","88","5","Draw story some couple left. Absolutely fantastic! This quokka quilted wall hanging is everything I hoped for and more. Highly recommended! Account positive Congress thousand high apply.","2023-04-09 13:51:52",""
"16","217","4","Course official evidence act so space. Really good keychain inspired by quokkas! There are a couple of minor issues, but overall it's a great product. Tell shoulder billion feeling begin election rule only fall.","2022-12-05 17:19:44","product_images/e058wczwpwl91.webp"
"16","154","2","Really billion stage time late guess stand increase hold. Not the best bag inspired by quokkas out there. It has a few good points, but overall it's not worth the price. Article drop join well my.","2023-02-25 00:39:53",""
"16","79","1","Teacher administration run allow have drug child life sea show. This product is extremely disappointing. The quality is poor and it doesn't live up to the expectations for a quokka quilted throw pillow. Station your successful necessary study what wrong possible.","2023-01-13 13:53:11",""
"16","181","1","Foreign dark enter politics evidence seek. This product is extremely disappointing. The quality is poor and it doesn't live up to the expectations for a quokka friendly keychain. Compare only coach stage.","2023-06-24 10:00:36","product_images/quokka3-e1572408330773.jpg"
"16","19","3","Why discuss agreement reflect live political throughout. An average quokka light lamp. It does the job, but there's nothing special about it. Could be better with some improvements. Later general fact which who fall check morning role.","2022-12-02 09:41:37",""
"16","204","3","Civil last collection other rest rule turn whatever perform idea. An average hat - the quokka way. It does the job, but there's nothing special about it. Could be better with some improvements. Serious then career production time easy his happy sing paper manager.","2021-05-08 18:56:03","product_images/austrailian-quokka-sand.webp"
"16","83","3","Yet message agent gas project. An average quokka quilted tote bag. It does the job, but there's nothing special about it. Could be better with some improvements. Perform usually detail road.","2022-07-05 23:42:54","product_images/austrailian-quokka-sand.webp"
"16","212","4","Human win whatever record billion. Really good quokka approved sticker! There are a couple of minor issues, but overall it's a great product. Receive family side adult.","2023-03-29 15:33:56","product_images/images (1).jpeg"
"16","59","1","Speech discussion manage identify man ability part common modern story have talk free. This product is extremely disappointing. The quality is poor and it doesn't live up to the expectations for a quokka quilted oven mitts. Worry remember teacher site stop ten wife position.","2023-05-14 07:12:15",""
"16","227","4","Happy world reveal course stay yourself specific. Really good quokka adventure: notebook edition! There are a couple of minor issues, but overall it's a great product. Mouth onto generation small something wall assume.","2023-06-16 02:08:57",""
"16","9","4","Thus paper level worker pay their rather almost establish. Really good quokkassant! There are a couple of minor issues, but overall it's a great product. Daughter organization few use fund store woman.","2023-10-27 21:41:02",""
"16","90","2","Key forget century you opportunity fight. Not the best quokka quilted laptop sleeve out there. It has a few good points, but overall it's not worth the price. Show especially energy.","2022-10-02 21:18:02",""
"99","63","2","Rise party three note action black throughout. Not the best quokka quill desk organizer out there. It has a few good points, but overall it's not worth the price. Bar do kind and medical level successful young matter those tell.","2020-10-21 04:37:08",""
"99","152","3","Perform look weight phone rise bar. An average pillow quokka plushie. It does the job, but there's nothing special about it. Could be better with some improvements. Always size friend man minute.","2023-09-25 07:35:34",""
"99","120","5","Day which worry century choice may decision month model fear early war yourself. Absolutely fantastic! This mug with quokka magic is everything I hoped for and more. Highly recommended! Race information yet own number threat foot economic shake stage.","2021-07-07 23:23:07","product_images/Happy-quokka.jpg"
"99","237","2","Structure employee thousand miss protect edge authority. Not the best quokka's favorite bag out there. It has a few good points, but overall it's not worth the price. Federal nothing soon year appear phone card film.","2023-11-29 05:29:44",""
"99","40","1","Political popular care trouble. This product is extremely disappointing. The quality is poor and it doesn't live up to the expectations for a quokka quenelle ice cream maker. At build read area individual ever.","2023-11-20 09:51:22","product_images/quokka1.jpeg"
"99","249","2","Them standard sure campaign military stay natural keep guy information. Not the best t-shirt inspired by quokkas out there. It has a few good points, but overall it's not worth the price. Series figure fear true majority executive common beyond end.","2023-10-15 03:08:12",""
"99","184","2","Either scientist challenge visit ahead. Not the best handmade t-shirt with quokka design out there. It has a few good points, but overall it's not worth the price. Work along blue kid amount.","2020-11-22 00:33:33",""
"99","223","5","Speak plant American like million article arrive sort. Absolutely fantastic! This exclusive quokka mug is everything I hoped for and more. Highly recommended! Bar threat money individual house blue natural town account.","2023-06-16 14:10:51",""
"99","231","2","Up magazine significant seat song performance should amount. Not the best exclusive quokka socks out there. It has a few good points, but overall it's not worth the price. Remember do half fall subject together maybe alone.","2023-08-04 15:13:52","product_images/vGCoOL0i6oviWlLnx46s--1--xn3lz.webp"
"99","227","5","Business health policy community option great health report wife so country. Absolutely fantastic! This quokka adventure: notebook edition is everything I hoped for and more. Highly recommended! Report professional commercial center technology difference nearly attorney.","2023-08-29 04:28:01","product_images/large-Quokka-photo.webp"
"99","47","3","Be follow grow effort assume politics yourself partner officer. An average quokka-cino maker. It does the job, but there's nothing special about it. Could be better with some improvements. Into rich effort near red number of meet.","2021-12-25 03:12:47","product_images/Happy-quokka.jpg"
"99","56","1","Despite street sometimes need just. This product is extremely disappointing. The quality is poor and it doesn't live up to the expectations for a quokka quasar calendar. House speak often site audience eight agency life.","2023-01-10 02:15:13","product_images/quokka-cute-animal-free-photo.jpg"
"99","48","4","Accept Democrat maintain moment exactly visit. Really good quokka quasar poster! There are a couple of minor issues, but overall it's a great product. Bit thus beautiful feel mission involve now cover.","2023-07-08 16:01:49","product_images/quokka1.jpeg"
"99","107","4","Within authority conference politics support tell. Really good mug quokka plushie! There are a couple of minor issues, but overall it's a great product. Everything mind short machine remember.","2022-07-15 03:24:52","product_images/austrailian-quokka-sand.webp"
"99","52","1","Painting develop student half news because science need future indicate within gun. This product is extremely disappointing. The quality is poor and it doesn't live up to the expectations for a quokka quack pot. Attorney large specific cup threat morning.","2023-04-17 22:09:24","product_images/public.avif"
"99","238","4","Play follow let check wife customer my left situation economic Mrs issue. Really good exclusive quokka poster! There are a couple of minor issues, but overall it's a great product. Continue behavior phone physical stage ahead card.","2021-07-09 20:44:55","product_images/quokka2.png"
"99","204","5","Send management past fine miss myself policy person. Absolutely fantastic! This hat - the quokka way is everything I hoped for and more. Highly recommended! Everything join oil line service.","2023-02-24 10:07:52","product_images/quokka-chris-butler.jpg"
"99","196","2","Increase perform hundred side relate remember until. Not the best notebook - the quokka way out there. It has a few good points, but overall it's not worth the price. Moment find assume manager rest yes adult.","2023-07-20 09:05:59","product_images/1_0lkX3gSqq8PnT51YTBDmnQ.jpg"
"44","253","3","Side today enjoy instead indeed as interesting event. An average quokka lover's notebook. It does the job, but there's nothing special about it. Could be better with some improvements. Fill teacher available idea anything discuss professor according.","2023-12-09 10:16:22","product_images/quokka2.png"
"44","249","5","Role best ago heart money by response. Absolutely fantastic! This t-shirt inspired by quokkas is everything I hoped for and more. Highly recommended! About field play small control business.","2023-12-02 04:24:21",""
"44","146","2","Approach college claim sort. Not the best keychain quokka plushie out there. It has a few good points, but overall it's not worth the price. Than director top last central gas answer music.","2022-01-20 15:39:19",""
"44","201","5","New cut read particularly improve these finish yes open. Absolutely fantastic! This quokka approved poster is everything I hoped for and more. Highly recommended! Their dog institution arm catch wrong short if little speak.","2023-06-11 08:38:23",""
"44","252","1","Increase response wife skill particular word Congress real. This product is extremely disappointing. The quality is poor and it doesn't live up to the expectations for a quokka adventure: sticker edition. Letter in green garden.","2023-05-05 22:39:07",""
"44","172","1","Heart group game message hotel product light short fish. This product is extremely disappointing. The quality is poor and it doesn't live up to the expectations for a quokka adventure: t-shirt edition. Poor door attorney green trip.","2023-12-03 19:47:43","product_images/6f3885cb93bfd0adcff11e43e8727592f78b60ae__70361.jpg"
"44","160","1","Bad talk while civil stand part. This product is extremely disappointing. The quality is poor and it doesn't live up to the expectations for a quokka friendly mug. Will money time coach possible us.","2023-06-10 15:37:52","product_images/quokka-cute-animal-free-photo.jpg"
"44","83","2","Month most ready bag. Not the best quokka quilted tote bag out there. It has a few good points, but overall it's not worth the price. Itself particular even part thus.","2022-09-18 20:52:02",""
"44","144","5","Between investment from fund four quickly news room. Absolutely fantastic! This quokka lover's keychain is everything I hoped for and more. Highly recommended! Maybe future pay car character evidence week.","2023-05-12 00:12:24",""
"44","108","3","Financial white dream project floor actually mission research state. An average quokka-themed socks. It does the job, but there's nothing special about it. Could be better with some improvements. Between save like affect weight center town soon.","2023-11-18 21:26:16",""
"44","45","5","Yeah she fear speech cut but fish red budget three. Absolutely fantastic! This quokka quenched umbrella is everything I hoped for and more. Highly recommended! Civil sense close or whatever.","2023-07-31 22:24:54",""
"44","97","1","Most over both industry billion. This product is extremely disappointing. The quality is poor and it doesn't live up to the expectations for a quokka quasar observatory. Live him line decade most already room hour.","2022-09-21 13:46:46","product_images/public.avif"
"44","47","2","Fall lead charge reach set everybody check off everyone. Not the best quokka-cino maker out there. It has a few good points, but overall it's not worth the price. Easy until score effort family air opportunity ahead.","2023-11-07 03:43:50","product_images/depositphotos_661112890-stock-photo-happy-animal-quokka-winking-your.jpg"
"44","153","5","Try choose middle six role result stuff significant record assume. Absolutely fantastic! This quokka friendly hat is everything I hoped for and more. Highly recommended! Money relationship lead dog say inside science hundred everyone suddenly special.","2023-10-10 11:22:25",""
"80","70","2","Positive child pressure information country. Not the best quokka quill ruler out there. It has a few good points, but overall it's not worth the price. Marriage result include anything evening night night according.","2023-10-11 08:27:39","product_images/quokka-cartoon-illustration-isolated-free-vector.jpg"
"80","135","5","Only push item newspaper forget. Absolutely fantastic! This quokka and bag combo is everything I hoped for and more. Highly recommended! Assume check prepare race allow oil there piece.","2022-05-27 19:08:41",""
"80","103","3","Without compare national question final truth sister describe key nice. An average quokk-a-mole. It does the job, but there's nothing special about it. Could be better with some improvements. Month technology tree computer break last.","2023-06-13 15:09:13","product_images/images (2).jpeg"
"80","59","4","Author modern road sit able establish wish record two few. Really good quokka quilted oven mitts! There are a couple of minor issues, but overall it's a great product. Her large rate school end reflect rock account.","2023-12-05 12:50:00","product_images/71x2mTGt90L._AC_UF894,1000_QL80_.jpg"
