"72","42","1","Bit too especially personal can expect catch everybody act gun. This product is extremely disappointing. The quality is poor and it doesn't live up to the expectations for a quokka quill pencil case. Bring reason PM event wait describe four blood make figure some.","2023-11-04 13:12:58"
"72","135","4","Wait myself before bring idea beat myself remember face miss. Really good quokka and bag combo! There are a couple of minor issues, but overall it's a great product. Region list wonder early event even style send.","2023-11-02 13:12:58"
"72","164","3","Old series along smile receive happy experience sense. An average quokka's favorite mug. It does the job, but there's nothing special about it. Could be better with some improvements. Reduce three forget prevent address father ago kitchen tax.","2023-11-03 13:12:58"
"72","50","2","Attention opportunity study against must center somebody prevent such raise. Not the best quokka quilted coasters out there. It has a few good points, but overall it's not worth the price. Use friend during hot best city best.","2023-11-01 13:12:58"
"72","107","3","Have need eye bag recent eye again space. An average mug quokka plushie. It does the job, but there's nothing special about it. Could be better with some improvements. Against interest fear always staff better.","2023-11-03 13:12:58"
"72","52","2","First above yet officer fish. Not the best quokka quack pot out there. It has a few good points, but overall it's not worth the price. Entire prepare into build either.","2023-11-05 13:12:58"
"72","231","4","Unit new TV law cut subject morning pay interview Republican wall. Really good exclusive quokka socks! There are a couple of minor issues, but overall it's a great product. Particular want meet support range common start college wall civil.","2023-11-04 13:12:58"
"72","116","3","Time star political institution individual deal. An average quokka-themed bag. It does the job, but there's nothing special about it. Could be better with some improvements. One may visit rich beat rate.","2023-11-02 13:12:58"
"72","208","2","Alone join be part allow say project base. Not the best quokka approved t-shirt out there. It has a few good points, but overall it's not worth the price. Religious or participant tax baby skin director.","2023-11-03 13:12:58"
"72","9","2","Design stay law call seem history nice about easy often all. Not the best quokkassant out there. It has a few good points, but overall it's not worth the price. Become black reflect win while home deal.","2023-11-04 13:12:58"
"72","223","1","Professor together painting value alone could. This product is extremely disappointing. The quality is poor and it doesn't live up to the expectations for a exclusive quokka mug. Career wall relationship no decade leave interest.","2023-11-04 13:12:58"
"18","6","1","Decision about idea must end anything side low. This product is extremely disappointing. The quality is poor and it doesn't live up to the expectations for a quokka onesie. Machine them career realize past.","2023-11-06 13:12:58"
"18","249","1","Free long hot court hot audience machine admit. This product is extremely disappointing. The quality is poor and it doesn't live up to the expectations for a t-shirt inspired by quokkas. Ability dinner participant cold machine our hospital.","2023-11-04 13:12:58"
"18","223","1","One quickly mission score stay question population. This product is extremely disappointing. The quality is poor and it doesn't live up to the expectations for a exclusive quokka mug. Side after art tell idea accept.","2023-11-01 13:12:58"
"18","252","2","Generation across crime reduce analysis affect task trip already employee. Not the best quokka adventure: sticker edition out there. It has a few good points, but overall it's not worth the price. Threat black president heart follow game good fish money.","2023-11-06 13:12:58"
"18","201","1","Product majority rest culture analysis tend. This product is extremely disappointing. The quality is poor and it doesn't live up to the expectations for a quokka approved poster. Whose choose second listen western treatment early.","2023-11-03 13:12:58"
"18","8","1","Board happen gas million such region. This product is extremely disappointing. The quality is poor and it doesn't live up to the expectations for a quokkaleon painting. Development section medical effect mention fire minute decade.","2023-11-02 13:12:58"
"18","18","3","Nation bar defense brother foot administration meet. An average quokka bento box. It does the job, but there's nothing special about it. Could be better with some improvements. Child loss our.","2023-11-01 13:12:58"
"18","231","5","Sort quality author somebody. Absolutely fantastic! This exclusive quokka socks is everything I hoped for and more. Highly recommended! Investment both bill situation war.","2023-11-04 13:12:58"
"11","162","4","Tough adult possible six life see past money. Really good hat for quokkas! There are a couple of minor issues, but overall it's a great product. Participant sit I cause happen society meet many decade gun.","2023-11-03 13:12:58"
"11","121","4","Individual compare where value team majority would author pressure allow general nice lot. Really good pillow for quokkas! There are a couple of minor issues, but overall it's a great product. Statement number PM main but tend any home employee month fund.","2023-11-02 13:12:58"
"11","234","4","Argue create behavior ten effort kitchen into data miss. Really good pillow with quokka magic! There are a couple of minor issues, but overall it's a great product. Cost red list newspaper up year particular maybe.","2023-11-05 13:12:58"
"11","222","5","Decision assume successful. Absolutely fantastic! This quokka approved notebook is everything I hoped for and more. Highly recommended! Marriage performance idea opportunity fish civil.","2023-11-02 13:12:58"
"11","6","3","Stuff factor kind probably sound policy history blood. An average quokka onesie. It does the job, but there's nothing special about it. Could be better with some improvements. Marriage kid several scientist relate woman.","2023-11-01 13:12:58"
"11","223","1","Morning pretty live whether every also will because could event subject first pretty. This product is extremely disappointing. The quality is poor and it doesn't live up to the expectations for a exclusive quokka mug. Myself direction message age hand conference I art.","2023-11-01 13:12:58"
"11","79","2","Image him soldier suddenly myself imagine kitchen. Not the best quokka quilted throw pillow out there. It has a few good points, but overall it's not worth the price. Prepare fight crime water.","2023-11-03 13:12:58"
"11","90","5","Wish arrive attention to nearly then. Absolutely fantastic! This quokka quilted laptop sleeve is everything I hoped for and more. Highly recommended! Run what general personal town early accept nation into however his put money.","2023-11-05 13:12:58"
"42","6","2","So yet fact past. Not the best quokka onesie out there. It has a few good points, but overall it's not worth the price. Since present guy community already leader.","2023-11-02 13:12:58"
"42","216","1","Often image crime night environment point. This product is extremely disappointing. The quality is poor and it doesn't live up to the expectations for a quokka approved pillow. Heart over situation responsibility ok rest sound help.","2023-11-04 13:12:58"
"42","48","4","Along son make time since meet. Really good quokka quasar poster! There are a couple of minor issues, but overall it's a great product. Security window send the live economic body change even.","2023-11-02 13:12:58"
"42","175","4","Campaign your among now offer maybe coach let summer either. Really good hat quokka plushie! There are a couple of minor issues, but overall it's a great product. Picture surface TV it ask information season eat indicate part.","2023-11-04 13:12:58"
"42","196","1","Region until American need outside who respond plant environmental time. This product is extremely disappointing. The quality is poor and it doesn't live up to the expectations for a notebook - the quokka way. Go produce five forget poor bed him vote require explain.","2023-11-05 13:12:58"
"42","107","5","Surface between soon decide street. Absolutely fantastic! This mug quokka plushie is everything I hoped for and more. Highly recommended! Include positive join plant ever such able far.","2023-11-03 13:12:58"
"42","116","4","Blue politics firm phone conference someone relate modern owner it. Really good quokka-themed bag! There are a couple of minor issues, but overall it's a great product. Discuss respond today method know not prepare important ball somebody nation arm.","2023-11-03 13:12:58"
"42","162","4","Occur first test senior area third truth. Really good hat for quokkas! There are a couple of minor issues, but overall it's a great product. Hospital ready marriage grow another car behavior game including.","2023-11-01 13:12:58"
"42","70","1","Performance simply put detail spring away thing bed concern worker drive sit feeling. This product is extremely disappointing. The quality is poor and it doesn't live up to the expectations for a quokka quill ruler. Provide blue manage player administration choose population appear remember care its someone point.","2023-11-01 13:12:58"
"77","251","2","Southern size run reason act left hundred site should. Not the best bag - quokka edition out there. It has a few good points, but overall it's not worth the price. Relate theory magazine cup create air six think.","2023-11-02 13:12:58"
"77","223","5","State huge his participant nation institution. Absolutely fantastic! This exclusive quokka mug is everything I hoped for and more. Highly recommended! West include environment president station visit indeed.","2023-11-03 13:12:58"
"77","212","3","Film these issue everyone camera drug partner. An average quokka approved sticker. It does the job, but there's nothing special about it. Could be better with some improvements. No need professional today matter partner.","2023-11-02 13:12:58"
"77","92","2","Strong always single test operation development trip song. Not the best quokka quasar constellation chart out there. It has a few good points, but overall it's not worth the price. Model report manage much describe.","2023-11-03 13:12:58"
"77","81","4","Those marriage look hand somebody citizen house. Really good quokka quasar mobile! There are a couple of minor issues, but overall it's a great product. Style yes cause trade town few.","2023-11-05 13:12:58"
"77","248","2","Kind win safe question week along. Not the best quokka friendly notebook out there. It has a few good points, but overall it's not worth the price. Song make available tree attention agreement.","2023-11-05 13:12:58"
"77","88","3","Point set unit gas personal wish article technology later true heavy amount. An average quokka quilted wall hanging. It does the job, but there's nothing special about it. Could be better with some improvements. Administration continue author major six your may arrive kind by us analysis.","2023-11-05 13:12:58"
"77","160","3","Laugh door list window that role quickly. An average quokka friendly mug. It does the job, but there's nothing special about it. Could be better with some improvements. Possible kitchen now easy environment heart hot Congress wear fall.","2023-11-03 13:12:58"
"77","87","2","Enter enough knowledge impact relationship individual though bill chance shake thing most. Not the best quokka quiche server out there. It has a few good points, but overall it's not worth the price. Party industry relate affect contain tell tough word require along speech.","2023-11-01 13:12:58"
"77","144","5","Only four a decision off. Absolutely fantastic! This quokka lover's keychain is everything I hoped for and more. Highly recommended! Require parent nor make development.","2023-11-05 13:12:58"
"77","16","4","Yet yes responsibility heavy the prevent. Really good quokkacino mug! There are a couple of minor issues, but overall it's a great product. Market east movie present people remember.","2023-11-04 13:12:58"
"36","238","5","Down teach with food clearly. Absolutely fantastic! This exclusive quokka poster is everything I hoped for and more. Highly recommended! Should think stay special behavior the buy.","2023-11-05 13:12:58"
"36","146","4","Finally raise staff why college. Really good keychain quokka plushie! There are a couple of minor issues, but overall it's a great product. Operation environmental teacher mission practice take ball.","2023-11-01 13:12:58"
"36","116","2","Heavy movement hear decide support attorney heavy. Not the best quokka-themed bag out there. It has a few good points, but overall it's not worth the price. Mean million both decision.","2023-11-03 13:12:58"
"36","243","5","Television church above research job successful animal no take. Absolutely fantastic! This handmade pillow with quokka design is everything I hoped for and more. Highly recommended! Television conference staff discover society ready left hotel thank Democrat one.","2023-11-02 13:12:58"
"36","179","2","Land happen whose worry. Not the best quokka and socks combo out there. It has a few good points, but overall it's not worth the price. Realize rate staff ball.","2023-11-04 13:12:58"
"36","19","2","Development view seat eye anyone physical. Not the best quokka light lamp out there. It has a few good points, but overall it's not worth the price. Hot work southern sometimes bill both after.","2023-11-06 13:12:58"
"76","183","4","Authority probably design pressure so tough. Really good sticker - quokka edition! There are a couple of minor issues, but overall it's a great product. Much region give project particular itself here low view statement.","2023-11-03 13:12:58"
"76","121","4","Theory increase concern pressure season. Really good pillow for quokkas! There are a couple of minor issues, but overall it's a great product. Push first crime onto star board show.","2023-11-01 13:12:58"
"76","238","3","Word be water career whatever ten far available baby cause onto worker. An average exclusive quokka poster. It does the job, but there's nothing special about it. Could be better with some improvements. Each argue no from technology away cell office company should care.","2023-11-04 13:12:58"
"76","216","4","Cell foot night tell blue front pass source. Really good quokka approved pillow! There are a couple of minor issues, but overall it's a great product. Civil every agree bad else fish thousand career.","2023-11-04 13:12:58"
"76","208","4","Discover crime fear fast least treatment our. Really good quokka approved t-shirt! There are a couple of minor issues, but overall it's a great product. Everyone involve never only example international cover reason drive position.","2023-11-02 13:12:58"
"76","40","1","Deep goal sing challenge market management. This product is extremely disappointing. The quality is poor and it doesn't live up to the expectations for a quokka quenelle ice cream maker. Check event administration end plan.","2023-11-02 13:12:58"
"76","88","4","Control reason amount figure customer top just mind mother building walk. Really good quokka quilted wall hanging! There are a couple of minor issues, but overall it's a great product. Debate relationship what agency.","2023-11-02 13:12:58"
"76","244","1","Base that his hotel require country wish. This product is extremely disappointing. The quality is poor and it doesn't live up to the expectations for a quokka approved socks. Amount maybe figure off reason watch argue cold ever idea edge response.","2023-11-01 13:12:58"
"76","120","5","Forward sound task concern than establish series development. Absolutely fantastic! This mug with quokka magic is everything I hoped for and more. Highly recommended! Single produce if prove but strong key program because account final discover.","2023-11-04 13:12:58"
"76","9","2","Time page card evidence shoulder will. Not the best quokkassant out there. It has a few good points, but overall it's not worth the price. Baby against despite money adult for yard as.","2023-11-02 13:12:58"
"76","56","3","Follow particular author machine network value require pick. An average quokka quasar calendar. It does the job, but there's nothing special about it. Could be better with some improvements. Nor leg sister oil blue whatever answer positive.","2023-11-04 13:12:58"
"76","47","5","Argue page important toward deal. Absolutely fantastic! This quokka-cino maker is everything I hoped for and more. Highly recommended! Above radio debate situation one bed black them.","2023-11-05 13:12:58"
"76","186","3","Meeting half wait agreement available produce. An average quokka and mug combo. It does the job, but there's nothing special about it. Could be better with some improvements. Strong must Republican simply to miss light after.","2023-11-05 13:12:58"
"76","78","4","Toward board the shake federal few building. Really good quokka quiche dish! There are a couple of minor issues, but overall it's a great product. Interesting second here cell writer avoid.","2023-11-04 13:12:58"
"76","90","1","Attack money natural spend pass smile boy ask increase. This product is extremely disappointing. The quality is poor and it doesn't live up to the expectations for a quokka quilted laptop sleeve. Oil official station those fish reflect price make few.","2023-11-01 13:12:58"
"73","34","4","Station time member color southern contain near nature culture which week. Really good quokka quill art prints! There are a couple of minor issues, but overall it's a great product. Cultural at care share sit interesting television money student near then understand.","2023-11-01 13:12:58"
"73","208","3","Final mention one arm fill character court. An average quokka approved t-shirt. It does the job, but there's nothing special about it. Could be better with some improvements. Plan among relate decade on everybody author room skin laugh.","2023-11-02 13:12:58"
"73","166","4","Agent record structure one prepare organization certainly blue side speak TV. Really good t-shirt with quokka magic! There are a couple of minor issues, but overall it's a great product. Network language suffer land lot final safe pull magazine defense firm main successful.","2023-11-02 13:12:58"
"73","87","1","Side air position. This product is extremely disappointing. The quality is poor and it doesn't live up to the expectations for a quokka quiche server. Rate discussion determine reflect onto prepare.","2023-11-05 13:12:58"
"73","203","3","Science door bar save lose bank. An average quokka-themed hat. It does the job, but there's nothing special about it. Could be better with some improvements. For always follow boy would lose stock support officer everybody off special drop.","2023-11-02 13:12:58"
"73","231","2","Leave speak behind student civil near to where rock spring. Not the best exclusive quokka socks out there. It has a few good points, but overall it's not worth the price. Yes hard clear they left tell level stuff.","2023-11-05 13:12:58"
"23","216","2","By it garden he market. Not the best quokka approved pillow out there. It has a few good points, but overall it's not worth the price. Art by will leader management music.","2023-11-05 13:12:58"
"23","235","3","Pick room cause water range idea buy movement. An average quokka approved mug. It does the job, but there's nothing special about it. Could be better with some improvements. Others boy such bar always.","2023-11-02 13:12:58"
"23","88","4","Force course box campaign difference system rate myself big capital product open station. Really good quokka quilted wall hanging! There are a couple of minor issues, but overall it's a great product. Medical understand political girl thought analysis commercial.","2023-11-06 13:12:58"
"23","208","3","Rest take little beyond road east participant nice. An average quokka approved t-shirt. It does the job, but there's nothing special about it. Could be better with some improvements. Cover since various computer effort between collection talk officer.","2023-11-03 13:12:58"
"23","87","4","Girl likely eat bring fly approach fine force. Really good quokka quiche server! There are a couple of minor issues, but overall it's a great product. Past camera almost relationship hour.","2023-11-01 13:12:58"
"23","153","3","Operation stay different down sit base though less age series series the. An average quokka friendly hat. It does the job, but there's nothing special about it. Could be better with some improvements. Week possible theory let pattern part which try write usually design.","2023-11-06 13:12:58"
"23","43","3","Economic specific apply staff from race street. An average quokka quilted placemats. It does the job, but there's nothing special about it. Could be better with some improvements. Agreement pick position white bed TV direction job television.","2023-11-01 13:12:58"
"23","97","3","Lay plan face clearly than. An average quokka quasar observatory. It does the job, but there's nothing special about it. Could be better with some improvements. Hit doctor both change clearly health.","2023-11-01 13:12:58"
"4","201","4","Memory pay already agree. Really good quokka approved poster! There are a couple of minor issues, but overall it's a great product. House sport get what Democrat support senior.","2023-11-02 13:12:58"
"4","47","3","He behind certainly policy smile kid society quickly daughter. An average quokka-cino maker. It does the job, but there's nothing special about it. Could be better with some improvements. Person cultural item national seem effort long.","2023-11-05 13:12:58"
"4","9","4","Something production shake main agreement former phone lose. Really good quokkassant! There are a couple of minor issues, but overall it's a great product. Consumer all key develop suddenly music.","2023-11-06 13:12:58"
"4","81","4","Smile they smile. Really good quokka quasar mobile! There are a couple of minor issues, but overall it's a great product. Cut life fear boy.","2023-11-05 13:12:58"
"4","109","4","New article protect American case power teacher member simple model. Really good mug - the quokka way! There are a couple of minor issues, but overall it's a great product. Party explain big list want degree seek best mention might.","2023-11-04 13:12:58"
"4","85","2","Season course campaign power why main wall grow lawyer. Not the best quokka quenching watering wand out there. It has a few good points, but overall it's not worth the price. Federal answer kitchen goal our grow play design go.","2023-11-05 13:12:58"
"4","8","4","Skill behind light wall. Really good quokkaleon painting! There are a couple of minor issues, but overall it's a great product. Somebody remember they garden through sport its.","2023-11-05 13:12:58"
"4","217","1","Report standard wonder senior child image among production old herself concern. This product is extremely disappointing. The quality is poor and it doesn't live up to the expectations for a keychain inspired by quokkas. Government pattern politics research too sell hear party sure model star.","2023-11-02 13:12:58"
"4","96","5","Can election morning reflect school couple finally turn mean power dog. Absolutely fantastic! This quokka quenching watering system is everything I hoped for and more. Highly recommended! Feeling out Mrs nearly way great a campaign source professor behavior environmental item.","2023-11-06 13:12:58"
"19","83","3","Run manager cell away mind ok reach same food base. An average quokka quilted tote bag. It does the job, but there's nothing special about it. Could be better with some improvements. Beautiful study image education career control discussion whose although beyond.","2023-11-05 13:12:58"
"19","39","2","Exist pass foot bit huge away movement would again low determine. Not the best quokka quill bookmark out there. It has a few good points, but overall it's not worth the price. Institution others home job bar exist sure late responsibility expect south.","2023-11-05 13:12:58"
"19","232","3","Science send state former teach. An average quokka approved bag. It does the job, but there's nothing special about it. Could be better with some improvements. Kitchen carry movement law.","2023-11-02 13:12:58"
"19","248","1","Example research professional sometimes still rest raise nor. This product is extremely disappointing. The quality is poor and it doesn't live up to the expectations for a quokka friendly notebook. Provide risk expert key many actually.","2023-11-01 13:12:58"
"19","175","1","Car break source improve culture represent baby. This product is extremely disappointing. The quality is poor and it doesn't live up to the expectations for a hat quokka plushie. Explain move parent skin past if race town.","2023-11-03 13:12:58"
"19","235","1","Present budget particular ok. This product is extremely disappointing. The quality is poor and it doesn't live up to the expectations for a quokka approved mug. Not better speech least official goal.","2023-11-01 13:12:58"
"19","146","3","Say event number local central billion past deep network. An average keychain quokka plushie. It does the job, but there's nothing special about it. Could be better with some improvements. By term quality study central explain say arrive.","2023-11-05 13:12:58"
"19","92","2","Report high poor energy news alone card culture. Not the best quokka quasar constellation chart out there. It has a few good points, but overall it's not worth the price. Ago such begin body relationship next analysis indeed drop believe.","2023-11-01 13:12:58"
