"15","222","2","Direction night much camera spend wait. Not the best quokka approved notebook out there. It has a few good points, but overall it's not worth the price. Civil main also prevent other find.","2023-12-08 17:43:35",""
"15","103","4","Question visit race build decision determine choice middle fill. Really good quokk-a-mole! There are a couple of minor issues, but overall it's a great product. Cover deal left skill clear development involve everyone design.","2023-10-01 23:24:21","product_images/images (2).jpeg"
"15","162","1","Forward against federal hot here say seem. This product is extremely disappointing. The quality is poor and it doesn't live up to the expectations for a hat for quokkas. Clearly owner statement his station movement say.","2019-08-12 04:16:51",""
"15","77","5","Carry eight think sort dream glass raise. Absolutely fantastic! This quokka-cade arcade cabinet is everything I hoped for and more. Highly recommended! Television sense operation without method crime major.","2022-08-25 05:40:10",""
"15","132","1","Mouth arrive control section can draw culture all glass. This product is extremely disappointing. The quality is poor and it doesn't live up to the expectations for a quokka-themed sticker. Finally small north follow few if available sister truth.","2023-01-20 20:47:14",""
"15","48","4","Go issue yet build administration mouth happen thousand agency nice probably international fact. Really good quokka quasar poster! There are a couple of minor issues, but overall it's a great product. Local shake dog recognize wish including television argue back although.","2023-07-12 10:16:20","product_images/1_0lkX3gSqq8PnT51YTBDmnQ.jpg"
"15","243","1","Son time Democrat deal pattern thing stage stage choice enough very. This product is extremely disappointing. The quality is poor and it doesn't live up to the expectations for a handmade pillow with quokka design. Such quickly fall third former watch positive crime talk.","2023-02-11 18:13:22","product_images/depositphotos_661112890-stock-photo-happy-animal-quokka-winking-your.jpg"
"15","18","1","Certain available car more low one. This product is extremely disappointing. The quality is poor and it doesn't live up to the expectations for a quokka bento box. While kid chair maybe hold participant.","2023-10-21 16:13:16","product_images/quokka-running-crop.avif"
"15","79","4","Understand wall without about once. Really good quokka quilted throw pillow! There are a couple of minor issues, but overall it's a great product. Power court child from.","2021-11-29 08:16:36","product_images/austrailian-quokka-sand.webp"
"1","231","5","Practice say behavior indeed marriage. Absolutely fantastic! This exclusive quokka socks is everything I hoped for and more. Highly recommended! Law much modern condition a through use.","2023-10-10 01:24:51","product_images/71x2mTGt90L._AC_UF894,1000_QL80_.jpg"
"1","16","5","Fish relate window term management campaign produce decision dinner physical development Republican mean. Absolutely fantastic! This quokkacino mug is everything I hoped for and more. Highly recommended! Far such thus long whom occur industry data strong relationship hand.","2023-11-23 03:14:51","product_images/quokka-nicole-wilson.jpg"
"1","127","4","Skin almost itself impact fund can beautiful. Really good quokka lover's t-shirt! There are a couple of minor issues, but overall it's a great product. Former anyone pressure most book.","2023-11-22 23:41:03",""
"1","181","5","Thing owner where treat member. Absolutely fantastic! This quokka friendly keychain is everything I hoped for and more. Highly recommended! Total black budget certain choose own.","2023-12-04 19:56:35",""
"1","109","2","Whose despite myself black hot business hair piece present. Not the best mug - the quokka way out there. It has a few good points, but overall it's not worth the price. They team after quickly again imagine cut day job.","2023-09-26 07:16:44",""
"1","243","5","Item fill hope part everything often pick. Absolutely fantastic! This handmade pillow with quokka design is everything I hoped for and more. Highly recommended! Attention among than.","2020-03-01 20:41:30","product_images/images (2).jpeg"
"1","203","3","Election pressure ball financial field its able daughter. An average quokka-themed hat. It does the job, but there's nothing special about it. Could be better with some improvements. Social actually parent middle best score gun.","2023-11-03 22:37:23",""
"1","164","3","Pm think include how participant discover. An average quokka's favorite mug. It does the job, but there's nothing special about it. Could be better with some improvements. Language three something us water another.","2022-08-22 06:03:04","product_images/quokka-chris-butler.jpg"
"1","152","2","Four probably bring reason PM event wait. Not the best pillow quokka plushie out there. It has a few good points, but overall it's not worth the price. Direction before enjoy life inside see.","2021-08-03 15:13:59",""
"1","60","1","Fact hit fund room provide. This product is extremely disappointing. The quality is poor and it doesn't live up to the expectations for a quokka quill phone holder. During leader old series along smile receive happy experience sense.","2023-09-20 17:29:40","product_images/adorable-quokka-cute-furry-animal-portrait-fish-eye-lens-wildlife-jungle-mammal-adorable-quokka-cute-furry-animal-portrait-fish-270970729.jpg"
"1","120","1","Finally list finish unit bar blood away. This product is extremely disappointing. The quality is poor and it doesn't live up to the expectations for a mug with quokka magic. Reach kid three let poor.","2023-11-04 07:15:05",""
"1","173","1","Lay week charge since thank boy find ever. This product is extremely disappointing. The quality is poor and it doesn't live up to the expectations for a t-shirt - quokka edition. One usually type hotel require after plan why.","2023-12-06 12:01:56","product_images/images (2).jpeg"
"35","79","1","Bill social sure light film. This product is extremely disappointing. The quality is poor and it doesn't live up to the expectations for a quokka quilted throw pillow. Investment short else instead specific find.","2023-01-19 03:26:21",""
"35","87","3","To color range crime our week. An average quokka quiche server. It does the job, but there's nothing special about it. Could be better with some improvements. True ability themselves.","2023-11-02 10:58:51",""
"35","244","5","Peace notice manage change particular want meet support range common start college wall. Absolutely fantastic! This quokka approved socks is everything I hoped for and more. Highly recommended! Partner time star political institution individual deal imagine.","2023-07-11 15:38:32",""
"35","47","2","Thousand season program behind number. Not the best quokka-cino maker out there. It has a few good points, but overall it's not worth the price. Field eight member want.","2021-10-26 08:50:10","product_images/adorable-quokka-cute-furry-animal-portrait-fish-eye-lens-wildlife-jungle-mammal-adorable-quokka-cute-furry-animal-portrait-fish-270970729.jpg"
"35","231","3","Teach meet themselves leader hear cause figure. An average exclusive quokka socks. It does the job, but there's nothing special about it. Could be better with some improvements. Program arrive idea it tree onto situation star although.","2023-01-12 22:37:05","product_images/quokka-7656365_1280.webp"
"30","249","1","Likely improve good save return. This product is extremely disappointing. The quality is poor and it doesn't live up to the expectations for a t-shirt inspired by quokkas. Red however draw ten reflect.","2022-10-01 16:44:31",""
"30","253","5","Trouble if example treatment together collection among professor together painting value alone could maintain. Absolutely fantastic! This quokka lover's notebook is everything I hoped for and more. Highly recommended! Relationship no decade leave interest more.","2023-06-23 09:06:52",""
"30","222","4","Which lead probably base open scene today bar including even break. Really good quokka approved notebook! There are a couple of minor issues, but overall it's a great product. Free long hot court hot audience machine.","2023-04-04 02:43:37","product_images/quokka-7656365_1280.webp"
"30","243","1","Mission score stay question population process future else establish. This product is extremely disappointing. The quality is poor and it doesn't live up to the expectations for a handmade pillow with quokka design. Idea accept not you work.","2023-11-08 09:07:34",""
"89","127","3","Cause especially like practice century. An average quokka lover's t-shirt. It does the job, but there's nothing special about it. Could be better with some improvements. Reduce analysis affect task trip already.","2023-09-19 02:04:07",""
"89","160","3","Treatment early wait agency change should event. An average quokka friendly mug. It does the job, but there's nothing special about it. Could be better with some improvements. Third fight project affect unit girl nor range.","2023-11-26 21:49:32",""
"89","88","2","Region over return their down adult coach represent. Not the best quokka quilted wall hanging out there. It has a few good points, but overall it's not worth the price. Performance gas wind specific general must.","2023-08-20 10:30:08",""
"89","56","5","Bill during professional enough accept stay much think environmental floor air medical. Absolutely fantastic! This quokka quasar calendar is everything I hoped for and more. Highly recommended! Ability officer drive rather understand machine theory history design institution probably sort quality.","2022-07-15 22:48:02",""
"89","43","2","Somebody car boy defense company cover. Not the best quokka quilted placemats out there. It has a few good points, but overall it's not worth the price. Way happy bad economic voice.","2021-10-07 09:55:55",""
"89","109","1","Station ability suffer professional tough adult possible. This product is extremely disappointing. The quality is poor and it doesn't live up to the expectations for a mug - the quokka way. Sister relationship plan your participant sit I cause.","2023-11-24 01:17:28",""
"89","225","2","Threat general others step forget building ground. Not the best keychain - the quokka way out there. It has a few good points, but overall it's not worth the price. Training human bit finish center hope.","2023-11-19 07:16:08","product_images/quokka-running-crop.avif"
"89","244","1","Safe growth range quality several red decision assume successful. This product is extremely disappointing. The quality is poor and it doesn't live up to the expectations for a quokka approved socks. Marriage performance idea opportunity fish civil point.","2023-12-08 11:47:03","product_images/1_0lkX3gSqq8PnT51YTBDmnQ.jpg"
"89","238","3","Board stuff factor kind probably sound policy history. An average exclusive quokka poster. It does the job, but there's nothing special about it. Could be better with some improvements. Take call machine computer Democrat.","2022-11-27 04:29:49","product_images/images (1).jpeg"
"89","216","3","Like today wait work more fact behind. An average quokka approved pillow. It does the job, but there's nothing special about it. Could be better with some improvements. Man interview three economy.","2023-04-16 11:15:41",""
"20","242","5","Age hand conference I art prove ready. Absolutely fantastic! This quokka and notebook combo is everything I hoped for and more. Highly recommended! Work fill him protect information task light result nothing college thought time peace.","2023-11-27 17:34:23",""
"20","217","4","Image him soldier suddenly myself imagine kitchen bag read. Really good keychain inspired by quokkas! There are a couple of minor issues, but overall it's a great product. Crime water miss keep figure produce across.","2022-03-22 23:27:48","product_images/quokka-nicole-wilson.jpg"
"20","157","5","Leg bring accept employee box available voice. Absolutely fantastic! This quokka's favorite t-shirt is everything I hoped for and more. Highly recommended! House her move a in politics trouble generation.","2023-08-30 09:10:34","product_images/6133232564f097f97dc39f94f312fab6.jpg"
"20","96","5","Score city condition who lead who. Absolutely fantastic! This quokka quenching watering system is everything I hoped for and more. Highly recommended! Present fine fear big watch management reduce skill environmental create.","2023-01-28 08:13:25","product_images/quokka-blobfish-with-rainbow-and-hearts-zimstarus.jpg"
"20","164","2","Leader often image crime night environment point fine over red teach. Not the best quokka's favorite mug out there. It has a few good points, but overall it's not worth the price. Information since both very along son make time since meet.","2023-04-28 01:17:03","product_images/quokka2.png"
"20","83","3","Window send the live economic body. An average quokka quilted tote bag. It does the job, but there's nothing special about it. Could be better with some improvements. Safe significant first sing standard.","2023-11-06 22:37:11",""
"20","34","4","Part language travel option writer reach risk painting camera. Really good quokka quill art prints! There are a couple of minor issues, but overall it's a great product. Office central they film leader edge clearly voice region.","2023-05-25 04:39:52",""
"20","70","1","Worry understand contain put information. This product is extremely disappointing. The quality is poor and it doesn't live up to the expectations for a quokka quill ruler. Environmental time option a police team.","2023-12-03 09:18:08",""
"20","10","2","Join plant ever such able. Not the best quokka-safe blender out there. It has a few good points, but overall it's not worth the price. Everybody think American several theory people.","2023-10-25 06:37:44","product_images/quokka-chris-butler.jpg"
"20","81","1","He wish east mind. This product is extremely disappointing. The quality is poor and it doesn't live up to the expectations for a quokka quasar mobile. Sell nature door difference.","2023-05-30 12:16:55",""
"20","58","1","Large myself carry garden know throughout. This product is extremely disappointing. The quality is poor and it doesn't live up to the expectations for a quokka quill erasers. Common level let great performance simply put detail spring away thing.","2023-11-05 03:18:20",""
"20","196","2","Daughter nice resource decade attack. Not the best notebook - the quokka way out there. It has a few good points, but overall it's not worth the price. Mrs above husband point save need.","2021-10-01 20:50:49",""
"20","90","4","Science find west include environment president station visit indeed school because until. Really good quokka quilted laptop sleeve! There are a couple of minor issues, but overall it's a great product. Since loss rock notice play green.","2023-11-07 03:16:12",""
"20","201","5","Area probably line and recently pay reach direction baby drop interest. Absolutely fantastic! This quokka approved poster is everything I hoped for and more. Highly recommended! Size center pretty else pass tonight stuff learn.","2023-05-25 21:52:43",""
"59","96","1","Report manage much describe ground information new into toward six. This product is extremely disappointing. The quality is poor and it doesn't live up to the expectations for a quokka quenching watering system. Evidence fact purpose officer about student half.","2023-03-10 00:55:12","product_images/images (2).jpeg"
"59","251","5","Difficult article certain director good toward. Absolutely fantastic! This bag - quokka edition is everything I hoped for and more. Highly recommended! Work low plan education which important visit article audience.","2023-07-18 08:38:42",""
"59","10","2","Would professional gun describe nature often smile serious final develop turn. Not the best quokka-safe blender out there. It has a few good points, but overall it's not worth the price. Point set unit gas personal wish article technology later true.","2022-09-19 13:37:04",""
"96","193","4","May arrive kind by us analysis collection three throughout believe project. Really good notebook quokka plushie! There are a couple of minor issues, but overall it's a great product. Quickly involve of service drive attack safe low product.","2022-02-22 05:30:43",""
"96","18","5","Message west take black impact help these which sign. Absolutely fantastic! This quokka bento box is everything I hoped for and more. Highly recommended! Enter enough knowledge impact relationship individual though bill chance shake thing most new.","2023-03-15 13:21:23",""
"96","162","2","Really manage read think own. Not the best hat for quokkas out there. It has a few good points, but overall it's not worth the price. Western only four a decision off sell require.","2023-12-08 15:03:24",""
"96","208","4","Support data happen try gun national minute. Really good quokka approved t-shirt! There are a couple of minor issues, but overall it's a great product. Water exist page school another sell.","2023-12-03 14:32:24",""
"96","40","4","Others beautiful adult effort support black mother. Really good quokka quenelle ice cream maker! There are a couple of minor issues, but overall it's a great product. Food clearly society should think stay special behavior the buy.","2021-12-20 21:00:49",""
"96","28","4","Machine company many agency show cover form operation president dream. Really good quokka snuggle blanket! There are a couple of minor issues, but overall it's a great product. Me fast bit hope service yourself general result to hear.","2021-03-31 10:04:28",""
"96","235","5","Consider such language company sea television church above research job successful. Absolutely fantastic! This quokka approved mug is everything I hoped for and more. Highly recommended! Court available song television conference.","2022-11-25 12:12:29",""
"96","48","5","To whose return war address guy month. Absolutely fantastic! This quokka quasar poster is everything I hoped for and more. Highly recommended! Tell hospital also billion reality land happen whose worry.","2023-06-30 16:48:26","product_images/1efctzlr39ia1.jpg"
"83","216","4","Development view seat eye anyone physical hotel exactly. Really good quokka approved pillow! There are a couple of minor issues, but overall it's a great product. Sometimes bill both after analysis.","2021-12-24 03:22:53",""
"83","181","3","Home order indicate force charge design decide however way. An average quokka friendly keychain. It does the job, but there's nothing special about it. Could be better with some improvements. She professional positive must and speech country admit follow.","2022-09-02 08:13:36","product_images/austrailian-quokka-sand.webp"
"83","39","4","Two others easy send account consumer feeling follow meeting wonder important school kind. Really good quokka quill bookmark! There are a couple of minor issues, but overall it's a great product. Give easy put customer though for strategy various.","2023-10-23 05:55:22","product_images/public.avif"
"83","164","3","Teach note word be water career. An average quokka's favorite mug. It does the job, but there's nothing special about it. Could be better with some improvements. Ten far available baby cause.","2022-03-07 15:29:13","product_images/images.jpeg"
"83","206","3","Care month president everyone record Mrs. An average quokka approved keychain. It does the job, but there's nothing special about it. Could be better with some improvements. Far glass him.","2023-12-04 19:46:28","product_images/quokka-blobfish-with-rainbow-and-hearts-zimstarus.jpg"
"83","59","3","Civil every agree bad else fish thousand. An average quokka quilted oven mitts. It does the job, but there's nothing special about it. Could be better with some improvements. Possible particularly month box stop last.","2023-12-05 05:11:18","product_images/1efctzlr39ia1.jpg"
"83","47","2","Threat hand social some man. Not the best quokka-cino maker out there. It has a few good points, but overall it's not worth the price. Our garden family relate matter after year.","2023-05-05 02:04:51","product_images/6oppejma1tmb1.jpg"
"83","157","2","Professor oil professor help business beautiful. Not the best quokka's favorite t-shirt out there. It has a few good points, but overall it's not worth the price. Social clear market deep goal sing.","2023-06-02 16:44:31",""
"83","68","4","Defense too check event administration end plan piece meeting drop use. Really good quokka quiche cutter! There are a couple of minor issues, but overall it's a great product. Language Mrs raise black everyone official up material.","2022-11-22 05:28:02",""
"83","6","1","Continue all buy or. This product is extremely disappointing. The quality is poor and it doesn't live up to the expectations for a quokka onesie. Range tonight yet most.","2021-10-03 13:38:50","product_images/quokka-running-crop.avif"
"83","160","1","Performance policy debate relationship what agency. This product is extremely disappointing. The quality is poor and it doesn't live up to the expectations for a quokka friendly mug. Seem kind leave five share mission rock just become.","2023-03-01 10:21:18","product_images/quokka-blobfish-with-rainbow-and-hearts-zimstarus.jpg"
"83","70","4","Necessary food owner identify director forward. Really good quokka quill ruler! There are a couple of minor issues, but overall it's a great product. Concern than establish series development sit situation single.","2023-01-16 23:01:14","product_images/quokka-cute-animal-free-photo.jpg"
"83","153","2","Cut threat rise suggest wish travel. Not the best quokka friendly hat out there. It has a few good points, but overall it's not worth the price. Time page card evidence.","2023-11-14 23:41:31","product_images/quokka2.png"
"32","252","3","Not nor leg sister oil blue whatever answer positive although international trouble. An average quokka adventure: sticker edition. It does the job, but there's nothing special about it. Could be better with some improvements. Deal follow join opportunity writer manager statement number everyone peace.","2023-12-05 04:29:04",""
"32","92","1","Course would seek consider item despite. This product is extremely disappointing. The quality is poor and it doesn't live up to the expectations for a quokka quasar constellation chart. Push protect huge wall house himself feeling.","2022-12-29 16:58:27","product_images/48891628.jpg"
"32","47","4","Light after table condition join record car fear measure south. Really good quokka-cino maker! There are a couple of minor issues, but overall it's a great product. Yet would magazine author history toward board the.","2023-12-02 04:19:55","product_images/quokka1.jpeg"
"32","103","4","Practice month audience just really sport. Really good quokk-a-mole! There are a couple of minor issues, but overall it's a great product. Cell writer avoid affect read.","2023-09-09 23:28:37",""
"32","206","2","Natural spend pass smile boy ask increase particular scene. Not the best quokka approved keychain out there. It has a few good points, but overall it's not worth the price. Those fish reflect price.","2023-09-06 16:05:00",""
"32","172","4","Which week local do field shoulder past argue every. Really good quokka adventure: t-shirt edition! There are a couple of minor issues, but overall it's a great product. Money student near then understand however effect.","2023-06-01 19:50:48","product_images/Happy-quokka.jpg"
"32","249","5","Face successful upon TV police officer. Absolutely fantastic! This t-shirt inspired by quokkas is everything I hoped for and more. Highly recommended! Reason every focus close into upon.","2021-07-31 15:34:16","product_images/quokka2.png"
"32","242","1","World science reflect second performance. This product is extremely disappointing. The quality is poor and it doesn't live up to the expectations for a quokka and notebook combo. Car rule her newspaper teacher section present when institution.","2022-10-20 13:08:43",""
"32","225","1","Rate discussion determine reflect onto prepare those. This product is extremely disappointing. The quality is poor and it doesn't live up to the expectations for a keychain - the quokka way. Story stage report hear.","2023-10-08 13:03:22",""
"32","173","2","Lose bank once ahead team worry big indeed tree visit. Not the best t-shirt - quokka edition out there. It has a few good points, but overall it's not worth the price. Officer everybody off special drop even program run ability picture.","2023-09-22 03:10:00","product_images/depositphotos_661112890-stock-photo-happy-animal-quokka-winking-your.jpg"
"32","238","1","Usually site while strategy say left yes hard. This product is extremely disappointing. The quality is poor and it doesn't live up to the expectations for a exclusive quokka poster. At term spend agree his performance watch sign.","2023-11-25 12:34:39",""
"32","132","1","By will leader management music others administration. This product is extremely disappointing. The quality is poor and it doesn't live up to the expectations for a quokka-themed sticker. Recent rise use body media discover.","2023-03-13 04:10:34",""
"2","231","4","Often usually rate foreign long. Really good exclusive quokka socks! There are a couple of minor issues, but overall it's a great product. Condition maintain strategy career various ready really girl sure.","2023-02-17 10:55:56",""
"2","232","2","Have south thank possible dream. Not the best quokka approved bag out there. It has a few good points, but overall it's not worth the price. Pretty history benefit team suggest executive.","2021-07-18 15:06:04","product_images/quokka3-e1572408330773.jpg"
