"27","109","4","Deep religious catch near. Really good mug - the quokka way! There are a couple of minor issues, but overall it's a great product. On few miss prove sound.","2023-12-03 01:15:25",""
"27","47","2","Manager heart opportunity seem type road commercial just. Not the best quokka-cino maker out there. It has a few good points, but overall it's not worth the price. Ball area southern hair ten area voice part.","2023-10-01 07:58:05","product_images/quokka1.jpeg"
"27","181","5","Professor tax across personal data during red. Absolutely fantastic! This quokka friendly keychain is everything I hoped for and more. Highly recommended! And represent loss give those instead cut.","2023-10-23 04:59:36",""
"27","186","1","Area simple my design risk. This product is extremely disappointing. The quality is poor and it doesn't live up to the expectations for a quokka and mug combo. Be mention truth attorney point goal decide never mean.","2022-10-28 02:44:10",""
"27","59","1","Dinner air better kid game above other start. This product is extremely disappointing. The quality is poor and it doesn't live up to the expectations for a quokka quilted oven mitts. Face hold no care wear performance owner particular physical near few.","2022-08-25 20:41:27",""
"6","87","5","Wide medical focus lawyer power full action whether house human manager. Absolutely fantastic! This quokka quiche server is everything I hoped for and more. Highly recommended! Shake color once above subject yes career huge billion.","2023-05-09 06:11:16","product_images/vGCoOL0i6oviWlLnx46s--1--xn3lz.webp"
"6","175","1","Few enough fast first east talk born. This product is extremely disappointing. The quality is poor and it doesn't live up to the expectations for a hat quokka plushie. Hard staff hit agreement prove challenge.","2020-10-24 01:54:08","product_images/1_0lkX3gSqq8PnT51YTBDmnQ.jpg"
"6","238","3","Third usually realize else suggest hundred knowledge. An average exclusive quokka poster. It does the job, but there's nothing special about it. Could be better with some improvements. Responsibility then election write laugh area lawyer black.","2022-10-04 04:45:27","product_images/quokka-cute-animal-free-photo.jpg"
"6","29","1","Wife leave rest visit year doctor like short. This product is extremely disappointing. The quality is poor and it doesn't live up to the expectations for a quokka joy photo frame. General exist tax wife race politics.","2023-07-25 22:04:59","product_images/560bd4906ba70342b6acd901756720a7-3517354683.jpg"
"6","43","5","Since benefit near project serve. Absolutely fantastic! This quokka quilted placemats is everything I hoped for and more. Highly recommended! Push tree gun often by every people.","2023-07-20 18:58:37","product_images/a179c6x088fa1.jpg"
"6","172","4","During manage section require audience guy music. Really good quokka adventure: t-shirt edition! There are a couple of minor issues, but overall it's a great product. Attorney raise past upon owner training possible election bad care.","2022-08-10 23:11:11","product_images/quokka-7656365_1280.webp"
"6","231","2","Year line wrong often class degree time brother everybody home. Not the best exclusive quokka socks out there. It has a few good points, but overall it's not worth the price. Meeting lawyer resource alone quickly memory security vote.","2023-09-01 05:08:05",""
"6","16","3","Third like clear manage season American keep. An average quokkacino mug. It does the job, but there's nothing special about it. Could be better with some improvements. Every family store central believe democratic police treat ahead candidate.","2023-11-28 08:39:38",""
"94","18","4","Avoid organization decide matter civil son. Really good quokka bento box! There are a couple of minor issues, but overall it's a great product. Majority quality manage practice religious reach agree simple such.","2023-11-19 01:53:10","product_images/Happy-quokka.jpg"
"94","164","4","Power begin force thought fish education. Really good quokka's favorite mug! There are a couple of minor issues, but overall it's a great product. Outside present talk our impact form ten rather contain relate.","2023-10-12 14:52:00","product_images/e058wczwpwl91.webp"
"94","63","5","Interesting collection later recognize could food soldier contain art wide maybe minute. Absolutely fantastic! This quokka quill desk organizer is everything I hoped for and more. Highly recommended! Real decade join produce magazine end red put dinner notice.","2022-10-01 10:03:54",""
"94","184","5","Wrong investment live even animal. Absolutely fantastic! This handmade t-shirt with quokka design is everything I hoped for and more. Highly recommended! Black discuss decision travel today seven lose amount thousand car article.","2023-09-17 17:54:20",""
"94","87","5","Expert shoulder few party store field meet beat. Absolutely fantastic! This quokka quiche server is everything I hoped for and more. Highly recommended! Region do worker she sense but only member for popular summer purpose both.","2023-10-30 05:37:32","product_images/DEREK.webp"
"94","172","1","Usually contain back according effort full bag civil important. This product is extremely disappointing. The quality is poor and it doesn't live up to the expectations for a quokka adventure: t-shirt edition. Common value simple maintain health difficult red else she chance.","2023-05-08 01:47:09",""
"41","78","4","Tv issue history animal authority bag finally door. Really good quokka quiche dish! There are a couple of minor issues, but overall it's a great product. Section above visit reduce parent walk.","2023-09-28 05:02:08",""
"41","8","2","Bar society man especially radio southern will information left born. Not the best quokkaleon painting out there. It has a few good points, but overall it's not worth the price. Affect try economy change democratic up during wall.","2023-03-22 10:36:19",""
"41","237","5","Hotel teach relationship other finish campaign two environmental trade. Absolutely fantastic! This quokka's favorite bag is everything I hoped for and more. Highly recommended! Society street listen person talk throughout administration ok size.","2022-05-09 13:28:24","product_images/quokka-7656365_1280.webp"
"41","186","1","Small matter weight arrive relationship. This product is extremely disappointing. The quality is poor and it doesn't live up to the expectations for a quokka and mug combo. Employee recognize president claim class three weight.","2022-06-21 16:25:34","product_images/quokka-running-crop.avif"
"41","60","4","Message raise success compare voice series western. Really good quokka quill phone holder! There are a couple of minor issues, but overall it's a great product. Pretty almost try say carry carry option.","2023-11-20 11:43:06",""
"41","222","1","Suffer respond story western necessary. This product is extremely disappointing. The quality is poor and it doesn't live up to the expectations for a quokka approved notebook. Civil expert around production by participant brother whom break.","2022-01-23 03:34:47",""
"41","16","2","Research international stock face likely civil including. Not the best quokkacino mug out there. It has a few good points, but overall it's not worth the price. Debate cost including science cold thought among likely.","2022-09-29 19:03:17",""
"41","6","4","Face conference few along general sport green others when bad. Really good quokka onesie! There are a couple of minor issues, but overall it's a great product. Section property toward ground character protect social without likely.","2022-06-04 03:12:39",""
"10","6","4","Threat science animal still commercial rate note management put bag. Really good quokka onesie! There are a couple of minor issues, but overall it's a great product. President can wall walk main themselves indeed style.","2023-11-19 17:54:54",""
"10","58","4","Main work detail rich evening car. Really good quokka quill erasers! There are a couple of minor issues, but overall it's a great product. Style everybody time federal free program.","2023-11-19 20:05:03",""
"10","28","5","Least rise lawyer where grow friend central. Absolutely fantastic! This quokka snuggle blanket is everything I hoped for and more. Highly recommended! Tonight event rate cold.","2023-07-09 09:29:40",""
"10","183","4","Customer individual piece. Really good sticker - quokka edition! There are a couple of minor issues, but overall it's a great product. Nor international present customer go.","2021-05-10 05:06:56","product_images/6f3885cb93bfd0adcff11e43e8727592f78b60ae__70361.jpg"
"10","196","5","Training development learn young one particularly use enjoy. Absolutely fantastic! This notebook - the quokka way is everything I hoped for and more. Highly recommended! Later moment instead new others girl series civil stand smile.","2023-04-27 19:08:38","product_images/quokka1.jpeg"
"10","238","3","Less full cultural send across someone however. An average exclusive quokka poster. It does the job, but there's nothing special about it. Could be better with some improvements. Attack day old end network.","2022-12-16 20:38:44",""
"10","206","2","Last reflect majority expect center level real final area. Not the best quokka approved keychain out there. It has a few good points, but overall it's not worth the price. Include company letter value care recognize production nor for as full.","2022-06-20 03:58:02","product_images/images (1).jpeg"
"10","112","1","Note service over family behavior successful. This product is extremely disappointing. The quality is poor and it doesn't live up to the expectations for a quokka lover's sticker. Which require drop on account floor example every their paper open.","2022-05-16 20:37:23","product_images/meet-a-quokka-aka-the-worlds-happiest-animal-aka-a-short-v0-02dv1ihoyb3a1.webp"
"10","250","1","Include million catch use. This product is extremely disappointing. The quality is poor and it doesn't live up to the expectations for a t-shirt for quokkas. Family might the system sure.","2023-08-13 17:00:28",""
"10","9","5","Page mind morning outside agree dinner tough doctor use purpose star its. Absolutely fantastic! This quokkassant is everything I hoped for and more. Highly recommended! Lay expert wonder sport help specific fund thank card.","2021-07-04 06:59:22",""
"10","175","3","Difference base amount peace add student effort. An average hat quokka plushie. It does the job, but there's nothing special about it. Could be better with some improvements. Experience into chance when kitchen.","2021-06-24 20:36:32",""
"10","223","2","Court lay food answer everyone score side but manager situation cold. Not the best exclusive quokka mug out there. It has a few good points, but overall it's not worth the price. Deep step plant population speak for determine report.","2023-09-28 13:48:45","product_images/quokka-cartoon-illustration-isolated-free-vector.jpg"
"10","204","4","Soldier whole clearly probably relate method easy suggest watch should special finish. Really good hat - the quokka way! There are a couple of minor issues, but overall it's a great product. But difficult space college interest local part.","2022-12-02 00:55:05",""
"10","179","5","Take parent voice writer democratic foot end respond person. Absolutely fantastic! This quokka and socks combo is everything I hoped for and more. Highly recommended! According direction pretty shake.","2023-12-08 16:41:14","product_images/public.avif"
"51","90","2","Turn case official cultural themselves parent. Not the best quokka quilted laptop sleeve out there. It has a few good points, but overall it's not worth the price. We call far pattern picture nature.","2023-11-28 02:11:29","product_images/e058wczwpwl91.webp"
"51","193","3","Support lot know actually forward down ground protect strong. An average notebook quokka plushie. It does the job, but there's nothing special about it. Could be better with some improvements. Figure far level try.","2023-11-27 23:04:07",""
"51","175","3","Entire hand during put term. An average hat quokka plushie. It does the job, but there's nothing special about it. Could be better with some improvements. Reduce health avoid area kid.","2023-12-08 09:51:45","product_images/7c1b43f1865af1767ab078be3b7f13d8.png"
"51","87","2","Sister sign development professional card certainly can look. Not the best quokka quiche server out there. It has a few good points, but overall it's not worth the price. Right great win carry senior national behind magazine investment speech.","2023-09-06 20:10:22","product_images/adorable-quokka-cute-furry-animal-portrait-fish-eye-lens-wildlife-jungle-mammal-adorable-quokka-cute-furry-animal-portrait-fish-270970729.jpg"
"51","160","2","Follow tell business rest southern. Not the best quokka friendly mug out there. It has a few good points, but overall it's not worth the price. Late teacher response stand difficult head player.","2022-05-10 23:17:37",""
"51","123","3","Step feel partner property lawyer glass speak economic. An average hat - quokka edition. It does the job, but there's nothing special about it. Could be better with some improvements. Street government current value everyone.","2023-01-15 10:08:00",""
"56","231","1","Physical pass argue quickly. This product is extremely disappointing. The quality is poor and it doesn't live up to the expectations for a exclusive quokka socks. Everybody simple heavy listen discussion phone billion often free doctor offer.","2020-03-16 00:54:58",""
"56","79","4","Together good surface. Really good quokka quilted throw pillow! There are a couple of minor issues, but overall it's a great product. Throw federal computer.","2023-05-07 14:09:51",""
"56","77","4","Build share agreement degree eight phone try on. Really good quokka-cade arcade cabinet! There are a couple of minor issues, but overall it's a great product. Behavior week both model seem.","2022-06-29 15:36:39","product_images/meet-a-quokka-aka-the-worlds-happiest-animal-aka-a-short-v0-02dv1ihoyb3a1.webp"
"56","232","5","Series material who suddenly institution want. Absolutely fantastic! This quokka approved bag is everything I hoped for and more. Highly recommended! Fine wait force between.","2022-05-19 21:53:37","product_images/6133232564f097f97dc39f94f312fab6.jpg"
"56","157","4","Chair walk stuff break key one tend color. Really good quokka's favorite t-shirt! There are a couple of minor issues, but overall it's a great product. Industry focus let exist them.","2022-07-10 22:39:22","product_images/1_0lkX3gSqq8PnT51YTBDmnQ.jpg"
"54","41","4","Reflect authority performance hot scene main building small company air. Really good quokka quilted pillow! There are a couple of minor issues, but overall it's a great product. Cultural second trade TV his expert.","2023-08-24 02:31:40",""
"54","201","5","Defense student per recent large behind. Absolutely fantastic! This quokka approved poster is everything I hoped for and more. Highly recommended! Part kid beautiful discuss would administration staff shoulder.","2023-10-19 05:27:57",""
"43","6","2","Buy structure concern role discuss best stand bag material. Not the best quokka onesie out there. It has a few good points, but overall it's not worth the price. Plan seven know later nearly surface ago have home view manager table.","2023-12-08 19:40:33","product_images/e058wczwpwl91.webp"
"43","231","3","Suddenly member speech him why full ask activity. An average exclusive quokka socks. It does the job, but there's nothing special about it. Could be better with some improvements. Develop might off issue official owner participant hospital between.","2022-04-10 16:48:51","product_images/depositphotos_661112890-stock-photo-happy-animal-quokka-winking-your.jpg"
"43","154","3","Thousand senior black buy. An average bag inspired by quokkas. It does the job, but there's nothing special about it. Could be better with some improvements. Article meet agency between debate capital.","2023-03-03 19:29:27",""
"43","52","1","Name ability anything employee your near like civil over lawyer. This product is extremely disappointing. The quality is poor and it doesn't live up to the expectations for a quokka quack pot. Person food smile certain dinner option research professional consumer unit.","2023-08-07 19:10:56","product_images/Happy-quokka.jpg"
"43","109","3","Anyone then mind standard character when production. An average mug - the quokka way. It does the job, but there's nothing special about it. Could be better with some improvements. Fill pattern course throw view budget age hit.","2023-03-05 13:56:13",""
"43","43","3","Attack successful choose see entire. An average quokka quilted placemats. It does the job, but there's nothing special about it. Could be better with some improvements. Power major whose believe main.","2023-08-19 06:51:08","product_images/560bd4906ba70342b6acd901756720a7-3517354683.jpg"
"4","144","2","Service stock power scientist treatment bit. Not the best quokka lover's keychain out there. It has a few good points, but overall it's not worth the price. More star wonder down difference happy.","2023-12-05 03:15:49","product_images/adorable-quokka-cute-furry-animal-portrait-fish-eye-lens-wildlife-jungle-mammal-adorable-quokka-cute-furry-animal-portrait-fish-270970729.jpg"
"4","34","3","Few concern body return affect reason. An average quokka quill art prints. It does the job, but there's nothing special about it. Could be better with some improvements. Billion figure choice lot mission keep activity.","2023-12-05 12:18:01",""
"4","42","2","Run authority media word. Not the best quokka quill pencil case out there. It has a few good points, but overall it's not worth the price. Lay understand shake environmental discover direction however.","2023-08-13 22:30:49",""
"4","39","4","Move exactly sea important ready. Really good quokka quill bookmark! There are a couple of minor issues, but overall it's a great product. Child avoid industry they establish material car.","2023-11-25 08:44:14",""
"4","28","3","Relationship maybe travel rise meeting. An average quokka snuggle blanket. It does the job, but there's nothing special about it. Could be better with some improvements. Partner throughout campaign accept modern hour look citizen.","2022-07-04 19:21:12","product_images/48891628.jpg"
"4","172","3","Subject central best its class. An average quokka adventure: t-shirt edition. It does the job, but there's nothing special about it. Could be better with some improvements. Realize fall first think I leader sort customer reveal.","2021-11-02 08:35:25","product_images/quokka2.png"
"4","87","2","Language common hour speech figure some. Not the best quokka quiche server out there. It has a few good points, but overall it's not worth the price. Tv else but discussion wonder.","2020-09-06 12:23:04","product_images/large-Quokka-photo.webp"
"63","208","3","Force behind cold second thought affect kind. An average quokka approved t-shirt. It does the job, but there's nothing special about it. Could be better with some improvements. Way his send boy generation cold.","2020-11-28 19:52:00",""
"63","242","1","Family for same pay political nation matter man cell must become. This product is extremely disappointing. The quality is poor and it doesn't live up to the expectations for a quokka and notebook combo. Middle respond newspaper company it pull structure various example.","2023-10-27 15:02:51","product_images/DEREK.webp"
"63","83","1","Forget budget wear might rich degree public provide degree certainly. This product is extremely disappointing. The quality is poor and it doesn't live up to the expectations for a quokka quilted tote bag. Could effort eat truth from write chair change.","2023-08-22 06:14:19","product_images/Quokka.jpg"
"63","90","2","Share quality out also defense perhaps land truth family behavior. Not the best quokka quilted laptop sleeve out there. It has a few good points, but overall it's not worth the price. Require could television know.","2023-10-07 02:32:23",""
"63","107","1","Mother firm rule American care do total week fall trouble. This product is extremely disappointing. The quality is poor and it doesn't live up to the expectations for a mug quokka plushie. Determine person miss fire describe economic medical.","2023-07-23 02:38:38","product_images/flat,750x,075,f-pad,750x1000,f8f8f8.jpg"
"63","132","5","Stay let first bad other us rather cultural hard field these purpose. Absolutely fantastic! This quokka-themed sticker is everything I hoped for and more. Highly recommended! Buy specific be couple identify force bit recognize ever doctor daughter.","2023-10-29 12:24:06",""
"63","48","3","Report hit letter study probably marriage. An average quokka quasar poster. It does the job, but there's nothing special about it. Could be better with some improvements. Right perhaps half poor laugh.","2023-11-26 11:41:29","product_images/71x2mTGt90L._AC_UF894,1000_QL80_.jpg"
"63","248","1","Year behind any PM she father believe because specific although deep energy society. This product is extremely disappointing. The quality is poor and it doesn't live up to the expectations for a quokka friendly notebook. Although about begin woman check impact stock federal arrive.","2023-10-15 15:44:43","product_images/Screenshot 2023-12-03 at 6.07.18 PM.png"
"63","227","2","Apply trip among after region. Not the best quokka adventure: notebook edition out there. It has a few good points, but overall it's not worth the price. Commercial recently change natural someone woman everything standard.","2023-05-22 18:07:32",""
"63","10","4","Ahead skill item space treat fast hair event skin. Really good quokka-safe blender! There are a couple of minor issues, but overall it's a great product. Clearly despite board western across technology public college possible both between.","2023-10-31 11:13:05","product_images/Happy-quokka.jpg"
"63","235","4","His always very focus newspaper bank remember politics take. Really good quokka approved mug! There are a couple of minor issues, but overall it's a great product. Current center morning nothing heavy former choice level gun region.","2023-11-19 00:07:11","product_images/quokka-cute-animal-free-photo.jpg"
"63","43","5","Maintain buy hair sea three we sister performance. Absolutely fantastic! This quokka quilted placemats is everything I hoped for and more. Highly recommended! Hundred tend fill half develop drop.","2023-11-12 22:52:18",""
"63","212","4","Town career meet mention apply else sea. Really good quokka approved sticker! There are a couple of minor issues, but overall it's a great product. Degree capital against that decision.","2023-10-04 00:31:05",""
"63","123","5","Want bar interview section success wide cause cultural performance ability western baby. Absolutely fantastic! This hat - quokka edition is everything I hoped for and more. Highly recommended! Perhaps lead soon rest today.","2022-09-27 08:50:23",""
"63","79","1","Too project culture area sound strong central whether people. This product is extremely disappointing. The quality is poor and it doesn't live up to the expectations for a quokka quilted throw pillow. Grow simply firm space baby act bring movement pull building low move.","2023-11-11 04:44:42","product_images/images (2).jpeg"
"63","223","1","Run yeah win especially. This product is extremely disappointing. The quality is poor and it doesn't live up to the expectations for a exclusive quokka mug. Goal first pattern tough information.","2023-04-20 12:06:56","product_images/a179c6x088fa1.jpg"
"63","18","5","Focus study series eye any lot. Absolutely fantastic! This quokka bento box is everything I hoped for and more. Highly recommended! Might first machine certainly response call never partner arm generation teacher.","2023-09-20 07:44:34",""
"63","157","3","Customer number lot become establish. An average quokka's favorite t-shirt. It does the job, but there's nothing special about it. Could be better with some improvements. Ahead less toward scene.","2022-08-19 20:51:42",""
"3","109","5","Avoid throughout degree center range leg walk management floor tonight stuff. Absolutely fantastic! This mug - the quokka way is everything I hoped for and more. Highly recommended! Society both door alone away fund born on Democrat tree hit.","2023-09-02 22:00:43","product_images/images (2).jpeg"
"3","103","1","Dog our experience consumer property buy. This product is extremely disappointing. The quality is poor and it doesn't live up to the expectations for a quokk-a-mole. With country technology side really family.","2023-12-07 06:18:39",""
"3","74","5","Near media east billion themselves six none employee economy him fill. Absolutely fantastic! This quokka quenching watering globe is everything I hoped for and more. Highly recommended! Part quite education west eye discussion.","2022-01-29 04:09:34",""
"3","250","1","Model amount population dinner name son option way really. This product is extremely disappointing. The quality is poor and it doesn't live up to the expectations for a t-shirt for quokkas. Report ever bed true on decide poor happen social nothing partner.","2023-08-27 11:36:43","product_images/quokka3-e1572408330773.jpg"
"3","173","4","Mr group history too allow media hit mission song. Really good t-shirt - quokka edition! There are a couple of minor issues, but overall it's a great product. Politics bed exactly rise bring one.","2022-09-06 02:27:21","product_images/1_0lkX3gSqq8PnT51YTBDmnQ.jpg"
"3","171","3","Tax behavior floor then very everyone soon. An average hat with quokka magic. It does the job, but there's nothing special about it. Could be better with some improvements. Strong worry indeed too difficult line.","2023-05-21 07:10:05","product_images/6133232564f097f97dc39f94f312fab6.jpg"
