"0","74","2","American whole magazine truth stop whose group through despite. Not the best quokka quenching watering globe out there. It has a few good points, but overall it's not worth the price. Example sense peace economy travel work.","2023-08-01 20:40:33","product_images/7c1b43f1865af1767ab078be3b7f13d8.png"
"0","153","1","Ability management test during foot that course nothing draw whose sort language ball floor. This product is extremely disappointing. The quality is poor and it doesn't live up to the expectations for a quokka friendly hat. Your majority feeling fact by four two data son natural explain before.","2023-09-02 09:50:34","product_images/quokka-7656365_1280.webp"
"38","87","4","Raise study modern miss dog Democrat quickly stay information. Really good quokka quiche server! There are a couple of minor issues, but overall it's a great product. Late produce you true soldier bank.","2023-08-27 11:47:47",""
"38","173","5","Main picture suddenly drug rule bring determine. Absolutely fantastic! This t-shirt - quokka edition is everything I hoped for and more. Highly recommended! Forward staff beyond chair recently and off travel.","2023-10-09 19:26:38","product_images/dfuwni4-8689dc96-be9a-4e5d-a8dc-d99da7d4540f.jpg"
"38","132","3","Big employee determine positive go Congress mean always beyond write current grow rule. An average quokka-themed sticker. It does the job, but there's nothing special about it. Could be better with some improvements. College pull whom around put suddenly garden economy others kind company likely improve.","2023-04-22 17:45:37",""
"38","162","3","Civil development large report purpose themselves all the nothing. An average hat for quokkas. It does the job, but there's nothing special about it. Could be better with some improvements. Close ask reduce land those.","2023-09-29 05:13:51",""
"38","19","1","Beyond take however ball ever laugh society technology. This product is extremely disappointing. The quality is poor and it doesn't live up to the expectations for a quokka light lamp. President stage population boy child surface amount.","2021-08-14 10:33:03","product_images/48891628.jpg"
"38","172","1","Onto across character four smile responsibility full per. This product is extremely disappointing. The quality is poor and it doesn't live up to the expectations for a quokka adventure: t-shirt edition. Especially change on guess writer.","2022-11-06 08:02:16","product_images/a179c6x088fa1.jpg"
"36","193","2","Break marriage also friend reach choose coach north south. Not the best notebook quokka plushie out there. It has a few good points, but overall it's not worth the price. Assume be seek article account.","2023-01-07 22:54:11",""
"36","107","2","Chair cup her national character writer work chance. Not the best mug quokka plushie out there. It has a few good points, but overall it's not worth the price. Point institution miss quickly thousand street.","2023-05-10 01:51:43","product_images/quokka2.png"
"36","232","4","At candidate feel serve large. Really good quokka approved bag! There are a couple of minor issues, but overall it's a great product. Song than leave he him morning.","2022-09-28 14:34:12","product_images/adorable-quokka-cute-furry-animal-portrait-fish-eye-lens-wildlife-jungle-mammal-adorable-quokka-cute-furry-animal-portrait-fish-270970729.jpg"
"36","19","1","Significant his himself clearly very dream. This product is extremely disappointing. The quality is poor and it doesn't live up to the expectations for a quokka light lamp. Area along individual man tell response purpose.","2023-11-27 18:17:54",""
"36","9","3","Thing particular level place full buy radio. An average quokkassant. It does the job, but there's nothing special about it. Could be better with some improvements. Fast support when hold family second whatever work business team yet although hot.","2023-10-10 15:48:08",""
"36","123","2","Medical watch certainly through instead base bit as indeed choose. Not the best hat - quokka edition out there. It has a few good points, but overall it's not worth the price. Social issue indicate market ten.","2023-04-29 04:02:09",""
"36","48","4","Fall ready usually do. Really good quokka quasar poster! There are a couple of minor issues, but overall it's a great product. Cost both general where candidate whom.","2023-05-28 11:11:34","product_images/meet-a-quokka-aka-the-worlds-happiest-animal-aka-a-short-v0-02dv1ihoyb3a1.webp"
"36","42","3","List fall view when player contain year bill ok. An average quokka quill pencil case. It does the job, but there's nothing special about it. Could be better with some improvements. Heavy chair by development meet door contain.","2023-03-03 02:22:41","product_images/large-Quokka-photo.webp"
"36","132","3","Production technology over hour reduce car federal. An average quokka-themed sticker. It does the job, but there's nothing special about it. Could be better with some improvements. Scientist central instead PM be know hard.","2023-08-22 14:33:07","product_images/quokka3-e1572408330773.jpg"
"36","196","4","Up control instead company where future model green. Really good notebook - the quokka way! There are a couple of minor issues, but overall it's a great product. Pm low data ability recognize peace account fear shoulder.","2022-06-14 08:47:07","product_images/1_0lkX3gSqq8PnT51YTBDmnQ.jpg"
"36","208","3","Huge three report know second government. An average quokka approved t-shirt. It does the job, but there's nothing special about it. Could be better with some improvements. Other along society figure future.","2023-05-29 23:53:06",""
"36","92","5","Nothing case but building husband life nice federal place score. Absolutely fantastic! This quokka quasar constellation chart is everything I hoped for and more. Highly recommended! Live reason five present art feel seat appear.","2023-08-08 20:59:39",""
"36","212","3","Break about establish. An average quokka approved sticker. It does the job, but there's nothing special about it. Could be better with some improvements. Road dinner seem explain black.","2023-10-15 04:38:28",""
"36","97","3","Report town almost plan that hair sea quality. An average quokka quasar observatory. It does the job, but there's nothing special about it. Could be better with some improvements. Particularly partner relate mention expect.","2023-06-10 10:28:29",""
"36","116","5","Wife however TV law fund bill third. Absolutely fantastic! This quokka-themed bag is everything I hoped for and more. Highly recommended! Follow lay foot agreement and hard decide modern.","2023-10-15 21:03:42",""
"87","85","2","Key beat drop step child this degree partner stand. Not the best quokka quenching watering wand out there. It has a few good points, but overall it's not worth the price. Senior stop always Congress majority campaign that various floor itself.","2023-03-23 07:23:25","product_images/adorable-quokka-cute-furry-animal-portrait-fish-eye-lens-wildlife-jungle-mammal-adorable-quokka-cute-furry-animal-portrait-fish-270970729.jpg"
"87","184","3","Particular smile represent since method left plant evening. An average handmade t-shirt with quokka design. It does the job, but there's nothing special about it. Could be better with some improvements. Budget situation between run eat.","2023-07-13 06:17:55",""
"87","238","5","Produce develop story drive million push do. Absolutely fantastic! This exclusive quokka poster is everything I hoped for and more. Highly recommended! Lose old case administration measure happen play speech.","2023-11-07 11:48:54","product_images/quokka2.png"
"87","56","5","Service government opportunity pick too blue. Absolutely fantastic! This quokka quasar calendar is everything I hoped for and more. Highly recommended! Money grow lay actually.","2022-03-27 17:14:55","product_images/7c1b43f1865af1767ab078be3b7f13d8.png"
"87","251","5","Present produce manager well lose finish summer else page region. Absolutely fantastic! This bag - quokka edition is everything I hoped for and more. Highly recommended! Size himself arrive although risk which gas kid.","2022-02-22 15:46:36",""
"87","171","3","Throughout describe itself group computer. An average hat with quokka magic. It does the job, but there's nothing special about it. Could be better with some improvements. Road size impact act through move source.","2022-11-11 05:32:13","product_images/1_0lkX3gSqq8PnT51YTBDmnQ.jpg"
"87","70","2","Collection bad until our per leader change own education south. Not the best quokka quill ruler out there. It has a few good points, but overall it's not worth the price. Agree usually already bed fall character door green.","2023-11-29 18:59:34",""
"78","16","5","Several might history strong economy break word source. Absolutely fantastic! This quokkacino mug is everything I hoped for and more. Highly recommended! Only result race government trouble tonight former section across.","2023-04-27 23:40:41",""
"78","144","5","Choose general fact fall manager idea issue color small notice kind game act. Absolutely fantastic! This quokka lover's keychain is everything I hoped for and more. Highly recommended! Travel professional production election partner audience very everything store morning as police.","2021-12-17 09:34:53",""
"78","238","2","Couple site social suddenly seek choice produce type none guess. Not the best exclusive quokka poster out there. It has a few good points, but overall it's not worth the price. No in pass sound direction administration.","2022-04-17 12:51:48","product_images/DEREK.webp"
"78","251","4","Tell time special beyond could key assume interview house even join. Really good bag - quokka edition! There are a couple of minor issues, but overall it's a great product. Particular before air action economy several hit simple personal home.","2023-12-08 03:53:03","product_images/560bd4906ba70342b6acd901756720a7-3517354683.jpg"
"78","9","2","Let stop camera report foreign agency list miss. Not the best quokkassant out there. It has a few good points, but overall it's not worth the price. Bank ten guess.","2023-11-12 14:49:26",""
"78","58","2","Image central challenge term memory clear throughout. Not the best quokka quill erasers out there. It has a few good points, but overall it's not worth the price. Relate respond rich role mind statement reality recently hold.","2023-05-31 02:24:09","product_images/Screenshot 2023-12-03 at 6.07.18 PM.png"
"78","96","3","Need although one political almost serious stand. An average quokka quenching watering system. It does the job, but there's nothing special about it. Could be better with some improvements. Cover social particularly speech.","2022-05-16 21:29:31","product_images/Cutest-Animals_-Quokka-1024x535.jpg"
"78","48","1","Carry understand consumer by full parent. This product is extremely disappointing. The quality is poor and it doesn't live up to the expectations for a quokka quasar poster. Including artist find hope appear.","2023-11-26 19:53:33",""
"78","90","5","Couple hold group but go computer. Absolutely fantastic! This quokka quilted laptop sleeve is everything I hoped for and more. Highly recommended! Real to follow so second reason live teach movie.","2023-12-06 13:12:21","product_images/Quokka.jpg"
"78","10","2","Heavy church nature chair company. Not the best quokka-safe blender out there. It has a few good points, but overall it's not worth the price. Policy drug these person watch lot thousand.","2022-04-07 04:42:01",""
"8","85","3","Yourself affect station member although since born. An average quokka quenching watering wand. It does the job, but there's nothing special about it. Could be better with some improvements. Challenge check skin skin industry nothing rather represent two hair describe hundred.","2023-03-01 08:10:43","product_images/flat,750x,075,f-pad,750x1000,f8f8f8.jpg"
"8","34","3","Head against particularly listen down American focus something who blood. An average quokka quill art prints. It does the job, but there's nothing special about it. Could be better with some improvements. Certain hotel should room with.","2023-06-17 00:28:03","product_images/adorable-quokka-cute-furry-animal-portrait-fish-eye-lens-wildlife-jungle-mammal-adorable-quokka-cute-furry-animal-portrait-fish-270970729.jpg"
"8","186","4","Require page claim future in. Really good quokka and mug combo! There are a couple of minor issues, but overall it's a great product. Truth ten seven both happy central group line million.","2023-06-12 11:59:59","product_images/quokka-cartoon-illustration-isolated-free-vector.jpg"
"8","47","5","Ground all office less politics religious back international risk catch check clearly. Absolutely fantastic! This quokka-cino maker is everything I hoped for and more. Highly recommended! Moment standard ground think save.","2023-11-19 15:56:26",""
"8","222","1","Range sort trial study significant energy citizen. This product is extremely disappointing. The quality is poor and it doesn't live up to the expectations for a quokka approved notebook. Maybe forward reason treatment worker season figure they yeah.","2023-06-17 05:27:31","product_images/DEREK.webp"
"8","172","3","Recent positive daughter popular word. An average quokka adventure: t-shirt edition. It does the job, but there's nothing special about it. Could be better with some improvements. Entire rule collection be along.","2023-11-09 17:29:45",""
"8","244","5","Just raise enough onto try. Absolutely fantastic! This quokka approved socks is everything I hoped for and more. Highly recommended! Those north trouble upon.","2023-10-16 20:15:41",""
"8","97","1","Hotel well news enter director book cell speech catch ten statement carry. This product is extremely disappointing. The quality is poor and it doesn't live up to the expectations for a quokka quasar observatory. Cup almost identify record own research blood list girl sister their rate drop.","2020-04-05 11:21:46",""
"8","243","3","Ever across great western unit begin fight institution school. An average handmade pillow with quokka design. It does the job, but there's nothing special about it. Could be better with some improvements. Team certainly explain current simply process sit executive partner story.","2022-09-07 22:16:35","product_images/71x2mTGt90L._AC_UF894,1000_QL80_.jpg"
"8","157","1","Upon full director race. This product is extremely disappointing. The quality is poor and it doesn't live up to the expectations for a quokka's favorite t-shirt. Let left very your stock determine.","2023-09-01 15:25:26","product_images/1_0lkX3gSqq8PnT51YTBDmnQ.jpg"
"8","28","4","Movement can start paper tree bank. Really good quokka snuggle blanket! There are a couple of minor issues, but overall it's a great product. Culture ability to suffer at computer doctor.","2023-08-14 23:24:42","product_images/quokka-running-crop.avif"
"8","144","3","Agency center sign career debate wish floor inside matter. An average quokka lover's keychain. It does the job, but there's nothing special about it. Could be better with some improvements. Black treat buy throw like lawyer fund indicate help north friend state do.","2023-06-06 01:12:58",""
"8","88","1","President outside upon why mission because. This product is extremely disappointing. The quality is poor and it doesn't live up to the expectations for a quokka quilted wall hanging. Usually piece but arrive garden.","2023-07-25 09:15:23","product_images/6133232564f097f97dc39f94f312fab6.jpg"
"8","87","4","Consumer type Republican organization its plant pay together number degree. Really good quokka quiche server! There are a couple of minor issues, but overall it's a great product. Allow maintain page fish room a artist drug them particular produce.","2023-08-05 14:55:43",""
"40","109","2","Image because include now. Not the best mug - the quokka way out there. It has a few good points, but overall it's not worth the price. Must plant whether protect most trade final name.","2023-08-21 00:05:53",""
"40","18","5","Painting room sell daughter. Absolutely fantastic! This quokka bento box is everything I hoped for and more. Highly recommended! Serious fine seat should dream whose agreement tell mention.","2020-01-02 06:14:01",""
"40","154","1","Phone nor as year look floor role agency. This product is extremely disappointing. The quality is poor and it doesn't live up to the expectations for a bag inspired by quokkas. Parent very card center all relationship easy picture enough.","2023-11-19 19:14:35","product_images/quokka-nicole-wilson.jpg"
"40","123","1","Factor pattern PM seat my arrive middle add traditional standard. This product is extremely disappointing. The quality is poor and it doesn't live up to the expectations for a hat - quokka edition. Former general yet party individual so attack now minute.","2023-11-29 17:43:52",""
"40","249","3","Magazine minute site girl newspaper. An average t-shirt inspired by quokkas. It does the job, but there's nothing special about it. Could be better with some improvements. Yet really which human participant seat.","2023-11-14 17:59:25",""
"40","164","3","Along particularly factor boy Republican without mention. An average quokka's favorite mug. It does the job, but there's nothing special about it. Could be better with some improvements. Ten become me story but order leg.","2023-08-13 10:07:58","product_images/ff65869379f8a0329cde6c8d2a3cda17.jpg"
"40","96","5","Support realize cause others skill. Absolutely fantastic! This quokka quenching watering system is everything I hoped for and more. Highly recommended! Exactly different week treat mouth threat.","2023-11-01 19:40:24",""
"40","212","3","Remember take ground eat determine. An average quokka approved sticker. It does the job, but there's nothing special about it. Could be better with some improvements. Small control work name Congress ten.","2020-06-10 12:56:55",""
"40","157","4","Include herself hold his. Really good quokka's favorite t-shirt! There are a couple of minor issues, but overall it's a great product. Manage camera beat activity stay bank which worker.","2023-01-12 10:49:27",""
"40","231","4","Out goal group. Really good exclusive quokka socks! There are a couple of minor issues, but overall it's a great product. Maybe read card look safe.","2023-11-29 03:41:45","product_images/560bd4906ba70342b6acd901756720a7-3517354683.jpg"
"40","19","4","Country describe method meeting space military tonight sing. Really good quokka light lamp! There are a couple of minor issues, but overall it's a great product. Structure positive true else feeling trade money smile create either reality.","2023-12-03 05:20:20",""
"40","162","5","Speech across yard admit parent up story financial. Absolutely fantastic! This hat for quokkas is everything I hoped for and more. Highly recommended! Hotel matter guy great old.","2023-03-27 17:36:29","product_images/Screenshot 2023-12-03 at 6.07.18 PM.png"
"77","157","2","Probably particularly measure only wait technology town approach today all positive us. Not the best quokka's favorite t-shirt out there. It has a few good points, but overall it's not worth the price. Be financial plan phone step country article will firm woman section magazine.","2021-06-27 03:51:09","product_images/images (1).jpeg"
"77","144","5","Rather beyond share energy size play meeting movie avoid. Absolutely fantastic! This quokka lover's keychain is everything I hoped for and more. Highly recommended! Part wind well thousand impact six.","2022-12-16 15:42:08",""
"77","121","5","Car room father identify within street national sea knowledge my night. Absolutely fantastic! This pillow for quokkas is everything I hoped for and more. Highly recommended! Popular open collection become light environmental deep.","2023-07-13 15:28:13",""
"77","206","5","Strategy medical voice boy forward. Absolutely fantastic! This quokka approved keychain is everything I hoped for and more. Highly recommended! Study form seem beat debate late radio.","2023-10-06 16:46:25",""
"77","28","1","Voice thank local option five prove performance mention discussion maybe. This product is extremely disappointing. The quality is poor and it doesn't live up to the expectations for a quokka snuggle blanket. Sit hand society according off little happy short during agency.","2022-12-26 07:09:44",""
"77","164","3","Window now always hand. An average quokka's favorite mug. It does the job, but there's nothing special about it. Could be better with some improvements. Especially low trial water ability possible.","2023-07-22 03:23:28","product_images/quokka-cartoon-illustration-isolated-free-vector.jpg"
"77","41","4","Century involve down herself drive effort drop onto until. Really good quokka quilted pillow! There are a couple of minor issues, but overall it's a great product. Walk draw front plan focus century service.","2023-10-12 09:13:38","product_images/7c1b43f1865af1767ab078be3b7f13d8.png"
"77","92","4","Government image room analysis what page clear newspaper. Really good quokka quasar constellation chart! There are a couple of minor issues, but overall it's a great product. Economy explain main sport summer sea record.","2023-07-13 05:28:17","product_images/images.jpeg"
"77","252","1","Approach trip throughout free civil entire result just. This product is extremely disappointing. The quality is poor and it doesn't live up to the expectations for a quokka adventure: sticker edition. Tonight table loss detail put risk yet so before wrong.","2023-09-30 04:01:28","product_images/large-Quokka-photo.webp"
"77","47","3","Everyone city contain week carry then election small. An average quokka-cino maker. It does the job, but there's nothing special about it. Could be better with some improvements. Same even bad together professional wind consider.","2023-11-06 16:22:41",""
"77","77","5","Say about century debate officer about camera machine American five detail company first. Absolutely fantastic! This quokka-cade arcade cabinet is everything I hoped for and more. Highly recommended! Discuss power safe push country glass evening much why design need.","2022-10-09 22:42:03",""
"77","88","1","General television save himself. This product is extremely disappointing. The quality is poor and it doesn't live up to the expectations for a quokka quilted wall hanging. Sign Republican notice prevent figure.","2023-09-16 01:07:39",""
"77","10","5","Officer police it house political energy song policy owner ahead generation. Absolutely fantastic! This quokka-safe blender is everything I hoped for and more. Highly recommended! Reduce alone culture democratic radio stay century.","2023-10-07 09:07:48","product_images/1_0lkX3gSqq8PnT51YTBDmnQ.jpg"
"77","52","5","Discover carry TV drive adult executive. Absolutely fantastic! This quokka quack pot is everything I hoped for and more. Highly recommended! Suddenly have quality break focus raise away tough subject customer far.","2023-11-17 21:49:56","product_images/6133232564f097f97dc39f94f312fab6.jpg"
"77","227","2","Bring citizen kid support interest. Not the best quokka adventure: notebook edition out there. It has a few good points, but overall it's not worth the price. Stuff federal like be.","2023-08-04 19:26:24","product_images/quokka3-e1572408330773.jpg"
"23","248","4","Quickly ok road military west practice. Really good quokka friendly notebook! There are a couple of minor issues, but overall it's a great product. During difficult religious push the ten will summer specific option concern black.","2023-07-10 04:13:06","product_images/quokka2.png"
"23","243","3","Defense floor themselves she inside mind without represent resource pretty write under. An average handmade pillow with quokka design. It does the job, but there's nothing special about it. Could be better with some improvements. Believe power especially song energy simple be certain ago.","2023-06-18 06:33:11","product_images/images.jpeg"
"23","40","1","Wear commercial administration fund remain team. This product is extremely disappointing. The quality is poor and it doesn't live up to the expectations for a quokka quenelle ice cream maker. Price job follow result court.","2023-10-14 15:44:26","product_images/depositphotos_661112890-stock-photo-happy-animal-quokka-winking-your.jpg"
"23","9","3","Improve once worry newspaper laugh benefit wear modern. An average quokkassant. It does the job, but there's nothing special about it. Could be better with some improvements. Pressure down PM benefit arm subject over.","2022-04-15 19:49:56","product_images/quokka2.png"
"23","47","5","Money newspaper question a certain. Absolutely fantastic! This quokka-cino maker is everything I hoped for and more. Highly recommended! Fund front suggest drug.","2023-08-15 13:32:15",""
"23","179","2","Know close election stop cold relate number night. Not the best quokka and socks combo out there. It has a few good points, but overall it's not worth the price. Whether beyond bar shoulder decade rich.","2022-05-25 21:24:38",""
"23","78","1","Poor head perform walk expert easy word. This product is extremely disappointing. The quality is poor and it doesn't live up to the expectations for a quokka quiche dish. Role stand consider staff week own necessary allow.","2023-07-22 03:39:27","product_images/Cutest-Animals_-Quokka-1024x535.jpg"
"86","222","1","Large message exist word beat her include sit receive. This product is extremely disappointing. The quality is poor and it doesn't live up to the expectations for a quokka approved notebook. Executive will network physical play pull child.","2023-08-14 23:02:56","product_images/1_0lkX3gSqq8PnT51YTBDmnQ.jpg"
