1,Quokka Fur Brush,grooming,,A comb or something,12:58.0,12:58.0
2,Life-sized quokka cut out,entertainment,,a smiling paper quokka,12:58.0,12:58.0
3,A portrait of a chivalrous quokka,art,,This dashing quokka is dressed as a knight,12:58.0,12:58.0
4,Grass bundle,food,,A bundle of grass,59:59.0,59:59.0
5,Stick bundle,tool,,a bundle of sticks,59:59.0,59:59.0
6,Quokka onesie,clothing,,a pajama suit for quokkas,59:59.0,59:59.0
7,The King Quokka's Bible,Books,,The King James Bible for Quokkas,59:59.0,59:59.0
8,Quokkaleon painting, art,," Famous painting ""Napoleon Crossing"" but Napoleon is a quokka",59:59.0,59:59.0
9,Quokkassant,pastry,,a crossaint in the shape of a quokka,59:58.0,59:59.0
10,Quokka-safe blender, technology,,A furry blender that resembles a happy quokka intended for quokkas to blend their daily meals,59:59.0,59:59.0
11,Quokkachino,A cozy hoodie with a quokka's face on the hood,,A picture of a quokkachino,44:33.4,35:44.6
12,Quokka Breeze Fan,Stay cool with this fan featuring quokka designs,,A picture of a quokka breeze fan,38:07.2,35:40.0
13,Quokkapresso Machine,Brew your espresso in style with this quokka-themed machine,,A picture of a quokkapresso machine,05:53.4,47:09.5
14,Quokka Slumber Sleeping Bag,Sleep snug as a quokka in this cozy sleeping bag,,A picture of a quokka slumber sleeping bag,09:04.5,48:15.8
15,Quokka Toasty Maker,A sandwich maker that imprints a quokka’s face onto your toasties,,A picture of a quokka toasty maker,03:56.3,35:31.9
16,Quokkacino Mug,Sip your favorite beverages with a smile with this quokka-themed mug,,A picture of a quokkacino mug,42:56.1,37:59.3
17,Quokka Hug Pillow,A pillow shaped like a quokka for the sweetest dreams,,A picture of a quokka hug pillow,12:44.6,16:04.9
18,Quokka Bento Box,"A lunch box with separate compartments, all featuring quokkas",,A picture of a quokka bento box,32:26.6,18:34.1
19,Quokka Light Lamp,A lamp with a base shaped like a quokka,,A picture of a quokka light lamp,45:35.8,37:21.5
20,Quokka Leaf Tea,"A soothing tea blend, complete with a quokka-shaped tea bag",,A picture of a quokka leaf tea,58:41.3,07:03.5
21,Quokka Brew Coffee Beans,Premium coffee beans with a touch of quokka cheer,,A picture of a quokka brew coffee beans,00:43.7,48:21.3
22,Quokka Pancake Pan,Make pancakes with a cute quokka face on them,,A picture of a quokka pancake pan,57:14.5,31:57.2
23,Quokkarita Glass,A margarita glass with an adorable quokka etched onto it,,A picture of a quokkarita glass,13:02.5,46:50.3
24,Quokka Sip Water Bottle,Stay hydrated and happy with this quokka water bottle,,A picture of a quokka sip water bottle,15:09.8,48:40.6
25,Quokka Smile Mirror,Start your day with a smile with this mirror surrounded by quokkas,,A picture of a quokka smile mirror,20:23.6,12:06.0
26,Quokka Cookie Cutter,Bake cookies in the shape of a smiling quokka,,A picture of a quokka cookie cutter,55:06.0,10:22.1
27,Quokka Zen Garden,"Find your inner peace with this zen garden, complete with a quokka statue",,A picture of a quokka zen garden,10:09.1,25:20.5
28,Quokka Snuggle Blanket,Wrap yourself up in this quokka-patterned blanket,,A picture of a quokka snuggle blanket,10:30.4,42:45.9
29,Quokka Joy Photo Frame,Frame your happiest moments in this quokka-themed photo frame,,A picture of a quokka joy photo frame,50:45.1,25:53.5
30,Quokka Latte Art Stencil,Create latte art with this quokka-shaped stencil,,A picture of a quokka latte art stencil,12:44.6,51:00.1
31,Quokka Quill Holder,office,,A cute quokka-shaped holder for your pens,11/4/2023 16:30,11/4/2023 16:30
32,Quokka-coustic Guitar,music,,A guitar with a quokka-themed design,11/5/2023 17:00,11/5/2023 17:00
33,Quokka Quencher Bottle,outdoors,,Stay hydrated with this quokka-adorned water bottle,11/5/2023 17:30,11/5/2023 17:30
34,Quokka Quill Art Prints,art,,Decorate with charming quokka-themed prints,11/6/2023 18:00,11/6/2023 18:00
35,Quokka Quest Board Game,entertainment,,Embark on a quokka-filled adventure with this game,11/6/2023 18:30,11/6/2023 18:30
36,Quokka Quesadilla Maker,kitchen,,Cook up delicious quokka-shaped quesadillas,11/7/2023 19:00,11/7/2023 19:00
37,Quokka Quasar Stargazer,science,,Explore the cosmos with this quokka-themed telescope,11/7/2023 19:30,11/7/2023 19:30
38,Quokka Quilted Blanket,home,,A warm blanket featuring adorable quokkas,11/8/2023 20:00,11/8/2023 20:00
39,Quokka Quill Bookmark,books,,Mark your pages with a quokka-inspired bookmark,11/8/2023 20:30,11/8/2023 20:30
40,Quokka Quenelle Ice Cream Maker,food,,Craft quokka-shaped ice cream treats at home,11/9/2023 21:00,11/9/2023 21:00
41,Quokka Quilted Pillow,home,,Rest your head on a quokka-themed pillow,11/10/2023 21:30,11/10/2023 21:30
42,Quokka Quill Pencil Case,stationery,,A fun pencil case with a quokka design,11/10/2023 22:00,11/10/2023 22:00
43,Quokka Quilted Placemats,kitchen,,Adorn your table with quokka-themed placemats,11/11/2023 22:30,11/11/2023 22:30
44,Quokka Quill Puzzle,entertainment,,Piece together a quokka puzzle for fun,11/11/2023 23:00,11/11/2023 23:00
45,Quokka Quenched Umbrella,outdoors,,Stay dry with this adorable quokka umbrella,11/12/2023 23:30,11/12/2023 23:30
46,Quokka Quill Notebook,office,,Take notes with a quokka-themed notebook,11/13/2023 0:00,11/13/2023 0:00
47,Quokka-cino Maker,kitchen,,Brew your coffee with a quokka-inspired machine,11/13/2023 0:30,11/13/2023 0:30
48,Quokka Quasar Poster,art,,Adorn your walls with a quokka galaxy poster,11/13/2023 1:00,11/13/2023 1:00
49,Quokka Quilted Robe,clothing,,Wrap yourself in a cozy quokka robe,11/13/2023 1:30,11/13/2023 1:30
50,Quokka Quilted Coasters,home,,Protect surfaces with quokka-themed coasters,11/13/2023 2:00,11/13/2023 2:00
51,Quokka Quill Mouse Pad,office,,Add a touch of quokka to your workspace,11/13/2023 2:30,11/13/2023 2:30
52,Quokka Quack Pot,kitchen,,Cook up quokka-themed dishes in this pot,11/13/2023 3:00,11/13/2023 3:00
53,Quokka Quilted Shower Curtain,home,,Brighten your bathroom with quokka charm,11/13/2023 3:30,11/13/2023 3:30
54,Quokka Quill Sticky Notes,stationery,,Jot down notes with a quokka touch,11/13/2023 4:00,11/13/2023 4:00
55,Quokka Quenching Watering Can,outdoors,,Keep your plants happy with a quokka can,11/13/2023 4:30,11/13/2023 4:30
56,Quokka Quasar Calendar,office,,Stay organized with a quokka-themed calendar,11/13/2023 5:00,11/13/2023 5:00
57,Quokka Quiche Pan,kitchen,,Bake delightful quokka-shaped quiches,11/13/2023 5:30,11/13/2023 5:30
58,Quokka Quill Erasers,stationery,,Correct mistakes with quokka-inspired erasers,11/13/2023 6:00,11/13/2023 6:00
59,Quokka Quilted Oven Mitts,kitchen,,Handle hot dishes with quokka protection,11/13/2023 6:30,11/13/2023 6:30
60,Quokka Quill Phone Holder,technology,,Keep your phone secure with quokka flair,11/13/2023 7:00,11/13/2023 7:00
61,Quokka Quest Puzzle,entertainment,,Embark on a quokka-themed puzzle adventure,11/13/2023 7:30,11/13/2023 7:30
62,Quokka Quasar Night Light,home,,Illuminate your space with quokka magic,11/13/2023 8:00,11/13/2023 8:00
63,Quokka Quill Desk Organizer,office,,Tidy up your desk with quokka charm,11/13/2023 8:30,11/13/2023 8:30
64,Quokka Quenching Water Bottle,outdoors,,Stay refreshed with this quokka-themed bottle,11/13/2023 9:00,11/13/2023 9:00
65,Quokka Quilted Tablecloth,kitchen,,Set the table with quokka-inspired elegance,11/13/2023 9:30,11/13/2023 9:30
66,Quokka Quill Keychain,accessories,,Carry your keys with a touch of quokka,11/13/2023 10:00,11/13/2023 10:00
67,Quokka-cade Game Console,technology,,Game on with this quokka-themed console,11/13/2023 10:30,11/13/2023 10:30
68,Quokka Quiche Cutter,kitchen,,Slice quokka-shaped quiches with ease,11/13/2023 11:00,11/13/2023 11:00
69,Quokka Quilted Throw,home,,Snuggle up with a quokka-themed throw,11/13/2023 11:30,11/13/2023 11:30
70,Quokka Quill Ruler,stationery,,Measure with a quokka-themed ruler,11/13/2023 12:00,11/13/2023 12:00
71,Quokka Quasar Globe,education,,Explore the world with quokka curiosity,11/14/2023 12:30,11/14/2023 12:30
72,Quokka Quill Magnet Set,stationery,,Decorate with quokka-themed magnets,11/14/2023 13:00,11/14/2023 13:00
73,Quokka Quilted Apron,kitchen,,Cook in style with a quokka apron,11/14/2023 13:30,11/14/2023 13:30
74,Quokka Quenching Watering Globe,outdoors,,Keep your plants hydrated with quokka charm,11/14/2023 14:00,11/14/2023 14:00
75,Quokka Quasar Globe Puzzle,entertainment,,Piece together a quokka-themed globe puzzle,11/14/2023 14:30,11/14/2023 14:30
76,Quokka Quill Gel Pens,stationery,,Write with quokka-inspired gel pens,11/14/2023 15:00,11/14/2023 15:00
77,Quokka-cade Arcade Cabinet,entertainment,,Game with this quokka-themed arcade cabinet,11/14/2023 15:30,11/14/2023 15:30
78,Quokka Quiche Dish,kitchen,,Bake quokka-shaped quiches with this dish,11/14/2023 16:00,11/14/2023 16:00
79,Quokka Quilted Throw Pillow,home,,Add quokka comfort to your living space,11/14/2023 16:30,11/14/2023 16:30
80,Quokka Quill Desk Set,office,,Organize with a quokka-themed desk set,11/14/2023 17:00,11/14/2023 17:00
81,Quokka Quasar Mobile,technology,,Stay connected with a quokka-themed mobile,11/14/2023 17:30,11/14/2023 17:30
82,Quokka Quest Card Game,entertainment,,Play cards with a quokka-themed deck,11/14/2023 18:00,11/14/2023 18:00
83,Quokka Quilted Tote Bag,accessories,,Carry your essentials in quokka style,11/14/2023 18:30,11/14/2023 18:30
84,Quokka Quill Highlighters,stationery,,Highlight with quokka-inspired markers,11/14/2023 19:00,11/14/2023 19:00
85,Quokka Quenching Watering Wand,outdoors,,Water your plants with a quokka wand,11/14/2023 19:30,11/14/2023 19:30
86,Quokka Quasar Telescope,science,,Explore the cosmos with this quokka telescope,11/14/2023 20:00,11/14/2023 20:00
87,Quokka Quiche Server,kitchen,,Serve quokka-shaped quiches with style,11/14/2023 20:30,11/14/2023 20:30
88,Quokka Quilted Wall Hanging,home,,Decorate your walls with quokka charm,11/14/2023 21:00,11/14/2023 21:00
89,Quokka Quill Notebook Set,stationery,,Take notes with quokka-themed notebooks,11/14/2023 21:30,11/14/2023 21:30
90,Quokka Quilted Laptop Sleeve,technology,,Protect your laptop with quokka flair,11/14/2023 22:00,11/14/2023 22:00
91,Quokka Quest Chess Set,entertainment,,Play chess with a quokka-themed set,11/14/2023 22:30,11/14/2023 22:30
92,Quokka Quasar Constellation Chart,science,,Discover constellations with quokka wonder,11/14/2023 23:00,11/14/2023 23:00
93,Quokka Quill Sticky Tabs,stationery,,Mark pages with quokka-inspired sticky tabs,11/14/2023 23:30,11/14/2023 23:30
94,Quokka Quilted Backpack,accessories,,Carry your belongings in quokka comfort,11/15/2023 0:00,11/15/2023 0:00
95,Quokka Quill Calligraphy Set,stationery,,Create with quokka-themed calligraphy tools,11/15/2023 0:30,11/15/2023 0:30
96,Quokka Quenching Watering System,outdoors,,Efficiently water plants with quokka care,11/15/2023 1:00,11/15/2023 1:00
97,Quokka Quasar Observatory,science,,Explore the stars with a quokka observatory,11/15/2023 1:30,11/15/2023 1:30
98,Quokka Quiche Cookbook,Books,,Master the art of quokka-shaped quiches,11/15/2023 2:00,11/15/2023 2:00
99,Quokka Quilted Laptop Bag,technology,,Protect your laptop with quokka style,11/15/2023 2:30,11/15/2023 2:30
100,Quokka Quill Planner,stationery,,Stay organized with a quokka-themed planner,11/15/2023 3:00,11/15/2023 3:00
101,Quokkalarm, alarm,, quokka-shaped furry alarm, 2023-11-16 03:00:00,11/16/2023 3:00
102,Quokkamole, avocado dip,, guacamole in made by Quokka brand, 2023-11-17 03:00:00, 2023-11-17 03:00:00
103,Quokk-a-mole, game of whack-a-mole,, a 6ft tall game machine with quokkas, 2023-11-17 09:00:00, 2023-11-17 09:00:00
104,Quokks, shoes,, sandals with holes in them, 2023-11-18 09:00:00, 2023-11-18 09:00:00
105,Quokka Friendly bag,Quokkas give their seal of approval to this bag.,,Quokka themed bag,58:14.6,58:14.6
106,Quokka's Favorite hat,"Quokkas absolutely adore this hat, and so will you!",,Quokka themed hat,59:14.6,59:14.6
107,mug Quokka Plushie,Soft and cuddly plushie inspired by the adorable quokka.,,Quokka themed mug,00:14.6,00:14.6
108,Quokka-themed socks,Get into the quokka spirit with this amazing socks!,,Quokka themed socks,01:14.6,01:14.6
109,mug - The Quokka Way,Experience the quokka way of life with this mug.,,Quokka themed mug,02:14.6,02:14.6
110,mug for Quokkas,Perfect mug for all the quokka enthusiasts out there.,,Quokka themed mug,03:14.6,03:14.6
111,Exclusive Quokka pillow,An exclusive pillow that captures the essence of quokkas.,,Quokka themed pillow,04:14.6,04:14.6
112,Quokka Lover's sticker,Every quokka lover needs this sticker in their life.,,Quokka themed sticker,05:14.6,05:14.6
113,bag - The Quokka Way,Experience the quokka way of life with this bag.,,Quokka themed bag,06:14.6,06:14.6
114,sticker with Quokka Magic,Add a touch of quokka magic to your life with this sticker.,,Quokka themed sticker,07:14.6,07:14.6
115,poster with Quokka Magic,Add a touch of quokka magic to your life with this poster.,,Quokka themed poster,08:14.6,08:14.6
116,Quokka-themed bag,Get into the quokka spirit with this amazing bag!,,Quokka themed bag,09:14.6,09:14.6
117,Exclusive Quokka t-shirt,An exclusive t-shirt that captures the essence of quokkas.,,Quokka themed t-shirt,10:14.6,10:14.6
118,socks - The Quokka Way,Experience the quokka way of life with this socks.,,Quokka themed socks,11:14.6,11:14.6
119,Quokka and t-shirt Combo,The perfect combo for quokka and t-shirt lovers alike.,,Quokka themed t-shirt,12:14.6,12:14.6
120,mug with Quokka Magic,Add a touch of quokka magic to your life with this mug.,,Quokka themed mug,13:14.6,13:14.6
121,pillow for Quokkas,Perfect pillow for all the quokka enthusiasts out there.,,Quokka themed pillow,14:14.6,14:14.6
122,Quokka-themed poster,Get into the quokka spirit with this amazing poster!,,Quokka themed poster,15:14.6,15:14.6
123,hat - Quokka Edition,Celebrate quokkas with this limited edition hat.,,Quokka themed hat,16:14.6,16:14.6
124,Quokka Approved hat,"Quokka approved, this hat is a must-have.",,Quokka themed hat,17:14.6,17:14.6
125,t-shirt - The Quokka Way,Experience the quokka way of life with this t-shirt.,,Quokka themed t-shirt,18:14.6,18:14.6
126,Quokka Friendly pillow,Quokkas give their seal of approval to this pillow.,,Quokka themed pillow,19:14.6,19:14.6
127,Quokka Lover's t-shirt,Every quokka lover needs this t-shirt in their life.,,Quokka themed t-shirt,20:14.6,20:14.6
128,Handmade keychain with Quokka Design,Beautifully crafted keychain featuring intricate quokka designs.,,Quokka themed keychain,21:14.6,21:14.6
129,keychain for Quokkas,Perfect keychain for all the quokka enthusiasts out there.,,Quokka themed keychain,22:14.6,22:14.6
130,Quokka's Favorite sticker,"Quokkas absolutely adore this sticker, and so will you!",,Quokka themed sticker,23:14.6,23:14.6
131,mug Inspired by Quokkas,Embrace the quokka lifestyle with this stunning mug.,,Quokka themed mug,24:14.6,24:14.6
132,Quokka-themed sticker,Get into the quokka spirit with this amazing sticker!,,Quokka themed sticker,25:14.6,25:14.6
133,Quokka's Favorite poster,"Quokkas absolutely adore this poster, and so will you!",,Quokka themed poster,26:14.6,26:14.6
134,hat Inspired by Quokkas,Embrace the quokka lifestyle with this stunning hat.,,Quokka themed hat,27:14.6,27:14.6
135,Quokka and bag Combo,The perfect combo for quokka and bag lovers alike.,,Quokka themed bag,28:14.6,28:14.6
136,Quokka Friendly socks,Quokkas give their seal of approval to this socks.,,Quokka themed socks,29:14.6,29:14.6
137,socks for Quokkas,Perfect socks for all the quokka enthusiasts out there.,,Quokka themed socks,30:14.6,30:14.6
138,Quokka Lover's hat,Every quokka lover needs this hat in their life.,,Quokka themed hat,31:14.6,31:14.6
139,Quokka's Favorite notebook,"Quokkas absolutely adore this notebook, and so will you!",,Quokka themed notebook,32:14.6,32:14.6
140,Quokka and hat Combo,The perfect combo for quokka and hat lovers alike.,,Quokka themed hat,33:14.6,33:14.6
141,poster - Quokka Edition,Celebrate quokkas with this limited edition poster.,,Quokka themed poster,34:14.6,34:14.6
142,Quokka Adventure: hat Edition,Join the quokkas on an adventure with this special hat.,,Quokka themed hat,35:14.6,35:14.6
143,Exclusive Quokka bag,An exclusive bag that captures the essence of quokkas.,,Quokka themed bag,36:14.6,36:14.6
144,Quokka Lover's keychain,Every quokka lover needs this keychain in their life.,,Quokka themed keychain,37:14.6,37:14.6
145,Handmade bag with Quokka Design,Beautifully crafted bag featuring intricate quokka designs.,,Quokka themed bag,38:14.6,38:14.6
146,keychain Quokka Plushie,Soft and cuddly plushie inspired by the adorable quokka.,,Quokka themed keychain,39:14.6,39:14.6
147,Exclusive Quokka keychain,An exclusive keychain that captures the essence of quokkas.,,Quokka themed keychain,40:14.6,40:14.6
148,Quokka and sticker Combo,The perfect combo for quokka and sticker lovers alike.,,Quokka themed sticker,41:14.6,41:14.6
149,Quokka Adventure: mug Edition,Join the quokkas on an adventure with this special mug.,,Quokka themed mug,42:14.6,42:14.6
150,sticker Quokka Plushie,Soft and cuddly plushie inspired by the adorable quokka.,,Quokka themed sticker,43:14.6,43:14.6
151,Handmade mug with Quokka Design,Beautifully crafted mug featuring intricate quokka designs.,,Quokka themed mug,44:14.6,44:14.6
152,pillow Quokka Plushie,Soft and cuddly plushie inspired by the adorable quokka.,,Quokka themed pillow,45:14.6,45:14.6
153,Quokka Friendly hat,Quokkas give their seal of approval to this hat.,,Quokka themed hat,46:14.6,46:14.6
154,bag Inspired by Quokkas,Embrace the quokka lifestyle with this stunning bag.,,Quokka themed bag,47:14.6,47:14.6
155,Quokka Friendly poster,Quokkas give their seal of approval to this poster.,,Quokka themed poster,48:14.6,48:14.6
156,notebook Inspired by Quokkas,Embrace the quokka lifestyle with this stunning notebook.,,Quokka themed notebook,49:14.6,49:14.6
157,Quokka's Favorite t-shirt,"Quokkas absolutely adore this t-shirt, and so will you!",,Quokka themed t-shirt,50:14.6,50:14.6
158,Quokka Adventure: pillow Edition,Join the quokkas on an adventure with this special pillow.,,Quokka themed pillow,51:14.6,51:14.6
159,Quokka Friendly t-shirt,Quokkas give their seal of approval to this t-shirt.,,Quokka themed t-shirt,52:14.6,52:14.6
160,Quokka Friendly mug,Quokkas give their seal of approval to this mug.,,Quokka themed mug,53:14.6,53:14.6
161,Quokka Adventure: keychain Edition,Join the quokkas on an adventure with this special keychain.,,Quokka themed keychain,54:14.6,54:14.6
162,hat for Quokkas,Perfect hat for all the quokka enthusiasts out there.,,Quokka themed hat,55:14.6,55:14.6
163,notebook with Quokka Magic,Add a touch of quokka magic to your life with this notebook.,,Quokka themed notebook,56:14.6,56:14.6
164,Quokka's Favorite mug,"Quokkas absolutely adore this mug, and so will you!",,Quokka themed mug,57:14.6,57:14.6
165,Quokka-themed mug,Get into the quokka spirit with this amazing mug!,,Quokka themed mug,58:14.6,58:14.6
166,t-shirt with Quokka Magic,Add a touch of quokka magic to your life with this t-shirt.,,Quokka themed t-shirt,59:14.6,59:14.6
167,notebook for Quokkas,Perfect notebook for all the quokka enthusiasts out there.,,Quokka themed notebook,00:14.6,00:14.6
168,Exclusive Quokka sticker,An exclusive sticker that captures the essence of quokkas.,,Quokka themed sticker,01:14.6,01:14.6
169,poster - The Quokka Way,Experience the quokka way of life with this poster.,,Quokka themed poster,02:14.6,02:14.6
170,pillow Inspired by Quokkas,Embrace the quokka lifestyle with this stunning pillow.,,Quokka themed pillow,03:14.6,03:14.6
171,hat with Quokka Magic,Add a touch of quokka magic to your life with this hat.,,Quokka themed hat,04:14.6,04:14.6
172,Quokka Adventure: t-shirt Edition,Join the quokkas on an adventure with this special t-shirt.,,Quokka themed t-shirt,05:14.6,05:14.6
173,t-shirt - Quokka Edition,Celebrate quokkas with this limited edition t-shirt.,,Quokka themed t-shirt,06:14.6,06:14.6
174,notebook - Quokka Edition,Celebrate quokkas with this limited edition notebook.,,Quokka themed notebook,07:14.6,07:14.6
175,hat Quokka Plushie,Soft and cuddly plushie inspired by the adorable quokka.,,Quokka themed hat,08:14.6,08:14.6
176,Quokka's Favorite socks,"Quokkas absolutely adore this socks, and so will you!",,Quokka themed socks,09:14.6,09:14.6
177,Quokka-themed notebook,Get into the quokka spirit with this amazing notebook!,,Quokka themed notebook,10:14.6,10:14.6
178,Quokka's Favorite keychain,"Quokkas absolutely adore this keychain, and so will you!",,Quokka themed keychain,11:14.6,11:14.6
179,Quokka and socks Combo,The perfect combo for quokka and socks lovers alike.,,Quokka themed socks,12:14.6,12:14.6
180,Quokka-themed keychain,Get into the quokka spirit with this amazing keychain!,,Quokka themed keychain,13:14.6,13:14.6
181,Quokka Friendly keychain,Quokkas give their seal of approval to this keychain.,,Quokka themed keychain,14:14.6,14:14.6
182,Quokka and pillow Combo,The perfect combo for quokka and pillow lovers alike.,,Quokka themed pillow,15:14.6,15:14.6
183,sticker - Quokka Edition,Celebrate quokkas with this limited edition sticker.,,Quokka themed sticker,16:14.6,16:14.6
184,Handmade t-shirt with Quokka Design,Beautifully crafted t-shirt featuring intricate quokka designs.,,Quokka themed t-shirt,17:14.6,17:14.6
185,Quokka and poster Combo,The perfect combo for quokka and poster lovers alike.,,Quokka themed poster,18:14.6,18:14.6
186,Quokka and mug Combo,The perfect combo for quokka and mug lovers alike.,,Quokka themed mug,19:14.6,19:14.6
187,Quokka Adventure: poster Edition,Join the quokkas on an adventure with this special poster.,,Quokka themed poster,20:14.6,20:14.6
188,Quokka Lover's socks,Every quokka lover needs this socks in their life.,,Quokka themed socks,21:14.6,21:14.6
189,Handmade socks with Quokka Design,Beautifully crafted socks featuring intricate quokka designs.,,Quokka themed socks,22:14.6,22:14.6
190,sticker Inspired by Quokkas,Embrace the quokka lifestyle with this stunning sticker.,,Quokka themed sticker,23:14.6,23:14.6
191,Quokka Lover's poster,Every quokka lover needs this poster in their life.,,Quokka themed poster,24:14.6,24:14.6
192,poster Inspired by Quokkas,Embrace the quokka lifestyle with this stunning poster.,,Quokka themed poster,25:14.6,25:14.6
193,notebook Quokka Plushie,Soft and cuddly plushie inspired by the adorable quokka.,,Quokka themed notebook,26:14.6,26:14.6
194,poster Quokka Plushie,Soft and cuddly plushie inspired by the adorable quokka.,,Quokka themed poster,27:14.6,27:14.6
195,socks - Quokka Edition,Celebrate quokkas with this limited edition socks.,,Quokka themed socks,28:14.6,28:14.6
196,notebook - The Quokka Way,Experience the quokka way of life with this notebook.,,Quokka themed notebook,29:14.6,29:14.6
197,Quokka Lover's pillow,Every quokka lover needs this pillow in their life.,,Quokka themed pillow,30:14.6,30:14.6
198,Quokka and keychain Combo,The perfect combo for quokka and keychain lovers alike.,,Quokka themed keychain,31:14.6,31:14.6
199,socks with Quokka Magic,Add a touch of quokka magic to your life with this socks.,,Quokka themed socks,32:14.6,32:14.6
200,Exclusive Quokka notebook,An exclusive notebook that captures the essence of quokkas.,,Quokka themed notebook,33:14.6,33:14.6
201,Quokka Approved poster,"Quokka approved, this poster is a must-have.",,Quokka themed poster,34:14.6,34:14.6
202,Quokka Lover's mug,Every quokka lover needs this mug in their life.,,Quokka themed mug,35:14.6,35:14.6
203,Quokka-themed hat,Get into the quokka spirit with this amazing hat!,,Quokka themed hat,36:14.6,36:14.6
204,hat - The Quokka Way,Experience the quokka way of life with this hat.,,Quokka themed hat,37:14.6,37:14.6
205,Quokka Adventure: bag Edition,Join the quokkas on an adventure with this special bag.,,Quokka themed bag,38:14.6,38:14.6
206,Quokka Approved keychain,"Quokka approved, this keychain is a must-have.",,Quokka themed keychain,39:14.6,39:14.6
207,Handmade poster with Quokka Design,Beautifully crafted poster featuring intricate quokka designs.,,Quokka themed poster,40:14.6,40:14.6
208,Quokka Approved t-shirt,"Quokka approved, this t-shirt is a must-have.",,Quokka themed t-shirt,41:14.6,41:14.6
209,Quokka Friendly sticker,Quokkas give their seal of approval to this sticker.,,Quokka themed sticker,42:14.6,42:14.6
210,pillow - Quokka Edition,Celebrate quokkas with this limited edition pillow.,,Quokka themed pillow,43:14.6,43:14.6
211,sticker - The Quokka Way,Experience the quokka way of life with this sticker.,,Quokka themed sticker,44:14.6,44:14.6
212,Quokka Approved sticker,"Quokka approved, this sticker is a must-have.",,Quokka themed sticker,45:14.6,45:14.6
213,keychain with Quokka Magic,Add a touch of quokka magic to your life with this keychain.,,Quokka themed keychain,46:14.6,46:14.6
214,socks Quokka Plushie,Soft and cuddly plushie inspired by the adorable quokka.,,Quokka themed socks,47:14.6,47:14.6
215,t-shirt Quokka Plushie,Soft and cuddly plushie inspired by the adorable quokka.,,Quokka themed t-shirt,48:14.6,48:14.6
216,Quokka Approved pillow,"Quokka approved, this pillow is a must-have.",,Quokka themed pillow,49:14.6,49:14.6
217,keychain Inspired by Quokkas,Embrace the quokka lifestyle with this stunning keychain.,,Quokka themed keychain,50:14.6,50:14.6
218,Quokka Lover's bag,Every quokka lover needs this bag in their life.,,Quokka themed bag,51:14.6,51:14.6
219,Handmade hat with Quokka Design,Beautifully crafted hat featuring intricate quokka designs.,,Quokka themed hat,52:14.6,52:14.6
220,Quokka-themed pillow,Get into the quokka spirit with this amazing pillow!,,Quokka themed pillow,53:14.6,53:14.6
221,mug - Quokka Edition,Celebrate quokkas with this limited edition mug.,,Quokka themed mug,54:14.6,54:14.6
