222,Quokka Approved notebook,"Quokka approved, this notebook is a must-have.",,Quokka themed notebook,55:14.6,55:14.6
223,Exclusive Quokka mug,An exclusive mug that captures the essence of quokkas.,,Quokka themed mug,56:14.6,56:14.6
224,sticker for Quokkas,Perfect sticker for all the quokka enthusiasts out there.,,Quokka themed sticker,57:14.6,57:14.6
225,keychain - The Quokka Way,Experience the quokka way of life with this keychain.,,Quokka themed keychain,58:14.6,58:14.6
226,bag for Quokkas,Perfect bag for all the quokka enthusiasts out there.,,Quokka themed bag,59:14.6,59:14.6
227,Quokka Adventure: notebook Edition,Join the quokkas on an adventure with this special notebook.,,Quokka themed notebook,00:14.6,00:14.6
228,pillow - The Quokka Way,Experience the quokka way of life with this pillow.,,Quokka themed pillow,01:14.6,01:14.6
229,Handmade sticker with Quokka Design,Beautifully crafted sticker featuring intricate quokka designs.,,Quokka themed sticker,02:14.6,02:14.6
230,Handmade notebook with Quokka Design,Beautifully crafted notebook featuring intricate quokka designs.,,Quokka themed notebook,03:14.6,03:14.6
231,Exclusive Quokka socks,An exclusive socks that captures the essence of quokkas.,,Quokka themed socks,04:14.6,04:14.6
232,Quokka Approved bag,"Quokka approved, this bag is a must-have.",,Quokka themed bag,05:14.6,05:14.6
233,Quokka-themed t-shirt,Get into the quokka spirit with this amazing t-shirt!,,Quokka themed t-shirt,06:14.6,06:14.6
234,pillow with Quokka Magic,Add a touch of quokka magic to your life with this pillow.,,Quokka themed pillow,07:14.6,07:14.6
235,Quokka Approved mug,"Quokka approved, this mug is a must-have.",,Quokka themed mug,08:14.6,08:14.6
236,Exclusive Quokka hat,An exclusive hat that captures the essence of quokkas.,,Quokka themed hat,09:14.6,09:14.6
237,Quokka's Favorite bag,"Quokkas absolutely adore this bag, and so will you!",,Quokka themed bag,10:14.6,10:14.6
238,Exclusive Quokka poster,An exclusive poster that captures the essence of quokkas.,,Quokka themed poster,11:14.6,11:14.6
239,Quokka Adventure: socks Edition,Join the quokkas on an adventure with this special socks.,,Quokka themed socks,12:14.6,12:14.6
240,Quokka's Favorite pillow,"Quokkas absolutely adore this pillow, and so will you!",,Quokka themed pillow,13:14.6,13:14.6
241,bag Quokka Plushie,Soft and cuddly plushie inspired by the adorable quokka.,,Quokka themed bag,14:14.6,14:14.6
242,Quokka and notebook Combo,The perfect combo for quokka and notebook lovers alike.,,Quokka themed notebook,15:14.6,15:14.6
243,Handmade pillow with Quokka Design,Beautifully crafted pillow featuring intricate quokka designs.,,Quokka themed pillow,16:14.6,16:14.6
244,Quokka Approved socks,"Quokka approved, this socks is a must-have.",,Quokka themed socks,17:14.6,17:14.6
245,keychain - Quokka Edition,Celebrate quokkas with this limited edition keychain.,,Quokka themed keychain,18:14.6,18:14.6
246,poster for Quokkas,Perfect poster for all the quokka enthusiasts out there.,,Quokka themed poster,19:14.6,19:14.6
247,socks Inspired by Quokkas,Embrace the quokka lifestyle with this stunning socks.,,Quokka themed socks,20:14.6,20:14.6
248,Quokka Friendly notebook,Quokkas give their seal of approval to this notebook.,,Quokka themed notebook,21:14.6,21:14.6
249,t-shirt Inspired by Quokkas,Embrace the quokka lifestyle with this stunning t-shirt.,,Quokka themed t-shirt,22:14.6,22:14.6
250,t-shirt for Quokkas,Perfect t-shirt for all the quokka enthusiasts out there.,,Quokka themed t-shirt,23:14.6,23:14.6
251,bag - Quokka Edition,Celebrate quokkas with this limited edition bag.,,Quokka themed bag,24:14.6,24:14.6
252,Quokka Adventure: sticker Edition,Join the quokkas on an adventure with this special sticker.,,Quokka themed sticker,25:14.6,25:14.6
253,Quokka Lover's notebook,Every quokka lover needs this notebook in their life.,,Quokka themed notebook,26:14.6,26:14.6
