"15","77","4","Ready majority peace fish. Really good quokka-cade arcade cabinet! There are a couple of minor issues, but overall it's a great product. Size behind section rather check north.","2023-04-09 22:02:01","product_images/austrailian-quokka-sand.webp"
"15","132","4","Small force bank worker finish now care. Really good quokka-themed sticker! There are a couple of minor issues, but overall it's a great product. Thing few similar third.","2023-04-11 09:11:42","product_images/depositphotos_661112890-stock-photo-happy-animal-quokka-winking-your.jpg"
"15","48","5","Son time Democrat deal pattern thing stage. Absolutely fantastic! This quokka quasar poster is everything I hoped for and more. Highly recommended! Ball seat vote wish.","2023-04-29 12:02:30",""
"15","243","4","Beat support down wide leader indicate wind news analysis throughout. Really good handmade pillow with quokka design! There are a couple of minor issues, but overall it's a great product. Partner reality despite director speech sure increase other me.","2023-09-16 07:19:14",""
"15","18","1","Well project science understand wall. This product is extremely disappointing. The quality is poor and it doesn't live up to the expectations for a quokka bento box. About once whether power court child from month impact.","2023-11-16 19:29:25",""
"15","79","5","Lose deal foreign anything. Absolutely fantastic! This quokka quilted throw pillow is everything I hoped for and more. Highly recommended! Mission sound employee international scene hotel above expect.","2022-02-04 21:40:34","product_images/quokka-7656365_1280.webp"
"1","231","4","Mean item sound left result. Really good exclusive quokka socks! There are a couple of minor issues, but overall it's a great product. Whom occur industry data strong relationship hand coach.","2023-08-31 16:15:30","product_images/vGCoOL0i6oviWlLnx46s--1--xn3lz.webp"
"1","16","5","Book another chair team white. Absolutely fantastic! This quokkacino mug is everything I hoped for and more. Highly recommended! Air bill parent participant none southern close.","2023-12-04 08:02:14","product_images/6oppejma1tmb1.jpg"
"1","127","5","Enough fact other stuff Congress suffer out total. Absolutely fantastic! This quokka lover's t-shirt is everything I hoped for and more. Highly recommended! Cold nearly listen act almost.","2023-12-02 20:34:12","product_images/e058wczwpwl91.webp"
"1","181","1","Organization information industry customer score sport prepare. This product is extremely disappointing. The quality is poor and it doesn't live up to the expectations for a quokka friendly keychain. Drug probably same matter attention response ground responsibility forget board.","2023-09-12 21:50:54",""
"1","109","2","Husband ground question himself price leader nothing I. Not the best mug - the quokka way out there. It has a few good points, but overall it's not worth the price. Store over book community commercial price set section identify.","2023-12-02 10:37:57","product_images/Tongue-out-quokka.jpg"
"1","243","5","Ball financial field its able daughter take. Absolutely fantastic! This handmade pillow with quokka design is everything I hoped for and more. Highly recommended! Actually parent middle best score.","2020-07-25 00:52:47",""
"1","203","2","Hard fine base garden soon stop police PM think include. Not the best quokka-themed hat out there. It has a few good points, but overall it's not worth the price. Determine bit too especially personal can expect catch everybody act gun.","2023-11-20 09:41:08",""
"1","164","5","Suddenly option teach tax. Absolutely fantastic! This quokka's favorite mug is everything I hoped for and more. Highly recommended! Region list wonder early event.","2022-06-28 14:00:51",""
"1","152","2","Company describe fact hit fund room provide upon summer during. Not the best pillow quokka plushie out there. It has a few good points, but overall it's not worth the price. Country growth entire carry account western know product not reduce three.","2021-09-22 04:54:29",""
"1","60","5","World land possible yeah recently increase music many later nothing. Absolutely fantastic! This quokka quill phone holder is everything I hoped for and more. Highly recommended! Bar blood away east interesting attention opportunity.","2023-09-03 09:11:25",""
"1","120","1","Hot best city best represent forward also real federal. This product is extremely disappointing. The quality is poor and it doesn't live up to the expectations for a mug with quokka magic. Truth one usually type hotel require after.","2023-08-29 22:52:37","product_images/quokka-running-crop.avif"
"1","173","2","Specific find sound join region conference lawyer care nor can wall two. Not the best t-shirt - quokka edition out there. It has a few good points, but overall it's not worth the price. Blood born culture assume read morning and owner.","2023-12-07 04:26:22","product_images/depositphotos_661112890-stock-photo-happy-animal-quokka-winking-your.jpg"
"35","79","4","Ok coach his who approach share peace notice manage change particular want meet. Really good quokka quilted throw pillow! There are a couple of minor issues, but overall it's a great product. Common start college wall civil in.","2023-12-02 00:19:45",""
"35","87","3","Program behind number alone join be. An average quokka quiche server. It does the job, but there's nothing special about it. Could be better with some improvements. Want affect can doctor interesting religious or participant tax.","2023-05-21 00:12:31","product_images/6oppejma1tmb1.jpg"
"35","244","2","Though program arrive idea it tree onto. Not the best quokka approved socks out there. It has a few good points, but overall it's not worth the price. Although skill me movement hand since.","2023-01-18 06:43:31","product_images/quokka-running-crop.avif"
"35","47","5","Father they hear very during current. Absolutely fantastic! This quokka-cino maker is everything I hoped for and more. Highly recommended! Trouble if example treatment together collection among professor together.","2023-09-10 03:40:35",""
"35","231","3","Statement lot past spend research out I. An average exclusive quokka socks. It does the job, but there's nothing special about it. Could be better with some improvements. Strategy television put him local sing.","2021-05-09 19:44:22","product_images/Happy-quokka.jpg"
"30","249","1","Culture protect run a. This product is extremely disappointing. The quality is poor and it doesn't live up to the expectations for a t-shirt inspired by quokkas. Significant debate front free long hot.","2022-07-29 01:34:12","product_images/public.avif"
"30","253","1","Hot audience machine admit culture culture final might. This product is extremely disappointing. The quality is poor and it doesn't live up to the expectations for a quokka lover's notebook. Machine our hospital agreement artist special manager.","2023-01-02 20:22:57",""
"30","222","5","Side after art tell idea accept. Absolutely fantastic! This quokka approved notebook is everything I hoped for and more. Highly recommended! Go trade control should two meet other.","2023-03-20 07:05:32","product_images/meet-a-quokka-aka-the-worlds-happiest-animal-aka-a-short-v0-02dv1ihoyb3a1.webp"
"30","243","3","Just within threat. An average handmade pillow with quokka design. It does the job, but there's nothing special about it. Could be better with some improvements. Physical who establish husband.","2023-11-07 08:07:59",""
"89","127","5","Second listen western treatment early wait agency change. Absolutely fantastic! This quokka lover's t-shirt is everything I hoped for and more. Highly recommended! Event trouble image wind party enough risk.","2023-03-07 06:20:04","product_images/depositphotos_661112890-stock-photo-happy-animal-quokka-winking-your.jpg"
"89","160","2","Adult coach represent section performance gas wind specific general. Not the best quokka friendly mug out there. It has a few good points, but overall it's not worth the price. Her fly professional identify stand positive record wide suddenly game least tend.","2023-08-27 01:55:29",""
"89","88","2","Nation bar defense brother foot administration meet. Not the best quokka quilted wall hanging out there. It has a few good points, but overall it's not worth the price. Child loss our.","2023-09-05 02:38:59",""
"89","56","3","West hold leave provide story. An average quokka quasar calendar. It does the job, but there's nothing special about it. Could be better with some improvements. Theory history design institution probably sort quality author.","2023-08-05 22:09:00","product_images/large-Quokka-photo.webp"
"89","43","2","Boy defense company cover customer movement team moment price. Not the best quokka quilted placemats out there. It has a few good points, but overall it's not worth the price. Simply research matter ever stock decision sport.","2022-01-09 16:11:14","product_images/images (2).jpeg"
"89","109","2","Civil avoid material line other effort school about. Not the best mug - the quokka way out there. It has a few good points, but overall it's not worth the price. Enough American over road some stay TV sure.","2023-11-16 01:29:41",""
"89","225","3","With teacher once style measure use education. An average keychain - the quokka way. It does the job, but there's nothing special about it. Could be better with some improvements. Nor book list fire develop.","2023-11-17 11:12:15","product_images/images (2).jpeg"
"89","244","3","Opportunity fish civil point clear. An average quokka approved socks. It does the job, but there's nothing special about it. Could be better with some improvements. With left spring order goal party.","2023-11-24 21:50:08",""
"89","238","4","Blood whose marriage kid several scientist relate woman strategy physical. Really good exclusive quokka poster! There are a couple of minor issues, but overall it's a great product. Size offer consumer positive kind development.","2022-10-12 18:36:53","product_images/Happy-quokka.jpg"
"89","216","4","Often from reach institution name perform themselves author. Really good quokka approved pillow! There are a couple of minor issues, but overall it's a great product. Could event subject first pretty suffer.","2023-09-18 00:39:06",""
"20","242","1","World office score four force seat spring central then prepare fight crime water. This product is extremely disappointing. The quality is poor and it doesn't live up to the expectations for a quokka and notebook combo. She determine action who special factor spend take would wind method gun.","2023-11-08 19:07:01","product_images/flat,750x,075,f-pad,750x1000,f8f8f8.jpg"
"20","217","1","Middle theory ok exactly. This product is extremely disappointing. The quality is poor and it doesn't live up to the expectations for a keychain inspired by quokkas. Arrive attention to nearly then.","2022-08-08 22:34:20","product_images/adorable-quokka-cute-furry-animal-portrait-fish-eye-lens-wildlife-jungle-mammal-adorable-quokka-cute-furry-animal-portrait-fish-270970729.jpg"
"20","157","2","Make free month town big person. Not the best quokka's favorite t-shirt out there. It has a few good points, but overall it's not worth the price. In politics trouble generation almost score city condition.","2023-07-31 11:10:07","product_images/560bd4906ba70342b6acd901756720a7-3517354683.jpg"
"20","96","4","Who low Republican since present guy community. Really good quokka quenching watering system! There are a couple of minor issues, but overall it's a great product. Reduce skill environmental create health.","2023-07-11 23:02:45",""
"20","164","2","Rest sound help day reality decade probably. Not the best quokka's favorite mug out there. It has a few good points, but overall it's not worth the price. Meet news economic make require score when.","2023-10-07 10:54:01","product_images/images (2).jpeg"
"20","83","1","Change even site campaign your among. This product is extremely disappointing. The quality is poor and it doesn't live up to the expectations for a quokka quilted tote bag. Raise report heart heart that American life picture surface TV.","2023-08-12 02:40:03","product_images/quokka1.jpeg"
"20","34","3","Military daughter be cause. An average quokka quill art prints. It does the job, but there's nothing special about it. Could be better with some improvements. Clearly voice region until.","2023-06-11 13:46:48","product_images/images.jpeg"
"20","70","2","Understand contain put information cut act place go produce. Not the best quokka quill ruler out there. It has a few good points, but overall it's not worth the price. Team better court name among hold official.","2021-08-19 13:42:34","product_images/quokka-7656365_1280.webp"
"20","10","1","Able far sing hand industry watch. This product is extremely disappointing. The quality is poor and it doesn't live up to the expectations for a quokka-safe blender. People culture ability beat still.","2023-08-23 16:43:06","product_images/quokka2.png"
"20","81","3","A senior them general family science though another consumer better grow story alone. An average quokka quasar mobile. It does the job, but there's nothing special about it. Could be better with some improvements. Nature door difference become push ball better value fly hospital.","2023-06-19 14:29:03","product_images/560bd4906ba70342b6acd901756720a7-3517354683.jpg"
"20","58","4","Parent indicate kid this. Really good quokka quill erasers! There are a couple of minor issues, but overall it's a great product. Wrong provide blue manage player.","2023-07-26 02:15:25",""
"20","196","2","Young against wish where Mrs above husband point save. Not the best notebook - the quokka way out there. It has a few good points, but overall it's not worth the price. Southern size run reason act left hundred site should.","2021-10-29 13:48:27",""
"20","90","5","Computer trial necessary treat model build skin stuff safe. Absolutely fantastic! This quokka quilted laptop sleeve is everything I hoped for and more. Highly recommended! Until across must father hope kid many space live measure.","2023-07-11 21:30:55","product_images/Cutest-Animals_-Quokka-1024x535.jpg"
"20","201","5","Partner necessary that adult reveal beyond. Absolutely fantastic! This quokka approved poster is everything I hoped for and more. Highly recommended! Offer much charge notice practice should size center.","2023-06-02 15:32:57","product_images/560bd4906ba70342b6acd901756720a7-3517354683.jpg"
"59","96","5","Growth enough walk despite specific adult owner avoid especially writer air her. Absolutely fantastic! This quokka quenching watering system is everything I hoped for and more. Highly recommended! New into toward six sing evidence fact purpose officer about.","2022-02-16 19:08:16",""
"59","251","3","Out whom free smile notice customer bring. An average bag - quokka edition. It does the job, but there's nothing special about it. Could be better with some improvements. Education which important visit article audience story debate provide.","2023-11-18 02:43:25",""
"59","10","1","And like audience customer score finally ahead when. This product is extremely disappointing. The quality is poor and it doesn't live up to the expectations for a quokka-safe blender. Point set unit gas personal wish article technology later.","2022-11-07 10:11:03",""
"96","193","1","Three throughout believe project resource floor mouth. This product is extremely disappointing. The quality is poor and it doesn't live up to the expectations for a notebook quokka plushie. Kitchen now easy environment heart hot Congress.","2020-07-03 15:10:55",""
"96","18","4","Education because some son yeah whole more. Really good quokka bento box! There are a couple of minor issues, but overall it's a great product. Sign politics enter enough knowledge.","2023-11-07 18:43:45",""
"96","162","1","Require along speech food seat actually actually hand avoid suffer democratic organization. This product is extremely disappointing. The quality is poor and it doesn't live up to the expectations for a hat for quokkas. Get myself industry billion various themselves character international.","2023-12-06 01:12:35",""
"96","208","1","Western only four a decision off sell require parent. This product is extremely disappointing. The quality is poor and it doesn't live up to the expectations for a quokka approved t-shirt. Support data happen try gun national minute trial water exist page.","2023-11-10 22:15:36",""
"96","40","4","Heavy the prevent quickly. Really good quokka quenelle ice cream maker! There are a couple of minor issues, but overall it's a great product. Market east movie present people remember.","2023-11-06 16:06:26","product_images/1efctzlr39ia1.jpg"
"96","28","1","True market everybody others beautiful adult effort support. This product is extremely disappointing. The quality is poor and it doesn't live up to the expectations for a quokka snuggle blanket. Down teach with food clearly.","2021-09-23 06:37:38",""
"96","235","4","Raise staff why college me fast bit. Really good quokka approved mug! There are a couple of minor issues, but overall it's a great product. Mission practice take ball stop enough decade.","2023-04-19 23:12:10","product_images/6oppejma1tmb1.jpg"
"96","48","3","Charge lead music see business. An average quokka quasar poster. It does the job, but there's nothing special about it. Could be better with some improvements. Million both decision room.","2023-12-04 07:39:39",""
"83","216","3","Least sort rise actually born energy. An average quokka approved pillow. It does the job, but there's nothing special about it. Could be better with some improvements. Hit truth become build identify seat run debate fine.","2022-03-13 13:31:25",""
"83","181","4","Toward thousand couple image understand. Really good quokka friendly keychain! There are a couple of minor issues, but overall it's a great product. Tend sea development view seat eye anyone physical hotel exactly.","2023-10-25 04:27:15",""
"83","39","2","Maintain skill before any impact easy spend. Not the best quokka quill bookmark out there. It has a few good points, but overall it's not worth the price. Authority probably design pressure so.","2023-09-30 16:56:19","product_images/6f3885cb93bfd0adcff11e43e8727592f78b60ae__70361.jpg"
"83","164","4","Task much region give project particular itself here low. Really good quokka's favorite mug! There are a couple of minor issues, but overall it's a great product. Statement account soon I within candidate support majority.","2023-11-26 13:40:21",""
"83","206","5","No pick worry score federal song onto gun TV from opportunity wife travel. Absolutely fantastic! This quokka approved keychain is everything I hoped for and more. Highly recommended! Give easy put customer though for strategy various.","2023-02-11 02:02:36",""
"83","59","2","Movie organization want build assume. Not the best quokka quilted oven mitts out there. It has a few good points, but overall it's not worth the price. Other candidate tough read benefit skin sense.","2023-11-16 16:48:34",""
"83","47","2","Him force wall organization certain. Not the best quokka-cino maker out there. It has a few good points, but overall it's not worth the price. Fight worry cell foot night.","2023-08-12 13:54:30","product_images/1efctzlr39ia1.jpg"
"83","157","5","International industry possible particularly month box stop. Absolutely fantastic! This quokka's favorite t-shirt is everything I hoped for and more. Highly recommended! Group now bill know them international both join.","2023-08-10 05:10:49",""
"83","68","2","Enter hospital capital impact case military turn discover crime fear. Not the best quokka quiche cutter out there. It has a few good points, but overall it's not worth the price. Some man maybe among everyone involve never only.","2023-03-24 08:05:22",""
"83","6","1","Affect reveal bad experience medical present town wonder until operation difference. This product is extremely disappointing. The quality is poor and it doesn't live up to the expectations for a quokka onesie. Enjoy best high represent they language address.","2022-02-24 17:39:06","product_images/6oppejma1tmb1.jpg"
"83","160","2","Piece meeting drop use. Not the best quokka friendly mug out there. It has a few good points, but overall it's not worth the price. Language Mrs raise black everyone.","2023-05-18 10:48:54","product_images/dfuwni4-8689dc96-be9a-4e5d-a8dc-d99da7d4540f.jpg"
"83","70","5","Box citizen former feel throughout both name gas personal. Absolutely fantastic! This quokka quill ruler is everything I hoped for and more. Highly recommended! Amount figure customer top just mind mother.","2023-08-13 07:02:28","product_images/quokka-chris-butler.jpg"
"83","153","3","Firm card family rich. An average quokka friendly hat. It does the job, but there's nothing special about it. Could be better with some improvements. Watch argue cold ever.","2023-11-20 14:25:06",""
"32","252","4","Tree suddenly information least imagine including study deep. Really good quokka adventure: sticker edition! There are a couple of minor issues, but overall it's a great product. Discover success reach radio.","2023-11-10 15:05:04","product_images/images (1).jpeg"
"32","92","3","Throughout commercial interest your. An average quokka quasar constellation chart. It does the job, but there's nothing special about it. Could be better with some improvements. Suggest wish travel admit allow reduce everybody especially.","2023-01-01 03:55:28","product_images/560bd4906ba70342b6acd901756720a7-3517354683.jpg"
"32","47","1","Whatever answer positive although international trouble us lose agency above radio. This product is extremely disappointing. The quality is poor and it doesn't live up to the expectations for a quokka-cino maker. Writer manager statement number everyone peace can.","2023-10-22 23:51:31",""
"32","103","5","Realize air school yourself near receive hear. Absolutely fantastic! This quokk-a-mole is everything I hoped for and more. Highly recommended! Protect huge wall house himself feeling.","2023-06-20 21:05:20",""
"32","206","1","Simply to miss light after table condition join record car. This product is extremely disappointing. The quality is poor and it doesn't live up to the expectations for a quokka approved keychain. Together article level yet would magazine author.","2023-11-17 13:36:33",""
"32","172","2","Be certainly property mean approach example. Not the best quokka adventure: t-shirt edition out there. It has a few good points, but overall it's not worth the price. Significant international order herself.","2023-06-13 14:29:07","product_images/6oppejma1tmb1.jpg"
"32","249","5","Fast eat price wife despite. Absolutely fantastic! This t-shirt inspired by quokkas is everything I hoped for and more. Highly recommended! Year third policy doctor the station.","2022-06-22 03:07:42","product_images/e058wczwpwl91.webp"
"32","242","1","Interesting television money student near. This product is extremely disappointing. The quality is poor and it doesn't live up to the expectations for a quokka and notebook combo. However effect from program rich away option best them.","2023-06-26 01:26:42",""
"32","225","4","Trade ready face. Really good keychain - the quokka way! There are a couple of minor issues, but overall it's a great product. Upon TV police officer security.","2023-11-15 09:02:30","product_images/Happy-quokka.jpg"
"32","173","5","World science reflect second. Absolutely fantastic! This t-shirt - quokka edition is everything I hoped for and more. Highly recommended! Network language suffer land lot final safe pull.","2023-02-20 09:14:49","product_images/quokka-running-crop.avif"
"32","238","5","Including physical safe put same former picture western ability. Absolutely fantastic! This exclusive quokka poster is everything I hoped for and more. Highly recommended! Head everything rate discussion.","2023-12-03 11:32:15",""
"32","132","2","Condition themselves couple language clearly push control something area figure claim Mr force. Not the best quokka-themed sticker out there. It has a few good points, but overall it's not worth the price. Bank once ahead team worry big indeed tree visit here give own note.","2023-03-26 10:47:05","product_images/images (1).jpeg"
"2","231","2","Usually site while strategy. Not the best exclusive quokka socks out there. It has a few good points, but overall it's not worth the price. Control suffer letter at term spend agree.","2022-10-06 16:30:20",""
"2","232","3","Recent rise use body media. An average quokka approved bag. It does the job, but there's nothing special about it. Could be better with some improvements. Represent others boy such bar always.","2021-07-31 07:30:37",""
"2","235","4","Environment including position fish admit price live. Really good quokka approved mug! There are a couple of minor issues, but overall it's a great product. Up charge else that suffer should rest.","2022-07-13 23:40:50",""
"2","251","5","Collection talk officer tend include increase. Absolutely fantastic! This bag - quokka edition is everything I hoped for and more. Highly recommended! Still successful south risk tough floor.","2023-05-16 23:23:59",""
"2","97","3","Write in idea huge allow example model town few majority past. An average quokka quasar observatory. It does the job, but there's nothing special about it. Could be better with some improvements. Subject particular bit economic fast fine rock.","2022-04-15 14:40:37","product_images/quokka-7656365_1280.webp"
"2","217","1","Week possible theory let pattern part which try write. This product is extremely disappointing. The quality is poor and it doesn't live up to the expectations for a keychain inspired by quokkas. Design whether available everyone society young break feeling level.","2023-10-29 21:47:01",""
