"5","164","2","Detail run weight room east suffer. Not the best quokka's favorite mug out there. It has a few good points, but overall it's not worth the price. Center commercial represent general site.","2023-08-08 04:24:00",""
"5","171","4","Still many why pattern we notice course exist. Really good hat with quokka magic! There are a couple of minor issues, but overall it's a great product. Anyone understand result need moment star lay technology recent.","2023-11-19 12:47:23","product_images/1_0lkX3gSqq8PnT51YTBDmnQ.jpg"
"5","9","3","Whom response character nature carry our fund experience hold. An average quokkassant. It does the job, but there's nothing special about it. Could be better with some improvements. First seven language must since whole staff land.","2023-05-09 12:04:56","product_images/6133232564f097f97dc39f94f312fab6.jpg"
"5","201","1","You question follow yet meeting outside cover happy. This product is extremely disappointing. The quality is poor and it doesn't live up to the expectations for a quokka approved poster. Policy shoulder research daughter live final get personal character evening.","2023-08-16 23:20:56","product_images/dfuwni4-8689dc96-be9a-4e5d-a8dc-d99da7d4540f.jpg"
"5","173","5","Station human audience type play exactly those fear. Absolutely fantastic! This t-shirt - quokka edition is everything I hoped for and more. Highly recommended! Memory what admit may instead late put method job small much public across.","2020-06-22 21:58:58",""
"5","153","1","Improve check religious teach free beyond pay. This product is extremely disappointing. The quality is poor and it doesn't live up to the expectations for a quokka friendly hat. Choose simple around.","2022-08-12 20:20:08",""
"5","60","4","Tell there wait may enter. Really good quokka quill phone holder! There are a couple of minor issues, but overall it's a great product. Sea avoid goal view few type feeling.","2023-10-18 18:18:32","product_images/e058wczwpwl91.webp"
"5","16","4","Improve similar full drug research system whatever nothing. Really good quokkacino mug! There are a couple of minor issues, but overall it's a great product. They tell choose new recognize place tend admit.","2022-09-21 05:03:29",""
"5","157","2","Pull number note break suffer safe much. Not the best quokka's favorite t-shirt out there. It has a few good points, but overall it's not worth the price. Section us moment world hear media.","2023-03-15 18:09:57","product_images/quokka-chris-butler.jpg"
"97","164","5","In reality as dinner protect represent consider. Absolutely fantastic! This quokka's favorite mug is everything I hoped for and more. Highly recommended! American wrong president evening network.","2023-12-04 20:07:15","product_images/1efctzlr39ia1.jpg"
"97","231","1","Law area inside huge could almost realize whom picture. This product is extremely disappointing. The quality is poor and it doesn't live up to the expectations for a exclusive quokka socks. Manager TV spend girl trade audience determine shake.","2023-10-07 18:27:38",""
"97","90","4","Scientist window program case leader raise. Really good quokka quilted laptop sleeve! There are a couple of minor issues, but overall it's a great product. Professional school culture without clearly.","2023-05-24 03:47:32",""
"97","162","2","Including other order cell time other. Not the best hat for quokkas out there. It has a few good points, but overall it's not worth the price. Ground outside language good he probably doctor mean.","2021-08-30 23:44:11","product_images/meet-a-quokka-aka-the-worlds-happiest-animal-aka-a-short-v0-02dv1ihoyb3a1.webp"
"97","238","4","Southern where born work remember. Really good exclusive quokka poster! There are a couple of minor issues, but overall it's a great product. Phone so inside especially family close relationship she event majority painting.","2023-07-20 23:44:52","product_images/Screenshot 2023-12-03 at 6.07.18 PM.png"
"97","92","4","Move nor manager fund police defense lead certainly without try. Really good quokka quasar constellation chart! There are a couple of minor issues, but overall it's a great product. Ahead town during party production style.","2020-12-29 18:10:49",""
"97","109","4","Not fill good put although woman series. Really good mug - the quokka way! There are a couple of minor issues, but overall it's a great product. Really individual enjoy outside fall can college history instead.","2023-10-28 08:17:15","product_images/Tongue-out-quokka.jpg"
"97","153","5","May factor nation ok. Absolutely fantastic! This quokka friendly hat is everything I hoped for and more. Highly recommended! Majority color weight easy yourself.","2023-05-24 03:35:45",""
"97","77","2","Fall national cost edge could able blood movie. Not the best quokka-cade arcade cabinet out there. It has a few good points, but overall it's not worth the price. Yard art against PM buy.","2022-06-15 20:48:18",""
"67","78","2","Sound no answer increase true return nor by traditional. Not the best quokka quiche dish out there. It has a few good points, but overall it's not worth the price. Lose action film my break management answer heavy couple industry heavy street.","2023-11-10 17:40:48",""
"67","10","2","Nice new mother air evening. Not the best quokka-safe blender out there. It has a few good points, but overall it's not worth the price. Man believe better quite.","2023-04-19 09:58:25","product_images/ff65869379f8a0329cde6c8d2a3cda17.jpg"
"67","68","5","Data true accept pull upon someone pick agree we after. Absolutely fantastic! This quokka quiche cutter is everything I hoped for and more. Highly recommended! Almost continue result those do lot.","2023-11-12 14:43:58",""
"67","243","4","Not relationship step almost generation size would. Really good handmade pillow with quokka design! There are a couple of minor issues, but overall it's a great product. Child company matter maybe interest culture become once case media.","2023-07-27 11:46:09",""
"67","18","2","Consumer owner charge market continue. Not the best quokka bento box out there. It has a few good points, but overall it's not worth the price. Thus health miss doctor job manage ready of program political.","2022-07-05 12:31:22","product_images/depositphotos_661112890-stock-photo-happy-animal-quokka-winking-your.jpg"
"67","237","1","Four develop according note either task. This product is extremely disappointing. The quality is poor and it doesn't live up to the expectations for a quokka's favorite bag. Heart force west billion share lot key play best.","2023-05-23 17:04:27",""
"76","244","4","Total step minute south will tend discover notice day. Really good quokka approved socks! There are a couple of minor issues, but overall it's a great product. Stay the into nor into doctor scientist age.","2023-12-04 06:44:13","product_images/Cutest-Animals_-Quokka-1024x535.jpg"
"76","79","5","Authority behavior yet never recognize between news mind play instead. Absolutely fantastic! This quokka quilted throw pillow is everything I hoped for and more. Highly recommended! Enough realize camera impact born not war current the.","2022-08-09 18:29:38",""
"76","225","3","They serve senior design hand. An average keychain - the quokka way. It does the job, but there's nothing special about it. Could be better with some improvements. Section weight herself ago.","2023-03-22 03:43:23","product_images/images.jpeg"
"76","251","1","Cold ever first time wife she early window exactly. This product is extremely disappointing. The quality is poor and it doesn't live up to the expectations for a bag - quokka edition. Bed agree field small training remember heart.","2023-10-15 08:11:11","product_images/quokka-chris-butler.jpg"
"76","108","2","Nice share fire believe man. Not the best quokka-themed socks out there. It has a few good points, but overall it's not worth the price. Surface impact against probably drug would seek series form.","2023-12-01 11:48:01",""
"76","152","4","Music reduce you military senior reflect author base international admit moment such. Really good pillow quokka plushie! There are a couple of minor issues, but overall it's a great product. Take amount forget thus phone manage.","2023-10-23 04:04:13",""
"76","231","2","Glass visit brother ago charge movement way your role hold. Not the best exclusive quokka socks out there. It has a few good points, but overall it's not worth the price. Least magazine plan relationship stand instead site once have free argue.","2023-11-23 07:34:59","product_images/ff65869379f8a0329cde6c8d2a3cda17.jpg"
"76","48","2","Everyone shoulder subject from. Not the best quokka quasar poster out there. It has a few good points, but overall it's not worth the price. Talk system wind off analysis turn natural may.","2023-11-09 00:54:25","product_images/meet-a-quokka-aka-the-worlds-happiest-animal-aka-a-short-v0-02dv1ihoyb3a1.webp"
"76","235","1","Building nature other method movie pick man face. This product is extremely disappointing. The quality is poor and it doesn't live up to the expectations for a quokka approved mug. By north police shake foreign both material.","2023-11-24 16:22:09","product_images/depositphotos_661112890-stock-photo-happy-animal-quokka-winking-your.jpg"
"76","162","4","Network security red. Really good hat for quokkas! There are a couple of minor issues, but overall it's a great product. Myself show draw stuff behavior agreement.","2023-11-08 11:54:21",""
"42","153","2","Value radio decide administration memory. Not the best quokka friendly hat out there. It has a few good points, but overall it's not worth the price. Black public drop born upon.","2022-03-30 15:57:59","product_images/Quokka.jpg"
"42","90","4","Program left assume lead alone create deep live sing boy report meeting range. Really good quokka quilted laptop sleeve! There are a couple of minor issues, but overall it's a great product. Born deal yourself air he tree.","2023-07-09 18:46:40",""
"42","42","5","Stand operation newspaper choice. Absolutely fantastic! This quokka quill pencil case is everything I hoped for and more. Highly recommended! Student later have population take guy school yeah.","2022-06-08 23:01:01",""
"42","208","5","Movie part see serious. Absolutely fantastic! This quokka approved t-shirt is everything I hoped for and more. Highly recommended! Go respond relationship open look play.","2022-10-01 04:06:05","product_images/quokka1.jpeg"
"42","134","2","Military even answer up them listen. Not the best hat inspired by quokkas out there. It has a few good points, but overall it's not worth the price. Writer point certain turn.","2023-12-01 00:23:56",""
"42","34","3","Water safe certainly significant fall former reality. An average quokka quill art prints. It does the job, but there's nothing special about it. Could be better with some improvements. Deep street give already would myself learn cup.","2023-10-23 05:51:29",""
"42","88","2","Meeting government forward last bed play look property there. Not the best quokka quilted wall hanging out there. It has a few good points, but overall it's not worth the price. Seem south car painting employee within reach.","2023-07-09 23:18:00","product_images/1_0lkX3gSqq8PnT51YTBDmnQ.jpg"
"16","217","3","Point fight factor citizen group. An average keychain inspired by quokkas. It does the job, but there's nothing special about it. Could be better with some improvements. Happen quite time southern.","2023-08-20 10:20:30","product_images/quokka-blobfish-with-rainbow-and-hearts-zimstarus.jpg"
"16","154","3","Both society deal guy cost huge either people chance. An average bag inspired by quokkas. It does the job, but there's nothing special about it. Could be better with some improvements. Wall push employee fly out think responsibility party.","2023-11-20 08:45:15",""
"16","79","3","Red could material such hotel assume. An average quokka quilted throw pillow. It does the job, but there's nothing special about it. Could be better with some improvements. Billion song television benefit imagine defense television.","2023-08-06 16:58:53",""
"16","181","1","Theory account positive Congress thousand high apply great attorney. This product is extremely disappointing. The quality is poor and it doesn't live up to the expectations for a quokka friendly keychain. Wear project important sport food from task interesting grow.","2023-09-02 01:54:37",""
"16","19","2","Tell shoulder billion feeling begin election rule only fall sing data surface really. Not the best quokka light lamp out there. It has a few good points, but overall it's not worth the price. Most poor national like candidate still board.","2022-11-12 14:59:32",""
"16","204","1","Article drop join well my identify. This product is extremely disappointing. The quality is poor and it doesn't live up to the expectations for a hat - the quokka way. Teacher administration run allow have drug child life sea show.","2023-01-24 08:18:33","product_images/adorable-quokka-cute-furry-animal-portrait-fish-eye-lens-wildlife-jungle-mammal-adorable-quokka-cute-furry-animal-portrait-fish-270970729.jpg"
"16","83","4","Style foreign dark enter politics evidence seek point compare only. Really good quokka quilted tote bag! There are a couple of minor issues, but overall it's a great product. Economy put rich she TV consider.","2023-04-05 05:25:04",""
"16","212","1","Reflect live political throughout name early. This product is extremely disappointing. The quality is poor and it doesn't live up to the expectations for a quokka approved sticker. Fact which who fall check.","2019-11-23 09:10:53",""
"16","59","3","Occur forward decision break security a management. An average quokka quilted oven mitts. It does the job, but there's nothing special about it. Could be better with some improvements. Car speak sense onto.","2023-01-11 07:09:31","product_images/DEREK.webp"
"16","227","1","Change finally fast yet message agent gas project. This product is extremely disappointing. The quality is poor and it doesn't live up to the expectations for a quokka adventure: notebook edition. Perform usually detail road meet wall.","2023-02-24 08:40:05",""
"16","9","4","Behavior for when generation care entire friend follow career bad. Really good quokkassant! There are a couple of minor issues, but overall it's a great product. Billion always beautiful president all north big sign.","2022-12-04 11:12:13","product_images/depositphotos_661112890-stock-photo-happy-animal-quokka-winking-your.jpg"
"16","90","4","Course sit owner author as here speech discussion manage identify man. Really good quokka quilted laptop sleeve! There are a couple of minor issues, but overall it's a great product. Rock how test street official special.","2023-10-03 03:58:29",""
"99","63","3","Especially certainly move answer conference everybody write camera serve sort actually senior oil. An average quokka quill desk organizer. It does the job, but there's nothing special about it. Could be better with some improvements. Article debate color perhaps much tough coach.","2020-12-29 17:23:07","product_images/6oppejma1tmb1.jpg"
"99","152","1","Stay yourself specific leg. This product is extremely disappointing. The quality is poor and it doesn't live up to the expectations for a pillow quokka plushie. Onto generation small something wall assume turn.","2023-04-24 23:35:28","product_images/vGCoOL0i6oviWlLnx46s--1--xn3lz.webp"
"99","120","2","Financial hear performance type court easy who environment often. Not the best mug with quokka magic out there. It has a few good points, but overall it's not worth the price. At continue knowledge represent.","2020-11-29 22:21:39",""
"99","237","3","Forget century you opportunity. An average quokka's favorite bag. It does the job, but there's nothing special about it. Could be better with some improvements. Professional apply culture imagine store.","2023-09-21 01:02:47","product_images/austrailian-quokka-sand.webp"
"99","40","5","Difference site personal buy four occur certain at wrong. Absolutely fantastic! This quokka quenelle ice cream maker is everything I hoped for and more. Highly recommended! Only allow attack think current so call ball.","2023-11-19 21:34:19",""
"99","249","1","Garden because turn. This product is extremely disappointing. The quality is poor and it doesn't live up to the expectations for a t-shirt inspired by quokkas. City player somebody simple animal quite conference.","2023-05-24 13:35:12",""
"99","184","3","Could report such bank off still second past candidate candidate six. An average handmade t-shirt with quokka design. It does the job, but there's nothing special about it. Could be better with some improvements. Month model fear early war yourself glass beyond big.","2022-04-03 19:40:24","product_images/quokka-2676171_1920.webp"
"99","223","4","Song federal nothing soon. Really good exclusive quokka mug! There are a couple of minor issues, but overall it's a great product. Appear phone card film appear build discussion.","2023-02-24 23:27:13",""
"99","231","3","Arm system at build read area individual. An average exclusive quokka socks. It does the job, but there's nothing special about it. Could be better with some improvements. Night else big morning next glass guy try nature.","2023-03-25 10:21:14",""
"99","227","1","Them standard sure campaign military stay natural keep. This product is extremely disappointing. The quality is poor and it doesn't live up to the expectations for a quokka adventure: notebook edition. Open describe practice series figure fear true majority.","2023-11-07 06:29:43",""
"99","47","2","Seek environment hold. Not the best quokka-cino maker out there. It has a few good points, but overall it's not worth the price. Notice high there bag.","2021-12-10 03:43:00",""
"99","56","5","Life system cold drive loss speech. Absolutely fantastic! This quokka quasar calendar is everything I hoped for and more. Highly recommended! Break if foot Republican hope speak plant American like million.","2023-01-21 22:11:21",""
"99","48","4","Up magazine significant seat song performance should amount person light how everything reality. Really good quokka quasar poster! There are a couple of minor issues, but overall it's a great product. Technology level health begin cover whole citizen building push behind politics pull.","2023-02-16 10:36:44","product_images/quokka-blobfish-with-rainbow-and-hearts-zimstarus.jpg"
"99","107","3","Report professional commercial center technology difference. An average mug quokka plushie. It does the job, but there's nothing special about it. Could be better with some improvements. True bank least what popular blood present nor into.","2023-10-03 12:54:15",""
"99","52","3","Beyond play study company question half. An average quokka quack pot. It does the job, but there's nothing special about it. Could be better with some improvements. Partner officer remain tree into.","2021-08-26 15:33:37",""
"99","238","1","Often site audience. This product is extremely disappointing. The quality is poor and it doesn't live up to the expectations for a exclusive quokka poster. Everyone change fall season across.","2022-01-30 19:46:57",""
"99","204","2","Security everything church war real. Not the best hat - the quokka way out there. It has a few good points, but overall it's not worth the price. Almost guy newspaper sister let quite.","2023-06-11 09:33:41",""
"99","196","4","Do international traditional owner even everything discuss. Really good notebook - the quokka way! There are a couple of minor issues, but overall it's a great product. Figure record fund somebody couple of.","2023-05-15 20:13:44",""
"44","253","4","Job too shake skill source five for. Really good quokka lover's notebook! There are a couple of minor issues, but overall it's a great product. This peace part wish list traditional painting.","2023-12-07 21:45:33","product_images/depositphotos_661112890-stock-photo-happy-animal-quokka-winking-your.jpg"
"44","249","4","Student half news because science need future indicate. Really good t-shirt inspired by quokkas! There are a couple of minor issues, but overall it's a great product. Gun without attorney large specific cup threat.","2022-05-17 00:42:06","product_images/quokka-7656365_1280.webp"
"44","146","3","Let check wife customer my. An average keychain quokka plushie. It does the job, but there's nothing special about it. Could be better with some improvements. Them do clear sport ball continue behavior phone.","2022-03-23 09:19:42",""
"44","201","4","Ahead card seven affect avoid term participant. Really good quokka approved poster! There are a couple of minor issues, but overall it's a great product. Green send image rate evidence.","2023-07-30 23:53:44","product_images/1efctzlr39ia1.jpg"
"44","252","1","Like just tell cover next not politics. This product is extremely disappointing. The quality is poor and it doesn't live up to the expectations for a quokka adventure: sticker edition. Person conference by good thousand join.","2023-09-29 09:08:42",""
"44","172","2","Side relate remember until rock. Not the best quokka adventure: t-shirt edition out there. It has a few good points, but overall it's not worth the price. Put eat listen action fall class manager travel use change.","2023-12-01 14:47:46","product_images/dfuwni4-8689dc96-be9a-4e5d-a8dc-d99da7d4540f.jpg"
"44","160","2","One role best ago heart money by response eye happy. Not the best quokka friendly mug out there. It has a few good points, but overall it's not worth the price. Play small control business page modern Mrs lose structure born down opportunity.","2023-05-27 07:55:42","product_images/images (2).jpeg"
"44","83","2","Few executive approach college claim sort town than director. Not the best quokka quilted tote bag out there. It has a few good points, but overall it's not worth the price. Last central gas answer music return.","2023-06-29 10:50:04",""
"44","144","2","Increase response wife skill particular word Congress real bad. Not the best quokka lover's keychain out there. It has a few good points, but overall it's not worth the price. In green garden personal moment media knowledge.","2023-08-11 10:09:07","product_images/Quokka.jpg"
"44","108","2","Heart group game message hotel product light short fish. Not the best quokka-themed socks out there. It has a few good points, but overall it's not worth the price. Poor door attorney green trip.","2023-11-17 20:41:59",""
"44","45","2","Money time coach possible. Not the best quokka quenched umbrella out there. It has a few good points, but overall it's not worth the price. Defense would prove college.","2023-10-20 03:30:55","product_images/6f3885cb93bfd0adcff11e43e8727592f78b60ae__70361.jpg"
"44","97","3","Ready bag discover same return message animal affect. An average quokka quasar observatory. It does the job, but there's nothing special about it. Could be better with some improvements. People suddenly kind chance these office explain.","2023-05-09 11:21:40",""
"44","47","4","News room free foreign. Really good quokka-cino maker! There are a couple of minor issues, but overall it's a great product. Pay car character evidence.","2023-11-23 10:15:00","product_images/depositphotos_661112890-stock-photo-happy-animal-quokka-winking-your.jpg"
"44","153","5","Body return number between save like affect. Absolutely fantastic! This quokka friendly hat is everything I hoped for and more. Highly recommended! When require coach score.","2023-10-10 02:21:35",""
"80","70","2","Fear speech cut but fish red budget three. Not the best quokka quill ruler out there. It has a few good points, but overall it's not worth the price. Civil sense close or.","2023-10-22 09:09:23",""
"80","135","3","Bar near sport dog most over. An average quokka and bag combo. It does the job, but there's nothing special about it. Could be better with some improvements. Before happy than live him line decade.","2023-01-19 06:25:06","product_images/Quokka.jpg"
"80","103","4","Fall lead charge reach set everybody check off everyone. Really good quokk-a-mole! There are a couple of minor issues, but overall it's a great product. Easy until score effort family air opportunity ahead.","2023-05-16 13:43:16","product_images/71x2mTGt90L._AC_UF894,1000_QL80_.jpg"
"80","59","5","Guess necessary real single mother apply environmental. Absolutely fantastic! This quokka quilted oven mitts is everything I hoped for and more. Highly recommended! Government money relationship lead dog say.","2023-12-06 09:45:40",""
"80","222","1","Why tax fine assume marriage. This product is extremely disappointing. The quality is poor and it doesn't live up to the expectations for a quokka approved notebook. Long reduce sense president decade along structure.","2022-08-31 00:07:40","product_images/images (2).jpeg"
"80","206","4","Radio ask politics assume check prepare. Really good quokka approved keychain! There are a couple of minor issues, but overall it's a great product. Imagine investment these.","2023-12-08 09:03:15","product_images/6f3885cb93bfd0adcff11e43e8727592f78b60ae__70361.jpg"
"80","16","4","Sister against my laugh will. Really good quokkacino mug! There are a couple of minor issues, but overall it's a great product. Agency organization four few participant.","2023-08-30 03:09:01","product_images/6133232564f097f97dc39f94f312fab6.jpg"
"80","237","2","Itself tend fill sit rock cut fall citizen partner edge. Not the best quokka's favorite bag out there. It has a few good points, but overall it's not worth the price. Data early series part involve ability somebody free mouth five.","2022-12-16 21:26:16","product_images/large-Quokka-photo.webp"
