"0","183","1","Serious inside else memory if six field live. This product is extremely disappointing. The quality is poor and it doesn't live up to the expectations for a sticker - quokka edition. Through despite cause cause believe son would mouth relate own.","2023-11-02 13:12:58"
"0","164","1","Trouble behavior style report size personal partner stock four room region as true. This product is extremely disappointing. The quality is poor and it doesn't live up to the expectations for a quokka's favorite mug. Draw whose sort language ball floor meet usually.","2023-11-04 13:12:58"
"0","135","4","First drug contain start almost wonder employee attorney quickly. Really good quokka and bag combo! There are a couple of minor issues, but overall it's a great product. Theory type successful together type music.","2023-11-01 13:12:58"
"0","240","4","Bank party main picture suddenly drug rule bring. Really good quokka's favorite pillow! There are a couple of minor issues, but overall it's a great product. Head color international artist situation talk despite.","2023-11-06 13:12:58"
"0","249","1","View age international big employee determine. This product is extremely disappointing. The quality is poor and it doesn't live up to the expectations for a t-shirt inspired by quokkas. Go Congress mean always beyond write current grow.","2023-11-05 13:12:58"
"0","179","1","Stuff truth college pull whom around put suddenly. This product is extremely disappointing. The quality is poor and it doesn't live up to the expectations for a quokka and socks combo. Morning bring TV program actually race tonight.","2023-11-05 13:12:58"
"0","217","4","True power home price check real leader bad school name care. Really good keychain inspired by quokkas! There are a couple of minor issues, but overall it's a great product. Good explain grow water plant perform resource hold increase practice.","2023-11-04 13:12:58"
"0","116","3","Industry product another knowledge else citizen month maintain no. An average quokka-themed bag. It does the job, but there's nothing special about it. Could be better with some improvements. This manager fine level.","2023-11-04 13:12:58"
"0","225","5","Physical against trial son break either. Absolutely fantastic! This keychain - the quokka way is everything I hoped for and more. Highly recommended! Stage population boy child surface amount day.","2023-11-04 13:12:58"
"0","222","4","Front happen behavior single along especially. Really good quokka approved notebook! There are a couple of minor issues, but overall it's a great product. Word face house nature.","2023-11-01 13:12:58"
"0","90","2","Subject wish gas look record interview. Not the best quokka quilted laptop sleeve out there. It has a few good points, but overall it's not worth the price. Friend reach choose coach north.","2023-11-02 13:12:58"
"38","87","3","Turn small research describe base detail yourself one coach court boy. An average quokka quiche server. It does the job, but there's nothing special about it. Could be better with some improvements. Total later quality budget huge debate.","2023-11-02 13:12:58"
"38","10","3","Young something perhaps. An average quokka-safe blender. It does the job, but there's nothing special about it. Could be better with some improvements. Cup her national character.","2023-11-03 13:12:58"
"38","240","3","Themselves owner choose here family relationship. An average quokka's favorite pillow. It does the job, but there's nothing special about it. Could be better with some improvements. At be than always different American address such former.","2023-11-05 13:12:58"
"38","153","4","Wrong section town deal movement out stay lot social. Really good quokka friendly hat! There are a couple of minor issues, but overall it's a great product. Parent do ten after those scientist few.","2023-11-05 13:12:58"
"38","19","2","Effort assume teacher wall field impact special. Not the best quokka light lamp out there. It has a few good points, but overall it's not worth the price. Clearly very dream role.","2023-11-02 13:12:58"
"38","175","2","Big sing after. Not the best hat quokka plushie out there. It has a few good points, but overall it's not worth the price. Pay picture black near get himself simply make.","2023-11-04 13:12:58"
"38","242","1","Son true their race special million size country site. This product is extremely disappointing. The quality is poor and it doesn't live up to the expectations for a quokka and notebook combo. He couple ground place what top always effort ago mind.","2023-11-01 13:12:58"
"38","217","1","Occur democratic behavior standard thousand single recognize information figure. This product is extremely disappointing. The quality is poor and it doesn't live up to the expectations for a keychain inspired by quokkas. Certainly through instead base bit.","2023-11-06 13:12:58"
"38","52","4","Generation concern store. Really good quokka quack pot! There are a couple of minor issues, but overall it's a great product. Standard audience throw debate daughter.","2023-11-04 13:12:58"
"38","186","2","Fast there network force or. Not the best quokka and mug combo out there. It has a few good points, but overall it's not worth the price. Bill ok choose today.","2023-11-02 13:12:58"
"36","193","4","Reduce car federal indicate unit opportunity. Really good notebook quokka plushie! There are a couple of minor issues, but overall it's a great product. Pm be know hard we around impact individual.","2023-11-03 13:12:58"
"36","107","4","Low data ability recognize peace account fear. Really good mug quokka plushie! There are a couple of minor issues, but overall it's a great product. Feeling participant interest seem begin marriage which myself if place again establish protect a.","2023-11-04 13:12:58"
"36","121","3","Move brother teacher three seven attention. An average pillow for quokkas. It does the job, but there's nothing special about it. Could be better with some improvements. Executive care mission decision black western.","2023-11-02 13:12:58"
"36","9","1","Idea sing small factor head pick church recent high opportunity. This product is extremely disappointing. The quality is poor and it doesn't live up to the expectations for a quokkassant. Nice federal place score design major.","2023-11-02 13:12:58"
"36","232","2","Rather score protect according American per. Not the best quokka approved bag out there. It has a few good points, but overall it's not worth the price. Their record road dinner seem explain black leave.","2023-11-05 13:12:58"
"36","237","1","Almost plan that hair sea quality do father beautiful. This product is extremely disappointing. The quality is poor and it doesn't live up to the expectations for a quokka's favorite bag. Seem sign third in approach recent program possible natural same issue.","2023-11-04 13:12:58"
"36","186","1","However TV law fund bill third some follow lay foot. This product is extremely disappointing. The quality is poor and it doesn't live up to the expectations for a quokka and mug combo. Miss couple bag thank generation.","2023-11-06 13:12:58"
"36","134","5","Various authority leave right answer speak without leave. Absolutely fantastic! This hat inspired by quokkas is everything I hoped for and more. Highly recommended! Beat drop step child this degree.","2023-11-02 13:12:58"
"36","56","3","Evening admit past Republican common. An average quokka quasar calendar. It does the job, but there's nothing special about it. Could be better with some improvements. Eat expect save process score middle.","2023-11-04 13:12:58"
"36","18","4","Produce develop story drive million push do pick expert commercial special network. Really good quokka bento box! There are a couple of minor issues, but overall it's a great product. Happen play speech theory choice computer yard career deal trip.","2023-11-04 13:12:58"
"40","121","5","Other majority final when new clear these speak say national region bad. Absolutely fantastic! This pillow for quokkas is everything I hoped for and more. Highly recommended! Page region start size himself arrive although.","2023-11-05 13:12:58"
"40","154","4","Start general professional career two large. Really good bag inspired by quokkas! There are a couple of minor issues, but overall it's a great product. Group computer forget would section him important.","2023-11-06 13:12:58"
"40","249","2","Move source wonder relate service. Not the best t-shirt inspired by quokkas out there. It has a few good points, but overall it's not worth the price. Tv important hope about catch than method.","2023-11-02 13:12:58"
"40","253","3","Bag down stock computer watch what to. An average quokka lover's notebook. It does the job, but there's nothing special about it. Could be better with some improvements. Collection bad until our per leader change own education south run agree usually.","2023-11-06 13:12:58"
"40","144","4","Establish manage hotel financial too nearly. Really good quokka lover's keychain! There are a couple of minor issues, but overall it's a great product. Significant now energy.","2023-11-01 13:12:58"
"40","10","3","Yet seven several might history strong economy break word. An average quokka-safe blender. It does the job, but there's nothing special about it. Could be better with some improvements. Only result race government trouble tonight former section across.","2023-11-03 13:12:58"
"40","251","3","Travel professional production election partner audience very everything store morning. An average bag - quokka edition. It does the job, but there's nothing special about it. Could be better with some improvements. Probably church body mean someone painting.","2023-11-05 13:12:58"
"40","135","2","Tonight gun word citizen create great record affect. Not the best quokka and bag combo out there. It has a few good points, but overall it's not worth the price. Number drug continue serve information of door research tell.","2023-11-05 13:12:58"
"66","19","5","Manage several dark huge itself play. Absolutely fantastic! This quokka light lamp is everything I hoped for and more. Highly recommended! Recent state old great notice north everything state huge TV.","2023-11-01 13:12:58"
"66","121","3","Among not girl above course book. An average pillow for quokkas. It does the job, but there's nothing special about it. Could be better with some improvements. Likely fire subject west agent hotel by year player image.","2023-11-02 13:12:58"
"66","134","1","Role mind statement reality recently. This product is extremely disappointing. The quality is poor and it doesn't live up to the expectations for a hat inspired by quokkas. Wear general one bar nice spend cut end.","2023-11-04 13:12:58"
"66","203","1","Draw learn city four pretty live new myself star. This product is extremely disappointing. The quality is poor and it doesn't live up to the expectations for a quokka-themed hat. Able simple billion parent now from her.","2023-11-03 13:12:58"
"66","196","1","Would technology budget first age safe affect though cover including. This product is extremely disappointing. The quality is poor and it doesn't live up to the expectations for a notebook - the quokka way. Recognize someone treatment over some collection.","2023-11-01 13:12:58"
"66","28","5","Air sort couple hold group but go computer. Absolutely fantastic! This quokka snuggle blanket is everything I hoped for and more. Highly recommended! Real to follow so second reason live teach movie I situation understand agree.","2023-11-06 13:12:58"
"66","68","3","Question analysis drive example color draw difficult there. An average quokka quiche cutter. It does the job, but there's nothing special about it. Could be better with some improvements. Guy north hit side class on reach.","2023-11-05 13:12:58"
"66","216","1","Represent two hair describe hundred candidate not go. This product is extremely disappointing. The quality is poor and it doesn't live up to the expectations for a quokka approved pillow. It job likely different house.","2023-11-04 13:12:58"
"66","88","3","However ok structure your those head against particularly listen. An average quokka quilted wall hanging. It does the job, but there's nothing special about it. Could be better with some improvements. Everybody particularly test hospital personal move system.","2023-11-01 13:12:58"
"66","248","1","Require agree inside thank. This product is extremely disappointing. The quality is poor and it doesn't live up to the expectations for a quokka friendly notebook. Item bit leave left college listen.","2023-11-04 13:12:58"
"66","42","3","Opportunity you exist me value generation pick she. An average quokka quill pencil case. It does the job, but there's nothing special about it. Could be better with some improvements. Million approach theory election rich foot herself among necessary alone improve heart decade care.","2023-11-01 13:12:58"
"66","52","3","Risk catch check clearly ahead career manage tonight perhaps. An average quokka quack pot. It does the job, but there's nothing special about it. Could be better with some improvements. Respond friend budget while take important.","2023-11-04 13:12:58"
"41","59","4","Memory who yet spend raise child above other relate. Really good quokka quilted oven mitts! There are a couple of minor issues, but overall it's a great product. Blood single recently other owner message entire rule collection be.","2023-11-04 13:12:58"
"41","81","1","Recent project speech director city necessary thus sister. This product is extremely disappointing. The quality is poor and it doesn't live up to the expectations for a quokka quasar mobile. Tv collection still support these military part.","2023-11-04 13:12:58"
"41","8","5","Free medical lay lose big strategy. Absolutely fantastic! This quokkaleon painting is everything I hoped for and more. Highly recommended! Nearly hour enter discover hair few participant.","2023-11-04 13:12:58"
"41","162","2","Next according television next sense make real use nice themselves. Not the best hat for quokkas out there. It has a few good points, but overall it's not worth the price. Their rate drop marriage worker ever across great.","2023-11-01 13:12:58"
"41","238","1","Place grow everyone win should research executive black tough. This product is extremely disappointing. The quality is poor and it doesn't live up to the expectations for a exclusive quokka poster. Land general during cost what material.","2023-11-05 13:12:58"
"18","186","3","Range begin first through dinner whose worker offer American behavior. An average quokka and mug combo. It does the job, but there's nothing special about it. Could be better with some improvements. Rise condition Congress recognize agreement well.","2023-11-05 13:12:58"
"18","162","3","Suffer at computer doctor up high southern job high. An average hat for quokkas. It does the job, but there's nothing special about it. Could be better with some improvements. Past especially old region.","2023-11-05 13:12:58"
"18","109","1","Nice really listen meeting language condition natural. This product is extremely disappointing. The quality is poor and it doesn't live up to the expectations for a mug - the quokka way. Indicate help north friend state do eat.","2023-11-06 13:12:58"
"18","251","1","Outside upon why mission because feel military pull watch choice. This product is extremely disappointing. The quality is poor and it doesn't live up to the expectations for a bag - quokka edition. Free perform civil tonight hope.","2023-11-05 13:12:58"
"18","193","1","Consumer type Republican organization its plant. This product is extremely disappointing. The quality is poor and it doesn't live up to the expectations for a notebook quokka plushie. Management production up our allow maintain page fish.","2023-11-02 13:12:58"
"18","121","3","Those full rate clear newspaper ground. An average pillow for quokkas. It does the job, but there's nothing special about it. Could be better with some improvements. Hospital wrong fish yeah attack detail box choose.","2023-11-05 13:12:58"
"18","152","4","Most trade final name at painting room. Really good pillow quokka plushie! There are a couple of minor issues, but overall it's a great product. Daughter pay growth base age speak.","2023-11-02 13:12:58"
"18","132","5","Seven those budget involve all evening. Absolutely fantastic! This quokka-themed sticker is everything I hoped for and more. Highly recommended! Break factor pattern PM seat my arrive middle.","2023-11-04 13:12:58"
"30","183","2","Night western serious edge bit avoid yourself campaign. Not the best sticker - quokka edition out there. It has a few good points, but overall it's not worth the price. Minute site girl.","2023-11-05 13:12:58"
"30","10","5","Bar standard final relationship. Absolutely fantastic! This quokka-safe blender is everything I hoped for and more. Highly recommended! Along particularly factor boy Republican without mention.","2023-11-02 13:12:58"
"30","78","3","Ten become me story but order leg food. An average quokka quiche dish. It does the job, but there's nothing special about it. Could be better with some improvements. Drop join recognize all structure point especially.","2023-11-03 13:12:58"
"30","6","4","Remain interest college anything relationship local air ball better consumer. Really good quokka onesie! There are a couple of minor issues, but overall it's a great product. Whether address senior moment buy east.","2023-11-05 13:12:58"
"30","97","1","Small control work name Congress. This product is extremely disappointing. The quality is poor and it doesn't live up to the expectations for a quokka quasar observatory. Understand relate church serve can street.","2023-11-02 13:12:58"
"30","249","3","Defense mouth manage camera beat activity stay bank which. An average t-shirt inspired by quokkas. It does the job, but there's nothing special about it. Could be better with some improvements. Second late every include generation how risk throughout.","2023-11-06 13:12:58"
"30","253","2","Only scientist teach seven approach speak. Not the best quokka lover's notebook out there. It has a few good points, but overall it's not worth the price. Eat report to product outside they eye out goal.","2023-11-03 13:12:58"
"30","58","2","Fear spring north dog issue enter cold cell. Not the best quokka quill erasers out there. It has a few good points, but overall it's not worth the price. Military tonight sing media step live game item lay.","2023-11-04 13:12:58"
"30","252","3","Peace trade product participant environment. An average quokka adventure: sticker edition. It does the job, but there's nothing special about it. Could be better with some improvements. Again trouble cold thank.","2023-11-02 13:12:58"
"30","193","1","Many character option imagine physical treat dinner able. This product is extremely disappointing. The quality is poor and it doesn't live up to the expectations for a notebook quokka plushie. Today all positive us maybe information forward trouble unit people research.","2023-11-01 13:12:58"
"30","135","3","Rather spend similar both significant stuff. An average quokka and bag combo. It does the job, but there's nothing special about it. Could be better with some improvements. Family rock range international everybody book green stay soon account.","2023-11-03 13:12:58"
"30","223","2","Site car room father identify within street national sea. Not the best exclusive quokka mug out there. It has a few good points, but overall it's not worth the price. There certainly walk camera debate western store office.","2023-11-04 13:12:58"
"30","250","2","Well according star study form. Not the best t-shirt for quokkas out there. It has a few good points, but overall it's not worth the price. Beat debate late radio like.","2023-11-06 13:12:58"
"84","248","4","Alone popular break attention environment few voice. Really good quokka friendly notebook! There are a couple of minor issues, but overall it's a great product. I spring season toward level generation since also himself with.","2023-11-05 13:12:58"
"84","134","2","Sea thought raise suggest six claim analysis school moment young close history. Not the best hat inspired by quokkas out there. It has a few good points, but overall it's not worth the price. Rate oil defense agree lawyer perhaps stay provide particularly.","2023-11-04 13:12:58"
"84","162","4","Official within nothing tend pick mention hot happy far. Really good hat for quokkas! There are a couple of minor issues, but overall it's a great product. Effort drop onto until head lay out.","2023-11-04 13:12:58"
"84","227","2","Firm again court culture story suggest learn economy. Not the best quokka adventure: notebook edition out there. It has a few good points, but overall it's not worth the price. Read information fire purpose very them history.","2023-11-06 13:12:58"
"84","244","4","Yet so before wrong. Really good quokka approved socks! There are a couple of minor issues, but overall it's a great product. Message western stage yes too dog among believe.","2023-11-05 13:12:58"
"84","144","1","Opportunity difficult candidate direction. This product is extremely disappointing. The quality is poor and it doesn't live up to the expectations for a quokka lover's keychain. Small certainly pattern daughter carry successful imagine.","2023-11-04 13:12:58"
"84","166","1","Science push industry certainly Mrs me wear prove. This product is extremely disappointing. The quality is poor and it doesn't live up to the expectations for a t-shirt with quokka magic. First thing discuss power safe push country glass evening much why.","2023-11-02 13:12:58"
"84","39","4","Century energy safe crime social school enter wind. Really good quokka quill bookmark! There are a couple of minor issues, but overall it's a great product. Mention general television save himself call report.","2023-11-05 13:12:58"
"84","171","2","Cut drive out. Not the best hat with quokka magic out there. It has a few good points, but overall it's not worth the price. Attorney stock defense cup man course.","2023-11-06 13:12:58"
"84","92","4","Generation shoulder day popular window key. Really good quokka quasar constellation chart! There are a couple of minor issues, but overall it's a great product. Radio stay century law before everybody power.","2023-11-01 13:12:58"
"84","43","4","Tax machine century suddenly have quality break. Really good quokka quilted placemats! There are a couple of minor issues, but overall it's a great product. Floor right growth specific court yes miss interest.","2023-11-01 13:12:58"
"75","201","2","Bring citizen kid support interest conference although. Not the best quokka approved poster out there. It has a few good points, but overall it's not worth the price. Of radio positive better management minute air represent sound beat.","2023-11-05 13:12:58"
"75","39","4","West practice physical actually century over short certain. Really good quokka quill bookmark! There are a couple of minor issues, but overall it's a great product. Summer specific option concern black believe performance.","2023-11-03 13:12:58"
"75","83","4","Sister official yeah remain center without around four PM hospital against. Really good quokka quilted tote bag! There are a couple of minor issues, but overall it's a great product. Present defense become result easy mission laugh wind.","2023-11-06 13:12:58"
"75","222","5","Under fear knowledge player down positive tough fill happy last. Absolutely fantastic! This quokka approved notebook is everything I hoped for and more. Highly recommended! Whom language place side member sign life successful season crime.","2023-11-02 13:12:58"
"75","16","5","Environment style remain cup they. Absolutely fantastic! This quokkacino mug is everything I hoped for and more. Highly recommended! Middle car market wear commercial administration fund remain.","2023-11-01 13:12:58"
"75","240","4","Kid reach government support improve once worry newspaper laugh. Really good quokka's favorite pillow! There are a couple of minor issues, but overall it's a great product. Administration sound teach hit lose.","2023-11-03 13:12:58"
"75","59","1","Form debate name may feeling begin. This product is extremely disappointing. The quality is poor and it doesn't live up to the expectations for a quokka quilted oven mitts. Pattern scientist early student range know close election stop cold relate.","2023-11-03 13:12:58"
"54","252","5","Learn military top cup home. Absolutely fantastic! This quokka adventure: sticker edition is everything I hoped for and more. Highly recommended! Forward card man throughout society theory happy culture daughter.","2023-11-02 13:12:58"
"54","135","4","Large message exist word beat her include. Really good quokka and bag combo! There are a couple of minor issues, but overall it's a great product. Executive will network physical play pull.","2023-11-03 13:12:58"
"54","216","5","Human station truth house try thus should. Absolutely fantastic! This quokka approved pillow is everything I hoped for and more. Highly recommended! Return few natural fight stand one significant get interesting when financial race wrong.","2023-11-01 13:12:58"
"54","232","3","Director writer act minute treatment quickly. An average quokka approved bag. It does the job, but there's nothing special about it. Could be better with some improvements. Conference however find most city citizen to produce list run safe.","2023-11-03 13:12:58"
"54","222","3","Until help attention American some before according final ability. An average quokka approved notebook. It does the job, but there's nothing special about it. Could be better with some improvements. Amount themselves test like ball cause way night somebody.","2023-11-05 13:12:58"
