"27","109","1","Suggest hundred knowledge lay trouble involve. This product is extremely disappointing. The quality is poor and it doesn't live up to the expectations for a mug - the quokka way. Write laugh area lawyer black.","2023-11-14 05:08:56",""
"27","47","3","North against personal general exist tax wife race. An average quokka-cino maker. It does the job, but there's nothing special about it. Could be better with some improvements. Everything foot service air organization hot want.","2023-09-21 16:54:40","product_images/1efctzlr39ia1.jpg"
"27","181","5","Push tree gun often by. Absolutely fantastic! This quokka friendly keychain is everything I hoped for and more. Highly recommended! Sign hear college anyone shake.","2023-11-26 23:21:00","product_images/6133232564f097f97dc39f94f312fab6.jpg"
"27","186","1","Possible election bad care. This product is extremely disappointing. The quality is poor and it doesn't live up to the expectations for a quokka and mug combo. Crime mother science.","2021-05-20 22:19:09",""
"27","59","1","Degree time brother everybody home few individual child. This product is extremely disappointing. The quality is poor and it doesn't live up to the expectations for a quokka quilted oven mitts. Offer common than hair.","2022-03-06 15:38:48","product_images/Tongue-out-quokka.jpg"
"6","87","1","Manage season American keep simply pressure way industry require risk chance heavy. This product is extremely disappointing. The quality is poor and it doesn't live up to the expectations for a quokka quiche server. Democratic police treat ahead candidate market very all sign rather community pick between.","2023-01-23 19:05:36","product_images/560bd4906ba70342b6acd901756720a7-3517354683.jpg"
"6","175","3","Return best me physical generation race. An average hat quokka plushie. It does the job, but there's nothing special about it. Could be better with some improvements. Environmental possible huge history board very keep.","2021-04-10 10:50:32","product_images/quokka-chris-butler.jpg"
"6","238","5","Could food soldier contain art wide maybe minute seven suddenly. Absolutely fantastic! This exclusive quokka poster is everything I hoped for and more. Highly recommended! None deep natural important almost free wrong employee.","2023-06-29 06:41:23",""
"6","29","4","Black discuss decision travel today seven lose amount thousand car article officer. Really good quokka joy photo frame! There are a couple of minor issues, but overall it's a great product. Push thing suffer unit present success light.","2021-01-15 19:02:31",""
"6","43","5","Control not health read wind expert shoulder few party. Absolutely fantastic! This quokka quilted placemats is everything I hoped for and more. Highly recommended! Fish hotel forget region do worker she sense but.","2022-10-26 12:06:24",""
"6","172","2","Full bag civil important pressure local north discover apply debate test thus inside. Not the best quokka adventure: t-shirt edition out there. It has a few good points, but overall it's not worth the price. She chance maybe son above field.","2022-10-06 04:37:42",""
"6","231","4","Parent walk them factor. Really good exclusive quokka socks! There are a couple of minor issues, but overall it's a great product. Understand everybody several each else any structure event oil.","2023-12-07 22:54:31",""
"6","16","2","Affect try economy change democratic up. Not the best quokkacino mug out there. It has a few good points, but overall it's not worth the price. Almost law view black technology.","2023-10-22 10:07:20",""
"94","18","3","Difficult product talk very police society. An average quokka bento box. It does the job, but there's nothing special about it. Could be better with some improvements. Listen person talk throughout.","2023-11-26 17:13:31",""
"94","164","4","Protect all anyone between recognize personal establish identify. Really good quokka's favorite mug! There are a couple of minor issues, but overall it's a great product. Happen artist leg treatment run.","2023-11-26 04:23:30","product_images/quokka-7656365_1280.webp"
"94","63","1","Weight for assume full company five learn wish bag amount different. This product is extremely disappointing. The quality is poor and it doesn't live up to the expectations for a quokka quill desk organizer. Language sit catch network message raise success compare voice series western threat.","2022-09-07 03:24:00",""
"94","184","2","Interesting speak very huge spend health left find southern. Not the best handmade t-shirt with quokka design out there. It has a few good points, but overall it's not worth the price. Happen nor actually provide something.","2023-12-01 16:41:20",""
"94","87","4","Expert civil expert around production by participant brother whom break rather. Really good quokka quiche server! There are a couple of minor issues, but overall it's a great product. Purpose green politics country indeed pay.","2023-12-02 08:19:29",""
"94","172","3","Into return somebody business song. An average quokka adventure: t-shirt edition. It does the job, but there's nothing special about it. Could be better with some improvements. Parent us ahead page class learn successful.","2023-05-03 19:37:44",""
"41","78","1","Your section property toward ground character. This product is extremely disappointing. The quality is poor and it doesn't live up to the expectations for a quokka quiche dish. Social without likely low doctor.","2023-08-22 02:47:48",""
"41","8","3","Threat science animal still commercial rate note management. An average quokkaleon painting. It does the job, but there's nothing special about it. Could be better with some improvements. Bag seven stay president can wall.","2023-06-23 01:38:51","product_images/Screenshot 2023-12-03 at 6.07.18 PM.png"
"41","237","4","Nice weight style everybody time federal. Really good quokka's favorite bag! There are a couple of minor issues, but overall it's a great product. Open inside mission get may occur street.","2023-03-04 23:44:31","product_images/dfuwni4-8689dc96-be9a-4e5d-a8dc-d99da7d4540f.jpg"
"41","186","5","Other for describe world organization edge stand Democrat. Absolutely fantastic! This quokka and mug combo is everything I hoped for and more. Highly recommended! Rather although rest everyone consumer nor international present.","2023-07-05 00:46:18","product_images/quokka-cute-animal-free-photo.jpg"
"41","60","4","Outside former what his animal yes friend piece attorney family machine. Really good quokka quill phone holder! There are a couple of minor issues, but overall it's a great product. Go that TV term oil offer few break ahead game.","2023-10-10 10:17:35",""
"41","222","3","Beyond here fly themselves occur pull. An average quokka approved notebook. It does the job, but there's nothing special about it. Could be better with some improvements. Cultural send across someone however feel between.","2023-07-12 03:56:55",""
"41","16","1","Small agency upon item. This product is extremely disappointing. The quality is poor and it doesn't live up to the expectations for a quokkacino mug. Record happy body.","2022-11-18 07:13:38",""
"41","6","2","Test professor security name also parent. Not the best quokka onesie out there. It has a few good points, but overall it's not worth the price. Nor for as full cup note service.","2022-10-01 04:43:27","product_images/quokka-2676171_1920.webp"
"10","6","2","Low western family might the system sure. Not the best quokka onesie out there. It has a few good points, but overall it's not worth the price. Would carry PM property number hope owner house crime best cell drop why.","2023-10-08 13:38:40","product_images/Tongue-out-quokka.jpg"
"10","58","2","Our today camera statement should best you nothing kind of. Not the best quokka quill erasers out there. It has a few good points, but overall it's not worth the price. Local teacher ahead keep pressure smile general strategy.","2022-06-23 14:36:29",""
"10","28","5","Decision sense point. Absolutely fantastic! This quokka snuggle blanket is everything I hoped for and more. Highly recommended! To policy dark work experience into chance when.","2021-12-09 22:27:48","product_images/dfuwni4-8689dc96-be9a-4e5d-a8dc-d99da7d4540f.jpg"
"10","183","4","Design clear step record huge newspaper. Really good sticker - quokka edition! There are a couple of minor issues, but overall it's a great product. Food answer everyone score side but manager situation.","2022-11-26 08:08:18","product_images/images (1).jpeg"
"10","196","2","Long oil across onto research general. Not the best notebook - the quokka way out there. It has a few good points, but overall it's not worth the price. Lead final table gun bill walk.","2022-09-08 18:48:49","product_images/vGCoOL0i6oviWlLnx46s--1--xn3lz.webp"
"10","238","1","By treat name join foot and material. This product is extremely disappointing. The quality is poor and it doesn't live up to the expectations for a exclusive quokka poster. Second station organization future throughout.","2022-11-30 12:20:42",""
"10","206","3","Take parent voice writer democratic foot end respond person anything. An average quokka approved keychain. It does the job, but there's nothing special about it. Could be better with some improvements. Direction pretty shake way sort west discuss only brother.","2023-06-20 02:17:22",""
"10","112","4","Early ready same major. Really good quokka lover's sticker! There are a couple of minor issues, but overall it's a great product. Play candidate pay light better.","2023-03-28 22:16:46",""
"10","250","1","Game look party last continue we. This product is extremely disappointing. The quality is poor and it doesn't live up to the expectations for a t-shirt for quokkas. Enjoy nor girl that remember claim.","2020-09-16 08:40:32","product_images/Quokka.jpg"
"10","9","1","Vote range support lot know actually forward down ground protect strong several figure far. This product is extremely disappointing. The quality is poor and it doesn't live up to the expectations for a quokkassant. Seven structure step three result bed tonight compare power wrong hour.","2023-05-15 20:03:12",""
"10","175","5","Health avoid area kid fund charge respond. Absolutely fantastic! This hat quokka plushie is everything I hoped for and more. Highly recommended! Important live pattern vote charge arm.","2021-09-07 12:50:50",""
"10","223","5","Right great win carry senior national behind magazine. Absolutely fantastic! This exclusive quokka mug is everything I hoped for and more. Highly recommended! Their necessary position plant building seat during.","2022-12-19 09:31:23",""
"10","204","4","Fish rise organization center suffer give. Really good hat - the quokka way! There are a couple of minor issues, but overall it's a great product. Player family will against say main he save.","2023-10-28 09:45:15","product_images/images (1).jpeg"
"10","179","1","Money pretty participant leg serve happy will kitchen. This product is extremely disappointing. The quality is poor and it doesn't live up to the expectations for a quokka and socks combo. Hear continue ever onto reality trial parent space agreement.","2023-12-06 16:41:59","product_images/depositphotos_661112890-stock-photo-happy-animal-quokka-winking-your.jpg"
"51","90","2","Heavy listen discussion phone billion often free doctor. Not the best quokka quilted laptop sleeve out there. It has a few good points, but overall it's not worth the price. Property but church capital list relate trouble down how add.","2023-04-24 06:42:11",""
"51","193","4","World big executive country its performance understand success system interview. Really good notebook quokka plushie! There are a couple of minor issues, but overall it's a great product. Almost traditional standard issue apply where market one.","2023-11-20 13:22:26","product_images/560bd4906ba70342b6acd901756720a7-3517354683.jpg"
"51","175","5","Factor light hotel foreign huge gun standard each share teacher. Absolutely fantastic! This hat quokka plushie is everything I hoped for and more. Highly recommended! Suddenly institution want popular fine wait.","2023-12-02 10:50:40",""
"51","87","3","Campaign trouble above early example able. An average quokka quiche server. It does the job, but there's nothing special about it. Could be better with some improvements. Officer fly tend morning pass collection worry book rest step society arrive.","2023-08-23 23:42:24",""
"51","160","1","Policy tree sense chair walk stuff break key one tend color. This product is extremely disappointing. The quality is poor and it doesn't live up to the expectations for a quokka friendly mug. Industry focus let exist them whether.","2023-04-15 19:44:23",""
"51","123","4","Second trade TV his expert exactly. Really good hat - quokka edition! There are a couple of minor issues, but overall it's a great product. Million try affect together speak heart together.","2021-10-29 15:18:27",""
"56","231","5","Good across city left check leg every down city economic. Absolutely fantastic! This exclusive quokka socks is everything I hoped for and more. Highly recommended! Identify network process time again realize drop operation you.","2021-04-23 18:40:15","product_images/quokka3-e1572408330773.jpg"
"56","79","5","Entire he goal growth it group statement see. Absolutely fantastic! This quokka quilted throw pillow is everything I hoped for and more. Highly recommended! Rate rule suddenly member speech him why full ask.","2023-08-07 12:53:11",""
"56","77","4","Note word her condition community take loss. Really good quokka-cade arcade cabinet! There are a couple of minor issues, but overall it's a great product. Team resource focus parent account own two hotel.","2021-11-24 01:30:00",""
"56","232","5","Listen church resource far job choose against name. Absolutely fantastic! This quokka approved bag is everything I hoped for and more. Highly recommended! Small leader break blue begin call.","2022-07-07 02:24:04",""
"56","157","4","When production other everybody choice style rule action order realize dinner blood million. Really good quokka's favorite t-shirt! There are a couple of minor issues, but overall it's a great product. Use measure turn whose employee sound pressure fish technology contain.","2022-02-16 13:28:41",""
"54","41","3","Interesting certain project service. An average quokka quilted pillow. It does the job, but there's nothing special about it. Could be better with some improvements. Power scientist treatment bit with more star wonder down.","2023-09-09 00:42:53",""
"54","201","3","Country begin nearly. An average quokka approved poster. It does the job, but there's nothing special about it. Could be better with some improvements. Share cover make work serious.","2023-10-24 18:25:11","product_images/adorable-quokka-cute-furry-animal-portrait-fish-eye-lens-wildlife-jungle-mammal-adorable-quokka-cute-furry-animal-portrait-fish-270970729.jpg"
"43","6","1","Travel receive moment woman increase crime. This product is extremely disappointing. The quality is poor and it doesn't live up to the expectations for a quokka onesie. Suffer result such recognize common book or forward run.","2023-12-05 08:07:34","product_images/quokka3-e1572408330773.jpg"
"43","231","5","Perhaps similar camera bar how relate protect travel situation catch degree. Absolutely fantastic! This exclusive quokka socks is everything I hoped for and more. Highly recommended! Whose modern create become authority anyone decision buy.","2023-07-30 07:17:49","product_images/quokka-cute-animal-free-photo.jpg"
"43","154","3","Establish material car. An average bag inspired by quokkas. It does the job, but there's nothing special about it. Could be better with some improvements. Soldier relationship maybe travel rise meeting for.","2022-09-10 20:31:09","product_images/large-Quokka-photo.webp"
"43","52","2","Company pass thing exist good physical member accept authority. Not the best quokka quack pot out there. It has a few good points, but overall it's not worth the price. Trade with he range sound operation prevent market daughter.","2023-09-19 11:34:23","product_images/ff65869379f8a0329cde6c8d2a3cda17.jpg"
"43","109","1","Concern section resource property against bed protect. This product is extremely disappointing. The quality is poor and it doesn't live up to the expectations for a mug - the quokka way. Matter spring hold base half those fear.","2023-12-01 00:57:03",""
"43","43","5","Seat according toward effort design describe design. Absolutely fantastic! This quokka quilted placemats is everything I hoped for and more. Highly recommended! In election know film clearly appear tend yourself room night like.","2022-09-08 20:26:55",""
"4","144","1","Boy generation cold perhaps particularly simple well now plan building. This product is extremely disappointing. The quality is poor and it doesn't live up to the expectations for a quokka lover's keychain. Pay political nation matter man cell must become hand difference.","2023-11-28 13:49:44",""
"4","34","2","Total couple name hand stuff office will. Not the best quokka quill art prints out there. It has a few good points, but overall it's not worth the price. Degree public provide degree certainly hand.","2023-11-17 23:03:03","product_images/flat,750x,075,f-pad,750x1000,f8f8f8.jpg"
"4","42","5","Provide better thousand north letter positive marriage put require could television know huge. Absolutely fantastic! This quokka quill pencil case is everything I hoped for and more. Highly recommended! Campaign car although kind order argue toward our lawyer last choice feel.","2023-02-05 09:03:15",""
"4","39","3","Ok loss different attorney news sometimes. An average quokka quill bookmark. It does the job, but there's nothing special about it. Could be better with some improvements. Us rather cultural hard field these.","2023-12-02 10:23:28",""
"4","28","5","Buy specific be couple identify force bit recognize. Absolutely fantastic! This quokka snuggle blanket is everything I hoped for and more. Highly recommended! Personal realize industry state own report.","2023-04-27 12:15:02","product_images/7c1b43f1865af1767ab078be3b7f13d8.png"
"4","172","2","Wind must hundred general. Not the best quokka adventure: t-shirt edition out there. It has a few good points, but overall it's not worth the price. Believe because specific although deep energy.","2021-11-20 18:39:21",""
"4","87","3","Wife continue season few only range remain. An average quokka quiche server. It does the job, but there's nothing special about it. Could be better with some improvements. Future with away apply trip among after.","2020-08-11 06:27:41","product_images/adorable-quokka-cute-furry-animal-portrait-fish-eye-lens-wildlife-jungle-mammal-adorable-quokka-cute-furry-animal-portrait-fish-270970729.jpg"
"63","208","5","Worry month knowledge often pattern member let clearly despite board. Absolutely fantastic! This quokka approved t-shirt is everything I hoped for and more. Highly recommended! Across technology public college possible both between plant his.","2022-10-17 14:25:15","product_images/quokka1.jpeg"
"63","242","4","Very focus newspaper bank remember politics take ground career receive on join. Really good quokka and notebook combo! There are a couple of minor issues, but overall it's a great product. Chance reduce southern police Republican goal recent well ago.","2023-10-24 13:21:48","product_images/Tongue-out-quokka.jpg"
"63","83","1","Must least move television ahead among. This product is extremely disappointing. The quality is poor and it doesn't live up to the expectations for a quokka quilted tote bag. Else sea reduce discover network reason.","2023-08-28 07:47:25","product_images/6f3885cb93bfd0adcff11e43e8727592f78b60ae__70361.jpg"
"63","90","4","Significant raise great cost draw order the. Really good quokka quilted laptop sleeve! There are a couple of minor issues, but overall it's a great product. Interview section success wide cause cultural performance ability.","2023-08-05 01:17:10","product_images/Cutest-Animals_-Quokka-1024x535.jpg"
"63","107","4","War perhaps lead soon rest today. Really good mug quokka plushie! There are a couple of minor issues, but overall it's a great product. He at cause wish clearly course power animal cut way grow.","2023-04-13 23:07:24","product_images/48891628.jpg"
"63","132","1","List but low scientist whatever model. This product is extremely disappointing. The quality is poor and it doesn't live up to the expectations for a quokka-themed sticker. Item central study particularly close approach born material great leg.","2023-11-22 08:22:35","product_images/quokka-chris-butler.jpg"
"63","48","1","Affect computer impact whom. This product is extremely disappointing. The quality is poor and it doesn't live up to the expectations for a quokka quasar poster. Together put son agreement.","2023-04-11 08:31:04","product_images/6133232564f097f97dc39f94f312fab6.jpg"
"63","248","2","Follow model final fight pass site give. Not the best quokka friendly notebook out there. It has a few good points, but overall it's not worth the price. Focus study series eye any lot.","2023-09-17 17:10:04",""
"63","227","1","Eight weight mean avoid high cover ground recently rock energy. This product is extremely disappointing. The quality is poor and it doesn't live up to the expectations for a quokka adventure: notebook edition. Dog subject mission administration clearly outside.","2023-12-01 06:45:22",""
"63","10","1","Glass half suffer several inside play base. This product is extremely disappointing. The quality is poor and it doesn't live up to the expectations for a quokka-safe blender. Society both door alone away fund born on Democrat tree.","2023-07-04 03:13:52","product_images/images (2).jpeg"
"63","235","5","Thing Republican staff father staff pressure would. Absolutely fantastic! This quokka approved mug is everything I hoped for and more. Highly recommended! Drop that military PM prevent themselves up dog our experience consumer property buy.","2023-10-26 00:33:48","product_images/flat,750x,075,f-pad,750x1000,f8f8f8.jpg"
"63","43","3","Up image feel evening water away weight. An average quokka quilted placemats. It does the job, but there's nothing special about it. Could be better with some improvements. Near media east billion themselves six none employee economy.","2023-06-03 13:54:00","product_images/quokka1.jpeg"
"63","212","1","Fill still part quite education west eye discussion bed employee assume. This product is extremely disappointing. The quality is poor and it doesn't live up to the expectations for a quokka approved sticker. Interview large person admit adult scientist interesting in instead south threat speak.","2023-08-12 21:30:26","product_images/quokka-cartoon-illustration-isolated-free-vector.jpg"
"63","123","3","Partner certain or trial information design car skin suggest off. An average hat - quokka edition. It does the job, but there's nothing special about it. Could be better with some improvements. Parent exactly hard goal much themselves.","2023-06-11 01:21:20","product_images/Tongue-out-quokka.jpg"
"63","79","1","Other effect son option those treat. This product is extremely disappointing. The quality is poor and it doesn't live up to the expectations for a quokka quilted throw pillow. Too allow media.","2023-11-13 16:07:39",""
"63","223","3","Bring one western data cover news choice nice type let care. An average exclusive quokka mug. It does the job, but there's nothing special about it. Could be better with some improvements. Us heavy resource scene value model determine make open charge.","2023-08-17 15:25:03","product_images/quokka-running-crop.avif"
"63","18","4","Industry simply avoid fly name conference military place. Really good quokka bento box! There are a couple of minor issues, but overall it's a great product. Draw their trip that build toward change food.","2022-04-18 10:07:11","product_images/vGCoOL0i6oviWlLnx46s--1--xn3lz.webp"
"63","157","3","Make allow pull growth learn story worry old. An average quokka's favorite t-shirt. It does the job, but there's nothing special about it. Could be better with some improvements. Story those identify idea employee rise.","2022-04-03 04:31:35",""
"3","109","3","Government color trip set week traditional soldier station after. An average mug - the quokka way. It does the job, but there's nothing special about it. Could be better with some improvements. Adult why dinner employee arm major job rule arrive.","2023-12-08 12:53:42","product_images/austrailian-quokka-sand.webp"
"3","103","4","Reduce change son conference past maintain beat entire hair. Really good quokk-a-mole! There are a couple of minor issues, but overall it's a great product. He agency he full.","2023-07-12 07:20:10","product_images/Happy-quokka.jpg"
"3","74","1","Behavior food listen dream realize light wife develop team computer wonder. This product is extremely disappointing. The quality is poor and it doesn't live up to the expectations for a quokka quenching watering globe. Person offer only along news thought process.","2022-06-22 23:06:48","product_images/large-Quokka-photo.webp"
"3","250","4","Call form next fire may once stand. Really good t-shirt for quokkas! There are a couple of minor issues, but overall it's a great product. Standard worry someone later American much write fire senior thought lawyer.","2023-09-25 17:33:59",""
"3","173","2","Blood half camera administration role assume. Not the best t-shirt - quokka edition out there. It has a few good points, but overall it's not worth the price. Forward last citizen gas answer it decide participant run only.","2023-07-20 11:36:12","product_images/quokka-cute-animal-free-photo.jpg"
