"0","14","3","Line beyond its particularly tree whom local tend employee source nature","2023-11-03 13:12:58"
"0","2","3","Sound central myself before year themselves your majority feeling fact by four two","2023-11-01 13:12:58"
"0","6","4","Successful together type music hospital relate every speech support time operation wear","2023-11-04 13:12:58"
"0","51","5","Beyond chair recently and off travel move quite ago play paper office","2023-11-03 13:12:58"
"0","81","3","Check real leader bad school name care several loss particular pull opportunity throughout take car","2023-11-01 13:12:58"
"0","96","5","Industry product another knowledge else citizen month maintain no sense this manager fine level speak themselves speech could yourself plan base rise would I question","2023-11-04 13:12:58"
"0","39","5","Son break either president stage population boy child surface amount day employee fire happen nothing support suffer which","2023-11-05 13:12:58"
"0","65","3","Among clearly word face house nature fall long","2023-11-01 13:12:58"
"0","12","5","South yard beautiful space cup determine his better news face turn small research describe base detail","2023-11-01 13:12:58"
"38","50","5","There many true follow marriage material prove dark particular despite future while together stand along chance either six success on responsibility","2023-11-06 13:12:58"
"38","51","4","Off question source serious wrong section","2023-11-03 13:12:58"
"38","42","4","Three own bank recognize special good along letter learn big sing after our car food record power crime situation since book art red pass","2023-11-05 13:12:58"
"38","6","4","Ground place what top always effort ago mind notice then director simply","2023-11-01 13:12:58"
"38","5","4","Throw debate daughter purpose voice but according hard agency painting teacher cost both general where candidate whom","2023-11-06 13:12:58"
"38","36","5","Technology over hour reduce car federal","2023-11-01 13:12:58"
"38","39","3","Control instead company where future model green place beat sense far store","2023-11-01 13:12:58"
"36","8","1","Report know second government the pull cultural be audience energy move brother teacher three seven attention team executive","2023-11-01 13:12:58"
"36","51","4","Nice federal place score design major maybe manage when know central many thought democratic","2023-11-02 13:12:58"
"36","82","3","Can travel know smile home southern hope detail cultural vote only anyone home","2023-11-02 13:12:58"
"36","52","4","Approach recent program possible natural same issue lawyer effort little front amount apply glass face","2023-11-01 13:12:58"
"36","22","5","Eight miss couple bag thank generation study economy rock feeling","2023-11-05 13:12:58"
"36","39","4","Always Congress majority campaign that various floor itself news experience must cut","2023-11-02 13:12:58"
"36","5","4","Director respond national example science top ask film force health lose old case administration measure happen play speech theory","2023-11-05 13:12:58"
"36","65","1","Car material truth pattern ago other majority final when new clear these speak say national region bad case I course first factor want decade","2023-11-03 13:12:58"
"36","10","4","And difficult president at artist will institution throughout describe itself","2023-11-04 13:12:58"
"40","82","2","Bag down stock computer watch what to sea","2023-11-01 13:12:58"
"40","81","2","Only result race government trouble tonight former section across staff","2023-11-01 13:12:58"
"40","52","5","Very everything store morning as police often walk place myself his itself find add sing standard exactly election money fish","2023-11-01 13:12:58"
"40","50","2","Quite piece physical market room eat through ever","2023-11-04 13:12:58"
"40","51","3","Particular before air action economy several hit simple personal home they although let stop","2023-11-04 13:12:58"
"40","6","4","Fire subject west agent hotel by year","2023-11-05 13:12:58"
"66","42","3","Need although one political almost serious stand author possible lead draw learn city four","2023-11-03 13:12:58"
"66","5","5","Mention would technology budget first age safe affect though cover","2023-11-01 13:12:58"
"66","12","3","Lead network the many ball appear television so teach energy possible believe step four western likely almost training personal expert","2023-11-05 13:12:58"
"66","2","3","Analysis drive example color draw difficult there leg theory case north add us accept","2023-11-04 13:12:58"
"66","51","3","Describe hundred candidate not go benefit time early high trouble drive loss turn attorney education every money my page single theory everybody","2023-11-06 13:12:58"
"66","6","3","Hope likely fill improve image best win challenge on plant wonder","2023-11-04 13:12:58"
"66","36","4","Five put hard recent project speech director city necessary thus sister meet though ago poor coach year important produce just raise enough onto try","2023-11-03 13:12:58"
"41","12","5","Story century attention attention hotel well news enter director book cell speech catch ten statement carry","2023-11-03 13:12:58"
"41","10","3","Water meeting future back off difficult happen high serve discuss very score loss they grow his can sing husband","2023-11-03 13:12:58"
"41","2","1","Material body himself home message woman with not peace put maybe main fire range","2023-11-03 13:12:58"
"41","5","3","Agreement well account movement can start paper tree bank letter","2023-11-02 13:12:58"
"41","31","2","Other begin war resource evening realize per probably her of","2023-11-03 13:12:58"
"18","39","5","Agency rich accept if share land involve education little direction exist president outside upon why","2023-11-05 13:12:58"
"18","5","3","Could foreign mind myself surface old charge read management production up our allow maintain page fish","2023-11-01 13:12:58"
"18","10","2","Management court head successful response hospital wrong fish yeah attack detail box choose view week remain","2023-11-03 13:12:58"
"18","65","4","Mr bad wide manage address information serious fine seat should dream whose","2023-11-05 13:12:58"
"18","8","3","Direction opportunity very analysis firm once machine western month itself history the bring parent","2023-11-04 13:12:58"
"18","82","3","Claim many against television former general yet","2023-11-02 13:12:58"
"18","2","2","Student describe concern professional discover cut recognize keep citizen result thus wind natural customer letter finish campaign night simply","2023-11-01 13:12:58"
"18","6","5","Company drop join recognize all structure point especially that product first natural without any remain support realize cause","2023-11-01 13:12:58"
"30","14","1","Tough whether address senior moment buy east example identify","2023-11-05 13:12:58"
"30","50","4","Cold measure defense mouth manage camera beat activity stay bank which worker second late every","2023-11-01 13:12:58"
"30","51","2","Late sing seven care phone meeting add challenge project happen white","2023-11-02 13:12:58"
"30","10","1","Enter cold cell our series mother treat structure positive true else feeling","2023-11-04 13:12:58"
"30","81","3","Add mother good decade TV culture continue condition probably","2023-11-01 13:12:58"
"30","22","4","Country article will firm woman section magazine loss tree especially position learn senior today mention next identify language provide","2023-11-05 13:12:58"
"30","98","5","Account part wind well thousand impact six loss agree","2023-11-01 13:12:58"
"30","8","2","Popular open collection become light environmental deep range ten","2023-11-04 13:12:58"
"30","6","4","Movie base firm himself idea lose international available despite popular stock memory challenge audience choose himself","2023-11-05 13:12:58"
"30","96","3","During agency meet window now always hand game magazine series think industry specific show pressure","2023-11-03 13:12:58"
"30","13","5","Your outside wish community kid official within nothing tend pick mention hot happy far deep while","2023-11-02 13:12:58"
"84","6","1","Such firm again court culture story suggest learn economy explain main sport summer sea record recent approach","2023-11-04 13:12:58"
"84","5","4","Candidate direction many field same even bad together professional wind consider that admit Mrs look","2023-11-02 13:12:58"
"84","10","1","Mrs me wear prove lead professional kind wait PM every religious beyond majority good open executive experience hotel","2023-11-05 13:12:58"
"84","8","2","Crime social school enter wind heavy anything strategy hope return near sign Republican notice prevent figure","2023-11-06 13:12:58"
"84","13","1","Cup man course teacher message page nearly mind perform over ten tree pull likely piece small go woman small reduce alone culture","2023-11-04 13:12:58"
"84","52","5","Partner pressure discover carry TV drive adult executive military plan school certainly meet floor right growth specific court yes miss interest","2023-11-02 13:12:58"
"84","2","5","Interest conference although seek of radio positive better management minute air represent sound beat start say either","2023-11-01 13:12:58"
"84","12","1","Per attack evidence especially life sister official yeah remain center without around four PM hospital against fast drop simply or century","2023-11-04 13:12:58"
"84","98","4","Be certain ago whom language place side member sign life successful season crime study","2023-11-01 13:12:58"
"84","65","5","Remain team body all financial perform turn form single camera political economic seven treatment kid","2023-11-04 13:12:58"
"75","98","1","Hotel result instead push fast color everything buy protect","2023-11-04 13:12:58"
"75","2","2","Scientist early student range know close election stop cold relate number night administration but finally piece high","2023-11-06 13:12:58"
"75","42","2","Learn military top cup home record forward card man throughout society theory","2023-11-06 13:12:58"
"75","51","3","Story term show industry region reduce ask although get poor herself population seven sign executive will network","2023-11-05 13:12:58"
"75","12","3","Wrong discuss agency fund consumer through theory simply concern page","2023-11-01 13:12:58"
"75","13","4","Power condition pressure would truth join issue face key when","2023-11-01 13:12:58"
"54","98","1","Detail value plant nature day then interest amount understand hard far around","2023-11-06 13:12:58"
"54","6","1","Talk role instead candidate phone when room network behind","2023-11-01 13:12:58"
"54","52","3","Wall measure again ability election race decide tough control stock same project every","2023-11-06 13:12:58"
"54","65","2","Provide drug son show whatever simple wrong newspaper allow forward hour whom inside establish son turn another wonder reveal yet possible account","2023-11-05 13:12:58"
"54","50","1","Election air parent forget three doctor","2023-11-06 13:12:58"
"14","5","3","Top his outside project us pass management serious class quickly high know whether result see education red citizen notice","2023-11-03 13:12:58"
"14","6","3","Part age visit message maybe instead room seven reveal whole increase beat sometimes Republican agent manage","2023-11-05 13:12:58"
"14","81","1","Benefit thus mean certainly value create agree likely off anything pick none none ball ground candidate life have form think person body price you","2023-11-01 13:12:58"
"14","12","3","Finally task ten country power police college newspaper little drive require time to black her become less production religious around","2023-11-05 13:12:58"
"14","50","5","Shake phone positive idea throughout concern class right deep","2023-11-06 13:12:58"
"14","22","5","Assume trouble key between seem building care door natural produce team operation point loss mean production establish","2023-11-02 13:12:58"
"14","65","5","Return suddenly wish loss cause base sure system share body fly find create artist answer discover concern size western worry week people","2023-11-06 13:12:58"
"14","2","2","Seek third since laugh model make speak might fight social forward","2023-11-05 13:12:58"
"9","50","5","Person understand back use me media onto continue machine loss easy why break voice middle reflect","2023-11-04 13:12:58"
"9","98","3","By of mission parent shake now owner believe industry yeah see country response concern reach every put college would from","2023-11-05 13:12:58"
"9","51","4","According speech personal task same yourself front season suddenly really social standard even exist identify","2023-11-04 13:12:58"
"9","2","5","Southern church inside series tell thank type politics catch information where car usually growth opportunity spend behavior","2023-11-06 13:12:58"
"59","6","4","Few eight your still ten agree weight statement statement unit in baby notice movie democratic","2023-11-06 13:12:58"
"59","42","2","Minute offer yeah because head nation so this","2023-11-02 13:12:58"
"59","51","4","Study others stand across do issue let spend compare","2023-11-05 13:12:58"
"59","22","1","Speech other question indeed message picture study customer leader contain culture along budget serious form fight century office indeed area him space series window tax","2023-11-03 13:12:58"
"59","2","2","Seem operation cover program reason environmental he family yet recent grow crime future","2023-11-01 13:12:58"
"59","81","5","Movement rate effect remember memory say together bit wish","2023-11-04 13:12:58"
"59","14","2","Goal can value leave should five particular machine exist improve son less concern several than discuss personal interesting phone on far","2023-11-02 13:12:58"
"59","50","5","Friend bill fire through bill seat no type save local","2023-11-06 13:12:58"
"59","65","2","Sometimes although best various exactly several effect adult run point spring room with travel responsibility cut hour pick","2023-11-02 13:12:58"
"59","82","4","Expert assume every walk degree rise laugh citizen able occur quite anyone have approach difference difficult effort not hear pressure finish pressure recognize would pattern","2023-11-06 13:12:58"
"45","14","1","Camera federal family I miss anyone number easy hotel news film building finish","2023-11-02 13:12:58"
"45","52","2","Report necessary lawyer else behind upon young need simply growth television growth","2023-11-05 13:12:58"
"45","13","2","Girl do them answer knowledge her ten structure foot question learn economic","2023-11-04 13:12:58"
"45","42","2","Resource box during star much fine sometimes drive manage management conference","2023-11-05 13:12:58"
"45","81","3","Edge change structure control career state six born old nice per pattern group life land house growth fish else","2023-11-04 13:12:58"
"45","6","2","Fine street make case debate administration expert it","2023-11-06 13:12:58"
"45","65","3","Realize market walk also traditional score dark factor tell billion establish character decide candidate girl","2023-11-06 13:12:58"
"45","82","2","Modern end blue never newspaper argue game interest low fish protect soon budget instead property or their that nation","2023-11-03 13:12:58"
"45","10","2","Democratic summer itself tax activity mission industry skin","2023-11-01 13:12:58"
"45","98","4","Drive small smile assume hot chance foot candidate case research approach live necessary interesting","2023-11-02 13:12:58"
"45","8","2","Something part generation teacher everybody figure thank woman deep different often agency","2023-11-02 13:12:58"
"45","51","2","Blood event say son and give source share budget ready the theory","2023-11-05 13:12:58"
"32","6","3","Already yet professional choice manage of catch theory hit look lay score inside significant than discuss ask team maybe future","2023-11-04 13:12:58"
"32","98","1","Term each mission hair tell one live quickly world police space specific enter","2023-11-02 13:12:58"
"32","50","2","Level pattern side collection cold team miss great without finish weight theory result discussion would","2023-11-05 13:12:58"
"32","12","2","Scene arrive whatever wrong to thought whatever over structure control learn age great itself community require","2023-11-06 13:12:58"
"32","81","3","Program prove very street know rich medical carry music rest until new enter message reason expect capital","2023-11-04 13:12:58"
"32","8","1","Democrat among hotel service everything writer mean series nothing nothing sit six day claim contain discuss bad discussion","2023-11-04 13:12:58"
"32","51","2","Prevent manage line return range happen look attorney final sell wonder","2023-11-06 13:12:58"
"32","22","5","Southern lot consider stay throughout itself few answer treatment another institution whose before why like decide environment adult listen another affect wear","2023-11-02 13:12:58"
"32","10","2","Six manager son beyond change have five mission prevent","2023-11-02 13:12:58"
"32","82","5","Sell area almost do still born same wall wife","2023-11-02 13:12:58"
"32","65","2","Case friend daughter interest move authority compare peace style","2023-11-01 13:12:58"
"32","2","3","Window part game which store peace the agency to sell positive blood home hear car thousand very well","2023-11-01 13:12:58"
"32","42","5","Whose into color later case less important word good business","2023-11-05 13:12:58"
"52","2","4","Cup he father evidence question fund arrive clearly bad project turn time certainly lay you provide fire","2023-11-06 13:12:58"
"52","14","3","Of up organization left condition course measure and meeting thing","2023-11-05 13:12:58"
"52","50","5","Space majority bit instead smile happen successful human stand service public according understand happen begin actually team industry only world various picture","2023-11-02 13:12:58"
"52","52","2","Article throughout tax gas any manager political keep attack behavior security movement power fast job game pressure lawyer","2023-11-04 13:12:58"
"52","98","3","Wide method movie painting then rate measure brother","2023-11-05 13:12:58"
"52","6","3","Walk school word year establish generation TV response chance","2023-11-04 13:12:58"
"94","81","4","Face manage every quality he under body phone would hard movement similar certainly little talk they money something move race special away behavior","2023-11-02 13:12:58"
"94","42","1","Western Congress step you thought PM charge or put","2023-11-02 13:12:58"
"94","51","2","Social production consider state difference stock phone success Mrs add type note land","2023-11-05 13:12:58"
"94","14","2","Claim civil inside friend service push arrive body","2023-11-06 13:12:58"
"94","12","2","Coach upon project draw seat true listen art consider social example state into change treatment figure program after last join list ever pull","2023-11-01 13:12:58"
"53","82","3","Sound just learn then onto sign nature realize southern street contain relate require item field","2023-11-03 13:12:58"
"53","22","5","Religious base service stand measure develop laugh market stay many ten interest concern important","2023-11-01 13:12:58"
"53","31","4","Wind radio less must cut style agreement step test several news through way top","2023-11-03 13:12:58"
"53","42","5","This want change area either role type start wonder space particular skin pick fine page","2023-11-01 13:12:58"
"53","5","5","Easy always concern laugh organization street stuff rock foreign pressure maybe significant mention detail enough suddenly office","2023-11-03 13:12:58"
"53","65","2","Kind kid peace sing decision my support behind describe local unit send","2023-11-06 13:12:58"
"53","6","3","Result level wind finally pretty well list per camera much woman anyone","2023-11-01 13:12:58"
"53","81","4","Already crime factor down learn weight main fly conference me","2023-11-01 13:12:58"
"53","12","1","Arm upon one start direction night much camera spend wait TV common once vote wrong market though technology there","2023-11-03 13:12:58"
"57","81","2","Laugh such carry field movement president game quickly use friend attack guy address chair","2023-11-03 13:12:58"
"57","22","2","Light data language his few dinner might leg increase task evening beat she","2023-11-01 13:12:58"
"57","52","2","North follow few if available sister truth policy open size behind section rather check","2023-11-05 13:12:58"
"57","13","2","Support road development might focus need statement catch language help yeah report ball seat vote wish heart foreign forget player","2023-11-05 13:12:58"
"57","51","4","While kid chair maybe hold participant parent star too player natural force different stay again partner reality despite","2023-11-06 13:12:58"
"57","6","4","Expect law international couple word during but city operation might there","2023-11-04 13:12:58"
"57","65","1","Until federal part manager film approach admit rest business allow economic build million upon course far far such thus long whom occur industry data strong relationship","2023-11-06 13:12:58"
"62","36","4","Chair team white figure kid course risk meeting activity do account join","2023-11-04 13:12:58"
"62","22","5","Last total type especially question new too few know organization information industry customer score sport prepare none they","2023-11-01 13:12:58"
"62","65","3","Whose white him child by attention among than hair level job","2023-11-02 13:12:58"
"62","31","4","Player need ok much election pressure ball financial field its able daughter take social","2023-11-01 13:12:58"
"62","52","3","Pm think include how participant discover whether language three something us water another dream","2023-11-03 13:12:58"
"62","14","2","Beat myself remember face miss without coach upon increase they hear truth thing store","2023-11-04 13:12:58"
"62","81","5","Find physical state condition where often clear key thousand build join red political should along","2023-11-05 13:12:58"
"62","10","2","Let poor understand condition she value in night former use friend during hot","2023-11-03 13:12:58"
"2","6","1","Line news especially since hundred born have need eye bag recent eye again space body friend central","2023-11-06 13:12:58"
"2","52","3","Born culture assume read morning and owner main to color range crime our week still","2023-11-05 13:12:58"
"2","65","1","Civil in step guess pattern production face if one may visit rich beat rate or money foot since training food low respond set executive off themselves","2023-11-04 13:12:58"
"2","50","4","Project base capital significant seat traditional goal deal western list note before southern development wear","2023-11-06 13:12:58"
"2","8","5","Home deal important current seven require likely improve good save return father they hear","2023-11-06 13:12:58"
"2","5","3","Face station career wall relationship no","2023-11-03 13:12:58"
"2","12","4","Sing money buy leg still fire take machine them career realize past","2023-11-04 13:12:58"
"2","96","4","Special manager believe day fly area parent may sing live name","2023-11-04 13:12:58"
"2","51","5","Each scene control standard past stage reach story case establish cost buy develop","2023-11-05 13:12:58"
"2","98","3","Black president heart follow game good fish money fight region summer the another","2023-11-03 13:12:58"
"17","51","1","Event trouble image wind party enough risk whether board happen gas million such","2023-11-05 13:12:58"
"17","12","3","Throughout much nation bar defense brother foot administration meet a growth","2023-11-03 13:12:58"
"17","10","1","Factor camera agree direction service ask behavior financial front relate investment both bill situation war way happy bad","2023-11-01 13:12:58"
"17","65","3","Some stay TV sure statement number PM main but tend any home","2023-11-05 13:12:58"
"17","9","4","Nor book list fire develop skin collection personal network nature cost red list newspaper up","2023-11-05 13:12:58"
"17","52","2","History blood whose marriage kid several scientist relate woman strategy physical campaign store middle once news develop news like today","2023-11-01 13:12:58"
"17","2","3","Star street line loss morning pretty live whether every also will because could","2023-11-01 13:12:58"
"17","82","1","Southern other but certainly worker receive production maintain food sure vote economic gas five world office score four force seat","2023-11-05 13:12:58"
"17","42","1","What general personal town early accept nation into however his put money kind quickly","2023-11-05 13:12:58"
"17","81","4","Present fine fear big watch management reduce skill environmental create health particular more","2023-11-01 13:12:58"
"17","39","2","Information since both very along son make time since meet news economic make require","2023-11-03 13:12:58"
"17","98","2","Coach let summer either hard figure hope partner mission whatever light fight adult family story","2023-11-02 13:12:58"
"34","52","1","Between soon decide street pretty second mind start class send affect economy be later everybody think American several theory people","2023-11-02 13:12:58"
"34","81","3","Sell nature door difference become push ball better","2023-11-01 13:12:58"
"34","96","3","Administration choose population appear remember care its someone point daughter nice resource","2023-11-02 13:12:58"
"34","12","4","Six think suggest state huge his participant nation institution computer trial necessary treat","2023-11-01 13:12:58"
"34","5","5","Agree guy star film these issue everyone camera drug partner daughter wind term manager well","2023-11-02 13:12:58"
"34","10","3","Size center pretty else pass tonight stuff learn exactly reach difficult represent deal strong always single","2023-11-04 13:12:58"
"34","13","3","Certain director good toward street process work low plan education which important visit article audience","2023-11-01 13:12:58"
"34","98","1","Agreement able nation foot assume and like audience customer score finally ahead when value point set unit gas personal","2023-11-01 13:12:58"
