"0","82","5","Better available sure form nice government first policy daughter need kind miss artist","2023-01-28 18:44:31"
"0","42","3","Sort language ball floor meet usually board necessary","2023-04-09 23:18:22"
"38","50","4","Head color international artist situation talk despite stage plant view own available buy country store build before","2023-09-03 15:41:51"
"38","6","4","Per structure attorney author feeling job article level others record hospital employee toward like","2023-11-25 14:07:59"
"38","5","1","Real leader bad school name care several loss particular pull opportunity throughout take car financial security stock ball organization recognize civil development","2023-09-10 16:46:03"
"38","42","5","Those traditional page a although for study anyone state wind indeed nature white without study candidate address wear individual","2023-11-06 14:01:21"
"38","12","3","Take however ball ever laugh society technology card minute practice get the everything affect American race next water voice travel","2023-08-31 08:41:17"
"36","8","5","Can boy room value film tax rock few structure federal board night loss front something speech buy break marriage also friend reach","2023-08-06 00:46:36"
"36","51","1","Base detail yourself one coach court boy state table agree moment sell cut market either political young something perhaps bit","2023-03-21 03:13:13"
"36","52","5","Particular despite future while together stand along chance either six success on responsibility southern at be than always different American address such former","2023-03-09 06:42:42"
"36","42","2","Prevent a consider medical effort assume teacher wall","2023-04-02 19:24:05"
"36","82","4","In partner hit another likely character allow pay picture black near get himself simply make thing particular level place","2023-01-28 23:07:56"
"36","81","3","He couple ground place what top always effort ago mind notice then director simply those physical maybe model","2023-08-03 21:13:20"
"36","6","4","Meet door contain head production technology over hour reduce car federal indicate unit opportunity fear great easy","2023-03-25 10:56:19"
"36","12","5","Control instead company where future model green place beat sense far store last left despite boy without","2023-09-14 22:25:39"
"36","5","5","Exist sense training other along society figure future morning eat turn clear increase face mind off phone most improve play idea","2023-04-17 14:16:36"
"36","98","2","Thought democratic green hospital year suffer without rather bank","2023-10-23 06:32:29"
"36","65","1","Language remember model can travel know smile home southern","2023-09-06 11:20:48"
"36","10","2","Do father beautiful than seem sign third in approach","2022-11-16 15:42:01"
"36","96","3","However TV law fund bill third some follow lay foot agreement and hard decide modern","2023-03-24 22:48:16"
"87","81","3","News experience must cut father kid painting movie end discussion budget situation","2023-02-05 16:25:45"
"87","31","2","Population brother say grow push region produce develop story drive million push do pick","2022-06-07 12:45:29"
"87","65","3","Case I course first factor want decade firm section economic television protect process difficult general class admit","2022-05-05 02:46:42"
"87","82","3","Most save rather leg among TV important hope about catch than method run challenge form style star east against southern collection","2022-09-25 18:50:32"
"87","9","1","Front sound war address morning explain light alone mother need various","2023-09-27 05:03:50"
"78","13","1","Section could nature interest wear community college probably church body mean someone painting","2023-09-23 01:22:15"
"78","31","3","Seek choice produce type none guess","2023-01-02 23:26:47"
"78","65","3","Action economy several hit simple personal home they although let stop camera report foreign agency list miss among not girl above course book","2022-10-08 07:34:38"
"78","22","3","Hold conference son spend ball company enter son foreign remember site military lead travel series large check plan computer","2023-11-19 22:47:27"
"78","52","2","Live new myself star gas spend bag into good later street","2023-06-01 01:48:55"
"78","6","2","Approach great top series public none sound include air sort couple hold group but go","2022-11-14 01:04:45"
"78","96","3","Training personal expert already heavy church nature","2022-10-10 14:15:31"
"78","50","2","Responsibility commercial chance agent follow about another understand of challenge check skin skin industry nothing","2022-09-19 06:54:56"
"8","81","4","Turn attorney education every money my page single theory everybody particularly test hospital personal move","2023-07-21 03:10:19"
"8","9","2","Care book ground all office less politics religious back international risk catch check clearly ahead career","2022-05-23 00:41:14"
"8","65","3","Popular word book read pass heart soldier action throughout stage lose board laugh once effect main simply two no","2022-05-17 23:20:38"
"8","12","3","North trouble upon beautiful open free medical lay lose big strategy make population line Congress","2022-03-26 19:11:57"
"8","8","2","Almost identify record own research blood","2022-05-08 00:05:40"
"8","10","3","Everyone win should research executive black tough building child usually sea upon full director race wish","2023-01-11 22:34:51"
"8","51","1","Both something hair do analysis him above bring painting various current scientist culture ability","2022-11-23 07:47:11"
"8","2","4","Other begin war resource evening realize per","2023-06-08 18:26:36"
"8","13","3","Law go simple improve language thousand need when simple difference drop local","2022-12-06 23:11:37"
"8","6","3","Source she light question in court hospital skin soon which thought radio minute rich consumer type Republican organization its plant pay together","2022-12-05 04:12:29"
"8","50","4","Rate clear newspaper ground just keep production suffer life chair senior seem west hour less music throughout region again debate take one them","2022-12-10 22:29:43"
"40","10","2","Once machine western month itself history the bring parent very card center all relationship easy picture enough break factor pattern PM seat my arrive middle add traditional standard","2023-10-12 05:25:01"
"40","81","2","Mother important ball woman you company drop join recognize all structure point especially that product first natural without any remain support realize cause others","2023-10-31 11:10:16"
"40","2","1","Address senior moment buy east example identify likely view around remember take ground eat determine feeling certainly necessary economy agree discussion star","2023-09-05 22:36:16"
"40","52","5","So suggest artist cold measure defense mouth manage camera beat activity stay bank which worker second late every","2023-08-16 00:56:28"
"40","65","1","Phone meeting add challenge project happen white maybe read card look safe street current however list key little fast speak tree give point herself","2023-09-07 01:40:33"
"40","51","4","Reality adult others talk without wall stay describe time peace trade product participant environment purpose prevent again","2023-09-30 20:34:50"
"40","96","1","Option imagine physical treat dinner able job page position possible career be financial plan phone","2023-09-10 07:18:19"
"40","42","3","Once born control white family rock range international everybody book green stay soon","2023-09-05 11:59:40"
"40","5","1","Out human night reflect image throughout western","2023-08-17 07:35:13"
"77","51","2","Environmental deep range ten television model sing then police choice cell seven care","2022-09-21 21:14:40"
"77","52","3","Choose himself north professional modern north good program risk I spring season toward level generation","2021-01-09 20:22:49"
"77","42","2","Specific show pressure local rise general sort stay rise two seven lose","2022-07-05 09:56:57"
"77","13","4","Mention hot happy far deep while movie tend","2023-05-26 17:33:56"
"77","2","4","Summer sea record recent approach trip throughout free civil entire result just nature increase","2022-07-06 11:38:08"
"77","5","3","When thing everyone city contain week carry then election small certainly pattern daughter carry successful imagine weight current open goal probably","2023-04-29 17:15:19"
"77","98","4","Assume heart west training believe system resource truth leave institution to movie seven","2023-01-28 11:03:07"
"77","65","3","Pattern might offer indeed light hot because movement business pull see collection cut drive out image thought nature moment","2020-11-15 10:02:58"
"77","39","1","Key military deep according door line page structure face forget result professor research theory become","2020-11-15 05:34:27"
"77","6","4","Growth specific court yes miss interest rise her along kid explain product","2023-10-23 03:20:23"
"77","50","4","Soldier class personal quickly ok road military west practice physical actually century over short","2021-10-26 09:27:34"
"77","36","1","Center without around four PM hospital against fast drop simply or century","2023-09-27 14:32:51"
"77","82","5","Down positive tough fill happy last hit poor appear since experience perform interest particularly notice military civil","2023-06-06 21:16:34"
"23","6","2","Price job follow result court improve use while buy group return line","2023-09-11 14:25:44"
"23","10","1","Pm benefit arm subject over feeling money newspaper question a certain behavior send laugh cup","2022-09-11 21:58:59"
"23","22","4","Key story agree her whether beyond bar shoulder decade rich director","2023-09-01 18:01:22"
"23","65","3","Party debate into name response garden trip culture far share thought soon large message exist","2023-05-15 18:05:55"
"23","81","4","Truth house try thus should wide return few natural fight stand one significant get interesting when financial race wrong discuss agency","2023-08-17 10:47:37"
"23","50","4","Also long time blood bring spring executive something few allow star forward leave art","2022-11-08 10:44:30"
"86","42","5","Career big remember parent produce cut beyond maintain bag list teacher would road collection big talk role instead candidate phone when room network behind","2023-05-14 17:10:28"
"86","5","5","Measure again ability election race decide tough control stock same project every end catch American true goal section customer","2021-05-31 19:50:01"
"86","14","2","Simple wrong newspaper allow forward hour whom inside establish son turn another wonder reveal yet possible account question","2020-08-24 11:04:16"
"86","50","5","Stand trip all myself tax country then probably or which white get bring society industry control","2022-09-08 23:12:59"
"86","2","3","Education red citizen notice feeling write continue you economy huge miss population fly","2023-05-05 17:15:52"
"86","9","4","Way glass line knowledge season region little continue onto agent green film at best small law campaign value firm key reason","2023-02-04 14:17:35"
"53","82","2","Think person body price you half side price little","2022-08-30 06:33:49"
"53","22","1","Early leave camera future despite child Mr painting role company","2023-03-04 17:55:59"
"53","36","1","City when bag model employee relate anything season hospital machine cell cell TV character build identify throughout example office","2021-12-24 14:22:34"
"53","81","2","Trouble key between seem building care door natural produce team","2021-07-15 03:32:39"
"53","12","2","Thank fish somebody dinner former manager mind scene ago scene south ability no affect catch that area traditional property she push","2023-08-01 22:53:50"
"53","31","1","Child cut often can treat skin seek third since laugh model make speak might fight social","2021-04-21 15:02:41"
"53","13","2","Subject clearly take product building view its contain such approach although say bed second behind vote case none position hand benefit major friend","2022-05-30 09:09:30"
"53","96","5","Senior how artist gas this sort unit operation foreign loss manage each","2023-08-01 10:43:22"
"53","50","5","Speak lay born southern feel fear choose song according foot","2022-12-24 05:25:41"
"53","42","2","Work collection bar drug dark wrong response suddenly wall agree","2023-08-25 07:40:55"
"90","81","5","Current wife budget save child speech represent performance cold if project","2022-04-16 10:45:26"
"90","52","3","Simply degree article available possible order commercial senior current fact scientist nothing change","2021-09-28 12:01:13"
"90","9","2","It start now family above ready lawyer attack simply protect","2023-03-29 12:17:43"
"90","82","3","Other question indeed message picture study customer leader contain culture along budget serious form fight century office indeed","2023-09-21 16:28:05"
"90","50","2","Main occur back book they field five capital white yet people conference indicate actually small case middle resource project","2023-09-20 07:56:47"
"90","8","3","Professor wife get hospital theory protect movement rate effect","2023-10-24 09:07:53"
"90","5","1","East trouble two oil drive local cover interview us up you social cell stage goal can value leave should","2023-08-09 10:14:20"
"90","42","2","Any worry include happy thought early president board bring painting fast magazine east since use out cost game set test friend bill fire through bill seat","2021-09-01 17:59:39"
"7","12","3","Employee situation red at stock sometimes although best various exactly several effect adult run point","2023-07-07 11:16:27"
"7","42","3","Many fine so say movie world show market understand media successful anyone candidate defense discussion cell","2023-02-16 03:52:26"
"7","13","5","Environment land trouble staff follow baby job game according board whole resource strategy black cultural pull above us adult see body","2023-02-28 07:12:57"
"7","82","1","Else behind upon young need simply growth television growth himself game will third and","2023-05-16 10:46:03"
"7","8","5","Structure foot question learn economic recent let receive scene no enough case action institution","2023-04-17 03:14:52"
"7","51","1","Sometimes drive manage management conference energy although well","2023-03-22 12:58:57"
"73","6","3","Probably only each ability carry kid why nothing woman subject you face ready","2023-12-07 02:25:03"
"73","5","5","Offer hope responsibility eight west leader side look give sense","2023-12-06 05:15:10"
"73","8","3","Realize market walk also traditional score dark factor","2023-12-08 09:28:42"
"14","14","4","Night personal sure whether visit speak ahead rock parent some three onto director interesting wear base worry economic shoulder gas right","2022-04-10 15:27:51"
"14","6","4","Young meeting material deep anything town board it big also foreign boy executive year drive small","2022-07-08 13:40:20"
"14","50","2","Land why thought how eye fire growth alone until sell occur person social see apply western feeling","2019-06-29 21:27:33"
"14","81","3","Better of music defense ok still beyond Congress television never discuss truth trial hundred anything morning","2023-11-26 09:05:31"
"14","13","4","Others sort forward policy mouth success federal movement down under white field television its factor herself","2023-07-06 14:57:34"
"14","10","3","Tell one live quickly world police space specific enter hope current page skill indeed four interview return American","2022-07-13 12:20:34"
"14","2","2","After level pattern side collection cold team miss great without finish weight theory result discussion would arrive teacher where close democratic body my behind","2021-12-29 21:26:28"
"14","22","3","Learn age great itself community require computer civil see travel understand term cup painting","2021-01-03 04:22:57"
"14","5","5","Much right phone effect themselves action sound use","2022-12-16 18:44:14"
"14","82","5","Kitchen try trial other night somebody process analysis detail scene pick impact network alone culture","2020-02-21 22:33:42"
"14","51","2","Happen discover she shoulder matter not rich foreign professor will themselves","2020-11-05 05:39:30"
"14","98","2","Pass report through pretty note fear him party sort give program","2019-08-31 14:41:08"
"33","52","5","Start quality if list claim writer modern available include there floor run bag should partner lay cover majority somebody anything economy","2021-01-05 05:39:12"
"33","2","4","Answer treatment another institution whose before why like decide environment adult listen another affect wear just writer citizen sport dream","2021-06-05 12:29:42"
"33","39","5","Question theory per deep method federal easy continue attack expect theory meet morning book whatever building","2020-12-30 09:27:12"
"33","6","3","Expect level window blood doctor even side over role score throw name","2022-11-28 15:46:37"
"33","82","4","Stuff consumer any space what practice town billion painting peace half clearly left fund","2023-07-19 08:56:47"
"33","51","5","Past behind just player nearly police discover lawyer assume away debate positive somebody our green account reason sure act pay","2021-05-17 11:18:57"
"33","81","1","Offer trip occur accept technology all describe coach concern worker laugh action short us likely","2023-10-05 02:28:33"
"33","42","1","Run wall force magazine paper age physical current note friend create choose","2020-05-05 05:51:10"
"33","50","1","According understand happen begin actually team industry only world","2022-12-31 23:26:52"
"33","65","2","Idea remain glass loss increase organization decide share present spend make garden","2020-12-06 01:15:56"
"33","98","4","War partner determine response wide method movie painting then rate measure brother approach five anything rate significant meet adult","2022-08-30 03:57:18"
"55","65","3","Beautiful late find heavy development nice most participant town foot hotel brother","2022-09-23 13:37:18"
"55","10","4","Under rock next week scientist recognize so relationship risk agent dark sound again professor operation next black bag wrong","2023-01-29 21:22:48"
"55","82","4","Someone management pressure feeling member civil audience drive may","2023-07-29 00:17:03"
"55","12","3","Term tree pass he training one consider financial themselves future local her front watch religious star head full thing","2023-10-21 18:38:16"
"55","2","2","Country toward claim civil inside friend service push arrive body modern bit no responsibility","2022-11-14 12:22:08"
"55","6","2","Summer price summer or like crime thank mean edge among direction yard trouble smile media send water happen debate view country adult represent","2023-04-26 13:33:47"
"55","5","1","Contain relate require item field deal wait rate type police finally site tend","2023-05-04 06:10:30"
"55","42","4","Important son participant tree remember recent type","2022-12-28 03:55:31"
"55","50","2","Must cut style agreement step test several news through","2023-08-07 14:39:43"
"55","51","1","Too this want change area either role type start wonder","2023-11-16 12:45:07"
"12","39","2","South environmental which painting degree federal other","2023-08-29 03:16:13"
"12","13","1","Technology practice yes kind kid peace sing decision my support behind describe local unit","2023-04-06 12:07:47"
"12","6","3","Central himself can citizen also leave price box range forget our rule","2023-09-14 15:12:05"
"12","5","5","Purpose either hold base arm upon one start direction night","2023-11-29 13:20:46"
"12","12","1","There question visit race build decision determine choice middle fill far gas career long thousand mention several home yard give","2023-06-25 01:13:44"
"12","50","2","Attention all forward against federal hot here say seem really successful eat","2023-05-10 01:33:32"
"15","12","1","Name student company light data language his few dinner might","2023-10-27 16:59:07"
"15","65","3","Behind section rather check north sort drug bad billion film himself street local shake","2023-06-22 08:38:04"
"15","5","1","Democrat deal pattern thing stage stage choice enough very right right such quickly fall","2023-05-31 09:41:18"
"15","39","3","Much practice talk beat support down wide leader indicate wind news analysis throughout every husband certain yet politics toward people tell them","2023-09-03 21:35:09"
"15","6","2","Behavior indeed marriage why law much modern condition a through","2023-02-17 07:50:47"
"15","10","3","People season throughout degree question above democratic scientist film design newspaper thought must defense fall can","2023-09-17 05:52:37"
"15","81","3","Account join that thing owner where treat member hotel","2023-03-23 06:43:01"
"1","6","1","Especially question new too few know organization information industry customer score sport prepare none they","2023-10-21 14:00:18"
"1","42","3","Set section identify cause offer three itself seek pay marriage model exist data send push film image seem rule until rich risk him decision","2023-11-24 00:34:28"
"1","81","4","Pm think include how participant discover whether language three","2023-11-20 08:44:25"
"1","10","5","Increase they hear truth thing store forget else better single hundred let believe attorney success next close country growth entire","2023-08-20 15:57:04"
"1","12","3","Throw provide suffer list bank let responsibility different campaign world land possible yeah recently","2023-10-13 11:01:10"
"1","2","2","Find ever community project trial debate line news especially since hundred born have need eye bag recent","2023-08-10 14:02:16"
"1","8","2","Find sound join region conference lawyer care nor can wall two everybody first above yet officer","2023-11-08 14:35:19"
"1","52","2","This manager fill mean respond place civil significant together maybe","2023-08-06 17:35:40"
"1","50","1","Common start college wall civil in step guess pattern production face","2023-11-29 06:14:09"
"35","81","4","Thousand season program behind number alone join be part allow say project base","2023-01-14 14:29:02"
"35","50","2","Though program arrive idea it tree onto situation star although skill me movement hand since become black reflect win while","2023-01-30 03:12:12"
"35","8","5","Sell statement deal style fish future property them radio face station career","2023-07-03 10:30:50"
"35","65","4","Still fire take machine them career realize past good","2023-10-01 23:30:43"
"35","96","2","Just ability dinner participant cold machine our hospital agreement artist","2023-11-04 08:44:18"
"30","81","5","Reduce analysis affect task trip already employee grow ok physical who establish husband","2022-11-10 19:35:47"
"30","65","5","Third fight himself suddenly traditional size try nearly community summer third fight project affect unit girl nor range statement religious force us","2023-09-07 02:11:41"
"30","10","4","Nation bar defense brother foot administration meet a growth bill during professional enough","2023-08-04 12:36:25"
"89","42","5","Situation war way happy bad economic voice trial push simply","2023-02-14 07:42:22"
"89","82","4","Gun see individual compare where value team majority would author pressure allow general","2023-03-27 07:41:56"
"89","65","1","Effort kitchen into data miss lawyer machine candidate loss","2023-05-07 14:48:28"
"89","10","2","Difference police identify carry minute parent money huge heart forward none sure will five lay take call machine computer","2023-08-31 21:15:47"
"89","39","3","Amount national war sense often from reach institution name perform themselves author direction democratic political population wrong Mr company if","2023-04-13 00:59:20"
"89","8","2","World office score four force seat spring central then prepare fight crime water miss keep figure produce across treat pattern","2023-05-09 03:55:29"
"89","31","2","West their free baby opportunity environmental certain size","2023-01-28 13:32:08"
"89","6","3","House her move a in politics trouble generation almost score city condition","2023-05-15 12:06:04"
"20","5","4","Help day reality decade probably say front direction security window send the live","2023-11-18 14:01:57"
"20","51","2","They film leader edge clearly voice region until American need outside who respond plant environmental time option a police team better court name among hold","2023-10-22 17:51:58"
"20","2","4","Beyond drop base conference mouth dog magazine particularly behavior north discuss respond today","2023-11-08 13:16:03"
"20","9","2","Garden know throughout particularly ground source dream ok war actually official significant name east than parent indicate","2023-10-22 03:27:50"
"20","50","5","Create chair they always clearly young against wish where Mrs","2023-11-24 08:50:34"
"20","10","1","Technology avoid less food study hit brother reach consider treat road science find west include environment president station","2023-10-25 20:19:45"
"20","22","1","Everyone camera drug partner daughter wind term manager well area probably line and recently pay reach","2023-11-19 17:17:29"
"20","12","4","Development trip song sure seat model report manage much describe ground information new into toward six sing evidence fact purpose","2023-12-05 02:12:38"
"20","96","4","Let reveal difficult article certain director good toward street process work low plan education which important visit article","2023-11-07 05:56:09"
"20","98","3","Professional gun describe nature often smile serious final develop turn machine condition","2023-11-30 19:46:49"
"59","42","5","Laugh door list window that role quickly involve of service drive","2021-02-22 14:07:37"
"59","65","5","Late manager ever quality dark tough subject effect message west take black impact help these which sign politics enter enough knowledge","2021-01-01 02:33:01"
"59","50","2","Air easy dark deal among position onto control","2022-05-03 05:23:25"
"96","8","1","Development low operation training issue far job edge majority behind record above environmental model","2021-11-16 07:44:41"
