"34","82","3","Laugh door list window that role quickly involve of service drive attack safe","2023-11-02 13:12:58"
"34","39","3","Process anyone nor even common over next education because some son yeah whole more understand as girl","2023-11-01 13:12:58"
"34","22","1","Recently similar quickly trouble air easy dark deal among position","2023-11-01 13:12:58"
"70","10","2","Majority behind record above environmental model politics yet yes responsibility heavy the prevent quickly","2023-11-03 13:12:58"
"70","42","4","What someone himself history floor very mother report finally raise","2023-11-02 13:12:58"
"70","50","3","Decision room fine scene out recent federal indeed surface court available","2023-11-01 13:12:58"
"70","81","2","View to whose return war address guy month","2023-11-03 13:12:58"
"70","6","3","Share maintain skill before any impact easy spend a believe save simply some decide keep he fund trouble road resource action home order","2023-11-01 13:12:58"
"70","39","5","Must and speech country admit follow break drop fish house five consumer she eat heart history sort option two others easy send account consumer feeling follow","2023-11-01 13:12:58"
"70","98","3","Fight worry cell foot night tell blue front pass source project","2023-11-04 13:12:58"
"70","51","4","Live though really table today yet bit knowledge coach owner nothing course claim up behavior threat hand social some man maybe among","2023-11-02 13:12:58"
"70","65","3","Fall cover character president defense too check event administration end plan piece meeting drop use dream poor","2023-11-04 13:12:58"
"12","12","1","Assume police sister positive base that his hotel require country wish want amount maybe","2023-11-04 13:12:58"
"12","5","2","Congress help cut threat rise suggest wish travel admit allow reduce everybody especially our","2023-11-01 13:12:58"
"12","31","4","Officer down single southern name nature order story argue page important toward deal follow join opportunity writer manager statement number everyone peace can expect realize","2023-11-03 13:12:58"
"12","6","4","Building result interesting second here cell writer avoid affect read dinner be certainly property mean approach example short available","2023-11-04 13:12:58"
"12","82","5","That about executive computer fear we next believe rather couple which","2023-11-02 13:12:58"
"12","51","2","Shoulder past argue every factor night establish pay quality likely","2023-11-03 13:12:58"
"12","10","2","Miss minute live student plan among relate decade on","2023-11-03 13:12:58"
"12","9","1","Agent record structure one prepare organization certainly blue side speak TV radio network language suffer land lot final safe","2023-11-04 13:12:58"
"12","2","5","Former picture western ability woman head everything rate discussion determine reflect onto","2023-11-01 13:12:58"
"12","42","5","Free behind condition themselves couple language clearly push control something area figure","2023-11-02 13:12:58"
"12","8","5","Give own note along play crime produce nature sea mind wonder accept measure","2023-11-05 13:12:58"
"12","81","3","At term spend agree his performance watch sign than on bar occur","2023-11-04 13:12:58"
"87","96","4","Others boy such bar always pressure force course box campaign","2023-11-03 13:12:58"
"87","12","1","Have south thank possible dream cover since various computer effort between","2023-11-02 13:12:58"
"87","82","1","Huge allow example model town few majority past camera almost relationship hour able discuss beyond hit every single address explain never audience","2023-11-03 13:12:58"
"87","5","1","Several president yard mission suggest site page town question religious herself","2023-11-06 13:12:58"
"87","14","5","Family along community whose player individual reach four brother other tree away help","2023-11-04 13:12:58"
"87","65","2","Hit doctor both change clearly health notice bit","2023-11-01 13:12:58"
"87","13","1","Whom pick very southern thus he behind certainly policy smile kid society quickly daughter country cut environment edge","2023-11-04 13:12:58"
"87","10","4","Line stage democratic sing read reduce his science good major step along marriage east trial","2023-11-01 13:12:58"
"81","51","3","Let party explain big list want degree seek best mention might couple occur to such","2023-11-06 13:12:58"
"81","8","4","Suddenly consumer history toward station ability relate sea skill behind light wall matter different left scientist truth technology","2023-11-01 13:12:58"
"81","6","2","Child image among production old herself concern teacher government pattern","2023-11-03 13:12:58"
"81","52","5","See seek huge today north throughout little who environment decade difficult gun single animal","2023-11-04 13:12:58"
"81","10","5","Wife run behavior recently court leg many effort station by long painting send team number wife as from south detail include join","2023-11-01 13:12:58"
"81","42","3","Professor past contain investment expert something world main case attack break","2023-11-01 13:12:58"
"81","81","2","Glass picture run quite since population develop amount mouth pattern","2023-11-01 13:12:58"
"81","12","5","Foreign indeed within example research professional sometimes still rest raise nor your education century toward large over federal management car break source improve culture","2023-11-03 13:12:58"
"81","39","1","Turn it draw find action with try question manager pass arm couple building animal change","2023-11-01 13:12:58"
"86","98","2","Job them finish health whether middle decade player by","2023-11-03 13:12:58"
"86","51","5","Play have whole building newspaper candidate natural lead even relationship article other image free green name list","2023-11-06 13:12:58"
"86","81","3","Peace should cost doctor would natural laugh all art poor foreign term hear hospital effort store current nor","2023-11-05 13:12:58"
"86","12","2","Write certain wide give front manager course avoid condition despite south possible chance manage position water Democrat owner authority house never agent meet figure nearly lose physical","2023-11-01 13:12:58"
"86","65","2","Own key newspaper theory job free product behind suffer to remain thank","2023-11-04 13:12:58"
"86","6","2","Bed cover white common author hot role me bar so provide old clearly administration style control","2023-11-03 13:12:58"
"33","52","3","Street today hospital lead will with election serve sea PM us fill analysis hope safe picture","2023-11-01 13:12:58"
"33","2","5","Bar avoid positive someone attorney off human eat guess black past middle forward foreign interesting hold level audience school back keep outside general special building expect push","2023-11-03 13:12:58"
"33","65","4","Doctor life prove movement film ground chair consider yeah employee per name tell war","2023-11-05 13:12:58"
"33","81","3","Until cut put tree choice someone prepare business our view herself option end song opportunity population myself itself","2023-11-04 13:12:58"
"33","39","4","Return do may bad important second","2023-11-04 13:12:58"
"33","6","2","For others wear pay medical ball too particularly represent arm ready","2023-11-05 13:12:58"
"33","36","1","Run available summer page discover raise and black Republican sort heavy degree","2023-11-02 13:12:58"
"8","6","2","Produce almost chance recent civil analysis nothing site class","2023-11-02 13:12:58"
"8","65","3","Congress soldier reason first marriage nation way may recent cover debate decade table visit","2023-11-06 13:12:58"
"8","39","5","Every feel huge miss hospital ball east choice mind discussion I investment goal","2023-11-01 13:12:58"
"8","12","1","Game thing trade article head beyond reveal successful","2023-11-04 13:12:58"
"8","10","1","Skill white play affect significant entire away case especially class already herself attention himself sign again season enjoy than","2023-11-06 13:12:58"
"8","98","4","Discover picture defense admit book wonder development peace early none many house","2023-11-03 13:12:58"
"8","42","4","Serve assume affect guess million form interesting eat be air yourself best","2023-11-02 13:12:58"
"8","5","2","Industry hot member itself later for today clearly occur scene stand shoulder avoid Congress list community theory save home sure child","2023-11-04 13:12:58"
"8","50","4","Bit dinner join ahead church responsibility these star boy move skill effect might people recent family I","2023-11-06 13:12:58"
"8","82","3","Door will floor employee drug type million assume shake organization cost fire","2023-11-05 13:12:58"
"8","52","3","Sell include personal scene account short space morning movement stay skill cell local society","2023-11-02 13:12:58"
"50","8","3","Happen soldier human they area threat image arm require open popular probably play later stop bill southern will speak","2023-11-03 13:12:58"
"50","2","4","Two technology get boy break present authority son will rate travel soldier strong charge director","2023-11-04 13:12:58"
"50","81","4","Explain out purpose whole place I item organization arrive know contain economic enjoy sound quickly","2023-11-03 13:12:58"
"50","96","3","Street director peace certainly condition main garden parent green listen field","2023-11-05 13:12:58"
"50","39","3","Western role modern stop blood listen poor draw century process spring health finally effort skill assume finish wish rate decision camera I write","2023-11-06 13:12:58"
"50","52","1","Ready meeting actually top one couple his can already side","2023-11-04 13:12:58"
"50","82","3","Science green role amount night find listen deal dinner paper gun","2023-11-03 13:12:58"
"46","8","5","Program space high about wish half watch exactly standard big affect consider occur common","2023-11-04 13:12:58"
"46","98","1","Number brother necessary can moment remain raise","2023-11-06 13:12:58"
"46","22","1","West growth important serve compare dark design treatment table star between though weight","2023-11-03 13:12:58"
"46","51","2","Two letter form character opportunity particular describe help","2023-11-02 13:12:58"
"46","2","1","List someone white enjoy join goal test animal enough southern","2023-11-05 13:12:58"
"46","6","1","Recently would own increase base star person recent election wonder low public president cut table boy","2023-11-06 13:12:58"
"46","39","2","Hand red speak agency class campaign such bag require her market individual","2023-11-02 13:12:58"
"46","10","2","Impact agreement according mother protect pretty notice know star teach","2023-11-01 13:12:58"
"46","42","2","Side drive inside nice indeed top west","2023-11-01 13:12:58"
"95","2","1","Around animal skin event season quite affect pull thing consider region find phone itself think","2023-11-03 13:12:58"
"95","65","3","Page popular continue day source court relationship campaign mention treatment imagine community value store suddenly major who federal only easy though meeting new","2023-11-03 13:12:58"
"95","22","5","Charge person rock as a require suffer agency nor remain threat him","2023-11-03 13:12:58"
"95","81","2","Magazine speech music despite guess move add standard south include mission scene decision affect choose great tree deal front decade remain up people road","2023-11-05 13:12:58"
"95","9","5","Animal task language at take side red store carry conference read its southern rest pretty deal","2023-11-02 13:12:58"
"95","5","1","Off plant commercial address artist strong page very site score share push kid","2023-11-06 13:12:58"
"95","42","4","Market tree ahead major good follow develop pass prove responsibility American","2023-11-02 13:12:58"
"95","6","2","Fact miss left including box improve factor","2023-11-03 13:12:58"
"91","13","2","Energy hundred low south owner institution hand nothing author sign soon particular building end return ever try product thing beyond","2023-11-03 13:12:58"
"91","50","1","Although middle hot affect friend glass home six event time you man so officer consumer","2023-11-04 13:12:58"
"91","81","1","Perhaps data tend name effect lot give people young probably increase next natural range recognize much light officer election important brother","2023-11-06 13:12:58"
"91","31","1","Mission never bank rule say skin him","2023-11-04 13:12:58"
"91","52","2","Focus long sea teacher among garden once good partner process know politics food month bit no person","2023-11-05 13:12:58"
"91","6","3","Modern thought common range prepare player east including consumer your","2023-11-06 13:12:58"
"91","82","4","Research ground economic pay back play language have hear citizen scene choice dark tend","2023-11-04 13:12:58"
"91","12","1","Billion benefit chair age compare people meeting century lead there soon","2023-11-02 13:12:58"
"1","82","2","Why if occur bit what provide training allow until push story poor according paper discover place group force agreement question","2023-11-05 13:12:58"
"1","6","4","Response option instead full use much more federal suffer rich seem plant prepare evidence","2023-11-01 13:12:58"
"1","13","1","Environment likely rate than what professional cover various second report certain possible him","2023-11-01 13:12:58"
"1","65","4","Congress economic option feel fill about article lead air","2023-11-01 13:12:58"
"1","81","2","Two school structure human southern huge player me whole cup staff let decision","2023-11-01 13:12:58"
"1","12","5","Military change better quality history find great medical discover even while hand speech green","2023-11-06 13:12:58"
"1","98","5","Action because door teacher hold school leg college ground center commercial represent general site","2023-11-04 13:12:58"
"1","42","4","Act little unit direction dream candidate recent professional professional remain recognize","2023-11-05 13:12:58"
"76","10","5","Strategy base black cold near mission involve sell represent central feel right performance everybody key who strategy owner","2023-11-01 13:12:58"
"76","5","3","Spend whom plant cultural day east quickly PM new learn head","2023-11-06 13:12:58"
"76","98","2","Then financial people prove can station human audience type play exactly those fear subject particularly high","2023-11-02 13:12:58"
"76","81","5","Pretty firm begin understand else glass city television on certain step similar point prove improve","2023-11-04 13:12:58"
"76","9","4","Easy outside question practice church act main too cause father","2023-11-01 13:12:58"
"76","6","4","Sea avoid goal view few type feeling grow his appear clearly heart expect area four it","2023-11-03 13:12:58"
"76","65","3","Forget shake wish employee whatever stay few heavy find bring sit she young","2023-11-05 13:12:58"
"76","51","4","Media clear yourself maintain ball really these out wonder list bit positive there","2023-11-02 13:12:58"
"76","50","5","Coach site in reality as dinner protect represent consider quality American wrong president evening network hair create student safe","2023-11-04 13:12:58"
"42","42","3","Trade audience determine shake nothing heavy herself forward even hotel image hotel expert professional school culture without clearly","2023-11-01 13:12:58"
"42","96","5","Cell time other discuss light nature writer later cause expect head similar","2023-11-03 13:12:58"
"42","6","5","Way many debate hear partner value wear note along sure yet language red other phone so inside especially family close relationship she event majority","2023-11-02 13:12:58"
"42","81","3","Thank bank simply teach garden space while all cell seem herself inside unit mention blue style much boy","2023-11-01 13:12:58"
"42","31","1","Outside fall can college history instead ok senior idea my sometimes ago consumer","2023-11-03 13:12:58"
"42","22","4","Behavior customer station officer toward each every fine let action nation happy sound no answer increase true return","2023-11-03 13:12:58"
"42","52","3","Black must picture man believe better quite which deal thing audience like public idea space foot number PM notice key","2023-11-04 13:12:58"
"42","39","2","Remember fact guy than arm from left","2023-11-01 13:12:58"
"42","13","5","Case everybody effect pick system herself year let child company matter maybe interest culture become once case media","2023-11-05 13:12:58"
"42","82","5","Account real physical development training guess within successful team likely sort read security each role care field keep act often language through heart","2023-11-06 13:12:58"
"42","10","3","Program possible performance reveal city parent source positive town total step minute south will tend","2023-11-05 13:12:58"
"77","22","1","Hand sell carry population bring loss form maintain thus if blue","2023-11-03 13:12:58"
"77","98","5","Clearly never quickly along firm we room response nation across popular call near benefit","2023-11-02 13:12:58"
"77","5","4","Share fire believe man parent form drug success sea door maintain loss she mind or picture draw","2023-11-06 13:12:58"
"77","39","1","Military senior reflect author base international admit moment such add determine ten agent possible enjoy particular still why performance way task","2023-11-05 13:12:58"
"77","12","4","Daughter talk system wind off analysis turn natural may government century prepare treat","2023-11-03 13:12:58"
"77","82","2","Seem significant return forward major war while together church enough machine foot issue prevent teacher by north police shake foreign both material wrong camera","2023-11-04 13:12:58"
"77","6","2","Red himself job sound land more","2023-11-03 13:12:58"
"77","50","1","Soon whose business try real build with both black public drop born upon this","2023-11-02 13:12:58"
"77","31","3","Audience scene same citizen thousand language agent trip born deal yourself air he tree these also","2023-11-03 13:12:58"
"78","13","3","Guy school yeah religious heart own whose risk resource popular let light","2023-11-03 13:12:58"
"78","9","1","Turn budget action this radio whose car mean form water safe certainly","2023-11-06 13:12:58"
"78","6","1","Forward last bed play look property there","2023-11-03 13:12:58"
"78","42","5","Same degree strong over authority one discussion international deal chance ever blood","2023-11-01 13:12:58"
"78","5","5","Wall push employee fly out think responsibility party teach society red could","2023-11-06 13:12:58"
"78","36","4","Theory account positive Congress thousand high apply great attorney interesting throughout add imagine goal step rest treat head you reason buy public nice","2023-11-06 13:12:58"
"78","2","2","Notice live figure nature rise behind product write cover drug","2023-11-03 13:12:58"
"99","2","1","Stand increase hold provide article drop join well my","2023-11-02 13:12:58"
"99","52","1","Man main east play whose step","2023-11-03 13:12:58"
"99","51","4","City far key agent usually important option perform usually detail road meet wall author behavior","2023-11-01 13:12:58"
"99","98","1","Meet difficult leader happy small ago boy value night yet physical before treatment direction rock how test street","2023-11-06 13:12:58"
"99","81","3","Stay they reason very week seat hundred","2023-11-02 13:12:58"
"99","10","3","Use fund store woman chair wife nor instead at continue knowledge represent along window activity article act have","2023-11-01 13:12:58"
"99","82","3","Very future animal training only allow attack think current so call ball","2023-11-04 13:12:58"
"99","50","1","Half little direction party defense very fear always size friend man minute clear understand director Mrs huge with energy government could report such bank off","2023-11-05 13:12:58"
"99","42","3","Threat foot economic shake stage public also then research film value behind against someone structure","2023-11-01 13:12:58"
"99","96","3","General today own have bill song federal nothing soon year appear phone card film appear build discussion","2023-11-01 13:12:58"
"99","14","2","Quite Democrat center structure study it magazine technology management matter policy strong them standard sure campaign","2023-11-03 13:12:58"
"99","22","5","Work along blue kid amount seek environment hold class","2023-11-03 13:12:58"
"99","65","2","Serve war bar threat money individual house blue natural town account top","2023-11-04 13:12:58"
"99","5","3","Health begin cover whole citizen building push behind politics","2023-11-01 13:12:58"
"96","14","3","Report professional commercial center technology difference nearly attorney reduce little model several officer base help official contain certain ok","2023-11-03 13:12:58"
"96","98","1","Assume politics yourself partner officer remain tree into rich effort near red number of","2023-11-01 13:12:58"
"96","12","4","Seven security everything church war real home accept Democrat maintain moment exactly","2023-11-06 13:12:58"
"96","10","3","Mention do international traditional owner even everything discuss above court finish many economic skill whole raise compare usually find before","2023-11-05 13:12:58"
"96","31","1","Record page citizen own particularly throughout Congress that for much his open learn ago become source","2023-11-05 13:12:58"
"80","9","1","Difference treat tax foreign oil identify customer wish before you","2023-11-06 13:12:58"
"80","22","5","Around green send image rate evidence throw stand like just tell cover next","2023-11-02 13:12:58"
"80","13","5","Free mouth the suffer bar condition choose easy both newspaper put eat listen action","2023-11-05 13:12:58"
"80","36","4","About their month cup early way born happen more girl experience high let fish camera","2023-11-03 13:12:58"
"80","2","2","Every receive century stage father agency night involve place important approach play","2023-11-04 13:12:58"
"80","81","3","Window early side common civil notice theory front others receive find animal often piece off rest","2023-11-02 13:12:58"
"72","42","4","Light short fish assume attention physical until seem evidence commercial cultural response quality improve power system very move","2023-11-04 13:12:58"
"72","10","2","Part us will money time coach possible us defense would prove","2023-11-05 13:12:58"
"72","51","1","Learn shoulder green itself particular even part thus career people suddenly kind chance these office explain realize animal back only between investment","2023-11-01 13:12:58"
"72","2","4","Response already computer daughter man city beyond no board whether since","2023-11-02 13:12:58"
"72","50","1","Available east consider song glass part cup wall ahead require job everyone many laugh attack cause single boy approach receive","2023-11-03 13:12:58"
"72","81","2","Since skin clear easy until score effort family air opportunity ahead","2023-11-05 13:12:58"
"72","13","2","Government money relationship lead dog say inside science hundred everyone suddenly special","2023-11-02 13:12:58"
"72","98","4","Why tax fine assume marriage result include anything evening night night according","2023-11-01 13:12:58"
"72","65","1","Only push item newspaper forget hope first card occur test imagine investment","2023-11-01 13:12:58"
"72","22","2","Nature candidate month technology tree computer break last attorney buy carry as player pass TV analysis response can later represent player report","2023-11-04 13:12:58"
"72","82","3","Poor before anyone painting wonder walk which old last respond past television travel property film many school risk bank and","2023-11-01 13:12:58"
"72","9","3","Pull rock baby surface decide term size century executive there","2023-11-06 13:12:58"
"15","5","4","Newspaper maybe quickly thousand have result need value pretty sense relationship guess lay that international run address pull leader natural property suggest conference notice resource","2023-11-01 13:12:58"
"15","52","2","Physical character learn story law whatever Republican industry toward seek how dark begin movie computer rather hope effect walk together little","2023-11-05 13:12:58"
"15","50","5","Usually want market us skin speak collection modern step room side","2023-11-01 13:12:58"
"15","65","4","Him those beautiful address thing medical decade mother break system reality compare at program whole family stop defense business include","2023-11-01 13:12:58"
"29","13","2","Support million treatment small about city middle anyone much himself process national shake situation live civil lay tax determine","2023-11-04 13:12:58"
"29","81","1","Rest involve control explain hope old stand laugh war from high son hard yourself not possible movement full read","2023-11-05 13:12:58"
"29","50","4","Natural month account control third really detail entire fish capital quite commercial beyond technology system television everyone during quite theory","2023-11-06 13:12:58"
"29","42","3","Also sign outside product strong discover trip material add southern discuss structure degree care night agency cover sister often","2023-11-05 13:12:58"
"29","6","3","Son son old kind large indeed week bad who event method health add run situation know decision employee effort","2023-11-06 13:12:58"
"29","22","4","Know court recent long on win end instead oil low nation force marriage","2023-11-04 13:12:58"
"29","65","2","Blue might decade coach bring nor American away north building front return draw hundred ability accept usually high my somebody","2023-11-03 13:12:58"
"61","6","2","Degree but speech particular pull simply father line assume follow during happy detail drive ago concern pattern certainly","2023-11-05 13:12:58"
"61","2","1","Become tough then great cost parent cost seek physical early common training moment hear nation","2023-11-01 13:12:58"
"74","5","3","Outside writer human upon community late should first writer right drug his while remain health stuff","2023-11-04 13:12:58"
"74","6","3","Reflect go someone church mouth medical rich former term couple answer let hit turn those big","2023-11-01 13:12:58"
"74","42","4","Reason tough score range she surface ball oil","2023-11-05 13:12:58"
