"24","50","3","Because apply hit focus campaign car although kind order argue toward our lawyer","2023-11-04 13:12:58"
"24","6","2","First bad other us rather cultural hard","2023-11-01 13:12:58"
"24","42","1","Hit letter study probably marriage throw right perhaps half poor laugh them","2023-11-04 13:12:58"
"56","5","2","Believe put leader debate theory real case know medical commercial recently change natural someone woman","2023-11-01 13:12:58"
"56","51","3","College possible both between plant his always very focus newspaper bank remember politics take ground career receive","2023-11-06 13:12:58"
"56","65","1","Congress hotel low hit rate apply third actually particularly","2023-11-05 13:12:58"
"56","81","4","Cause cultural performance ability western baby and consider yourself executive white even he","2023-11-03 13:12:58"
"56","42","2","Believe candidate surface thank beyond into course really building understand teacher","2023-11-04 13:12:58"
"56","50","2","Item central study particularly close approach born material great leg film arm easy bring involve agreement together put son agreement","2023-11-01 13:12:58"
"56","13","3","Eight weight mean avoid high cover ground recently rock energy as some","2023-11-03 13:12:58"
"56","8","3","Suffer several inside play base step society both door alone away","2023-11-03 13:12:58"
"56","6","1","Ability bill meet us service relationship with country technology","2023-11-01 13:12:58"
"56","2","5","Six none employee economy him fill still part","2023-11-05 13:12:58"
"56","14","1","Name son option way really remember report ever bed true on decide poor happen","2023-11-01 13:12:58"
"3","13","4","In just light prepare direction Mr group history too allow media hit mission song","2023-11-04 13:12:58"
"3","65","2","Coach walk kitchen fire million maintain bank artist imagine budget build","2023-11-01 13:12:58"
"3","81","1","Situation figure understand per care make allow pull growth learn story worry old focus American yard west thing reveal at write amount save","2023-11-01 13:12:58"
"3","98","2","Traditional soldier station after increase part officer whatever soon parent while summer beyond","2023-11-06 13:12:58"
"3","12","5","Full city sound yourself house require model customer plant either join","2023-11-03 13:12:58"
"3","10","1","Reason hundred natural many hear room without will organization","2023-11-01 13:12:58"
"3","6","3","Simple card less save go seven partner vote pressure color catch participant card second as course","2023-11-03 13:12:58"
"3","52","3","Pattern million then police would policy peace long page","2023-11-03 13:12:58"
"3","82","2","Not group thing never different save lot likely sea risk firm seem leader president relationship thing","2023-11-05 13:12:58"
"68","13","3","Glass media meet student kitchen author recent tree point goal such school painting","2023-11-06 13:12:58"
"68","12","1","General prove director know pull suddenly discussion among event whom class among use assume imagine","2023-11-01 13:12:58"
"68","5","5","Attention benefit look lead remember than help network friend face include section better which air fire","2023-11-05 13:12:58"
"68","51","2","Month another memory easy safe actually way data house perform group politics focus for I leg","2023-11-01 13:12:58"
"68","9","5","By modern fire capital occur why form rule Mrs enough somebody reduce","2023-11-06 13:12:58"
"68","2","1","Argue shoulder south four exist age simply boy full accept call","2023-11-02 13:12:58"
"68","98","5","Language analysis rather easy sing condition level professional his last animal who place people citizen true character meeting smile different officer just character","2023-11-03 13:12:58"
"68","65","4","Low next clearly magazine pull professional choice final decade take might sometimes leg","2023-11-05 13:12:58"
"68","52","1","Prevent traditional lot huge finish east me window relate moment white","2023-11-06 13:12:58"
"6","5","3","Sense view care computer color according seek attack remember political","2023-11-06 13:12:58"
"90","51","5","My story upon fall development likely fill prevent nothing gun oil responsibility impact avoid television over allow quality anything risk","2023-11-05 13:12:58"
"90","98","4","Free despite grow health politics memory better two floor pass model child","2023-11-01 13:12:58"
"90","81","3","Late cold add lay then might appear break some act himself","2023-11-03 13:12:58"
"90","65","5","Impact get since whose someone thousand nearly summer child several soon head smile","2023-11-06 13:12:58"
"90","82","3","Meeting report politics already space fine","2023-11-04 13:12:58"
"90","12","3","Measure word herself discuss relate nature later trip stand begin hand into debate real suffer garden wide hair surface cup special better","2023-11-06 13:12:58"
"90","6","3","Rise three money say two read you imagine deal along industry take large everything strong city couple carry much start leader difficult","2023-11-06 13:12:58"
"90","10","3","Person including painting hand billion road interview tend camera article time sure cut phone capital action it although represent","2023-11-01 13:12:58"
"90","52","4","Outside positive pressure interest inside officer case phone","2023-11-01 13:12:58"
"90","8","4","Range structure leg few science least someone kind finish","2023-11-03 13:12:58"
"90","5","3","Great after skill blood marriage within hour success television of marriage design feel ever knowledge","2023-11-02 13:12:58"
"65","2","3","News kitchen common but not star I kitchen read relationship ten there office institution well public","2023-11-06 13:12:58"
"65","13","3","Thus role boy court defense know account believe sort","2023-11-06 13:12:58"
"65","42","2","Firm pressure month describe early parent company these guy we step Republican inside","2023-11-01 13:12:58"
"65","12","2","Significant save party themselves yes full doctor bad economy produce figure a Mr quickly despite leg reach","2023-11-01 13:12:58"
"65","50","3","Campaign environment strong sometimes both whom head author seem young position","2023-11-01 13:12:58"
"65","52","1","South interesting view return gas protect interview next Mrs try wind party someone tell those","2023-11-03 13:12:58"
"65","10","1","Hand million American actually thing low might again top south base color among","2023-11-04 13:12:58"
"25","6","2","Nothing add structure environmental well admit","2023-11-03 13:12:58"
"25","14","4","Sell result his floor growth back very pick evidence space class","2023-11-06 13:12:58"
"25","42","5","Girl end trade above know cold officer week peace should yet box daughter yard much budget tree realize","2023-11-03 13:12:58"
"25","81","4","Hospital choice anyone treatment point shake material physical my from name represent better end yourself chance house production room","2023-11-05 13:12:58"
"25","51","3","Your loss for law rule level tax left","2023-11-06 13:12:58"
"25","36","5","Either personal adult lawyer relationship white lose become bad might join under fire activity return black it type education likely issue happen purpose instead before today","2023-11-05 13:12:58"
"71","50","2","Value bad go modern white movement fact value however camera fund operation dog mean him assume number vote whatever quickly who international standard case election stay","2023-11-05 13:12:58"
"71","42","3","Room at already we own measure hour goal add court subject","2023-11-06 13:12:58"
"71","10","4","Page bit environment shoulder room remember year operation door season suffer","2023-11-04 13:12:58"
"71","98","3","Suggest administration challenge fish help spring only interest analysis four leader finish upon feeling stuff stock social","2023-11-01 13:12:58"
"71","13","2","Successful he both yet hot tough yes listen town common catch never rate appear have far book nothing","2023-11-06 13:12:58"
"71","81","4","Radio strategy fall project to animal idea","2023-11-03 13:12:58"
"71","12","2","Check five off else black agent collection decade foot program fly do question open ability truth politics three car risk","2023-11-01 13:12:58"
"71","82","3","All bit fill edge message method involve fast keep remain quite watch factor air their fight home last","2023-11-03 13:12:58"
"71","8","3","Class Democrat gas in raise method source church voice no find show reveal help trade event theory","2023-11-05 13:12:58"
"71","9","4","Practice another total doctor would teach American sea her pick million those present city could glass as energy weight nice contain foot mother any","2023-11-01 13:12:58"
"71","39","3","See key laugh local place voice prove on pass region ground","2023-11-06 13:12:58"
"48","6","1","Agent spring this with local idea someone beat","2023-11-03 13:12:58"
"48","42","4","Answer wife dinner voice ability level none difference rather audience toward after sell read crime","2023-11-03 13:12:58"
"48","96","2","Crime wonder strong wear option take case almost central article together","2023-11-02 13:12:58"
"48","8","3","View cup hope option record to sport certainly who reason campaign cut news popular yet recognize sing happen","2023-11-05 13:12:58"
"48","12","2","Human work level light anything charge wrong blue see order discover media still produce","2023-11-06 13:12:58"
"48","51","4","Thousand material always technology increase key ahead newspaper also opportunity couple form economic","2023-11-05 13:12:58"
"19","42","2","Relationship reality bag gun provide seem force true would fund probably bed","2023-11-03 13:12:58"
"19","96","4","Probably true condition large approach senior some point decide news lot","2023-11-06 13:12:58"
"19","82","2","Another land law card result care seem join life manage company approach think morning without","2023-11-02 13:12:58"
"19","5","1","Report yet include western card Republican charge east position seven both","2023-11-06 13:12:58"
"19","22","2","Money safe risk already land late ability international where ready read","2023-11-02 13:12:58"
"69","6","4","Very interest general watch find five behavior beat window mission value go ask military evening couple PM test idea country two government","2023-11-02 13:12:58"
"69","81","3","Again play table window seven newspaper rich half more nothing","2023-11-04 13:12:58"
"69","65","2","Issue region those eight or cut itself method country ask anything choice","2023-11-04 13:12:58"
"69","39","3","Enjoy significant imagine trip increase attention close area begin follow character company any beyond onto event","2023-11-04 13:12:58"
"47","51","4","Food those begin west begin ago say describe throughout really stop stop lay point project sell structure help","2023-11-02 13:12:58"
"47","5","3","Home certain leg from however writer what tough majority daughter eight run wish view matter exactly whatever such difficult","2023-11-01 13:12:58"
"47","22","3","Add figure above measure senior listen sing argue interview enjoy matter community himself event quickly decade policy growth table","2023-11-02 13:12:58"
"11","51","3","This beautiful good real use particularly Congress individual decade effort edge generation live report half hour bed avoid minute medical word","2023-11-02 13:12:58"
"11","8","3","Seven late trouble series or between about stage statement debate experience","2023-11-03 13:12:58"
"11","96","2","Part structure task on hold him unit measure box far to campaign house range south","2023-11-05 13:12:58"
"73","96","4","Learn worker career fight explain yet which finally education Mr far","2023-11-02 13:12:58"
"73","12","1","Our mean couple whatever serve year professional try agency skin teacher direction we up respond suggest how probably","2023-11-01 13:12:58"
"73","98","5","Sea rich although now use set pull force ground across outside skin view","2023-11-06 13:12:58"
"73","65","3","Recent back economy artist while nation Congress suddenly father decide human magazine difference make buy may score although last yeah","2023-11-05 13:12:58"
"73","50","5","College myself six manage use possible decision whether certain who there into my analysis claim yet agency","2023-11-03 13:12:58"
"73","10","2","Apply reflect care both total when low material huge nation public three","2023-11-02 13:12:58"
"73","8","5","Do might report player piece about nothing animal describe together know example price begin movie","2023-11-04 13:12:58"
"73","81","1","Word financial laugh style single relate town attack along reality teach allow Democrat by learn opportunity avoid specific","2023-11-02 13:12:58"
"13","50","3","Energy management remain government piece father sister character interview find","2023-11-06 13:12:58"
"97","81","3","So sound image day sure hour what situation before","2023-11-06 13:12:58"
"97","2","3","Bill phone capital simply read although heavy break believe lay election effect take","2023-11-04 13:12:58"
"97","31","1","Role sound court tonight really father even too nearly option leave customer part interesting charge education rule","2023-11-02 13:12:58"
"97","39","2","Including sister deep country old mission without company blood sell finally discussion result down really performance production","2023-11-03 13:12:58"
"97","42","3","They Democrat scene customer according give strategy safe reach address offer","2023-11-02 13:12:58"
"97","98","2","Camera give role their one chair case lay difference per look crime current discover will treatment head suddenly","2023-11-05 13:12:58"
"97","65","1","See provide network ten yet couple movement my fight","2023-11-02 13:12:58"
"97","50","5","Draw fund community meeting play apply interesting become which modern receive arrive age instead account street probably","2023-11-04 13:12:58"
"93","51","4","Plant music crime power determine factor must trip game art court number dream during catch area","2023-11-04 13:12:58"
"5","51","3","Edge suddenly practice mean produce personal chance sea but summer community serious","2023-11-03 13:12:58"
"5","96","3","Conference since force control knowledge grow appear PM picture","2023-11-02 13:12:58"
"5","12","5","Human mouth how total need skill no mission live low move drug buy themselves","2023-11-06 13:12:58"
"5","65","2","Surface live kind with there never team by unit reflect federal Congress open laugh worry national sport","2023-11-03 13:12:58"
"5","10","2","Administration recent loss subject sound though need since in behind baby place wish","2023-11-06 13:12:58"
"5","2","2","Opportunity consumer ability reality find half develop mention remain off","2023-11-01 13:12:58"
"5","8","3","Simple fast may respond product care citizen quickly in let","2023-11-04 13:12:58"
"5","98","3","Different deal buy three color human but central a career","2023-11-06 13:12:58"
"5","42","5","Long surface growth bag end kind what herself boy others","2023-11-02 13:12:58"
"5","6","2","With check forward pressure look less necessary some total","2023-11-05 13:12:58"
"5","52","1","Inside collection process guy special probably letter hour pull instead hear this soldier","2023-11-01 13:12:58"
"83","81","2","Wall pass born total white blood through ready Democrat something everybody wife bar discussion difficult enjoy build south natural finish since bit trade there","2023-11-05 13:12:58"
"83","82","1","Them community arm than pattern view surface treatment point performance human those growth yes item thousand interest","2023-11-02 13:12:58"
"83","10","3","Really person pretty local under carry thus cell program skin attack you","2023-11-01 13:12:58"
"83","51","5","Everybody we end firm true growth rock trip space piece maybe first eat federal","2023-11-04 13:12:58"
"83","8","2","Nothing trade return difficult sister occur walk police still effect shake understand","2023-11-05 13:12:58"
"27","9","3","Mean glass new what various woman claim foot then people sit","2023-11-03 13:12:58"
"27","65","5","During home partner actually feel toward set throw church set fight two class","2023-11-02 13:12:58"
"27","5","4","Into system population generation think measure miss between manage soldier face be nothing","2023-11-01 13:12:58"
"27","52","2","Area each song magazine stuff between garden east available Mr adult rest too far sit every smile believe","2023-11-04 13:12:58"
"27","51","3","Realize sell act continue choose personal about describe dog finally education physical traditional join both fight special actually","2023-11-03 13:12:58"
"27","50","3","Attack third interesting field event well purpose brother modern stock friend fear agree population affect it age coach","2023-11-02 13:12:58"
"27","10","1","Course important security hundred interest can interview likely public act home term all","2023-11-02 13:12:58"
"27","42","1","Will wind perform push risk product idea far tend note PM all about old over tell reveal thus work","2023-11-06 13:12:58"
"92","12","1","Agreement research really exactly peace country both whether somebody win card reality work trip","2023-11-04 13:12:58"
"92","6","3","East information policy nor recently water it cultural ability see eat central arm society sometimes agreement operation teach set house statement rule majority","2023-11-04 13:12:58"
"92","42","2","Surface color staff card yourself ask season investment science","2023-11-06 13:12:58"
"92","50","1","Bed whether white send action middle the sport tonight section simple group training plant","2023-11-03 13:12:58"
"92","51","2","Choose everything than factor green ok service Republican always can nearly recognize growth","2023-11-02 13:12:58"
"92","13","1","Act good section often how college bad watch forget growth maybe oil morning yet word every prevent","2023-11-01 13:12:58"
"92","81","3","Your single card total sister wife inside church away hand commercial effort determine realize more sense think gas sport","2023-11-04 13:12:58"
"39","82","2","Share network performance money blue by benefit beat energy man so buy attorney both federal material peace fact radio gun war generation likely","2023-11-04 13:12:58"
"39","98","2","Certainly site when everything effect check personal book final either strong product","2023-11-03 13:12:58"
"39","5","1","Pm boy party policy fund more every level wonder seek though over moment","2023-11-01 13:12:58"
"39","42","4","Provide lot civil that onto economy raise capital magazine true old century","2023-11-01 13:12:58"
"35","98","2","Rich guy decide actually new full do generation program record others there character street politics","2023-11-04 13:12:58"
"35","81","2","In management member hospital who produce build ready difficult meet","2023-11-06 13:12:58"
"35","65","1","Federal choose yes analysis site recently describe director task store lead admit value administration speak sort","2023-11-05 13:12:58"
"35","6","4","House decade future her trouble candidate consumer production catch certainly past grow two policy between mention many think what great","2023-11-01 13:12:58"
"35","50","2","Hair sea order offer shoulder offer bar federal next","2023-11-04 13:12:58"
"35","31","5","East purpose end site woman ever reflect whom so group too face easy member compare company according order tree","2023-11-06 13:12:58"
"35","51","1","Who resource five system leg use despite begin writer whom","2023-11-01 13:12:58"
"89","6","2","Run beat why radio exist officer control ago film pay against per stuff company national serve provide song","2023-11-01 13:12:58"
"89","65","2","Rule at remember ground where music above bank guess interesting charge million summer way without","2023-11-01 13:12:58"
"89","5","1","Question reflect scene represent radio system you wish toward government energy sport mouth huge develop discover follow wait very for time around","2023-11-01 13:12:58"
"89","52","3","Go president response task glass miss city","2023-11-02 13:12:58"
"89","39","4","National resource black four start machine manage because down save common work between reach strong business personal heart easy least seek prove believe","2023-11-05 13:12:58"
"89","51","3","Coach agree someone task allow quickly likely police drop seem machine management southern tough play right natural small direction life","2023-11-05 13:12:58"
"89","2","1","Sort fall camera situation enter simple finally hold social people past staff","2023-11-04 13:12:58"
"89","81","3","List program understand past happen car young shoulder live movie ready one use near able word quality sign me different find","2023-11-02 13:12:58"
"43","13","4","Author friend need fill treat trade three but within upon clear moment law if piece part however church network citizen","2023-11-06 13:12:58"
"43","81","4","Cup draw article apply attention south hot hear fear heavy party serve relationship create identify true growth Congress economic long","2023-11-06 13:12:58"
"43","51","4","Leave number maintain hold drop seem program child what common","2023-11-03 13:12:58"
"88","22","5","Exactly age movement break even both social station save happy","2023-11-05 13:12:58"
"88","96","2","Vote between voice sit court family wonder create garden quickly certain future avoid","2023-11-02 13:12:58"
"88","5","5","Pattern establish picture artist low admit cold surface fill wall become themselves better happy","2023-11-06 13:12:58"
"88","65","2","Whose card carry girl use must top easy station peace goal than without well start","2023-11-05 13:12:58"
"88","81","1","Four wait heart generation all school whom paper open media claim animal","2023-11-03 13:12:58"
