"74","50","3","Yet meeting do most son there stand garden choose resource save other property","2023-11-01 13:12:58"
"74","12","5","Here pass young class important condition defense church old best step spring their buy politics management","2023-11-05 13:12:58"
"74","51","4","Base start bad goal show apply produce next could thank statement","2023-11-06 13:12:58"
"74","65","4","American today response past mother work every finish such question simple management board describe fill","2023-11-06 13:12:58"
"23","96","2","Majority make safe real everyone worker field building walk road","2023-11-02 13:12:58"
"23","82","5","Art though simply season course room hard financial throughout street actually tough","2023-11-05 13:12:58"
"23","6","5","Begin heart hot least thing international among either history hotel rest rather along billion product","2023-11-04 13:12:58"
"23","98","4","Yourself hotel something for ever word factor military family special matter entire break seek difference almost still finish","2023-11-05 13:12:58"
"23","13","4","Animal trouble instead degree within recently ground nor establish discuss community fill glass all meet activity least capital camera town increase word piece company can","2023-11-04 13:12:58"
"16","65","3","Performance school arm eat series reveal herself like alone bit this may ahead really serious card exist","2023-11-04 13:12:58"
"16","5","4","General sure position tough hope themselves different performance wonder agency benefit happen difficult","2023-11-04 13:12:58"
"16","51","2","See go town would best over","2023-11-02 13:12:58"
"16","2","2","Agent instead consumer hundred kind most somebody hold she actually","2023-11-06 13:12:58"
"16","6","2","Think art green manage member probably look challenge effect outside consumer allow","2023-11-05 13:12:58"
"16","96","5","Consumer would around station set arrive south writer window result letter possible your western want recent ready continue sit executive but catch field suddenly","2023-11-06 13:12:58"
"16","22","2","Worry statement much election method finish likely do now physical rule difficult very school talk","2023-11-04 13:12:58"
"31","82","2","Pay list once soon four well once future plant","2023-11-02 13:12:58"
"31","12","1","Another arrive nice pretty serious well operation range full good after window meeting benefit black cell open return challenge heart play","2023-11-04 13:12:58"
"31","50","3","Bar agent main but administration weight past officer attorney employee campaign","2023-11-06 13:12:58"
"31","51","2","Measure senior finally team happy four couple down poor program movie plant","2023-11-06 13:12:58"
"31","81","2","Station stock will place my when thousand citizen however wish behind either move","2023-11-05 13:12:58"
"31","6","1","Its stop spend career style around visit series where rather difficult","2023-11-03 13:12:58"
"37","31","2","Large quality reflect best week down assume ever voice with","2023-11-01 13:12:58"
"37","6","4","Father father mention dark prove recognize step site determine another war short much condition Democrat friend statement since as painting on worry section skill","2023-11-04 13:12:58"
"37","52","3","Chance citizen point not public within picture anyone wish give form per poor interview city","2023-11-06 13:12:58"
"37","8","2","Owner list though wonder camera involve before purpose nearly wife character technology low guy simply know parent white whom","2023-11-05 13:12:58"
"37","81","3","Sea always important room money air media themselves but dinner gun outside","2023-11-06 13:12:58"
"37","39","5","Nothing dark better start year down order assume be bit season say him would class","2023-11-05 13:12:58"
"37","2","4","Buy movement hotel central between do program name","2023-11-03 13:12:58"
"22","96","3","Goal too accept instead order physical word general light just small each attention be rest top then","2023-11-01 13:12:58"
"22","81","5","Summer dark above foreign rise anything above follow major poor","2023-11-05 13:12:58"
"22","8","3","Important before also success meet key identify reality occur media determine","2023-11-01 13:12:58"
"22","6","5","Situation understand investment art soldier discover put technology too answer sea receive happen page college cut thing else save rather","2023-11-06 13:12:58"
"98","8","2","Possible natural every bag hard stay almost tend make character trial PM large leave bag difference key eye","2023-11-05 13:12:58"
"98","81","1","This laugh pattern important sport realize","2023-11-02 13:12:58"
"98","2","1","Test through role face message establish song weight must assume improve organization wall behavior area side perhaps simply","2023-11-06 13:12:58"
"98","65","4","Campaign cold institution project sometimes all couple actually role top body","2023-11-01 13:12:58"
"98","82","5","Production soldier street yeah hour science sister gun visit prove food guy it community","2023-11-06 13:12:58"
"67","2","2","Over rise suggest now clear wife yard direction technology onto ever instead","2023-11-04 13:12:58"
"67","5","3","Few country but south which administration shoulder nation","2023-11-04 13:12:58"
"67","12","1","Expect couple write tough nature what avoid task join land natural discussion expect attack","2023-11-03 13:12:58"
"51","81","2","Only adult wife enough physical vote method usually president question world data effort","2023-11-02 13:12:58"
"51","51","2","Television like always huge total everything discover hot right never popular city require relate term","2023-11-06 13:12:58"
"51","6","2","Everyone large close far college early student money cover scene leave way be before machine actually","2023-11-01 13:12:58"
"51","8","1","Even direction police something score official create chance police body may ground","2023-11-06 13:12:58"
"51","50","3","Opportunity such true major line fish put walk still body poor high kid big without laugh hit sign store probably individual easy poor girl quite break","2023-11-03 13:12:58"
"51","10","5","Gun small thought cause room writer","2023-11-01 13:12:58"
"51","42","4","Fear event thus worry say certain ground will share fish meeting item during policy agency however around want station wife spend physical knowledge","2023-11-06 13:12:58"
"51","2","3","Important national stand brother step provide look resource skin safe join news","2023-11-06 13:12:58"
"79","81","4","Person increase past first tree seek return establish","2023-11-03 13:12:58"
"79","12","1","Common threat gun model strategy establish again ahead including red despite network perhaps after","2023-11-01 13:12:58"
"79","52","2","Beat reduce responsibility news knowledge employee institution end fact ready coach","2023-11-06 13:12:58"
"79","98","2","Place tough new beautiful year key relate wide little","2023-11-01 13:12:58"
"79","9","2","Add ok prove so able here goal political education care plant happy else at woman politics education","2023-11-05 13:12:58"
"79","6","4","Production form television true believe strong any purpose newspaper by dinner ask","2023-11-04 13:12:58"
"49","31","2","Trade pay exist either oil beyond indeed street number pull mother carry painting nature world mention whole with do","2023-11-04 13:12:58"
"49","51","4","Sing nearly family issue field dinner who wind recognize remember during owner check attorney","2023-11-05 13:12:58"
"49","5","1","Imagine accept stock area again concern every oil music fast picture through really","2023-11-04 13:12:58"
"49","9","2","Someone if throw indicate professor example idea fast meeting win citizen seat","2023-11-04 13:12:58"
"49","39","5","Many ready according be decision film anything cost conference cause fish difference","2023-11-02 13:12:58"
"49","42","3","Interview table but kind stand fund too camera human single face capital bad institution tonight act base suddenly support but share policy","2023-11-02 13:12:58"
"49","6","4","Seven whether education view must side grow try history south all usually growth step","2023-11-05 13:12:58"
"49","50","5","Nature Democrat case medical surface present office stuff though station should","2023-11-03 13:12:58"
"49","81","4","Class at order leg above style partner over morning cost wrong relate growth return middle plant","2023-11-01 13:12:58"
"26","98","3","Worker amount billion image mother clear couple according professional bank deal high","2023-11-01 13:12:58"
"26","10","1","New write most left hundred still per sell","2023-11-06 13:12:58"
"26","42","2","Back rock generation marriage that adult game rich institution window find it world decide impact already detail official produce option result night tonight black where turn","2023-11-04 13:12:58"
"26","51","1","Final though material dark responsibility often animal wife maybe of","2023-11-02 13:12:58"
"26","65","2","Investment throughout discussion face color do girl some exactly important no heart","2023-11-05 13:12:58"
"26","82","5","Leave professional consumer share sure would trouble amount quite if bill base store cold affect","2023-11-02 13:12:58"
"26","14","5","Follow speak serious finally gun peace though people democratic month nation evidence","2023-11-06 13:12:58"
"26","5","3","Design gas dark raise down thing theory example inside box wind image guy particularly people","2023-11-05 13:12:58"
"26","96","4","Up heavy structure community loss Democrat heart development example question drop me career thousand plan them section next in his tax hot media major page","2023-11-06 13:12:58"
"26","6","5","Road thank stand course sister career different phone career else stock stage family easy debate","2023-11-06 13:12:58"
"26","39","5","Throughout suggest this write thing reflect enter firm music money","2023-11-02 13:12:58"
"26","9","4","Store present kitchen I world never make interesting course early box stock government specific consumer","2023-11-02 13:12:58"
"26","81","1","Bag I modern together big want","2023-11-01 13:12:58"
"10","2","4","Ever first structure summer alone fact side instead top reach national weight air","2023-11-03 13:12:58"
"10","81","2","Author nothing sound event spend myself hold describe next project example discover rule film moment act discuss draw think collection whole","2023-11-03 13:12:58"
"10","12","3","Close often nice pick meeting major of democratic capital join true quickly stock feel program nature nature","2023-11-03 13:12:58"
"10","52","3","Cell major nice attorney language not west within ground environmental turn than speech future born current hope condition","2023-11-04 13:12:58"
"10","65","2","Interview model community key manager television nearly this single look piece","2023-11-03 13:12:58"
"10","50","3","Just degree name tend company number early great","2023-11-05 13:12:58"
"10","96","3","Choice practice win bad understand great go manager drop whether candidate tough doctor camera","2023-11-03 13:12:58"
"10","82","1","Party alone keep team skin style force trade effect course begin apply specific put","2023-11-06 13:12:58"
"60","42","3","Certainly another buy draw purpose whole use right church executive pattern figure year talk compare","2023-11-05 13:12:58"
"60","81","2","Notice campaign size effort former like agreement include section he probably skin ready per political find them civil example third speech walk least charge","2023-11-01 13:12:58"
"60","51","4","Western Democrat behind skill service blue so oil stage material training simple sort business kind behind minute","2023-11-01 13:12:58"
"60","82","2","About eye piece total contain certain though body discuss","2023-11-05 13:12:58"
"60","12","1","West voice degree trial follow space decide sell magazine","2023-11-02 13:12:58"
"20","2","3","Hold his us would take inside research her attack yet key commercial couple piece especially tell raise investment remember","2023-11-05 13:12:58"
"20","6","2","Wish learn edge body nature reason medical sign step a party","2023-11-06 13:12:58"
"20","12","1","Off yourself marriage hand task bit offer conference about accept manage Mrs at","2023-11-02 13:12:58"
"20","50","4","Those whether after reason sea thank president play hard could hope be investment heart top nearly recent chair it","2023-11-05 13:12:58"
"20","5","1","Seven group think head son service attention fight city","2023-11-03 13:12:58"
"20","22","2","Though safe use place score kitchen daughter","2023-11-03 13:12:58"
"20","8","2","Test new sing size certain six however mother begin scientist government gas about point our section now sport tough mission speak","2023-11-06 13:12:58"
"20","82","1","Which minute age enjoy approach hotel tax scientist him message friend financial","2023-11-06 13:12:58"
"20","52","1","Little project outside behind his risk too feel everything whom course recent company party theory structure well major brother","2023-11-02 13:12:58"
"20","9","5","Early energy pick return civil rule alone name program fight yard short","2023-11-05 13:12:58"
"28","14","2","Over behavior even significant movement single behind nearly anything","2023-11-01 13:12:58"
"28","9","2","Design direction look town party worker news pick edge pass dinner","2023-11-01 13:12:58"
"28","13","4","Religious bag mouth capital surface quite seat lot behavior movement woman","2023-11-05 13:12:58"
"28","96","2","Training finally garden fast happy when red test his production several","2023-11-03 13:12:58"
"28","12","2","Industry hear view interesting everyone play surface add age without relationship consider ground food value reveal me free draw per fight role","2023-11-06 13:12:58"
"28","22","3","Join model usually lawyer reach later surface interest Democrat step home hotel","2023-11-01 13:12:58"
"28","42","3","Here detail then sure race color deal make just himself party sell until data yet baby box red describe between","2023-11-05 13:12:58"
"28","81","2","Blood ago always begin meet itself piece pass bed claim sell her too community","2023-11-05 13:12:58"
"28","8","4","Protect star field everything very management add light day hope around few different create late certainly project rise like side","2023-11-01 13:12:58"
"28","65","4","Whose generation cold collection attention hand old eat girl line program sense remain increase test sport reality box scene laugh from believe leg","2023-11-02 13:12:58"
"44","14","4","Lawyer daughter store study light try win turn with above goal idea same","2023-11-06 13:12:58"
"44","22","3","According product town something space store party surface story lot capital woman PM center","2023-11-06 13:12:58"
"44","9","4","Defense would until exist street Democrat his same pattern professor common Democrat final keep environment","2023-11-05 13:12:58"
"44","36","3","Happen success large teach store more air big land","2023-11-02 13:12:58"
"44","50","1","Black thought budget term positive option serious minute president whether perform list I spring mother draw","2023-11-05 13:12:58"
"44","6","3","Outside skin sister what wait prepare third industry over perform daughter organization star beyond ahead","2023-11-01 13:12:58"
"44","12","4","Base professor develop candidate respond behavior available guess they maybe consider husband let huge direction","2023-11-04 13:12:58"
"44","52","2","Memory commercial capital seek give PM size","2023-11-02 13:12:58"
"58","51","2","Could player cut effect reach election nearly month happen feeling compare blood none raise bring its enter","2023-11-04 13:12:58"
"58","65","3","Body popular project factor study audience style these recently through adult interesting operation recently","2023-11-05 13:12:58"
"58","98","4","Language notice board too hair model arrive hospital of community so similar whom official","2023-11-02 13:12:58"
"58","9","5","Between use think in politics allow office culture same mind leave","2023-11-05 13:12:58"
"58","50","4","Drive low manager road apply several want history brother fine of might","2023-11-06 13:12:58"
"58","6","5","Night entire skill professor expect change option before head focus fall respond dark lawyer agreement ahead something article","2023-11-02 13:12:58"
"58","10","3","Medical read to stop get tell bit account across treatment use PM seat moment management","2023-11-04 13:12:58"
"58","8","3","Baby western team place democratic eight understand especially because participant exactly price","2023-11-01 13:12:58"
"82","2","1","Live school who memory over something most history sign seat case individual score","2023-11-03 13:12:58"
"82","42","3","Throw to science close enjoy value people follow this show factor should part paper","2023-11-01 13:12:58"
"82","22","3","Interest son customer boy rule my home human individual grow whether month respond factor chair","2023-11-06 13:12:58"
"82","81","1","Discover family property for all building bit situation nature cultural fall on cold material push particular onto develop sport especially summer","2023-11-05 13:12:58"
"82","50","3","Last inside anyone successful order window apply","2023-11-05 13:12:58"
"82","10","3","Manager heart opportunity seem type road commercial just serve ball area southern hair ten area voice part dream woman form key hold rate role record five author","2023-11-02 13:12:58"
"82","65","2","Where central live month remember body will enjoy tell police Democrat long","2023-11-05 13:12:58"
"82","82","3","Thousand artist special minute spend herself page clear popular watch","2023-11-03 13:12:58"
"82","36","2","Report to anything a like beat help his dinner air better","2023-11-02 13:12:58"
"21","42","2","Produce girl stop agreement nearly spring difficult stock will upon produce","2023-11-03 13:12:58"
"21","81","2","Subject yes career huge billion very customer road white which away interview food reason mother training statement time ground bank behind alone play few enough fast","2023-11-05 13:12:58"
"21","8","3","Health central pressure ready capital open food sure responsibility then election write laugh area lawyer black various thank look police newspaper","2023-11-02 13:12:58"
"21","50","2","General exist tax wife race politics develop resource security claim education actually possible middle","2023-11-02 13:12:58"
"21","36","1","Gun often by every people now reduce get rate suffer result television everyone check check","2023-11-06 13:12:58"
"21","2","5","Say power entire arm Mr own responsibility inside crime mother science make too black energy actually son listen federal thing teach player two inside","2023-11-04 13:12:58"
"21","82","4","Actually later good fire view section only although boy involve tonight","2023-11-02 13:12:58"
"21","5","2","Force final model listen civil main bit moment old simply indicate trade course sea nothing","2023-11-01 13:12:58"
"63","51","1","Such campaign computer president cause American unit player environmental possible huge history board very keep","2023-11-02 13:12:58"
"63","2","3","Contain art wide maybe minute seven suddenly real decade join produce","2023-11-02 13:12:58"
"63","5","3","Open important lawyer third community wrong investment live even animal","2023-11-02 13:12:58"
"63","8","3","Suffer unit present success light figure know attorney community issue appear evidence president","2023-11-01 13:12:58"
"63","22","3","Painting himself shake way production check need machine now teach task strategy owner","2023-11-06 13:12:58"
"63","65","4","Contain back according effort full bag civil","2023-11-06 13:12:58"
"63","50","1","Hear those president finish exactly million pattern fly understand civil amount score","2023-11-05 13:12:58"
"7","98","5","Understand everybody several each else any structure event oil best month turn especially outside control form four event idea knowledge believe measure conference occur","2023-11-02 13:12:58"
"7","81","5","Occur whether project consumer hotel teach relationship other finish campaign two environmental trade large red both","2023-11-05 13:12:58"
"7","31","4","Goal thank later entire worker since small matter","2023-11-06 13:12:58"
"7","12","2","House do customer say much sign box language sit catch network message raise success","2023-11-06 13:12:58"
"7","82","2","Campaign arrive race grow mention growth product trial set","2023-11-04 13:12:58"
"7","52","2","Sea yourself stuff suffer respond story western necessary like big","2023-11-02 13:12:58"
"64","14","2","Run compare face indicate article take foot into","2023-11-01 13:12:58"
"64","9","3","Doctor six two hair itself model public popular could beat democratic building lose center wait","2023-11-02 13:12:58"
"64","6","4","Plan meet thank threat science animal still commercial rate note management put bag","2023-11-03 13:12:58"
"64","65","4","Least rise lawyer where grow friend central avoid could although of stop even speak take technology poor whatever other for describe","2023-11-03 13:12:58"
"64","82","3","Easy candidate take measure shake station difference end game outside former what his animal","2023-11-03 13:12:58"
"64","13","4","Past west station environmental how drive detail drop pick write management","2023-11-01 13:12:58"
"85","5","4","Attack day old end network scene quickly we situation morning specific crime contain happen most we business small agency","2023-11-05 13:12:58"
"85","65","3","Which require drop on account floor example every their paper open state both land describe low western family might the system sure","2023-11-05 13:12:58"
"85","51","2","Dinner tough doctor use purpose star its either choose protect oil world run and our today camera statement should best you","2023-11-01 13:12:58"
"85","8","3","To policy dark work experience into chance when kitchen ok total could report class challenge two image front current century mean outside across heavy design","2023-11-01 13:12:58"
"85","12","5","Cold defense then decade time the evidence figure American ready long","2023-11-02 13:12:58"
"85","39","1","Heart but difficult space college interest local part church professor","2023-11-01 13:12:58"
"85","52","5","Sort west discuss only brother painting early ready same major","2023-11-04 13:12:58"
"4","10","4","We call far pattern picture nature audience wrong successful or draw agree","2023-11-01 13:12:58"
"4","51","1","Three result bed tonight compare power wrong hour continue young nothing determine describe oil modern","2023-11-06 13:12:58"
"4","5","1","Trade teach believe case style close think finish media economic sister face heavy woman move what alone especially right great","2023-11-02 13:12:58"
"4","12","1","Although identify role entire increase arrive character me story fund themselves factor late teacher response stand","2023-11-05 13:12:58"
"4","52","3","Test step fill newspaper radio remain should gas ask would food buy ready couple color argue herself","2023-11-04 13:12:58"
"4","2","4","Western also actually home cover campaign rate personal public","2023-11-01 13:12:58"
"4","81","4","Week throw federal computer better generation toward national economy season amount forward trouble enter serve piece ok situation one first gas build share","2023-11-04 13:12:58"
"4","6","1","Tell allow camera star relationship people per can current certainly yes finish west almost","2023-11-04 13:12:58"
"4","50","4","Want popular fine wait force between laugh own company nearly her low doctor","2023-11-02 13:12:58"
"4","42","3","Out eat together hard put own amount man bill whole indeed experience number positive","2023-11-02 13:12:58"
"4","22","1","Chair walk stuff break key one tend color already final must position","2023-11-04 13:12:58"
"4","96","4","Total how education begin see necessary very only it over character woman television school per sure","2023-11-01 13:12:58"
"55","98","3","However defense student per recent large behind sort part kid beautiful discuss","2023-11-02 13:12:58"
"55","2","4","Particularly truth bad reveal mind only thing us modern buy structure concern role discuss best stand bag material out answer audience expect","2023-11-03 13:12:58"
"55","13","3","Stand door thus develop might off issue official owner participant hospital between","2023-11-01 13:12:58"
"55","51","3","Defense leg thousand senior black buy eight student view talk commercial southern control difference nor now into themselves common church","2023-11-02 13:12:58"
"55","6","3","Really our clearly letter air police both seven pay family way seek country exactly song energy company energy cut develop conference cost","2023-11-05 13:12:58"
"55","5","2","Budget age hit final beyond sister","2023-11-04 13:12:58"
"55","81","1","Fact bit physical budget both child game low color including probably again experience pressure current","2023-11-06 13:12:58"
"55","50","3","Increase floor sing he tend design","2023-11-03 13:12:58"
"24","81","2","Woman increase crime notice respond have analysis possible plan drop own administration picture tree run authority media word food challenge career bill near stay","2023-11-05 13:12:58"
"24","22","3","Become authority anyone decision buy course challenge significant American two region practice move exactly sea important ready explain wall newspaper","2023-11-06 13:12:58"
"24","82","2","Dinner country two note draw whole student resource her","2023-11-06 13:12:58"
"24","5","3","Against bed protect none major film human plan free identify than much amount chair measure","2023-11-02 13:12:58"
"24","12","1","Future yeah decade already force behind cold second thought affect kind","2023-11-05 13:12:58"
"24","14","2","Simple well now plan building Mr bag image we billion common tax half citizen middle respond newspaper","2023-11-05 13:12:58"
"24","9","4","Total couple name hand stuff office will glass nothing model particularly experience house could effort eat truth from write chair change explain entire move determine","2023-11-01 13:12:58"
