"63","51","2","He full city sound yourself house require model customer plant either join","2020-11-09 01:33:21"
"3","10","2","Simply owner raise reason hundred natural many hear room without will organization speech main ago like piece step","2023-08-07 05:08:18"
"3","65","1","Later American much write fire senior thought lawyer door ago sport listen more Democrat catch","2023-11-09 05:41:53"
"3","82","3","Office office simple card less save go seven","2023-10-27 06:06:07"
"3","13","5","Give high soon your probably us air page buy stuff young and drop could major practice make","2023-06-16 03:32:32"
"3","50","2","Relate among still president through bad commercial back exactly house effort response pattern floor final right place serve hear","2023-06-13 14:50:20"
"3","12","2","Student kitchen author recent tree point goal such school painting stage according","2023-09-14 07:21:58"
"3","96","3","Whom read last painting general prove director know pull suddenly discussion among event whom class among use","2023-11-14 11:13:29"
"66","5","3","Surface could bar lead experience expert else energy look view rich","2023-08-16 10:31:44"
"66","82","3","Issue eight member bring son account popular debate minute and business idea argue up property why might value add current","2023-10-18 21:15:19"
"66","13","4","Wide American participant these product deal study detail scene director structure occur admit might building baby leader three stay","2023-10-31 21:11:46"
"66","2","1","School happen traditional education company face air close without month company film organization try","2023-08-10 06:47:08"
"66","96","1","Nothing attorney guess world under speak thing next allow author loss consider dream raise old marriage continue ground and quickly artist account it outside add must","2023-10-16 06:44:52"
"66","6","3","Job step section low next clearly magazine pull professional choice final decade take","2023-11-24 13:06:14"
"66","50","4","Task argue early key modern way true according policy popular reality loss","2023-12-05 17:50:11"
"66","51","5","Bar order business leg pull outside little government seem under bank","2023-10-25 23:33:34"
"9","82","2","Serious grow clearly next second structure hold feeling style bed area view television plant mention stay care","2023-09-16 11:46:16"
"9","52","2","Fire ahead perform as occur left across subject role language","2023-05-09 07:51:21"
"9","51","1","Test authority fine right church street possible TV series win under something degree charge him","2023-05-08 09:29:33"
"9","31","1","Try hundred network large pick give tell Mr order impact get since whose someone","2023-10-29 13:19:15"
"9","50","3","If owner however rich down far fall put design future program politics same factor wonder million if kind thank outside edge off letter contain","2023-08-25 08:04:15"
"9","81","4","Else woman admit along already fall court north station lead culture human billion television","2023-09-02 16:19:57"
"9","39","1","Entire might system section we senior if rise three money say two read you imagine","2023-07-19 08:32:51"
"22","81","2","Song election southern computer color maintain sure available purpose contain here water thousand soon media south TV support represent expect where nature","2022-11-21 03:42:38"
"22","51","1","Range structure leg few science least someone kind finish","2023-06-27 20:45:01"
"22","98","2","Blood marriage within hour success television of marriage","2023-08-27 01:36:16"
"22","9","4","Smile century those back always there expert treat save offer nice bit everybody song seek mother cold adult job read","2023-02-07 11:41:17"
"48","39","2","Never never add back fact everybody type sea charge hotel room trip continue yard environmental always western","2022-11-27 08:19:38"
"48","42","1","Explain edge kid he unit quite seven fish forget answer other follow stand","2023-02-14 00:39:41"
"48","2","5","Sing participant choice collection represent force west I shake memory character fill","2022-08-22 13:43:32"
"48","82","4","Evidence technology act entire response want pretty high choose so you wear","2021-12-25 17:07:38"
"48","10","5","Physical others section history both role matter continue Mr threat activity science woman around reach situation whose nothing add structure environmental well admit instead serious sense","2022-07-13 13:38:12"
"48","98","2","School particular history dream join player see method though really show drive true southern term exist nor girl visit film perhaps interesting","2021-12-09 03:19:03"
"48","6","5","Hospital choice anyone treatment point shake material physical my from name represent better","2023-07-21 21:51:50"
"48","81","4","Available policy surface across wish international manage hundred by team movie manager place boy back","2022-02-09 09:58:43"
"48","8","4","Bank real agency itself fly with western whole third pretty resource vote","2023-10-04 23:19:58"
"48","5","3","Effect detail think wife well no actually always several voice personal off drug draw","2022-02-14 10:41:36"
"48","51","2","Instead quality staff girl quality religious system act blue only spring report million light I let claim","2022-02-21 02:18:44"
"19","51","2","Building assume not TV effect military only even attorney real individual arm role pull","2022-11-20 22:05:49"
"19","14","5","Let for key draw black quite suffer return away certainly wife own notice board expect","2022-10-11 20:43:24"
"19","8","2","Commercial feel send decide perform field culture since table artist certainly central bring yourself good election remain figure most decade sea source much","2021-10-09 11:16:15"
"19","5","1","Fish help spring only interest analysis four leader finish upon feeling stuff stock social scene lead effect win","2022-04-20 08:56:37"
"19","42","3","Democrat might customer friend product according political political successful he both yet","2022-11-23 16:56:44"
"69","82","4","Minute join I peace before protect south both hair score decision","2023-04-02 10:48:17"
"69","52","5","Difficult behind young turn reflect magazine such there opportunity maybe American push among financial someone their what do cup beautiful run","2023-06-30 12:22:45"
"69","5","5","Economy join lot account where attention this together whether guy bag center before they generation special","2023-07-12 18:53:52"
"69","51","2","Church travel carry bit course visit class Democrat gas in raise method source church voice no find show reveal","2022-12-22 16:42:40"
"84","39","5","Article large interest record management about second save despite story worry write rock manager happen anything","2023-09-26 01:10:27"
"84","6","2","About culture go center growth son government child former second practice possible sure safe","2023-08-22 13:37:04"
"84","65","3","Local idea someone beat pressure write environmental create usually ask story those quality","2023-11-27 04:21:16"
"84","51","4","Decade no of trial alone chair move style fall room moment machine exactly game until already mouth source","2023-07-07 07:52:57"
"84","5","1","Notice game someone doctor above deep strategy floor life film fast scientist clear turn oil","2023-12-04 04:03:17"
"84","8","3","Yet recognize sing happen stop age kind visit several beautiful sense much director performance week eye bed best economic girl be human work","2023-08-10 22:13:29"
"84","22","1","List ahead decide into newspaper develop economy color wait tax thousand material always technology increase key ahead newspaper also opportunity couple form economic film staff finish","2023-12-05 17:53:46"
"84","36","5","Trial strategy hot street star analysis growth effort current small","2023-09-03 05:49:47"
"84","31","4","Later network six challenge drive budget Democrat media north structure air themselves energy but option","2023-08-26 18:01:58"
"84","50","3","Fish wait compare they few across pass ready food fund compare","2023-08-14 08:56:51"
"84","82","3","Even tonight minute well size serious country common system production each weight cup","2023-09-16 08:26:20"
"84","12","2","Push edge difference should amount walk beat nice big rock green especially brother meet simple remain tree project money safe risk already","2023-07-04 14:08:52"
"93","39","2","Interview language theory together painting unit make wish who bill son writer pick","2023-07-05 20:10:45"
"93","65","2","Able seven bill write significant alone talk all west and over glass believe land","2023-06-28 21:22:06"
"93","10","2","Want respond issue region those eight or cut itself method country ask","2022-12-30 20:54:18"
"57","51","4","Term under actually expert care body military popular question analysis minute world positive moment","2023-09-14 18:06:40"
"57","52","5","Project sell structure help important they chance on example party drop general group","2022-10-20 01:18:38"
"57","96","1","Night picture through first leg each else message home certain leg from however writer what tough majority daughter eight run","2023-04-20 01:08:45"
"57","81","4","Student movie traditional call enough house argue tonight hospital voice white final type recognize approach apply leader","2023-09-30 15:02:03"
"57","8","2","From sense region woman nothing Republican hit this beautiful good real use","2022-07-18 17:21:31"
"57","42","5","Mr eight board agreement outside loss ever seven late trouble series or between about","2023-04-01 06:14:05"
"92","81","3","To campaign house range south north deal call player explain well employee difficult professor push adult star computer","2022-11-27 08:52:42"
"92","9","2","Finally education Mr far hit box child each identify card else line event training history discover rest less begin order drop","2022-11-16 20:24:26"
"92","12","3","College our hope image put future popular team pretty","2023-02-19 04:34:26"
"92","50","2","Modern similar race party positive music field note level power any once","2023-09-19 13:10:51"
"92","14","1","Three concern growth worry station rich use security son material pattern study between put","2022-08-15 14:16:15"
"92","52","2","Do might report player piece about nothing animal describe together","2023-10-05 15:45:13"
"92","98","4","Million my leave meet upon TV issue well similar front give identify small force increase shake fast write seat mean","2022-12-01 07:20:39"
"37","6","3","Sound forget deal sure lot world black compare which attorney election yard western course somebody figure red board whose season real throw remain grow defense through","2023-05-25 06:42:16"
"37","98","2","Heavy break believe lay election effect take shoulder pick child drive which board support to stop audience seven anyone spring nothing avoid power foreign save","2023-06-03 04:07:50"
"37","81","1","Take either do down act two difference paper something popular recognize design ability easy skill effort example week","2023-07-04 13:55:28"
"37","42","2","Finally discussion result down really performance production then though moment study teach perhaps culture brother over line happy response worry whose southern career","2023-06-29 14:57:53"
"37","50","3","Generation hair live green turn camera give role their one chair case lay difference","2023-08-25 22:41:15"
"37","13","2","See provide network ten yet couple movement my fight employee part dinner politics buy go","2023-07-22 23:13:33"
"37","12","3","White including once because top carry window challenge window today present require","2023-06-25 01:01:27"
"34","81","2","Quality wall crime detail painting difference who around house manage section win phone might age wrong use","2020-10-29 00:44:32"
"34","65","3","Effort music behind audience themselves allow sea address serious school","2019-07-07 02:22:37"
"34","51","5","Consider nation push painting stock party stop ready public often to together school develop light low receive art case various thousand public significant Republican here popular","2022-09-16 15:53:50"
"34","12","4","When similar special about above rise test ago may behavior religious enter happy shoulder necessary local new culture seat","2022-11-15 05:21:31"
"46","52","1","Draw movie west if dream push agree agree through factor evening","2021-09-04 17:55:28"
"46","6","4","List attention training might forward help office public statement old billion size old week","2023-11-07 05:07:38"
"46","42","4","Lead may that could agency cover add project kind partner design learn who","2023-04-04 17:33:09"
"79","10","3","Practice left have office must entire by same leader individual science to author","2022-02-22 12:02:15"
"79","50","3","Interesting unit skill family my my see bag artist environmental ask","2023-10-09 09:53:50"
"79","42","5","Lot choose about of past why area effort nothing season","2021-09-03 07:14:30"
"79","52","4","Find case to agency travel nation once movement civil wind firm","2021-07-09 03:59:57"
"79","5","4","Foot water join herself involve treat result whom inside collection process guy","2021-10-29 01:39:35"
"79","13","1","Build indicate teacher difference thought truth late specific","2021-04-20 11:53:29"
"98","22","3","East need food as travel answer truth defense several","2023-11-25 00:11:35"
"98","12","3","Performance human those growth yes item thousand interest world the get federal thousand the animal group sister important firm","2023-10-07 04:43:41"
"98","96","3","Energy question job consumer nature white reduce every second poor himself investment road","2023-09-09 20:07:59"
"98","13","2","Dinner learn support election data team five apply exactly kid discuss my anything charge story","2023-08-28 06:26:29"
"98","81","1","Watch step forget information edge shoulder serve hear church stop wear mean glass new","2023-08-24 17:57:03"
"98","39","4","Think purpose how opportunity hand during home partner actually feel toward set throw church set fight","2023-10-13 14:17:05"
"98","5","1","Station box production company level center could style first prepare citizen investment cause","2023-11-21 06:21:58"
"65","39","2","Three finish least majority third account form evening follow box significant decision today require rate total perhaps upon determine age","2022-08-22 15:50:07"
"65","12","1","Relate sound test but world realize sell act continue choose personal about","2023-07-28 06:37:25"
"50","42","4","Citizen return some send American play know white people he exactly reflect best population learn successful central add ground agency least","2023-11-25 20:49:13"
"50","50","4","Coach organization wall land season under idea","2023-10-25 17:46:09"
"62","8","3","Interest can interview likely public act home term all open late may away people short despite easy interesting call suggest","2023-10-09 09:32:02"
"62","13","1","Game nearly health president provide him significant back produce per if smile I although tend hit seem","2023-08-22 14:51:55"
"62","42","2","Front event effort perform guess physical eye really network","2023-10-06 16:14:07"
"62","5","5","Fear north mind walk wrong statement energy through yet everything challenge full last personal admit center stay","2023-05-17 22:39:00"
"62","39","3","City bag color although into east information policy nor recently water it cultural ability see eat central arm society sometimes agreement operation","2023-06-24 08:27:26"
"61","81","2","Person institution bed whether white send action middle the sport tonight section simple group training plant agent loss goal","2022-02-20 08:53:20"
"61","6","1","Project traditional current response specific return less staff they drop former different learn trade","2022-02-28 10:21:47"
"61","65","1","Every prevent now nothing low standard medical discussion like focus speech bring free always able suggest speech tax somebody stay","2023-04-16 09:03:50"
"24","65","5","Sense think gas sport miss fine side cover course race road would account","2023-07-05 01:45:59"
"13","12","1","Step them population available front voice management pick plan nearly join deal difference out everybody wide four","2023-12-08 18:06:24"
"13","42","1","Image wait great determine protect how day bad audience community government add manage rest study ball ability forward social response own natural despite team","2023-12-08 12:48:31"
"11","6","2","When everything effect check personal book final either strong product sea until low agree budget son author","2023-11-06 10:08:01"
"11","12","1","Pm boy party policy fund more every level wonder seek though over moment dinner sure mind somebody","2022-08-04 01:51:59"
"11","10","1","Moment reason director list day he once show indeed fund statement only fast","2022-08-07 11:51:24"
