"88","82","5","Tough hope themselves different performance wonder agency benefit happen difficult understand","2023-02-25 14:49:42"
"88","39","3","Outside like shoulder cover factor really agency arrive size dog research provide above team several accept against technology today","2022-05-01 18:43:28"
"88","42","1","How movement pick card surface around apply until write perform everything accept yourself conference","2021-06-06 01:28:31"
"88","5","5","Ground staff find everyone door whom audience","2022-03-25 04:21:14"
"88","96","4","Around station set arrive south writer window result letter possible your western want recent ready continue sit executive","2022-01-09 10:29:39"
"88","12","3","Bar town decide series relate send both administration state record old special walk near woman we win official anything","2023-03-01 04:12:12"
"88","36","4","Difference director good stock another arrive nice pretty serious well operation","2023-05-31 08:22:54"
"88","10","3","Case thus example especially maintain blood goal strong citizen","2022-11-26 23:42:02"
"88","81","2","Ask control serious clear standard sing concern form lawyer memory she","2022-05-08 00:57:57"
"26","10","3","Place summer position wear treatment long voice really push policy growth shoulder family identify while better a free science third new weight their majority boy expert","2023-06-02 07:13:03"
"26","81","5","Run reduce third that relate today compare offer daughter drive choice religious","2023-07-12 11:35:18"
"26","22","2","Vote whom large quality reflect best week down assume ever voice with likely full recent school drug","2023-02-06 09:32:34"
"70","10","3","Nature wrong person wife watch half girl military political else indeed tell executive","2023-01-01 03:09:22"
"70","81","4","Enough follow southern involve at eight stage direction bar research chance citizen point not","2023-07-10 07:19:37"
"70","31","1","American spring cold measure three garden manager fly line add catch","2023-03-20 05:18:56"
"70","51","3","Ahead cup service special small war hundred use tonight lose find doctor bed gas voice structure like serious modern","2023-12-04 21:09:18"
"70","65","2","Class side house sea administration design necessary allow floor decide break sport culture","2023-07-31 03:46:31"
"70","42","3","Name service here movie admit stay continue anyone key majority share change hair side quite plant respond both their federal message","2022-07-23 05:30:25"
"70","98","3","Reality establish front themselves attention wear prove table cut off","2022-06-21 07:44:01"
"70","6","2","Drop century lose dream source million course huge film structure sense city","2023-01-18 15:09:50"
"39","5","5","Art soldier discover put technology too answer sea receive happen page college cut thing else","2022-09-18 18:39:14"
"39","6","3","Make character trial PM large leave bag difference key eye now real science sign party","2021-01-12 04:29:42"
"39","65","5","Everything fast office forget off several with the meet get couple issue good evidence reality station themselves","2021-03-31 23:03:30"
"39","82","4","Matter she grow either level look issue finish report source","2023-09-23 16:23:40"
"60","52","3","The set rise out shoulder interesting goal student campaign cold institution project","2023-10-26 21:11:14"
"60","42","4","Audience continue effort out nature board seat well property push sell beyond student third book town less eye stand purpose successful","2023-08-03 22:46:37"
"60","12","4","Head change herself then approach condition pull direction sure certainly four several new course guess your education arrive condition show style hard glass know change note","2023-12-05 11:30:18"
"60","50","2","Tv service major shake audience include hear thank least story expect couple write tough nature","2023-10-19 12:54:49"
"71","5","3","Protect fund rest relate actually treat goal affect himself past suddenly increase","2023-09-24 20:19:05"
"71","6","5","Sell sense well practice letter TV middle exactly case certainly big concern college only adult wife","2023-09-20 12:28:24"
"71","96","3","Indeed charge senior friend process young sound interview boy prove hot run necessary art people member","2022-08-26 04:33:46"
"71","50","2","Future officer response lay response within lawyer notice","2022-11-21 16:22:39"
"71","51","4","Thank Mrs mission something country include good Mrs himself dinner visit reduce interview time which north far practice law wish together ago accept","2023-08-26 10:37:33"
"29","81","5","No case democratic work opportunity such true major line fish put walk still body","2023-10-19 22:45:26"
"29","12","1","Floor open far real know executive address","2023-10-19 03:20:35"
"29","51","5","Trip consider east then yet fear event thus worry say certain ground will share fish meeting item during policy agency","2023-10-26 01:51:38"
"29","42","1","Finally even behavior truth family go where research all south doctor force time themselves have professional","2023-09-26 13:26:39"
"29","65","5","Treat yet western thousand good if water agent make","2023-10-10 00:54:36"
"29","6","5","Read wear theory important mean almost because job power from not beyond it in","2023-10-18 02:10:58"
"29","50","3","Save soon well must already these growth never machine child quite general animal ball fall pass other yes tree crime still reflect eight light she store","2023-10-08 14:05:58"
"29","8","4","Remain later continue own necessary TV grow me protect toward ok trade dinner","2023-11-02 11:36:41"
"85","2","3","Often particularly security claim hour return dark ten man who meeting material two","2021-09-05 00:52:16"
"85","51","3","Believe strong any purpose newspaper by dinner ask commercial doctor cold nearly enjoy nearly time reach cup capital rich","2022-03-05 05:34:05"
"85","5","5","Pm church care easy view how response city future several","2022-10-04 20:21:23"
"85","96","3","Down plan call customer each power staff training left after bit toward adult also get inside open deep guy office prevent crime agency close compare eight","2023-04-29 23:41:40"
"85","82","1","Discussion rich ball girl turn camera imagine accept stock area again","2023-03-04 11:35:28"
"85","50","2","Student exist head someone if throw indicate professor example idea fast meeting win citizen seat collection face stuff can stage weight listen assume with","2021-10-06 15:44:10"
"85","12","2","Easy key type force upon serve significant choose serious experience country mission argue name realize sense the raise much","2023-11-18 18:52:30"
"85","42","4","Their keep election respond story production food skin building front including","2021-10-15 09:11:51"
"31","6","3","Surface present office stuff though station should rest all officer hand society change behavior number together five class","2023-03-03 23:34:54"
"75","6","2","Around small instead material discuss stuff those provide two beyond approach dream guess director lay listen statement raise bed class","2023-10-08 18:56:12"
"75","51","4","Full relate course several somebody suggest class list card back rock generation marriage that adult game rich institution window find it","2023-10-04 16:08:01"
"75","96","2","Treatment big money challenge understand whether member late mean political","2023-08-06 04:10:33"
"75","81","2","Piece discuss great step idea public car with particular base investment","2023-10-31 08:47:32"
"75","9","3","Ability north couple miss customer sign capital democratic military paper remember almost remain agree culture child ability high girl age","2023-10-28 20:14:56"
"75","52","5","Affect woman down trouble truth identify between executive amount pass quite fact political baby nation hear several","2023-08-08 08:04:02"
"75","13","1","Grow bad either those education certainly action citizen mention finish simple others painting","2023-09-18 23:43:40"
"75","98","2","Them section next in his tax hot media major page its service language tax however material because really reality person get","2023-10-25 12:29:37"
"64","42","5","Open usually interesting discussion oil air can camera score store","2023-01-22 07:41:49"
"64","65","3","Within need season company approach change care institution school friend environment new","2023-01-01 11:05:31"
"64","5","2","Together big want free choose money party production past single sell respond when enough indicate car floor development factor","2023-01-06 02:38:03"
"64","12","4","Charge simply hold fight two low glass few ok thousand eat degree though give hand less blue challenge chance skin truth about","2022-04-26 05:29:55"
"64","13","4","Program five receive cover four represent discover protect American piece up news","2022-08-30 20:04:02"
"64","6","5","True quickly stock feel program nature nature learn billion realize thought personal former throughout forward tree rule knowledge teacher four","2022-10-30 02:27:39"
"64","22","4","Speech future born current hope condition seem thank side whole part indeed soon","2023-11-09 05:33:48"
"64","82","2","Teacher at pass indicate amount affect record","2023-02-08 21:11:40"
"95","6","2","Owner establish human relationship effect everything government leave direction young body order though","2023-07-16 19:58:15"
"95","96","3","Former spend expert start find country test stuff remain total likely","2023-07-12 09:21:44"
"95","65","3","Right church executive pattern figure year talk compare woman your","2023-09-05 02:05:14"
"95","82","2","Economic third education notice campaign size effort former like agreement include section he probably skin","2023-08-24 16:09:40"
"95","51","2","Impact green culture level song top conference writer specific station past","2023-06-02 03:05:53"
"95","14","2","Training simple sort business kind behind minute standard particular authority we behavior safe stop cold field central skin dog who but campaign","2023-07-17 01:14:07"
"95","52","4","Must sit maintain feel million act man happy night within recent involve","2023-09-21 20:10:33"
"95","5","2","Until skill century pass commercial range we central camera new fish production exist read clearly","2023-05-26 00:30:37"
"95","8","1","Themselves piece relationship alone her down good dream ability itself prove establish outside important through reality leader second maybe new","2023-07-20 20:01:34"
"95","42","4","Federal establish stage adult kind moment themselves international table make point will health","2023-08-11 08:31:27"
"95","12","2","Learn edge body nature reason medical sign step a party entire those own forward break close wrong future","2023-06-22 18:13:41"
"82","6","2","Congress care medical common involve his seven strong decade control add exactly show drop we she page reach central once pull term attention","2023-08-27 10:43:40"
"82","52","5","Experience sit analysis result seven group think head son service attention fight city low hour","2023-09-04 12:14:50"
"82","81","2","Director large blood stay happen court card prepare image yourself leader fund professor population","2023-08-06 19:07:21"
"82","42","2","Our section now sport tough mission speak sell indicate effort find cultural with turn","2023-12-06 07:57:03"
"82","50","3","Scientist him message friend financial executive","2023-08-06 11:10:23"
"82","10","1","Project outside behind his risk too feel everything whom course recent company party theory","2023-11-04 17:07:10"
"82","82","1","Against no prepare ok conference walk road camera it research part eight dinner","2023-10-09 17:06:03"
"49","6","3","Article rich often establish since live claim option development police lot will other describe organization third late","2023-10-23 02:00:56"
"49","81","2","Test his production several magazine sign act outside tough evidence","2023-09-13 03:30:44"
"49","12","3","Control foot present money size improve note our song similar","2023-07-30 09:27:49"
"49","96","4","Phone many manage among safe pressure life one month report season reach here any none foot affect","2023-10-26 12:22:22"
"49","42","2","Million never hope gas after son include for","2023-08-25 03:58:40"
"49","9","5","Goal sea seem Republican while development","2023-11-29 12:34:56"
"49","5","2","Inside continue break where may growth quite tough dark wear hospital whose past we line","2023-10-01 23:09:35"
"49","50","2","Local rise project painting school would put agree international use best heart whose","2023-10-14 08:25:18"
"49","65","3","Place company ahead bank save vote church poor chair treatment","2023-10-19 09:37:05"
"49","98","1","Goal idea same item reflect he ago year forward far employee","2023-05-28 13:46:52"
"49","10","1","Can white miss instead myself itself mind method can card bank","2023-08-23 23:43:02"
"49","52","5","Difficult require hit provide wish message check","2023-07-19 19:29:39"
"49","2","3","Fund that admit wind sport draw suffer behind","2023-08-14 18:26:13"
"58","12","5","Church hear get century ten serious value three us game stay little three southern but keep near message risk national pass several home figure","2021-12-05 11:29:02"
"58","98","3","Once will couple walk sort official whom ago all","2023-06-27 09:20:55"
"58","51","2","Who Republican statement worry necessary worry huge gas","2022-06-14 02:42:05"
"58","81","3","Mother matter billion popular including power thought could player cut","2023-07-08 23:50:34"
"58","42","5","Strategy law color base that child political former other laugh enjoy decide billion Mr family simply speak","2023-04-05 17:27:27"
"58","52","1","Let good question either social person would rule pay TV hear myself that next range level action ever tax those collection","2021-12-02 23:48:33"
"58","10","1","Community so similar whom official could home short image kind politics it however option movement design wide between use think in politics allow office","2023-01-16 17:23:21"
"58","50","1","Fear drive low manager road apply several want history brother fine of might training onto pressure factor let west report account wide","2023-10-20 23:52:54"
"58","65","5","Wall then support art visit great member material citizen education consumer full","2023-03-28 18:51:38"
"58","6","1","Yard race who reach million then send woman medical read","2022-10-30 00:24:13"
"58","82","3","Land more particularly medical keep sell responsibility summer own indicate life major across","2022-02-08 06:30:22"
"47","50","4","Who memory over something most history sign seat case individual score risk","2023-07-28 21:04:36"
"47","6","4","Decade form right account course include foot assume yeah there hotel store throw to science close enjoy value people follow this","2022-12-21 20:04:46"
"47","52","1","All memory task head little option style approach officer country accept","2023-08-09 10:43:20"
"47","42","1","Any nearly week decision executive training might why agent hospital must wrong happy character account security scene such section","2023-08-31 21:11:32"
"52","81","5","Direction time those single professor rest believe final sea me out concern anything","2023-12-04 22:16:19"
"52","6","1","Outside step that position stop order argue military rather","2023-09-25 08:23:11"
"52","12","3","Laugh deep religious catch near really on few miss prove sound fund no half bit none degree","2023-09-26 10:04:24"
"52","50","3","Evidence leader better drive interview street personal without rock anyone fly for within describe leave per nothing","2023-12-06 06:53:39"
"28","6","2","And represent loss give those instead cut professional","2022-02-28 17:58:11"
"28","12","1","Employee view be mention truth attorney point goal decide never mean return down","2023-10-30 09:22:58"
"28","65","4","Argue plant face hold no care wear performance owner particular physical near few tell between beyond management can listen","2021-07-18 04:39:53"
"28","10","2","Whether house human manager hold sit like or physical charge","2021-07-26 19:33:25"
"28","39","5","Bank behind alone play few enough fast first east talk born break cost everything political assume ball grow laugh","2023-01-15 04:28:50"
"28","50","4","Unit by should health central pressure ready capital open food sure responsibility then election write laugh","2021-11-13 18:51:12"
"27","82","3","Great artist general explain body long and current leader admit perform rate push tree gun often by every people","2023-11-28 16:18:30"
"27","10","3","Inside crime mother science make too black energy","2023-09-04 22:09:29"
"27","65","4","Region meeting lawyer resource alone quickly memory security vote story","2023-10-24 20:56:56"
"27","81","2","Heavy network one a president much wish force","2023-09-18 11:50:40"
"27","9","4","Picture everybody dark could ok eye hundred doctor population return best me","2023-11-26 18:23:51"
"27","12","5","Relationship power begin force thought fish education head begin indicate sure page modern marriage owner film southern over my deep service try himself everybody security cell","2023-11-07 02:42:33"
"6","50","5","Baby staff medical son product body mind beat concern thousand truth open important lawyer third community wrong investment live","2023-03-10 19:22:00"
"6","6","5","Article officer clearly practice main lead prove score cell see Democrat participant PM direction sport need wind child deep determine easy base","2022-12-30 21:35:10"
"6","31","2","Meet beat painting himself shake way production check need machine now","2023-05-12 14:04:30"
"6","52","1","Us leave ahead onto strong work analysis offer step","2022-10-24 03:09:27"
"6","22","1","Partner establish TV issue history animal authority bag finally door election at house year avoid couple","2023-07-18 09:30:39"
"6","12","1","Born work second affect try economy change democratic up during wall even country","2023-09-12 19:58:24"
"6","96","1","Listen person talk throughout administration ok size sort grow your writer performance wait","2023-09-03 00:57:13"
"6","42","2","President claim class three weight for assume full company five learn wish bag amount different many whom director soon","2022-11-06 14:14:58"
"94","10","4","Develop half certainly type happen nor actually provide something manager national","2023-11-27 20:49:22"
"94","2","5","Two debate cost including science cold thought among","2023-11-29 09:50:04"
"94","81","5","Along general sport green others when bad your section property toward ground character protect social without likely low doctor window central Mrs just fine hour last however","2023-11-18 14:28:52"
"94","50","1","Budget guess down stock guess position positive bank somebody president page something","2023-10-24 08:16:03"
"94","12","4","Car although himself career traditional view open inside mission get may occur street conference third important tonight event","2023-11-15 17:18:11"
"41","50","1","Enter choose quality girl practice song environment former some difficult easy candidate take measure","2023-12-07 05:52:01"
"41","2","2","Instead new others girl series civil stand","2023-11-16 19:59:21"
"41","22","5","Tv nation blue drive air if important beyond here","2023-10-21 06:49:09"
"41","9","2","Morning specific crime contain happen most we business","2023-08-10 10:47:28"
"41","8","4","Agreement include company letter value care recognize production nor for as","2023-09-10 12:13:34"
"41","65","4","Always such success include million catch use describe say daughter interesting level movie short would carry PM property number hope","2023-08-24 13:01:05"
"41","13","3","Later respond prove catch couple field leg lay expert wonder sport help specific fund thank card","2023-11-24 14:16:29"
"41","51","4","Work experience into chance when kitchen ok total could report class challenge two image front","2023-09-15 02:13:53"
"10","51","3","Side but manager situation cold defense then decade time the evidence figure American ready long oil across onto research general western himself","2023-10-12 23:06:41"
"10","22","3","Southern plant we maintain practice stock opportunity dream couple pass son rate","2023-10-04 17:09:03"
"10","14","5","Candidate pay light better catch game look party last continue we","2023-11-18 03:54:42"
"10","12","3","Protect half to science vote range support lot know actually forward","2023-10-09 08:25:35"
"10","31","4","Continue young nothing determine describe oil modern ago fill threat base","2023-10-25 18:35:36"
"10","13","1","Increase arrive character me story fund themselves factor late teacher response stand difficult head player family will against say","2023-10-13 09:18:09"
"10","65","1","Speak economic popular street government current value everyone environment also civil","2023-10-21 11:25:26"
"10","6","5","Quickly same everybody simple heavy listen discussion phone billion often free doctor offer","2023-09-23 00:02:37"
"10","96","2","Week throw federal computer better generation toward national economy season amount forward trouble enter serve piece ok situation one","2023-11-18 04:01:54"
"10","42","2","Brother special several tree indicate person prove yourself would wide","2023-10-09 15:04:01"
"10","81","2","Wait force between laugh own company nearly her low doctor war","2023-10-17 22:28:21"
"51","12","2","Man bill whole indeed experience number positive final against consider who up should green doctor front science everyone imagine","2023-01-23 14:57:51"
"51","8","5","Million effect tonight management something own type total how education begin see necessary very","2023-11-28 07:10:07"
"51","6","2","Benefit whole audience any card money local learn step truth however defense student per recent large behind sort part kid beautiful discuss","2023-04-21 23:47:45"
"51","50","2","Particularly truth bad reveal mind only thing us modern buy structure concern role discuss best stand bag material","2023-04-06 20:47:17"
"51","82","2","Mrs size assume best stand door thus develop might off issue official owner participant hospital between","2023-07-11 10:24:43"
"51","81","5","Article meet agency between debate capital almost any research because political","2023-11-04 21:07:12"
"56","96","5","Near like civil over lawyer really our clearly letter air police","2020-07-16 17:43:09"
"56","81","2","Option student job method out employee future soon per put each fill pattern course throw view","2021-01-14 23:31:45"
"56","39","4","West fact bit physical budget both child game low color including probably","2023-05-07 23:28:31"
"56","52","1","Mission protect financial race serve positive day yet control quite wait friend recent lawyer adult color she give share cover","2022-08-13 10:47:46"
"56","50","5","Serious together billion figure choice lot","2023-02-11 13:13:46"
"56","51","1","Plan drop own administration picture tree run authority media word food","2020-03-26 18:23:14"
"54","5","3","Whose modern create become authority anyone decision buy course challenge significant American two region practice move exactly","2023-09-03 16:39:39"
"54","98","5","Fear best region whose green thousand political know phone political skin company pass thing exist good physical member accept authority","2023-09-25 07:31:29"
"43","51","3","Leader sort customer reveal red concern section resource property against bed protect","2023-12-07 08:13:35"
"43","96","4","Present use future land around free TV else but discussion wonder","2023-12-05 00:36:58"
"43","81","1","Decade already force behind cold second thought affect kind really way his","2023-12-06 13:26:20"
"43","36","2","We billion common tax half citizen middle respond newspaper company it pull structure various example from","2023-12-07 09:25:21"
"43","10","3","Degree public provide degree certainly hand continue ago who study positive over black word agent security","2023-12-08 17:31:40"
"43","22","1","Mother firm rule American care do total week fall trouble rich determine","2023-12-07 06:57:15"
"4","13","2","Human everybody I ok loss different attorney news sometimes crime","2023-12-05 05:42:57"
"4","9","3","Ever doctor daughter senior record identify fight court box party girl treat","2023-12-06 04:58:36"
"4","6","4","Strong born quality big among mission low growth into maintain collection ahead","2023-11-20 04:18:49"
"4","2","3","Kind both report view behavior issue full ability look worry month knowledge often pattern","2023-12-03 13:17:43"
"4","12","2","Test question style price five hold current center morning nothing heavy former","2023-11-27 13:01:52"
"4","50","3","Century know prepare on strategy maintain buy hair sea three we sister performance capital reflect among building teacher throughout","2023-12-04 02:03:23"
"63","5","2","War perhaps lead soon rest today huge too","2021-11-24 23:12:59"
"63","2","3","Move more challenge news expect table person dinner challenge itself and down run yeah win","2022-10-23 22:19:00"
"63","12","1","Focus study series eye any lot north","2023-10-07 09:56:01"
"63","6","3","Avoid throughout degree center range leg walk management floor tonight stuff kind operation if child thank ok room","2022-08-31 20:24:26"
"63","82","5","Ability bill meet us service relationship with country technology side really family certain","2021-01-02 03:35:36"
"63","50","1","Interview large person admit adult scientist interesting in instead south threat speak let avoid but to sit threat party","2023-10-20 02:51:32"
"63","65","4","Consider myself news new look middle foreign","2021-11-07 05:46:20"
"63","81","4","Industry simply avoid fly name conference military place reality style draw their trip that build toward change food ability","2020-12-01 14:41:16"
"63","96","2","Growth learn story worry old focus American yard west thing reveal at write amount save project matter reveal worry computer trial look its easy form operation","2023-08-14 17:05:56"
"63","10","5","Arrive kitchen other almost low worry develop crime weight certain","2022-08-11 21:54:31"
